US	41702248	R1QO3KDHB0XCAL	0393312836	483124263	A Clockwork Orange	Books	4	0	0	N	N	A Clockwork Orange	This book is a strange, intriguing book, although this is about violence, it is also about the good and evil. This book was a great book although it did not gain my interest too fast, once i got far into the book it got interesting. The beginning of this book was one of the most boring sections of a book i have read. I read two books over the summer, this being one of them. The other book seemed boring, but turned out to be good, this only took my interest by the beginning of the middle. A Clock Orange is great book, it gains my interest about this troubling boy named Alex, who is sentenced to fourteen years in prison. I do not relate to this book one bit, but I still do enjoy this very much. The real question this book got me to think is; is being good, actually good, if it is not by choice than is being bad not by choice either? That is the way I see the book and how it effects me.	2015-08-27
US	23143194	R2N1XB1QKTZ19B	0393312836	483124263	A Clockwork Orange	Books	3	0	0	N	Y	violent society without giving any indication about how it got to be like that. Teenagers roam in packs committing horrific acts	I found ACO to be a bit too artsy for my tastes.  Burgess creates this dystopic, violent society without giving any indication about how it got to be like that.  Teenagers roam in packs committing horrific acts of violence as if this is a perfectly natural human impulse.  His offerings concerning the interplay of morality and choice are interesting.  The MC's conversion into a &#34;solid citizen&#34; simply because he becomes an adult is a bit of a stretch.	2015-08-25
US	4264762	R2Y0SWYRZVGHE2	0393312836	483124263	A Clockwork Orange	Books	3	0	0	N	Y	Three Stars	Good book, but could not stand the jargon.	2015-08-21
US	28379352	R1XCBQ75SYR3I2	1419832255	427132247	A Clockwork Orange	Books	3	0	2	N	Y	Three Stars	Scarey.  A classic	2015-08-16
US	5419536	REUZZXMUWP1DA	0393312836	483124263	A Clockwork Orange	Books	5	0	0	N	N	A horrorshow of a book	Whoo Hoo, I finally managed to get though this and understand the slang. For anyone who wants to read it but isn't sure I say go for it. The hardest part of reading this amazing novel was the nadsat slang used in the book. Gosh!  What a way to start a book, having to look up  almost every other sentence to figure out what exactly this crazy teen was saying. Once you get deep into the novel and get used to all that slang, the book is an easy read and amazing at making a good argument. Should criminals have a say in how they're treated, and should the government take away their right to choose? Violence is all this crazy teen has in mind as he both rapes and beats innocent people. He becomes the subject of some sort of experiment in where he is forced to feel sick while witnessing violent films of very real situations. I was left both feeling bad for this kid and wanting him to stay a &#34;good boy&#34; forever. The ending is brilliant and it left me wanting the next chapter of Alex's life. If you haven't read this you are missing out.	2015-08-16
US	28098119	R2NE6ESYV24VFL	0393312836	483124263	A Clockwork Orange	Books	5	0	0	N	Y	and ultimately sad. It offers a first-person perspective of a violent ...	This book is very dark, thought-provoking, and ultimately sad. It offers a first-person perspective of a violent criminal, but the steps taken to neutralize the threat he poses are questionable. The author does a great job getting us to actually feel empathy towards the character, even though by the standards of most people he is a horrible human being. The question is left to the readers, does free will encompass the freedom within one's mind? This book will forever hold a place on my Favorites shelf.	2015-08-11
US	140681	RYZP800JM2RVP	1419832255	427132247	A Clockwork Orange	Books	4	0	0	N	N	good book	good book	2015-08-04
US	43307010	R1RYTCY9FP2OSH	0345354435	483124263	A Clockwork Orange	Books	5	0	0	N	Y	Five Stars	Great book. One of the GOAT. Wouldn't recommend for anyone under 13 due to the nature of the narrative.	2015-07-28
US	5779723	R2D91ZATABCJDP	0393312836	483124263	A Clockwork Orange	Books	3	1	2	N	N	Annoying language...	I did not enjoy this book as much as I thought I would. And its not to do with the controversial violence in it. I know Burgess was praised for his use of language and Nadsat, but that was what puts me off. I didn't like the writing, the language itself. Nothing to do with the plot. A satisfactory book.	2015-07-19
US	26853374	R2HX5OQ83JECWA	0393312836	483124263	A Clockwork Orange	Books	4	0	0	N	Y	It's not about to break into the list of my favorite reads, but at the same time I couldn't ...	I went into the book never having seen the movie and with no knowledge of the plot, only having picked it up out of curiosity and name recognition.  It's not about to break into the list of my favorite reads, but at the same time I couldn't put the book down when I was reading it and I burned through it pretty quickly.  The slang seemed incredibly overwhelming at first (I read the first page and a half and just had to stop for a moment and ask myself what the heck I just read), but you do pick it up pretty quickly.  I was looking for a quick, enjoyable read and I got what I wanted.	2015-07-19
US	6475283	R1L8SZE5FB3Q4Y	0393312836	483124263	A Clockwork Orange	Books	5	0	0	N	N	Great book	Once you start to understand the nadsat speak it's a pretty interesting read. If you enjoy anti heroes this book is for you	2015-07-06
US	51568950	R2Y8WTXLD6BDWA	0393312836	483124263	A Clockwork Orange	Books	3	0	0	N	N	Not Impressed	The plot is excellent, but the language is beyond irritating. I want a book I enjoy with good flow. This is just a nuance the way it is written out. I would have given it five stars otherwise.	2015-06-30
US	40880060	R3VVFH4MBIF6IV	3453130790	903495349	A Clockwork Orange	Books	5	0	0	N	Y	Someone's got to be #1 = A. Burgess!	My favorite book of all time!!!!	2015-06-26
US	2257548	RKMZLRO41K46M	0393312836	483124263	A Clockwork Orange	Books	5	0	0	N	Y	Five Stars	Nice	2015-06-22
US	11568196	R3A0H19CECIBS2	0393312836	483124263	A Clockwork Orange	Books	5	0	0	N	Y	Catchy Slang	Amazing read, I was at once hooked by Burgess's poetic slang that he used.  Easy to catch onto and hard to put down. Finished within two shifts at work. After Naked Lunch this was quite a relief, even after On the road and Darma Bums.	2015-06-18
US	7950351	R84FM6EU34SYF	0393312836	483124263	A Clockwork Orange	Books	5	0	0	N	Y	Five Stars	Love the addition of the previously censored chapter. Really puts a new twist on the novel.	2015-06-08
US	37069788	R1NWX7XRMLVEHJ	0393312836	483124263	A Clockwork Orange	Books	5	0	0	N	Y	A chilling narrative of a small out of control gang ...	A chilling narrative of a small out of control gang of thugs, which is relative today, even though it was written decades ago.	2015-06-06
US	26074525	RK5CYOTXFPR0X	0393312836	483124263	A Clockwork Orange	Books	5	0	1	N	Y	Five Stars	Daughter enjoyed this classic.	2015-05-21
US	5702807	R37XN1Y4OK689X	0393312836	483124263	A Clockwork Orange	Books	5	0	1	N	Y	Five Stars	Love it thanks	2015-05-17
US	39552165	R37EVTEFU9YA9T	0393312836	483124263	A Clockwork Orange	Books	5	0	1	N	N	A Clockwork Orange	A real horror show.	2015-05-11
US	1797872	R3HV80HQDCS3H7	1419832255	427132247	A Clockwork Orange	Books	5	0	1	N	N	Five Stars	Love it	2015-05-05
US	1502575	R1DZW5ON5BXA9V	3453130790	903495349	A Clockwork Orange	Books	4	0	0	N	N	this book is one of the best books I've read for a high school assignment	Honestly, this book is one of the best books I've read for a high school assignment. The made-up english dialect creates such an interesting and fun spin for the audience& even past that it reaches such a deep psychological subject of the good and evil in men. The characters were also such a fantastic and creative group and kept the readers enjoying their antics. Overall, its a great fiction piece and read for those who are looking for a dystopian setting.	2015-04-28
US	10796373	R1QS5S1FBOJ1K4	3453130790	903495349	A Clockwork Orange	Books	5	0	0	N	N	German	I guess people don't know how to read, it says, &#34;German&#34; on about 10 places on the order form.	2015-04-23
US	12600406	RGKCHQ7QJC3JO	0393312836	483124263	A Clockwork Orange	Books	5	0	0	N	Y	TEN OUT OF TEN, WOULD RECOMMEND.	10/10 must read.	2015-04-22
US	12798851	R1JL0ZFGIH0WD	0393312836	483124263	A Clockwork Orange	Books	5	0	0	N	Y	Five Stars	Good	2015-04-15
US	21151739	R2P2GUPTI55P47	0393312836	483124263	A Clockwork Orange	Books	5	0	0	N	Y	Witty and Thought Provoking	It may be Anthony Burgess' least favorite of his works, but A Clockwork Orange is still an excellent read, especially with its surprising amount of wit.	2015-04-14
US	52135394	RLJISSM3DTKG3	0393312836	483124263	A Clockwork Orange	Books	5	1	1	N	N	Worth reading, especially if you like the movie	I had been putting off reading this book for decades, but I finally got around to it because I wanted to see how it compared to the film. I was not disappointed.<br /><br />While there are small differences between the book and movie, the story is essentially the same. The book adds more context and details, which make it worth a reading if you're a fan of the movie. Among those inclusions: An explanation of where the book's title comes from. But the movie at the same time left very little out of Anthony Burgess' original story. Of course, the book itself is barely 200 pages, so the film doesn't have to slice and dice the story to cram it in, a la &#34;The Lord of the Rings&#34; or &#34;Harry Potter.&#34; The added details, the changes, and Alex's additional first-person musings make the original novel worth a read.<br /><br />As other reviewers have noted, the book adds the final chapter that was missing from the movie and the American version of the book. I have mixed feelings about the &#34;redemption&#34; chapter, but I don't believe it makes the book any worse.<br /><br />The hardest part of reading the book is the Nadsat. My copy of &#34;Clockwork Orange&#34;, the Penguin Books version, had a Nadsat glossary, which was handy — even though it slowed down reading considerably. Most of the Nadsat words' meanings can be guessed or just glossed over, but if you want to know what's really being said, Google &#34;Nadsat glossary&#34; and have the reference handy.	2015-04-11
US	1693568	R1CJIWW9OFS22G	0393312836	483124263	A Clockwork Orange	Books	5	0	0	N	Y	Five Stars	nice	2015-04-03
US	42836336	R1VJSPS019INDF	0393312836	483124263	A Clockwork Orange	Books	5	0	0	N	Y	Five Stars	The book came in great condition.	2015-03-24
US	35619134	R33RAZPV0KE3UQ	0393312836	483124263	A Clockwork Orange	Books	5	0	0	N	Y	Read it, you danged devotchkas.	Excellent, my droogies.	2015-03-23
US	5150451	R3VJNR02W6LM4F	0393312836	483124263	A Clockwork Orange	Books	5	0	0	N	Y	Five Stars	Great book	2015-03-22
US	52500692	R3BYHAL9VS8MUR	0393312836	483124263	A Clockwork Orange	Books	5	0	0	N	N	1960s Britain rather than the future	Initially daunting but ultimately rewarding, A Clockwork Orange doesn't so much open a window on the future as reveal the stresses of 1960s Britain. Well portrayed thuggery and government cynicism make for a thought provoking read.	2015-03-12
US	13555583	R1P58907MHZV5H	1419832255	427132247	A Clockwork Orange	Books	4	1	1	N	Y	Four Stars	Yup.	2015-03-09
US	2574027	RKV2R6ELV8KTV	0393312836	483124263	A Clockwork Orange	Books	5	0	1	N	N	Eng 106 CPP	Anthony Burgess creates a different work, a outrageous world where violence is controlled by youngster. Burgess has created a beautiful challenge language that builds up throughout the first couple pages and just keeps on giving.‘Nadsat’ spoken by Alex does more than draw readers to attention it urges them to search up the mean of ‘Nadsat’ and also help the readers m possess as a means of determining the sense of those unfamiliar words. As know A Clockwork Orange is a well-known classic. It is a book I can not reconvened everyone. Not that many people would enjoy to read. In other words, it took me a time to read this book because of the different vocabulary. I had to have openA Clockwork Orange - Wiktionary on my laptop to be able to enjoy the chapters. I did appreciate the message behind the book and the unique style of writing. Burgess put in this book a high amount of suffering, violence, and immoral behavior among the book. Burgess also hints humans morals and good vs. evil upon this book, he shows twisted side of human nature. He deeply explores violence and human moral. Lots of people might find it disturbing and look at the underlying message of freewill and moral choices.I like this book and the theme it takes on over being able to make decisions by yourself.  It will be hard to pick at first,but it will get interesting and easier to understand. I highly recommend it!	2015-03-06
US	2232471	R2QB2KDBF6MQTI	0393312836	483124263	A Clockwork Orange	Books	5	0	0	N	Y	Five Stars	It was rad	2015-03-05
US	11245377	RUKLQS68W0MWV	3453130790	903495349	A Clockwork Orange	Books	1	2	2	N	Y	One Star	Should have read the others reviews. Its in German.	2015-03-05
US	3956170	R1F7664NMYZCJY	0393312836	483124263	A Clockwork Orange	Books	4	0	0	N	Y	Excellent, if you have seen the movie	Excellent, if you have seen the movie, you might still find the book exciting because the language is creative.	2015-03-04
US	429515	R2Y54YLVP4UGK2	1419832255	427132247	A Clockwork Orange	Books	5	2	3	N	N	pleased do, and add The Shining	This is probably the most fascinating while at the same time disturbing movie I have ever seen and in some level, addictive. I have seen it almost 10 times already and I still get impressed every time, as I was the first time. I have read the book too and I can say, as far as movie adaptations go, this is the most accurate and lacked only a few (unnoticeable) parts. If you haven't seen this yet, pleased do, and add The Shining, Rosemary's Baby, Strangers on a Train, Nineteen Eighty-Four (1984), and Dr. Strangelove to the list.	2015-02-26
US	12748223	R2M81WMEJKQXJ0	0393312836	483124263	A Clockwork Orange	Books	5	0	0	N	Y	Five Stars	Excellent service and merchandise.	2015-02-25
US	4476712	R2QXKLVMJSARRX	0393312836	483124263	A Clockwork Orange	Books	5	0	0	N	Y	Five Stars	Amazing quality.	2015-02-22
US	7784264	R3A7YTH59LM9AT	0393312836	483124263	A Clockwork Orange	Books	5	0	0	N	Y	i usually dont like to read	i usually dont like to read, but this book was pretty good. there really was no &#34;protagonist,&#34; but i guess that's why i liked it. in a lot of books, the main character is portrayed as this noble character, when in reality i dont think anyone is really like that. this book was written during the cold war, so they make a lot of russian language references that you may not seem to understand at first (such as devotchkas, malchicks, etc). i HIGHLY RECOMMEND that you DONT google the meanings of words you are not familiar with, even though you WILL be confused at first. everything will fall into place though, i promise.	2015-02-17
US	8683972	RD6AY4KK39JLQ	0393312836	483124263	A Clockwork Orange	Books	5	0	0	N	Y	Five Stars	good	2015-02-17
US	21870982	R1JB1TAXGICTQ1	0393312836	483124263	A Clockwork Orange	Books	5	0	0	N	Y	An absolute must-read	Just fantastic. Like most, I've seen the film and loved it. Now having read the book it makes me appreciate the story even more. The narrative, which is engaging and irreverent, is just as entertaining as the story itself. And don't worry about the slang, you'll pick it up in no time.	2015-02-05
US	23639887	RR0BW5HP2KX2O	0393312836	483124263	A Clockwork Orange	Books	1	1	13	N	N	Terrible writing style by the author.	Having seen the movie I wanted to read the book. Unfortunately this book is so poorly written that I stopped in frustration a little ways past part 3 (chapter 23ish). Every sentence has 'like' in it, so much so that I couldn't even concentrate on the story being told. &#34;I tried to like read, but like couldn't like concentrate because the like author sounded as if he was an like uneducated like fool.&#34;<br />On top of that the author repeats many words for no apparent reason other than to fatten up the word count. Instead of saying 'and the camera went flash' he would say 'and the camera went flash flash flash' and he uses this toddler form of description dozens of times through what parts I could bear.<br />My biggest gripe is that the author thinks it's cute to make up long winded slang for simple words (again, probably just to fatten up the book). 'Viddy' is slang for 'see', 'slooshy' is 'hear' and so on. He makes up a compacted word for nearly everything and it's up to the reader to figure out what he means.<br />If the author would have left out the issues I've detailed here this book would have probably only been 100 or less pages. My advise, skip the headache this book gives and just watch the movie or better yet just read a better book by a better author. Have you read Don Quixote?	2015-02-04
US	14023620	R32VNW0GVU9DHK	0393312836	483124263	A Clockwork Orange	Books	5	0	0	N	N	Brilliant. Better than Kubrick could have ever portrayed	Brilliant. Better than Kubrick could have ever portrayed, then again he was dealing with the version that was missing the 21st chapter that was released here in America. An entire chapter that is the resolution to the entire plot and climax to the protagonist's struggle. Definitely a must read!	2015-01-21
US	2697050	R2CIIBXLPY2NC7	0393312836	483124263	A Clockwork Orange	Books	5	0	0	N	Y	Wonderful Book! Genius plot for a book and movie	Quite the masterpeice! Upon reading this book I was shocked at why I had not read this book earlier! Wonderful Book! Genius plot for a book and movie!	2015-01-17
US	39653498	R2WCK1XHTMXI8G	0393312836	483124263	A Clockwork Orange	Books	5	0	0	N	Y	Wow,	What a fantastic book. It challenges your emotions. It is a great book to practice your word interpreting.	2015-01-13
US	11298385	R17X5F0LG8VDZ4	3453130790	903495349	A Clockwork Orange	Books	1	7	7	N	Y	BOOK IS GERMAN, NOT ENGLISH	BOOK IS GERMAN, NOT ENGLISH.	2015-01-09
US	11752761	R1LCOHPFUXLVU1	B007ZURKL0	996031648	A Clockwork Orange	Books	5	0	2	N	Y	Five Stars	GREAT	2015-01-07
US	31824697	R992T6ZWSYWAZ	0393312836	483124263	A Clockwork Orange	Books	5	0	0	N	Y	He loved it. Gave him the DVD as well	Purchased this as a gift for my friend.  He loved it.  Gave him the DVD as well.	2015-01-02
US	11191604	RMUT2IHUIVKG2	0393312836	483124263	A Clockwork Orange	Books	5	1	1	N	N	Totally Horrorshow	Of all the early 1960s novels made famous by later movie adaptations (The Prime of Miss Jean Brodie and One Flew Over the Cuckoos's Nest come to mind), A Clockwork Orange is perhaps the one most able to stand on its own. Irrespective of Stanley Kubrick's unforgettable cinematic version (and Malcolm McDowell's star turn as Alex), Anthony Burgess' achievement in this book cannot be overstated.    A dystopian nightmare of frightening plausibility, it explores the nature of free will through the experiences of its protagonist Alex, a juvenile delinquent who is maneuvered into undergoing aversion therapy that in effect forces him to be \\"good.\\" A number of characters opine that such conditioning severs a man from choice, eliminating his humanity. \\"Does God want goodness or the choice of goodness?\\" asks one. \\"Is a man who choses the bad perhaps in some way better than a man who has the good imposed upon him?\\" One need not believe in a God to understand the philosophical stakes implied by those questions.    Burgess does a great job of stacking the deck to make the point. Alex is undeniably despicable. By age 15 (his age at the start of the book) he has committed numerous acts of \\"ultra-violence\\" that has left at least two people dead, participated in a brutal gang-rape, molested a pair of 10-year-old girls and perpetrated numerous acts of theft and gratuitous vandalism that have terrorized his community. He is clearly a cancer on society and society has a reasonable rationale for taking him out of circulation through incarceration (or perhaps, at the extreme, execution). But does it have a right to remove his free will? That is the uncomfortable question Burgess asks.    Clockwork Orange is the second dystopian novel Burgess published in 1962. The other, The Wanting Seed, lacks Clockwork Orange's tight structure, consistent theme and anything close to Alex as a dramatic center, something made even more unforgettable by Alex' first-person narration in an idiosyncratic Slavic/English polyglot slang. The only two book-length first-person in-character narrations I can compare it to in 20th century English language literature for sheer end-to-end brilliance are Holden Caulfield in J.D. Salinger's Catcher in the Rye and Humbert Humbert in Vladimir Nabokov's Lolita.    The book also exposes the generational rift emerging in British society in the late 50s and early 60s. If one watches some of the \\"kitchen sink dramas\\" being made around that same time by directors like Tony Richardson and John Schlesinger (The Loneliness of the Long Distance Runner, also dating from 1962, is an excellent example), one can see the utter befuddlement of the older generations, still clinging to king-and-country traditions, when faced with the aggressive, cynical attitudes of the young, particularly the young of the lower classes. Gangs like Alex's \\"droogs\\" had their real-life counterparts in the Teddy Boys and the early Mods.    Clockwork Orange can also be seen as an indictment of the kind of secular, scientifically planned societies then in vogue, which Burgess exposes as breeding cynicism by weakening traditional checks on amoral behavior such as religion and parental authority, setting the stage for authoritarianism (a cultural/political cycle that he explores more overtly in The Wanting Seed).    A Clockwork Orange is a bravura achievement as a philosophical meditation and also a hell of an entertaining read. What more can one ask?	2014-12-31
US	45253190	RVVNUG2LBZ83S	1419832255	427132247	A Clockwork Orange	Books	4	1	1	N	Y	An excellent viddy, my druges and fellow Compatriots.	An infamous and stylized romp centered around Alex, a disillusioned criminal youth, and his escapades, arrest, controversial treatment, and attempt at reintegration into society in 1960s England.	2014-12-27
US	43397407	R3PPJ378H8KU23	0393312836	483124263	A Clockwork Orange	Books	2	0	2	N	Y	the description didn't include the fact that there was an ...	the description didn't include the fact that there was an inscription inside of the book it also didn't mention the spine wear. this informathion was only disclosed on the receipt. because shipping is almost as much as the book I'm going to just keep it.	2014-12-17
US	13371920	R31M9ZYPVWHMN3	3453130790	903495349	A Clockwork Orange	Books	1	2	2	N	Y	VERY WORN	Very worn and dog eared pages.  Binding is bent in poor shape.  Very disappointing	2014-12-13
US	30790877	R2KEMBOMBNTE5W	0393312836	483124263	A Clockwork Orange	Books	5	0	0	N	Y	Five Stars	loved it	2014-12-13
