US	43801732	R1218BJ3YRO6NR	0393312836	483124263	A Clockwork Orange	Books	5	0	1	N	N	the greatest book ive ever read	after seeing 'a clockwork orange' many times on film i thought i would try the novel.i have found it to be the best book i have ever read.Burgess completely captivates you with his use of innovative language and the way he tells the story through alex.even after alex's diabolical acts,the novel still calls for the reader to have symathy for him when he is being tortured by the state.very challenging in it's time but it has always been a fantastic novel.	2001-05-29
US	46042899	R1U4O0HQXY8V8T	1568495110	483124263	A Clockwork Orange	Books	4	0	1	N	N	What a horrowshow  of cal	A teenage thug and his &quot;droogs&quot; wreak havoc on the streets. Using a street language that is easy to decipher, Burgess tells a tale of the not to distant future or is it the present?<br />Alex the leader is captured by the police and is sent to prison where he is offered a controversial treatment. The tratment is a sort of brainwashing that makes Alex ill everytime he encounters violence.<br />Alex is let out of prison and finds it very difficult to find his way in the world. He is cast out by his parents and brutalized by one of his droogs who has become a policeman.  <br />Finally the brainwashing wears off and Alex turns back into a street thug and he finally tires of his brutal life.	2001-05-28
US	43994023	R378FKPOEWFRGC	0393312836	483124263	A Clockwork Orange	Books	5	5	5	N	N	Good movie, better book.	Very rarely do I enjoy reading the book rather than watching the movie, but with A Clockwork Orange, it was quite the opposite.  Having seen the movie first (and loving it), I knew what to expect from the book, but I had no idea that it would leave me feeling like the movie was not nearly as good as I thought before.  The book is beautifully written, with the young Droogs own language that is confusing at first, but soon becomes easy to follow.  Burgess portrays the world of the young criminal in such a way that rather than being disgusted, I was very interested in continuing with the story.  By the end, I even felt bad for him.  Any book that can make me feel bad for a boy who enjoys rape, murder, and crime in general must be very well written.  What I enjoyed most about the book was the fact that it left so much to the imagination.  While the movie showed scenes and settings such as the woman with the cats' house and her attack, the book merely described them, which allows the reader to come up with his/her own mental picture.  I  found myself picturing things very differently from the movie, which I love.  Overall, this was an excellent book and I am overly impressed by Anthony Burgess's writing.	2001-05-14
US	45337623	R30EJ4J3AOH6CG	0393312836	483124263	A Clockwork Orange	Books	5	0	0	N	N	A real horrorshow of goodies	The lyrical narrative in this book was what captivated me most, my brothers.  This includes the unrivalled originality in Burgess' nadsat language.  The story really captured the often destructive self-absorption and invulnerable feeling of youth -- the ability to act without fearing the consequences, and even when suffering the consequences, caring very little if at all about one's own part.<br />The introduction, in which Burgess harped on about the excluded 21st chapter of the American version prior to 1986 had me curious.  I think that the book without the final chapter, the way it was captured in the movie, is in fact better.  Burgess makes an important point about the final chapter, yet I found it didactic and perhaps with the least flow of any in the rest of the book.<br />Still, this is an excellent book, and well worth a read for anyone.	2001-05-07
US	45658723	R27NHFCB294T9K	0393312836	483124263	A Clockwork Orange	Books	3	8	11	N	N	Realisticly Disturbing	The novel A Clockwork Orange written by Anthony Burgess is a disturbing but realistic view of the world.  The main character, Alex, is a violent teenager who enjoys bringing pain to other humans.  He is not scared by the law or threat of jail time.  The only action that has any affect on Alex also takes away his free will.  Through the treatment Alex is turned into a zombie and can no longer think for himself nor can he act on his thoughts.  Eventhough the treatment turns Alex into a non-violent human he is no longer his own person.  The question that came to my mind while reading the book was, is it better to be forced into being a good person, or be yourself?	2001-05-03
US	48331673	RYGC1A58DW48T	1568495110	483124263	A Clockwork Orange	Books	5	0	0	N	N	Clockwork Orange as as shocking view of reality	Anthony Burgess's A Clockwork Orange tells the horroring tale of young Alex as he partakes in acts of ultra-violence and his reform which sends him right back to his evil ways.  The novel presents the question of: Is it better to be made to be good or is it better to have the choice of being good?  Anthony Burgess attempts to portray the extreme of youth and the capability of it's evil, but he is also able to show more than simply the aspect of evil, he shows the human side also.  Our narrator enjoys Beethoven and by this we see that he has intrests common to our own, not just that of crime.  This book was so well written using a unique dialect which Alex himself creates.  The reader soon becomes accustomed to this language and is able to sit back enjoy an extremely thought-provoking book which will send you off with a renewed hope for mankind.	2001-05-02
US	47874852	RXJ09ABD7FOE2	0393312836	483124263	A Clockwork Orange	Books	4	5	6	N	N	First-person narrative enhanced this read	I saw the movie first and was blown away by how disturbing and real it was.  While it is true that I and many others have been de-sensitized to violence, the book delves into a different kind of violence.  I guess what scared me after reading A Clockwork Orange was that we do not really know why Alex was &quot;evil&quot;.  Alex would do his thing every night, come home to sleep, then in the morning, gets up and eat breakfast and usually goes to school. What is up with this guy?<br />Usually when you see movies or read books that involve killings and other types of violence, you can always trace the reason to a person or an event that happened previously.  Even in the Columbine shootings and others like it, the kids had reasons and they acted out this anger.<br />But in A Clockwork Orange, Alex chose this evil.  This freaks me out.  It's not I find the other type acceptable, but when shoud people ever have a choice between a good and evil lifestyle?<br />Anyway, the book was good.  It took me like 15 minutes to read the first three pages because of the Nadsat language.  Make a printout of the words and keep it on hand when reading.  The first-person narrative was great and I do think the movie makes the book better because you don't quite get all the emotions of Alex out of the book.  For example, you can hear him laugh and giggle during a rape scene in the movie - something you can never get from a book even if you have a great imagination.  Then reading about his trip to the chair to watch the films - wow - it was described so well - you actually had to feel for the guy.<br />I did get a little turned off by the politics - maybe that is because I always get turned off by politics.  But this book was great!!	2001-04-23
US	49726088	R8C1AI079GTJJ	0393312836	483124263	A Clockwork Orange	Books	5	2	2	N	N	a linguistic paradise, a futuristic hell	This is one of my favorites. A linguistic classic, brilliantly written. I recommend this copy for, while it has no glossary, it does have the final chapter. American publishers who forced the 20 chapter copy of this book, did the world an injustice. The book, and subsequently, the movie is incomplete, and dare I say void of something. This is the something: Alex, our protagonist, is just that, and any understanding reader knows this but may not know why. How can we know when a novel and a film start and end in the same place? The final chapter fulfills this need for closure, thus transforming Alex into a round character, rather than a flat one, incapable of change. My only critiscism with this novel (including the final chapter) is that, at the end, like at the end of Tim Burton's Beetlejuice, we see conformity, for, in my view, no reason. Not to give it away, I will just discuss the part in question. Before Alex becomes a &quot;Clockwork Orange,&quot; he tells the reader that he loathes what is, in their society, pop music, and prefers &quot;Ludwig Van&quot; (Beethoven). The changes in the last chapter, has him abandon his earlier passion, in place of &quot;tamer&quot; music. This bothers me; perhaps i have misinterpreted this, but to me it makes a comment about civility and music. <br />Anyway, this is one of my favorite novels. It is a brilliant Pavlovian study of psychology (why we do what we do and what can control that) and the philosophy of free will, as well as the conflict between the proponents of free will and law enforcement and psychiatry. You will not read this book without having a lot to think about well after you close the pages of this book.	2001-04-16
US	48535200	R2BU7YV530D7QG	0393312836	483124263	A Clockwork Orange	Books	4	0	1	N	N	One of the best...	I read this book a couple of years ago, and to say that it scared and thrilled me is almost an understatement. Burgess' use of language is fantastic, creating a slang that's as disturbing as it is confusing. The story itself is especially interesting for the times we live in. The only thing I disliked was the added final chapter. It seemed to be tacked on, even though it was originally in the text. That's why this only gets 4 of 5 stars. Aside from that, it's one of my favorite books of all time. ^_^	2001-04-05
US	52708337	R1NGR7OIOB30S1	0393312836	483124263	A Clockwork Orange	Books	3	4	12	N	N	Wholesome it's not!	Okay I admit it, like another reviewer before me, I was drawn to the books' sadistic side.  If someone bans a book I sometimes have to find out WHY?  In my high school about ten years ago, we were not allowed the choice to choose books such as &quot;Catcher in the Rye&quot;, &quot;Clockwork Orange&quot;, or &quot;American Psycho&quot;.  I am 26 now and yes I became too curious and read them all.  Definitely didn't make me a bad person.  Would, (if I had) a 13 year old, allow he/she to read it too?  Of course.  Banning books just makes youth more curious.  Anyway, I liked &quot;Clockwork Orange&quot;. It was wild to say the least.  I was instantly attracted to the use of an almost &quot;foreign &quot; sounding language the boys used amongst themselves.  I myself often wake up from dreams and realize that in them I was speaking in an unknown tongue....one my mind had created on its own.  The first few chapters are hard to understand but once you memorize a few words here and there the lingo becomes more clear.  Alex and his friends are delinquents. They drink &quot;milk&quot; which I immediately recognized as their drug of choice.  They beat up old people without reason.  They rape and even kill.  They live vicariously, showing no conscience or remorse.  They almost remind me of &quot;Jack&quot; and his pig-hunting pack from &quot;Lord of the Flies&quot;-Just living on pleasure and animal instinct.  I failed to finish reading &quot;Clockwork Orange&quot;, not because I didn't find it a modern masterpiece, but because the violence was more hard to stomach than some Stephen King novels.  I finished at the point where Alex was kept in a &quot;hospital&quot; in attempts to reform him. These scenes in the book often brought back memories of Michael Crichton's &quot;the Terminal Man&quot;.  If you read the book I know you understand.  Someday I hope to stomach the book in its whole-even the edition with the exta chapter.  I would give it the five stars I know it deserves, but I gave only three until I finish it someday cover to cover.	2001-04-04
US	52474360	R1CQ581QS4HSWK	0393312836	483124263	A Clockwork Orange	Books	5	56	64	N	N	A real tolchock in the yarbles, O my brothers	Fans of Ayn Rand's ATLAS SHRUGGED will no doubt disagree with me here, but _A Clockwork Orange_ may be the most remarkable man-against-the-State story ever published. Anthony Burgess's approach is in one significant sense the opposite of Rand's: where she tried to project a hero (and in my opinion failed; John Galt seems to be little more than a one-dimensional abstraction), Burgess projects a thoroughly depraved teenager and forces us to root for him anyway. It's not every author who can make you watch a bunch of gratuitous sex'n'violence and _then_ conclude that even great moral depravity trumps behavioristic psychology and mechanistic determinism.<br /><br />What \\"protagonist\\" (or Your Humble Narrator, at any rate) Alex does in the first half of the novel will make you ill. But what the State does to him to \\"cure\\" him makes his nadsat gang violence seem almost . . . well, \\"innocent\\" isn't quite the right word, but the fact that I'm even thinking of that word is an indication of Anthony Burgess's power.<br /><br />For Burgess, the important thing is moral choice, and the possibility of choice entails the possibility of evil. Once Alex has been \\"reformed\\" by the very latest techniques of behavioristic science, it's no longer even _possible_ for him to be moral -- and that's somehow more horrible than any of his own horrible acts.<br /><br />But Burgess stops short of making volition an object of idolatry. In the first place, he doesn't make any argument that Alex's actions were somehow \\"good\\" merely because he had _chosen_ them; quite the contrary. In the second place, even though Alex bears the full blame for all his depraved actions, there are hints scattered throughout the book that if he weren't living in a \\"socialist paradise,\\" he just wouldn't have been acting this way in the first place. (For example, both his parents are required by law to work full-time. They also seem curiously unwilling to discipline their son, or even inquire what it is he does when he goes out at night.)<br /><br />I read this book twenty years ago in an edition that had something this one lacked: a glossary. I thought I was going to miss it, but I didn't; Burgess is a fine writer and anticipates his readers' needs very nicely. If the meaning of one of his Russian-import slang terms isn't obvious from context, he works in a definition. (And there are a few glossaries available online anyway.)<br /><br />The earlier edition also lacked something this one has: a twenty-first chapter. I hadn't read this before -- it was left out of the American edition of the book and therefore out of Stanley Kubrick's film adaptation as well -- but to my mind it makes a better ending for the book.<br /><br />Sure, as Burgess himself admits, it's a little crude; we never actually _see_ Alex develop into an adult, we just suddenly learn at the end that he's growing up and becoming ashamed of his past actions. But the novel wouldn't be complete if Burgess hadn't introduced that final bit of irony: after all the State's torturous efforts to \\"reform\\" the poor misguided youth, in the end he just sort of, well, gets over it.<br /><br />Other readers may have different opinions -- and according to Burgess's delightfully snarky introduction of 1986, that's okay with him. And he almost sounds resigned to the fact (for it probably is a fact) that of all his thirty-two novels -- not to mention his nonfiction (including a fine exposition of James Joyce released in the UK as _Here Comes Everybody_ and in the US as _Re Joyce_) and a whole bunch of music -- in the end it's this book for which he will be universally remembered.<br /><br />He may be right that it isn't his best work, and he's undoubtedly right that it's a bit preachy. But it's undoubtedly the book for which I myself will remember him. And I'll make no appy polly loggies for that, O my brothers, for it's a horrorshow book with the impact of an oozy across the glazzies, and no mistake. This malchick and his droogs deserve a place in literary history.	2001-03-30
US	48174144	R1K9ITVYFB8MVO	0393312836	483124263	A Clockwork Orange	Books	5	0	2	N	N	WOW!!!!!!	This is by far the best book i have ever had the privilage to come across. every book i have read after reading A Clockwork Orange has seemed dull and lifeless. The language is new, (once you get past the first chapter it gets easier to understand.) After finishing this book i was saying things like 'all that cal' and 'horrorshow'. I have recommended this book to about ten people, every single one of them has bought there own copy of it!I have yet to see the movie for fear it will ruin the feeling the book has left in me, though maney say the book is just as good as the movie is.  Burgess makes a strong commentary on what the human nature to violence is and the human nature to control violence @ all costs, even the free will of a person. This book could make the president hate the government! I hope that every single person in the entire world will read this book, and let it control their thinking the way it did mine.	2001-03-23
US	44985762	R3Q19WQEFGWQEI	0393312836	483124263	A Clockwork Orange	Books	5	3	3	N	N	We all know Alex	Anthony Burgess rips open our minds, throws in an entire imaginary universe and sews it back together, leaving the universe with us forever in his style-driven novel, \\"A Clockwork Orange.\\"  Burgess weaves the English language with Russian slang to create a fictional teenage dialect for our protagonist, Alex and his gang of \\"droogs.\\" These characters shock us with their extracurricular activities of raping women, beating up bums and exploring hallucinogenic drugs at the age of 15.  The crimes catch up to this villain that we want to hate, but can't. Alex takes the fall for his droogs and receives a 15-year prison sentence.  However, Alex's doctors have been working on a case study, \\"Ludovico's Technique.\\" They offer Alex an alternative of reducing his prison sentence to less than a year by participating in the experiment. Alex does what any 15-year-old would do and takes what seems the less painful choice.   Ludovico's Technique is an experiment designed to condition its subject to lose their evil tendencies and become the \\"perfect Christian.\\" This technique comes right out of Psychology 101. Dr. John B. Watson first conducted the experiment with a rat and a child in the \\"Little Albert\\" case study.  Although Burgess creates a new world, he leaves our imaginations to fill in our own world. \\"A Clockwork Orange\\" will have the reader questioning the dangers of conformity, the roles of society and their own existence. \\"A Clockwork Orange\\" should be read with an open mind. It took me two weeks to get past the first chapter, but once I did, I never wanted to put it down.	2001-03-09
US	44900797	R1HJK2XUNS29QQ	0393312836	483124263	A Clockwork Orange	Books	5	0	1	N	N	A Dystopian Masterpiece	Anthony Burgess' finest work is not only a disturbing look into the future, but also asks intruguing ethical questions. I found Burgess'use Nadsat Language intresting, athough it is difficult to understand. Espically disturbing is the dystopian world Burgess invents. The book's combination of a socialist society and decayed western culture makes it an intresting read	2001-03-08
US	51021767	R29U3QEQKHNVPV	0393312836	483124263	A Clockwork Orange	Books	5	0	0	N	N	Tremendously powerful, agressive and enirely honest.	This book was beutifully written, and not in a flowery or traditional way.  It was angry, it ws brutally honest, it was somehow endearingly disturbing.  The author makes you think, reason, listen and question. I am so glad that I was able to get the edition with the last chapter not previously published in the US- but a word of advice: either get the book with a glossary or download the vocabulary from the internet because it makes the book that much more enjoyable.  Although at first, the dialog is a bit puzzling- if you look up a few key words you are able to easily follow it and somehow get caught up in the author's speak.   A malenky bit of beuty my friends!	2001-02-22
US	51705408	R3AD22KKBKWRWI	0393312836	483124263	A Clockwork Orange	Books	5	25	38	N	N	Fruits of Redemption	After following a few violent days in the life of  Alex, the anti-hero of Anthony Burgess' A Clockwork Orange, and his friends (his `droogs' in the slang of the time), we're obviously supposed to be shocked when we he declares, after murdering an elderly woman, \\"And me still only fifteen..\\"<br />Yawn.<br />Maybe when written in 1962 this was shocking.  Post-Columbine High School, most people have become numb to violent acts committed by children.   The fact that Alex and his gang's favorite pastimes are spreading terror, theft, and rape, may even seem tame by today's standards.  Yet we should be appalled, none the less.  Not at his age, but with the cavalier attitude towards death and the destruction of the lives of others.<br />It is a well known fact that Burgess was dismayed at the success of A Clockwork Orange.  In the introduction to the 1986 reprint, which included the \\"missing\\" 21st chapter, never published in the United States before (more on that later), Burgess says he would \\"be glad to disown it for various reasons, but that is not permitted.\\"  While ACO survives, other works of his that he values more, \\"bite the dust.\\"  Such is the life of an artist. Our humble narrator is a 15-year old leader of a small gang of droogs.  The four spend their after-school hours wreaking as much havoc as they can muster.  Of course, boys being boys, someone has to lead the pack.<br />As the result of a power struggle within the little group, during a bungled robbery attack, Alex takes one across the glazlids, and is left blinded for the police to pick him up.<br />Though sentenced to spend 15 years in prison, a stroke of luck gives Alex the opportunity to participate in a new experimental aversion treatment for violent criminals.  He emerges from prison a changed, if not particularly new, man.  The violent impulses are still there, but he is overwhelmed by nausea whenever they rear their ugly head.<br />Enter Politics.<br />Now a \\"victim\\" of the state, the opposition political party that is fighting the government's recent crackdown on violent crime seizes upon Alex's plight.  He becomes their poster child for overthrowing the oppressive regime in the next elections.  Tormented by his present condition, Alex attempts suicide by leaping from a window.  His failure only draws attention to the issue (the opposition is delighted) but prods the government into righting its previous &quot;wrong&quot; by changing Alex back to his old self.<br />\\"I was cured all right,\\" the original American version ended.  So now our little droog is back to the way he was; violent, chaotic free will and hormones raging.  Ready to prey on society once again, only now with a good paying government job from his new friends.<br />The new version or, perhaps I should say, the original version (now available in the U.S.) has an entirely different ending.  In the final chapter, our \\"young thuggish protagonist grows up.  He feels bored with violence and recognises that human energy is better expended on creation rather than destruction.\\"   This version, Burgess believes, is a true novel as it is founded on the principle that human beings change.  The old American version was a fable as are all fictional works that fail to show change in human character.<br />The prison chaplain, who befriends Alex, puts it succinctly when he says, \\"When a man ceases to choose, he ceases to be a man... It may be horrible to be good.\\"<br />He warns the pre-treatment Alex, \\"You are passing now to a region where you will be beyond the reach of the power of prayer.  A terrible terrible thing to consider.  And yet, in a sense, in choosing to be deprived of the ability to make an ethical choice, you have in a sense really chosen the good.  So I shall like to think.&quot;<br />Burgess, like his jailhouse preacher, is a strong believer in free will.  They are appalled that government could decide to take away one's ability to make decisions between right and wrong.  If that happens, a person is no longer a person and the fact that they will no longer harm anyone else is secondary to the fact they have been harmed themselves.  Then what is the point of punishing criminal behavior?<br />Which brings us to the final, omitted (dare I say censored?) chapter.  In the original novella, and the revised American version, Burgess' character has a sort of realization that maybe the life of violence he has lead is not the right way.  Maybe he should even get married and have kids - not that he would be able to control them any more than his parents did him, but just maybe...  Is this a true conversion in Alex?  Or is it the idle prattle of a common street thug?  Burgess intends for us to believe that it's the beginnings of a true change.<br />Suppose it is.  That's not a hard thesis to support.  Alex himself recognizes that something is changing.  \\"There is something happening inside me,\\" he says, \\"and I wondered if it was like some disease or if it was what they had done to me...\\"  But Burgess fails to take the cue from his own character.  <br />Perhaps out of resentment for the original omission of his last chapter, Burgess refuses to even recognize that maybe it was the punishment he received that has lead to the new Alex.  Instead, he gives all the credit to Alex's free will.  Perhaps.  After all, as he says, \\"The important thing is moral choice.  Evil has to exist along with good, in order that moral choice may operate.\\"  <br />And so it must.	2001-02-21
