US	23081414	RN009BV2ZAIOC	0393312836	483124263	A Clockwork Orange	Books	5	2	3	N	N	Great book, great final chapter....	Anthony Burgess is one of my favorite writers.  He is an extraordinary novelist, essayist, and a very interesting (though overly pompous at times) person.  He wrote over 40 novels during his lifetime, which is remarkable considering he didn't start until his late 30's.  This is (obviously) his most famous novel, which he found somewhat annoying, as there were other books he was most proud of, but it's still a great novel, worthy of all its praise.  I especially like this new edition, which eliminated the Nadsat glossary (which was included in the initial American version of the book), and it reinstates the 21st chapter, which Kubrick didn't know about until filming was well under way.  The final chapter works very well.  It makes perfect sense that Alex would indeed grow weary of his punk/violent teenage days.  Occasionally, people refuse to grow up, but more often than not, they do mature and decide that things they did as youths were ridiculous and naive.  Youth, in my opinion, has always been terribly overrated (something Burgess agrees with), and that as one grows in experience and time, wisdom comes (for most, anyway), and that the silliness of youth can be set aside for a more intelligent, thoughtful, and open minded stance on life.  I feel the older you get, the more liberal and open minded you become, because you see more things and feel more things.  I really do like that final chapter quite a bit.<br /><br />Ironically, when the novel was released in Britain, the reviews were brutal, especially over the Nadsat language.  The reviewers felt that Burgess was committing sacrelige on the English language (which was ridiculous).  The American critics, however, loved the work, praising it for its vision and its inventions in language.  The American publisher did insist on adding the glossary (against Burgess's wishes), and cutting off the final chapter, which they felt softened Burgess's argument.  The final chapter makes it more of a fable (something Burgess talks about in his new intro \\"A Clockwork Orange Resucked\\"), but without the final chapter, the ending is creepier and more ambiguous.  Usually it's the opposite with editing for an American audiences.  Publishers/distributors dumb down for American audiences (when I don't think they should), but here, dropping the final chapter did make the ending darker.<br /><br />The book and the film should be read and seen as often as possible.  Kubrick wouldn't have been able to make such a great film without such strong source material.  And the differences between the film and the book are quite minor compared to most other adaptations.  Read the book, see the film, and repeat.out in his new intro \\"A Clockwork Orange Resucked\\"), but without the final chapter, the ending is creepier and more ambiguous.  Usually it's the opposite with editing for an American audiences.  Publishers/distributors dumb down for American audiences (when I don't think they should), but here, dropping the final chapter did make the ending darker.      The book and the film should be read and seen as often as possible.  Kubrick wouldn't have been able to make such a great film without such strong source material.  And the differences between the film and the book are quite minor compared to most other adaptations.  Read the book, see the film, and repeat.	2007-11-14
US	43530996	R3IH6QAC6TRO2T	0393312836	483124263	A Clockwork Orange	Books	3	2	6	N	N	Not Free SF Reader	Criticising control of rebellious youth.      The novel looks at one young man in particular, leader of a violent gang, and what he does, and what is done to him by a rather fascist government to rein him in.    Also would seem to be about the usual fears of the old people of the powerless in general youth of the time, in whatever time.    Unfortunately, a little dull to go along with that, an comes across as contrived at times.	2007-10-26
US	29015245	R2CJU68NA6QIH3	0393312836	483124263	A Clockwork Orange	Books	5	2	3	N	N	classic	An amazingly creative, engrossing novel. I thought in Nadsat for weeks. I must say that I disliked the glossary in the back, and didn't use it. That sort of colloquialism is subjective, and trying to define it reduces its meaning. The final chapter was kind of a throw -- not sure how I liked it, but Burgess is a master storyteller -- he really makes you interested in a perverse, completely insane person.	2007-10-15
US	37856976	R1PQEJII5VLU1Z	0393312836	483124263	A Clockwork Orange	Books	5	1	1	N	N	Skorry and Bezoomy!	Even though I knew this was supposed to be one of those \\"must be read in your lifetime\\" kind of books, I was always hesitant to pick it up due to the violence I knew lurked between the covers.  Not because I feared it, but because I could never quite find the right \\"mood\\" to tolerate it (especially with the newspaper, Kiterunner and such one picks up these days!)  However, the book came highly recommended (mostly by men, including the 30-something librarian who I checked it out from: \\"oh, you're going to love it!\\" I don't know how he knew, but he was right).  I finally cracked the cover.<br /><br />Lo and behold, what indiscernible argo did I discover on the first page! For such a short book, I told myself, this would be a long read.  After two or three pages of the futuristic, Russian-based slang I found that, like reading Shakespeare, the reader adjusts to the rhythm of the language.  It did not prevent the story from absorbing me, and I didn't need to know the definition of every word to grasp the meaning.<br /><br />Alex, the charming teenage sociopath narrator, spends the first third of the book inciting nightly acts of \\"ultraviolence\\" with his hooligan friends.  In the second part, he is caught, punished, and rehabilitated.  In the third, he must deal with the consequences of his violent past, and his present as a man who can no longer defend himself from them.  Although written in the 60's, it's hard not picture a 1980's London backdrop complete with the punks and hooligans bringing anarchy in an alternate socialist dystopia.<br /><br />A quick word on the violence.  Although the narrator gleefully partakes in some terrible actions, his use of slang to describe it actually keeps it rather slapstick and prevents it from becoming overly graphic (like Fightclub, for instance).  What I didn't expect at all was the humor.  Some of Alex's observations are riotously funny.  I even got a few strange looks while reading in public, either because I laughed too loudly, or reacted to Alex's deepening predicament with an \\"aah!\\"--a pretty good sign that I'm captivated.  This says something about the skill of the writer, that he had me empathizing with (if not exactly rooting for) a depraved character who I had no business liking under normal circumstances.<br /><br />The only thing that didn't quite sit with me was the inconsistent (yet original) 21st chapter.  Some say this ends the novel on a lighter, more hopeful note.  I don't think it needed to.  Without giving too much away, what Alex hints at maturing into was, to me, far more terrifying than his old hooligan self. Especially seeing how the other adults in this book, including his parents, have turned out in this fictional future.  Give me the other, albeit more sinister, end.pening predicament with an \\"aah!\\"--a pretty good sign that I'm captivated.  This says something about the skill of the writer, that he had me empathizing with (if not exactly rooting for) a depraved character who I had no business liking under normal circumstances.    The only thing that didn't quite sit with me was the inconsistent (yet original) 21st chapter.  Some say this ends the novel on a lighter, more hopeful note.  I don't think it needed to.  Without giving too much away, what Alex hints at maturing into was, to me, far more terrifying than his old hooligan self. Especially seeing how the other adults in this book, including his parents, have turned out in this fictional future.  Give me the other, albeit more sinister, end.	2007-09-12
US	29365616	R1TNNNXDNGI7JF	0141182601	483124263	A Clockwork Orange	Books	5	1	1	N	N	Outstanding!	I've been on a little reading binge lately, and I found this book to be quite exilerating.  I have never read anything like it!  I would have to say that this is one of my absolute favorite books.  I am so happy that they decided to publish the last chapter of this book in the States.  It would be completely different without it!!      I would recommend this book to anyone, I checked it out from the library for the first reading.  I am going to have to add it to my collection, that's how good it is!	2007-09-08
US	22794128	R1GIUXAZYYIVVY	0141182601	483124263	A Clockwork Orange	Books	5	3	3	N	N	Literature as Art and Social Conscience	If you are looking for a simple and straightforward novel, then this is not it.<br /><br />This is a piece of literature as art by the talented British writer Anthony Burgess (1917 to 1993).  I got interested in Burgess from his non-fiction works on Shakespeare and Joyce.<br /><br />Even the title here is complex, and According to Burgess himself, the title is from an old Cockney expression \\"as queer as a clockwork orange. Burgess wrote in his later that a creature who can only perform good or evil is \\"a clockwork orange -- meaning that he has the appearance of an organism lovely with color and juice, but is in fact only a clockwork toy to be wound up by God or the Devil; or the almighty state.\\"<br /><br />So, the novel is about good and evil and as a vehicle he uses a young man Alex, who leads a life of crime and random violence including rape. He sets the story in the future but using realism. Alex narrates the tale and does so in a language called \\"Nadstat\\" which is not English but a sort of street slang. That adds to the ambiance or flavour or  setting of the story.<br /><br />The novel contains three parts: the narrative on Alex and his illegal activity or street crimes,  the imprisonment and attempted rehabilitaion of Alex, and finally the retribution of his victims.<br /><br />What does it all mean? First and foremost it is a work of art so keep that in mind. It includes various themes such as the power struggles between old and young generations, the corruption of social institutions, and  politics. It is supposed to make us think about the direction of society as a whole.	2007-09-06
US	23557974	R2R58MRMO10BJT	0393312836	483124263	A Clockwork Orange	Books	5	2	4	N	Y	great	fantastic once you get the hang of the language and slang. Suggestion--watch the movie first to put a face with the characters. The movie is but a fraction of the book, so it won't spoil anything. LOVE IT!!!	2007-09-06
US	48120892	RIWJ4WJ0YJWDJ	0393312836	483124263	A Clockwork Orange	Books	3	2	4	N	Y	Mostly Good Book.	If you are a fan of the dystopian drama then look no further.  This book has a wonderful and imaginitive plot with a good moral to follow.  Burgess's unique storytelling abilities, combined with the \\"Nadsat\\" dialect which he himself adapted for this novella, makes it a great read for any type of reader!	2007-08-23
US	17629738	R1LM1Z65OZID5U	B000BZ9JYC	483124263	A Clockwork Orange	Books	2	3	6	N	Y	wierd and quite hard to read	for one.. prepare to spend awhile rereading and thinking.... the use of language here is INSANE.... it is alot like that guy from snatch.. the rhyming thing.. lol.. without the ryming. it is quite confusing. using some sort of freakish british cockney slang.. almost a made up language.<br />i didnt finish it..........has the same type of strange and confusing  language as \\"lock, stock and two smoking barrels\\"... unless you are quite good at understanding made up languages.. do not read.	2007-08-05
US	16420556	RYCQV1Y7ZZOXG	0141182601	483124263	A Clockwork Orange	Books	3	1	3	N	N	A hard read!	This book will give you a glimpse of gang violence (beating, raping, and killing by teens) in a futuristic time. The book explores the meaning of free will and the conflict between good and evil, which is often not apparent. It also poses the following important question: can a person be forced into being good, and is being good truly good if it is not by choice?     The main character in the novel, Alex (a 15 year old boy who is a rapist and killer), is injected by prison doctors with a drug that makes him experience nausea and headaches, and is then forced to watch violent flicks. He associates nausea with violence, and can stand violence no more! He is therefore restricted from his free will and forced to become good! According to the author, we all have a sense of what is right and what is wrong, so do we need to be forced into being good?    Interestingly, readers in America and the rest of the world will read different versions of this book. In America, the editors edited out chapter 21 all together, giving the novel 20 chapters in all. In Britain and the rest of the world (including all translated versions), chapter 21 is included in the novel. Readers in the rest of the world will therefore get a different ending. The movie version of the book by Stanley Kubrick was based on the American version of 20 chapters. I will recommend readers of this book to read the British version to get the ending the author meant for us to read.     Another interesting fact is that the author wished this book to go away - but obviously it is not, accumulating fans from all over the world since its publication in 1963. The book has been translated into many different languages, including Russian, Japanese, Spanish, and Italian, to list just a few. Many of the latter books written by the same author (32 novels in all) have not succeeded as much, even though the author believed them to be much superior. The book he believed would fail succeeded and the ones he believed would succeed failed miserably compared to A Clockwork Orange.     Many will find this book difficult to read and understand (me for one). The dialogue is quite unique but difficult to understand because it is slang, with most of it invented by the author (was the slang taken from the Russian language?).    The title, A Clockwork Orange is a cockney word meaning to the limit or hilt. For example, he is queer as clockwork orange (a saying often used). The author believes that we cannot be evil as clockwork orange; that is, pure evil with not an inch of goodness in us. Similarly, we cannot be pure good with no evil in us. We all live with a balance of evil and good, with some displaying more evil while others more goodness. And we all have free will to choose whether we want to be evil or good.    A lot of people have liked the movie more than the book. Read the book first though (the British version), and then watch the movie. You'll get a much better flavor of the book this way. And if you gave up reading the book, watch the movie. It might just make you want to give the book a second chance!	2007-07-25
US	52398462	RR31CUYDDYMXX	0393312836	483124263	A Clockwork Orange	Books	1	29	89	N	N	Unreadable	First paragraph,  page 1.  \\"What's it going to be then, eh?\\"  There was me, that is Alex, and my three droogs, that is Pete, George, and Dim. Dim being really dim, and we sat in the Korova Milkbar making up our rassoodocks what to do with the evening, a flip dark chill winter bastard though dry.  The Korova Milkbar was a milk-plus mesto, and you may, O my brothers, have forgotten what these mestos were like, things changing so skorry these days and everybody very quick to forget, newspapers not being read much neither. Well, what they sold there was milk plus something else. They had no license for selling liquor, but there was no law yet against prodding some of the new veshches which they used to put into the old moloko, so you could peet it with vellocet or synthemesc or drencrom or one or two other veshches which would give you a nice quiet horrowshow fifteen minutes admiring Bog And All His Holy Angels And Saints in your left shoe with lights bursting all over your mozg. or you could peet milk with knives in it, as we used to say, and this would sharpen you up and make you ready for a bit of dirty twenty-yo-one, and that was what we were peeting this evening I'm starting off the story with.\\"   Last paragraph, last page \\"Oh it was gorgeosity and yumyumyum. When it came to the Scherzo I could viddy myself very clear running and running on like very light and mysterious nogas, carving the whole litso of the creeching world with my cut-throat britva. And there was the slow movement and the lovely last singing movement still to come. I was cured all right.\\"  'Honey for the Bears', the second story in the book I had,  was just as unreadable.	2007-07-22
US	13559293	R3QTBBF4TNAWTJ	0141182601	483124263	A Clockwork Orange	Books	5	0	1	N	N	Funny, violent, conflicted.	Rarely have a film and book inhabited such distinctive worlds of their own as those of 'A Clockwork Orange'. As a youth, I felt lucky to see a film so bizarre; as an adult I feel like I appreciate what so many others cannot. Burgess makes it clear through the introduction that Stanley Kubrick ignored the book's final chapter in his film, in which Alex grows up and grows tired of the ultra-violence and such. I was happy to read the 'lost' chapter, but the film had a lot more impact by letting the viewer guess where Alex's life would lead, that cheeky grin and those gleaming eyes hiding a new monster. I still enjoyed the book, although the film is so vivid it seems like the book is based on it, not the reverse. The liberal use of slang might put some people off, but it's repeated often enough that you'll catch on in no time. The story itself is impossible not to be intrigued by: do we prefer absolute morality in our society, or do we value choice so much that it sometimes comes at the expense of morality? I'll leave the tough questions to you, but there's no question this book deserves to be more widely-read. The film is so famous for being graphic and controversial that it often overshadows the story, which should always be the real star of the show.	2007-07-21
US	20311826	RTQO3130ULD0G	0393312836	483124263	A Clockwork Orange	Books	5	0	1	N	N	Great Read	A Clockwork Orange (\\"orange\\" referring to a seemingly normal outward appearance, \\"clockwork\\" referring to the idea that, on the inside, human beings are controlled by either God, the Devil, or the Almighty State) is a classic work of fiction known mainly for its rich use of \\"Nadsat,\\" a language created by Burgess and used throughout the entire novel, and its controversial elements of rape and violence.<br /><br />The book takes place around, and is told by, Alex, who at the beginning of the novel is fifteen and by the end of the novel is around eighteen. The book starts off with a series of events that set the tone for the state of law and order in the novel (Alex and his \\"droogs\\" rob, rape, and pillage with no regard for authority or their elders). In a nutshell, Alex's \\"droogs\\" turn against him, he is imprisoned, he is promised to be released if he undergoes Ludovico's Treatment, he is brainwashed against violence, returns to violence, and at the end finally decides to repudiate violence of his own accord (if the version you're reading contains the twenty-first chapter, that is).<br /><br />The book focuses mainly on a loss of morals, facilitated by the State, but carried out on an everyday basis by the people, or, more specifically, by the youth. Burgess satirizes such things as police brutality by portraying the State's hiring of gang members to positions in the police department, subtly comparing the police of future generations to be no better than the criminals. Burgess also satirizes the future status of religion by presenting Alex's point of view on the bible (when reading about the crucifixion, he imagines himself nailing Jesus onto the cross), which represents the idea that religion will become increasingly irrelevant as a direct result of degeneration among the youth. Other themes in the novel include: good and evil, the transition from adolescence to adulthood, government meddling, corrupt political practices, and free will.<br /><br />Overall, the book excellently demonstrates Burgess's intellectual grasp on society and also his commanding use of language. It's worth the read.tes Burgess's intellectual grasp on society and also his commanding use of language. It's worth the read.	2007-06-18
US	10181599	R5V5IOYBXNMD2	0141182601	483124263	A Clockwork Orange	Books	4	1	2	N	N	Fascinating and provocative	This is a fascinating and provocative novel that questions what it means to be good.  Is a law abiding person still good if they have no free-will; if their mind has been altered so that they are incapable of violence?<br /><br />The novel is written from the perspective of 15 year old Alex, a charming sociopath who enjoys `ultra violence'.  Alex writes in a street slang of Burgess' own devising called Nadsat (although it is derived largely from Russian). This may be off-putting to some readers initially, but after a few pages you start to get the hang of it, and before long, you start to like it. (I am resisting the temptation to write my review using Nadsat).<br /><br />When the novel was first published in the US in the 1960's, the 21st chapter was not included.  Burgess felt the final chapter was important but he needed money and agreed to have the novel published without it.  The final chapter changes the tone of the novel.  I have to say that I agree with the original American publishers.  I found the final chapter a little too optimistic.<br /><br />Burgess wanted to present a world where there was hope that even criminal sociopaths can choose to be good without the state forcing goodness on them.  I on the other hand, prefer the nastier (and I think) more realistic ending that the original US version gave us.<br /><br />Burgess felt that the real evil in A Clockwork Orange lay with the state (don't get me wrong, I'm not in favor of radical behavioral controls like the ones administered to Alex) and as a result, he seems to excuse Alex's violent behavior as if it were only a `phase' he might outgrow.<br /><br />Because Alex is charming and because much of the violence is described in a strangely unfamiliar slang, the reader may be desensitized to it and may even sympathize with Alex (something I think Burgess wanted).  In reality, Alex is a self absorbed sociopath who rapes little girls and beats little old ladies to death.  Even after his reconditioning, he still wants to be violent (he just can't) and he shows absolutely no remorse for any of the crimes he has committed. Alex may or may not be able to change his behavior and 'choose good' but it's difficult for me to imagine that he is capable of feeling compassion or empathy, let alone find love.<br /><br />I prefer the sarcastic and cynical ending to Chapter 20.  While Burgess may have intended the 21st chapter to give us hope, I actually think this chapter is the scariest part of the novel.  The only thing more frightening to me than Alex roaming the streets with violence on his mind - is picturing him as a father.<br /><br />That would be a real horror show.<br /><br />Regardless of which ending you prefer, there is no doubt that this is a fascinating novel, well worth reading.  Read it and reach your own conclusion.st can't) and he shows absolutely no remorse for any of the crimes he has committed. Alex may or may not be able to change his behavior and 'choose good' but it's difficult for me to imagine that he is capable of feeling compassion or empathy, let alone find love.    I prefer the sarcastic and cynical ending to Chapter 20.  While Burgess may have intended the 21st chapter to give us hope, I actually think this chapter is the scariest part of the novel.  The only thing more frightening to me than Alex roaming the streets with violence on his mind - is picturing him as a father.      That would be a real horror show.    Regardless of which ending you prefer, there is no doubt that this is a fascinating novel, well worth reading.  Read it and reach your own conclusion.	2007-06-14
US	32093990	RR6R93KU0IWVR	0393312836	483124263	A Clockwork Orange	Books	5	1	2	N	N	Couldn't stop thinking about this book	A Clockwork Orange had me asking myself a lot of questions as I was making my way through it. I'm still asking myself these questions.  <br /> <br />\\"What's it going to be then, eh?\\" <br /> <br />Is it better to be bad by choice or good because you're told to be?  <br /> <br />I can't help but think about the book even though I finished it a month or so ago. Certain scenarios are still racing through my mind and more than ever I am questioning the motives of the people that I interact with. Are they the Clockwork Oranges (with eggyweg in their tummywums) being good little soldiers for fear of the millicents paying them a visit?  <br /> <br />Am I? <br /> <br />That said, this book is fantastic. The lingo that Burgess has invented is very tricky to get to grips with at first, but thankfully by simply understanding the context of unknown words one can easily grasp their meaning.	2007-04-09
