US	16399077	R2JBZMJRQTBNIB	0393312836	483124263	A Clockwork Orange	Books	5	0	0	N	N	Marvelous, Simply Marvelous	This is a striking peak into the future faintly paralleling the worlds that Orwell and Huxley foretold.  The narrator and main character, Alex, leads his droogs (friends) to vandalism and anarchical acts.  Burgess uses a slang language derivative of Russian that creates a strange futuristic tone.  At first, the language made it hard to understand and read, but as one begins to indulge themselves in the story, the language is nearly non-existent.  Burgess puts this group of kids against all the best wishes of society and they survive society's grasp.  Burgess also uses parallelism of his future with our reality to show what might happen.  Strangely enough, and quite ironic, Alex, the leader of a vicious group of street hooligans, finds favoritism in classical music such as Beethoven, Handel, and Bach.  This contrast was obviously intentional to show the influence of the past in the near future.  It is a great story that I quickly started reading and enjoyed every slash of Alex's britva and every beating of innocent bystanders.  To enhance every brutal scene, Burgess uses a mix of dialog and narration.  Burgess' use of strong language, a pioneer of his time, helps create an atmosphere of anarchical lunacy.  I would highly recommend this book to anybody that can take a good old graphic novel filled with suspense and fun.	2004-12-13
US	32937959	R4UTPLAMW5QH2	0393312836	483124263	A Clockwork Orange	Books	5	0	1	N	N	The best book I have ever read	Anthony Burgess is not only a great storyteller, but a literary god. He invents a language and manages to translate it brilliantly without destroying the story. The book is perfect. It describes a horrifying moral society when the children take over at night. DO NOT WATCH THE MOVIE. Read the book it is much better and it includes chapter 21, the most important chapter. The book may scare you and the first few chapters may make you want to stop reading but the book is amazing. Highly recommended	2004-12-05
US	15592762	R2H0FSTH9H7P6D	0393312836	483124263	A Clockwork Orange	Books	5	0	0	N	N	a drak, brilliant novel with a jubilant touch	I can easily rate this book the best I have ever read. Although this novel covers a very dark, terrible topic, it is joyful in a sense. I say this, because the narrarator writes and speaks with such a bouncy tone, expressing bad events as \\"a real horror show\\" and swears as \\"grahzny\\" and \\"vonny.\\" He regards himself as \\"your humble narrarator although he is really a psychotic terrible person. Some people might find this book just terrible and disgusting, but overall through the book, you realize just hpw bad ultra-violence is. The plainly bizzare plot hooks you and although really confusingly written, you will understand. Anthony Burgess writtens with many confusing words, but it is fun just to figure out what the words mean. I recommend this book to whoever envies strang plots and loves to read. If you find it slow, just stick with it and you will become the character in the book, feel his pain and suffering.	2004-12-02
US	16685369	R26GUCV1JKTLJU	0393312836	483124263	A Clockwork Orange	Books	5	0	0	N	N	One of the World's Greatest Books	This book is a landmark, legend, and icon.  Burgess wrote in 1963 and it has been an iconoclasitc classic ever since.  It's an exciting, innovative literary adventure that I think everyone should experience. <br /> <br />Many people are put off by the slang that Burgess wrote this book in.  In his introduction, Burgess said that this would happen because people 'are scared, rightly, of language.'  I think that this book isn't too hard to read and the slang/nadsat makes the book more exciting and intelligent.  This is one book written in the English language that will stretch your mind.  However, once you have gotten the slang down, this book isn't difficult to read at all. <br /> <br />	2004-11-18
US	41523864	R32OOORTNGFY12	0393312836	483124263	A Clockwork Orange	Books	4	0	0	N	N	pleasant surprise	I read A Clockwork Orange to  help with studying while I was taking Russian in college.  (The slang used by characters in the book uses words similar to Russian.)  I was pleasantly surprised by the story.   <br /> <br />The plot follows 15 year old juvenile delinquent Alex.  He enjoys ultra-violence, a popular but illegal sport, raping women and girls, and classical music.  Alex tells his story to us heavily laden with slang.  The first person approach it kind of freaky because Alex is so... normal.  Unlike the violent and sexual explicit movie, the book isn't graphic.  What Alex is doing is more graphic than in the movie (at one point he rapes two nine year olds), but he doesn't describe it graphically.  He just does what he thinks will be fun.  If he sees something he wants he takes it  As he explains stealing a car he likes is like picking fruit from a tree. <br /> <br />Alex ends up arrested.  He is offered early release if he goes through a \\"deconditioning\\" program.  The program will deter him from crime.  It works but it has unexpected side effects.  His whole thought process at this point is disturbing since he still wants to rape and beat, but then he is also revolted by violence.  He wants the deconditioning undone. <br /> <br />This book is more of a pleasant curiosity than a must read.  The movie kind of played up the deconditioning and simplified or focused things depending on how you look at it.  The book has more issues, including a peaceful disturbing ending in which Alex lumps his violent tendencies with childhood.  The book is also good conversations material.	2004-11-12
US	52099048	R1QGQTX7XWEDBE	0393312836	483124263	A Clockwork Orange	Books	4	1	1	N	N	SUMMER READING MADE FUN.	This maybe one of the greatest books of the 20th century. I purchased this book july 5 and was so drawn into it i had finished in with 3 days. The was compelled to speak as they do in the book. No one could understand me until, well i was at a 7-11 and i ask for some moloko (milk) the store clerk instantly relized where i had gotten in from and we began to discuss the book. Now it has been 4 years. I have a very important question Amber will you marry me? the book brought us together and will keep us that way. Are friends may laugh be we will always have the memories and we will always be together.	2004-11-12
US	32171412	RUYDAZANEPI6S	0393312836	483124263	A Clockwork Orange	Books	5	1	2	N	N	Sad, Funny, Brilliant	A Clockwork Orange is no doubt one of the greatest books ever written. However i wish i had bought the book instead of getting it from the library because i never got to read the last and final chapter. <br /> If you have not read this book, it is a must that you do.	2004-11-11
US	17071337	R3MDX93UFUARGS	0393312836	483124263	A Clockwork Orange	Books	1	8	54	N	N	Complete waste of time	All this book is is a book of slang, and if you can get past the slang it is just a sob story of some dumb teenager too stupid to figure things out for himself. Burgess does make a good point about how training people to be good is taking away their identity but that issue is resolved too quickly. <br />If you are looking for a truly thought provoking book with similar ideas read A Brave New World which is actually worth the time.	2004-10-24
US	18352879	R2QZEVJ6KOT0DO	0393312836	483124263	A Clockwork Orange	Books	5	1	3	N	N	Clockwork Orange School Report Book Review	A Clockwork Orange is undoubtedly my favorite book/movie of all time. Clockwork Orange is not only a story to me but a lifestyle. Not only does it tell stories of the old \\"ultra-violence,\\" but it teaches many moral lessons. Some of the greatest bands have also followed the lead of A Clockwork Orange. This is the greatest Anthony Burgess creation. Grab some moloko plus and put on the lovely lovely Ludwig van and read this classic Anthony Burgess novel.	2004-10-19
US	16385043	R2W8EUI6U5UO59	0393312836	483124263	A Clockwork Orange	Books	5	0	1	N	N	Amazing	A Clockwork Orange would have to be one of my favorite books of all time.  It is an amazing story of a young boy, Alex, and his daily life as a child delinquent.  The moral of the story, to me at least, is that one must choose to be good; it cannot be forced upon them.  I recommend this book to anyone who can read it and get the gist of it.  It is filled with it's own made-up language, so that is a bit hard to get used to at first.  Read it!	2004-10-04
US	52256737	RS4BCEHUEQZ9U	0393312836	483124263	A Clockwork Orange	Books	5	8	8	N	N	Short, fast-paced, compelling, brilliantly written	It took me years to get around to reading this, because 1) I'd already seen the movie several times; 2) I was afraid Burgess' invented \\"language\\" would make the book a tough read. Far from it. There are really only about a dozen invented words, which are supposed to be the teen-speak of the time; and you don't even have to memorize them because their meaning is always clear from the context.     So is the book better than the movie? Well, they're very different underneath, even though their plots are superficially identical, and they're both brilliant in their own ways. Kubrick's movie is typically obscure and mysterious, and he leaves you to draw your own conclusions about its point. Burgess' book, on the other hand, is much clearer about its political stance. One good thing about the book is that its characters are in their early-to-mid teens, as opposed to the movie, where everyone looks around thirty, O my brothers.    The book is absolutely compelling. The violence is brutal, but not all that disturbing, because the novel takes place in a \\"dystopian future.\\" In actual fact, it's no more dystopian than the industrialized societies of today, or of the '60s or '70s; the book is an allegory of 20th century society. The novel is actually pretty short; it's a quick and easy, fast-paced read.    You're probably familiar with the plot; vicious little Alex, he of the ultra-violence and the in-out, in-out and the Ludwig van, gathers his droogs every night, and together they terrorize the decent folk after drinking their narcotic-laced milk. Eventually Alex is captured, and what little free will he has is removed through some kind of controversial aversion therapy. It's a relatively short but very strong story.    My only problem with A Clockwork Orange (the book) is that Burgess oversimplifies the causes of social problems. Burgess strongly implies at various points in the book that \\"free will\\" is an illusion; that little Alex, Your Humble Narrator, is nothing more thanthe product of society. His randomly violent behavior is not his \\"free choice;\\" he behaves this way because his peers do, and because it's the only logical way that society gives him to act. Again, I don't necessarily agree with this, but this is what Burgess implies throughout the book. In case you had any doubts, he makes it clear near the end, when the kind old guy who takes him in (the same one little Alex terrorized before his \\"rehabilitation\\") is also named Alexander. Burgess is saying that little Alex and nice old Alexander are the same type of person inside, just brought up in different situations. And at the end, Burgess throws in a chapter which Kubrick left out, which has little Alex realize that he's too old for the \\"ultra-violence\\" and the old \\"in-out, in-out\\" and decides it's time to become a respectable adult. Again, Alex does this not because he's \\"changed\\" or become \\"better,\\" but because it's what all his friends have done at that age, and what society expects. But this isn't really a flaw in the book; Burgess set out to make a societal statement and he makes it.     Burgess is a born writer; the dialogue and plot are far ahead of their time. The book was written in the '60s and feels not the slightest bit dated today. I may not entirely agree with its politics, but A Clockwork Orange may be the most vibrant and memorable book I've ever read.	2004-10-04
US	37344292	R1341Y7K5R224B	0393312836	483124263	A Clockwork Orange	Books	5	0	0	N	N	Anthony Burgess is simply amazing	I am going to start off by saying that this book is not for everyone.  I repeat: IT IS NOT FOR EVERYONE!!!  If you are offended by violence and other \\"adult situations\\" then you will not like this book.  It is also an intensely difficult read for the first chapter or so.  This is due to the fact that Anthony Burgess invnented his own kind of slang, through which the story is narrated by the central character, Alex.  There is no glossary so re reading is a necessity if you're going to enjoy this book, simply to figure out what the language means.  For a book written almost 50 years ago, it is quite a ways ahead of its time.  The way all of the characters can be loathed and loved at the same time is just mind boggling.  Even Alex can be felt sorry for after he is subjected to the government's rehabilitation program.  To sum it up, amazing, but not for the faint of heart.	2004-09-26
US	28217969	RCHLZ2YA0REVK	0393312836	483124263	A Clockwork Orange	Books	5	0	0	N	N	A Real Horrorshow Raskazz	I had seen the Kubrick film about a gazillion times, and finally broke down and read the book.  Glad I had.  The opening line of the book instantly caught me, and did not let go till the last hair raising sentence. <br /> <br />Before going off on the story, I want to comment on Burgess' intense writing style, which has reshaped my own view of what writing should be.  In addition to the Slang used by Alex (Nasdat) There is a wonderful natural fluidity to his language that grips the reader instantly. <br /> <br />The plot, it seems, is intertwined so that reader must identify with any one particular person at a time, but this changes rapidly.  At one point you find yourself loving the character Alex, then the next moment you realize he's a total jerk!  The police are appreciated till their evil is revealed.  The old man F. Alexander seems to be compassionate till you realize he plans to kill Alex.  You want to smack Alex's parents for not having raised their kid right, yet you pity them for fearing their own sons evil tendancies.  It's bothersome because you don't have any character that you can latch onto. <br /> <br />Alex is evil.  Let there be not mistake.  The state is evil.  The kind old man is evil, driven so because of Alex.  By the end the evil has not left.  It just simply went through a cycle.  In short, this book scared the crap out of me, Bog blast it!	2004-09-19
US	17069795	R30QAPWN57Q155	0393312836	483124263	A Clockwork Orange	Books	4	0	1	N	N	disturbing tough read	I did not like this book at all until I reread the first few pages. I had to actually go back and read them over after putting the book down. I then read the whole hting in one sitting.  I do not think everyone will like this book but I think if you can read it it is worth the read.  My point is that although difficult to read it is worth the struggle.	2004-08-24
US	30248563	R2AUMW2MRJ8P8B	0393312836	483124263	A Clockwork Orange	Books	5	2	2	N	N	Amazing; Well worth the read	Anthony Burgess has committed a great act of selfishness, which has in turn become a masterpeice. There is no box for Anthony Burgess. <br /> <br />Burgess has taken the English language and made it his own. In difference from other authors, Burgess has used English as a basis, rather than a guideline, to create a new art. Using his own words and style, he has become something special that is deserving of praise. <br /> <br />The Novel Itself. All in all, A Clockwork Orange is an amazing work. The story of a troubled nadsat (teenager) who is caught in the act and sentenced to punishment. Yet, Alex (the main character) gets more than he ever bargained for. He is subjected to a new form of correction used by the government only to be released to a changed world that rejects him real skorry (quickly). Alex soon finds himself back he began (in a sense, that is), only to be enlightened by part of his beginning. The story proves to be very circular, yet un-repetitive in a very masterful way. <br /> <br />Philosophy. Burgess quietly challenges the world within his story. Is it fair to force someone to do the right thing, rather than to let them choose? Which is better: a world of forced good or a world of independence? You'll see both the author, protagonist, and main other characters challenge these questions. <br /> <br />The Human Brain AND A Clockwork Orange. Due to Burgess wonderfully unique style of writing, this novel allows the reader to tap into him- or herself. As Burgess uses many of his new, invented words (such as: veck, droog, itty, viddy, etc.) we can see ourselves becoming accustomed to them and understanding what they mean. It excites the brain on the thought that we are learning a new language, and thus brings back childhood illusions. Burgess knows precisely how to use his new words and when an explanation is needed. Remarkable. <br /> <br />A Clockwork Orange should be read by all intellectuals at one point or another. It does not take long, but we mustread it with an open mind realizing that we will have to do some thinking ourselves, as well as some accepting. Make sure (if you're planning on reading A Clockwork Orange) that you have the original British version that includes a Seventh Chapter in the last section of the book. Originally, when this book was brought to America, the last chapter was omitted (also was it omitted in the film adaptation of the book). The Norton Paperback Edition includes this last chapter.	2004-07-26
US	22952028	R2G38SSZ4T4OMU	0393312836	483124263	A Clockwork Orange	Books	5	2	2	N	N	Conciseness makes the book great	This is Burgess's most famous novel, largely to the controversial treatment of it by Kubrick. As with most famous novels, there is the danger of disappointment because they are so hyped up. This was the case with me, until I was about halfway through. Then, because it was sufficiently different from the movie, I realised that it was good beyond the hype. And overall, it is the fact that Burgess has condensed quite a lot of ideas onto about 150 easy pages that makes this book a great read. If it was much longer (like so many other thematic books of novels-of-ideas) it would lose its tolchok...<br />Speaking of tolchoks, this would be the most challenging part of the novel - nadsat. The narrator is Alex, a juvenile delinquent living in a somewhat not-too-distant-and-certainly-dystopian future, where Britain is quite close to being a police state and where crime is such that the &quot;delinquencies&quot; of little Alex involve rape, murder and other examples of ultra-violence. Furthermore, the teens in this future speak nadsat, a slang peppered with Russian expressions. The first page should be quite a shock to those who don't know Russian (and if like me you do know it, there's the feature of figuring out what Russian word the Anglicised string of letters is meant to symbolise). Anyhow, you can think of it as a cloze passage and in a few pages, you should be fluent. If not, there are excellent resources on the internet, such as Wikipedia's nadsat entry. As for the purpose of this deliberate difficulty, it's actually worthwhile in highlighting the superficial and brutal subculture Alex lives in.<br />The novel is divided into three parts. Part 1 is Alex and his friends running amok and basically doing what they like. Part 2 is Alex in prison, and the famous Ludovico's &quot;rehabilitation&quot; technique. Part 3 is Alex back in the world, with a difference.<br />The book is seen to explore free-will and the choice to do good and evil. As such, we climb into the head ofsomeone who would most likely be described as a sociopath in conventional terms. He commits acts of violence simply because this is what he genuinely enjoys. And to go against the stereotype of the low-IQ bum, Alex is considerably intelligent and has a true passion for classical music. This sets up the background of a world-gone-mad. Then, Alex is treated with a technique that physically conditions him to be unable to do harm to anyone. Of course, the prison chaplain is against this but according to the Minister of the Interior, at least it will help in the seemingly-hopeless fight against violence.<br />Alex immediately becomes front-page material and a political pawn from all sides of the spectrum. Burgess examines the nature of our society, where politics and public perception are at the heart of every issue, and where both sides can become involved in dirty and partisan tactics. Also, the inconsistencies of the way society brings people up, incarcerates, punishes and attempts to rehabilitate criminals is a major idea.<br />The good thing is that it is unclear to me what moral lesson Burgess was actually attempting to espouse. He really lets the reader draw their own conclusions, more so than most writers. Finally, some of the early editions cut the last chapter, making the novel more edgy and dark (this is the case in the film). The last chapter (part 3, chapter 7) is an actual resolution. People have argued whether it makes the novel better or not. I think it does make it better because it casts irony on the tortuous attempts to rehabilitate Alex. But try to get an edition with the last chapter so you can see what Burgess intended originally.<br />Because it seems that somehow, violence is still with us *just a bit*, and the Clockwork opens up the recesses of evil and not-so-evil and its such a concise read makes it a great novel of the 20th century, and more original than many other dystopias.	2004-07-07
US	35226212	R11DXL1A3032W5	0393312836	483124263	A Clockwork Orange	Books	5	3	3	N	N	A masterpiece!	I got this book at some cheap used book section; simply because it was cheap and I remember seeing the film as a kid but I didnt really remember it that well. The William Burroughs recommendation on the back of my edition didnt harm either. <BR>A bit shallow start but I wasnt expecting a thing and that propably helped alot. As I started reading I went, after a few unknown - to me - russian looking words &quot;what the hell is this?&quot; But the brilliant black humor came right on the first page and thats how I got to know a book that I can read anytime with the same pleasure (if not more) as the first time.<BR>By far the best book Ive ever read - and Ive read ALOT of books that have similar elements but the wordplay is so special that no book comes close. Its got everything in it, this neat little novella: black humor, satire, insane violence, a new language and even some prophetic statements. <BR>If you like this one I recommend &quot;the wanting seed.&quot; Its also by Anthony Burgess. That one is a futuristic dystopian novel/la. With the same humor.	2004-06-22
US	36017453	R3PXYQNTCNO4B5	0141182601	483124263	A Clockwork Orange	Books	3	4	7	N	N	3.5 stars...Other reviewers are being generous	The faults with this book lie completely with its length...it is just simply too long for what it has to say. I havent found myself being bored or anything, but still i wish Burgess would have put fewer pages in this book: it goes on and on when it really doesnt need to.<br />That being said, i enjoyed the book. The language takes some getting used to...even by the end of the book youll still wonder what some words mean (no, theyre not as obvious as everyone else says they are). This doesnt depreciate the value of this book though...actually i find it kind of fun. Sometimes it's fun not knowing exactly what he's saying. It gives the book a genuine feel to it...as though it is a diary.<br />Despite all of the horrible things Alex and his droogs do, you cant help feeling a little sad for Alex...you sort of get emotionally attached, but not too much. The novel is good at producing some sympathy for the criminal. Interesting, it is.<br />I sort of recommend it...actually, anything believed to be a classic is worth reading. I guess im just warning you that nothing really happens in this book, and you might walk away slightly disappointed. But classics do that sometimes. All in all, it's worth 3.5 stars.	2004-06-03
US	18253016	R28C52SUXW6VKP	0393312836	483124263	A Clockwork Orange	Books	5	39	45	N	N	And all that cal	A Clockwork Orange is the story of good and evil and the value of choice. The main character, is a 15 year old lad named Alex whose life consists of crime, cruelty, and recklessness. After being betrayed by an accomplice, he is sentenced to prison where he volunteers for a program that corrects the seemingly uncorrectable. Only then does he being to suffer the consequences of his crash and burn lifestyle. <br />A Clockwork Orange is what I believe to be a fabulous novel. It may confuse a reader at the start because of the language, but its not that hard to understand the slang dialect if you have a firm grasp on English and are a few pages into the book. Also, one must be patient when reading it because the main ideas aren't revealed until later in the novel. There is a lot of building up the characters before hand, which is valuable information but may bore those who are already have a distaste for the book's violent nature. I also highly recommend that you read the British version because the last or 21st chapter is quite important.  <br />Anyways, the book is more oriented those who can see past the gore and sex and can grasp the main ideas the author is trying to convey through a clockwork orange.	2004-05-28
