marketplace,customer_id,review_id,product_id,product_parent,product_title,product_category,star_rating,helpful_votes,total_votes,vine,verified_purchase,review_headline,review_body,review_date
US,10514199,R3BUJIX52FB760,B00817RYCG,458864358,Catch-22,Books,5,1,1,N,N,"Painfully Funny","Let me preface this by saying that I have never really reviewed a classic, so this is a new sensation for me. But I felt too strongly about this book not to. Anyway...<br /><br />Catch-22 chronicles fictional characters in a fictional country fighting in the very real World War II. The majority of these characters are soldiers with interesting names and even more interesting idiosyncrasies. The primary character (in the myriad of characters) is a fellow named Yossarian with a stronger than usual disdain for his superior officers and the authority they hold over him. You can't really blame him for said disdain, as Colonel Cathcart is continually raising the number of missions required to complete service.<br /><br />With this trend, you'd think that more soldiers would rebel. However, most of them are only quietly disgruntled and surprisingly contented. The catch in Catch-22 states that &#34;a man is considered insane if he willingly continues to fly dangerous combat missions, but if he makes the necessary formal request to be relieved of such missions, the very act of making the request proves that he's sane and therefore ineligible to be relieved.&#34; Aside from death, desertion, or indefinite physical illness (which Yossarian often relies on), there is legitimately no way out. (I never quite got the 22 part of Catch-22. There's not a catch 1-21... :P)<br /><br />Anyway, this is easily one of the funniest books I've read in my life. But, thing is, I can't really explain why it's so funny. A whole lot of it made me chuckle to myself, but huge chunks of it made me laugh out loud until I almost cried. Seriously, this is a funny book. Again, I'm not sure why, but that doesn't change the fact that it is. Especially the scene with the moaning men... Good gosh, scenes like that I had to read over and over because they are simply too comical to only read once.<br /><br />Despite the hilarity, this book can be confusing, what with the multitude of characters and the fact that the story doesn't necessarily follow a chronological order. Also, if you're like me and know next to nothing about the military ranking system, it can become daunting trying to keep up with who is in charge of whom. It all gets a bit overwhelming when you think about it too much. The process I took to reading this was to try not to overthink everything. I just sort of accepted it all, let it roll over me. It's definitely not a slow read, but the reading process itself can be quite time consuming.<br /><br />I was also pleasantly surprised when a story began forming out of the babble. Don't get me wrong; I enjoyed the book from the start, but, for a very long while, it seems like nonsensical ramblings from irrational soldiers and unreasonable officers. For that long while, it seems almost like Joseph Heller is painting a portrait of each individual character but leaves no overlap from character to character. There are the characters and there is the world, but the story of those characters and that world itself emerge slowly and out of a clutter of confusion.<br /><br />I guess it's to be expected with a war story, but there are harsh bits of tragedy that just pop up in the book. You can't have a war without violence or bloodshed, but the brutality in these pages is thrown in randomly and without warning. Some of the passages manage to freeze the world for a moment. Most of the story is a goofy, ironic view of the world. It's so absurd and silly the majority of the time that it is very easy to forget the serious subject in which it is really about.<br /><br />All in all, I think this is a brilliant book. You probably had to be pretty bright back then to get a word added to the dictionary, before everyone became ridiculous.<br /><br />As for the ending, I think it is perfect-the only way out of the Catch that makes sense for Yossarian, but I won't say more. Apparently there is a sequel, but I am not yet sure if I want to read it. I hate when sequels ruin the original for me, and that happens more often than not. Unlike lots of other books with lots of others words, all of the words in this particular book feel necessary. I wouldn't add or detract a thing.<br /><br />SIDE NOTE: I intend to name my next pet Yossarian. It just feels right.",2015-08-24
US,3751207,R168R6CK6CE8LI,B00817RYCG,458864358,Catch-22,Books,5,0,0,N,N,"It is full of poor jokes. You might abandon it as well","When I told my friends that I was reading Catch-22, one of them said “I tried reading it once, but left it after reading hardly the first 50 pages. It is full of poor jokes. You might abandon it as well.” What he didn’t know is once I start reading a book I cannot leave it without finishing it. I cannot even take up another book without finishing reading the previous one. And I am proud of that trait of mine, especially now, because I didn’t quit reading Catch-22. Yossarian is a lead bombardier for the United States of America, posted overseas and wants to live. He swears on his one and only life that everybody out there is trying to kill him. On top of that his superiors are raising the number of missions he has to fly if he wants to go home. As soon as he gets the number, he gets notified that the number of mission per person has been raised again. He complains to his friends about this constantly, but flies the missions anyway. Often he finds himself standing up for himself and others demanding to be sent home, but his superiors somehow convince him to fly more.<br /><br />There are simply too many characters in this novel. You will get confused with who is who and who does what. Though they are too many in number, they all are unique character-wise. Only by the time you finish half of the book, will you be clarified with your doubts. But by then, one by one Yossarian’s friends die or disappear. Though it is Yossarian who is afraid of losing his life more than anybody else, others die before him. Your heart will go out for the Chaplain and you will hate Colonel Cathcart and Colonel Korn from the bottom of your heart and gut. This novel evidently makes you understand the plight of every person who was overseas fighting not knowing what for accurately. There are many highlights in the story. An argument between Yossarian and Lieutenant Scheisskopf’s wife about existence of God on Thanksgiving Day, an argument between Nately and an old Italian man aboutwhy or why not one should fight for the country and effect of war-destroyed Rome on Yossarian to name a few highlights. Icing on the cake is the last chapter. Everything happens at once that you wish to be there with Yossarian, Major Danby and the Chaplain. This novel on the whole is truly one of the greatest novels of the century.<br /><br />“Every victim was a culprit, every culprit a victim, and somebody had to stand up sometime to try to break the lousy chain of inherited habit that was imperiling them all.”<br /><br />Joseph Heller, hats off to you.",2015-07-22
US,8950610,R164OIDHJ79NFO,B00817RYCG,458864358,Catch-22,Books,5,0,0,N,Y,"Five Stars","fantastic",2015-07-19
US,23420899,RQQF5THE3D44I,B00817RYCG,458864358,Catch-22,Books,5,0,0,N,Y,"she loved it, great buy from","bought for daughter, she loved it, great buy from amazon",2015-07-09
US,29281697,R1PTETHNC390Q6,B00817RYCG,458864358,Catch-22,Books,5,0,0,N,Y,"... a million times but this is one of the best books ever written by anyone anywhere about anything","Surely this has been said a million times but this is one of the best books ever written by anyone anywhere about anything.  It picks up the human condition and smacks you over the head with it, then picks you and and smacks you again.  And again.",2015-05-20
US,23039137,R2LP83MQVGFXMX,B00817RYCG,458864358,Catch-22,Books,5,0,0,N,N,"Crazy Good","Joseph Heller’s Catch 22 makes no sense. It is also one of the most profound pieces of American literature to be written. It is hilariously sobering, and brilliantly insane. This impressively original novel is assured a spot on bookshelves far into the future.  Catch 22 gives the reader an omniscient perspective of one who is completely sane in a world of pure insanity, the world of USAAF airmen in Italy during World War II. These men face the prospect of death regularly but find themselves in an inescapable situation due to paradoxical bureaucratic rules. Their thoughts and actions are made apparent to us as they try to preserve their sanity, or at least stay alive. In the novel, it seems, it is nearly impossible to do both.  Heller’s wit is insanely sharp. This war novel is an extremely funny read which had me laughing throughout. The characters’ motives and secrets which are revealed to us can only be described as humorous. The book’s message, however, isn't funny. Heller uses his original brand of exaggerated satire to make a statement about the insanity of war and the impossible situations soldiers find themselves in. In a broader sense, one could interpret it as a statement about 20th century society in general. It shows that people care most about themselves, and it shows that everyone is completely batshit crazy. Call me crazy, but I think there is some truth to this.  Catch 22 also shows how little people know about the wars they are fighting in. It may be funny, but is also extremely gruesome. It makes the horrors of war apparent and makes us ask, “Why do we do this?”  Joseph Heller’s first novel was unlike anything written before it. It is a brilliant satire and the funniest war novel ever written. Dr. Strangelove, a 1963 satire film, also touches upon the insanity of war in a way that makes me wonder if it was influenced by Catch 22, which was published just two years before. I think Catch 22 is more funny. It encompasses the insanity of war in a way never done before. It doesn't make sense, because neither does a lot of the world.",2015-05-14
US,20075180,RBHJOS8EIDYFS,B00817RYCG,458864358,Catch-22,Books,5,0,0,N,N,"One of my favorite books of all-time","I had to read this book again.  This classic is one of my all-time favorite novels.  I envy Heller for the words and emotions that he is able to put to paper.  Some, granted, may find Catch-22 a bit too smart-ass.  The novel is filled with humor, sarcasm, senseless contradictions, irony and satire.  But, I hate spoilers, so there will be none in this review.<br />Catch-22 is a character-driven novel based around the exploits of World War 2 bombardier John Yossarian.  Yossarian’s squadron is based near Rome and North Africa.  There is a whole cast of zany characters.  I am not a proponent of war, but this novel really expounds on some of the stupidity and government wastefulness that happens during wartime - or at least in this book.  The reader, if he or she is not from a military background, will begin to wonder if these things can really possibly happen during a war, and begin to believe it possible.  The premise of the book is that one would have to be crazy to want to fly a mission, or more missions.  But The Great Loyalty Oath states that one is crazy to unwillingly continue to fly dangerous combat missions.  That’s the catch, the Catch-22.  As the novel progresses, the reader, Yossarian, and the rest of the gang begin to realize that there are all kinds of other Catch-22’s lurking around that they are completely unaware of.<br />War is war and the war goes on.  People live and people die.  More people come to replace those who are lost.  However, the humor, irony and satire are not lost in this wonderful book by Joseph Heller that I will probably read again and again.  A little humor never hurt anyone,eh?<br /><br />Cameron",2015-04-02
US,35619134,RDP1F57TNTS75,0684833395,458864358,Catch-22,Books,5,0,0,N,Y,"Hilarious Classic","Osarian4lyfe",2015-03-23
US,43225004,R2WXR4OAHWZWSG,044011120X,458864358,Catch-22,Books,5,0,0,N,Y,"Five Stars","I love this book, and the one I bought (older) was fantastic. Love the old book smell~",2015-03-19
US,3194053,R27CSBR5V6UWIE,B00817RYCG,458864358,Catch-22,Books,4,0,0,N,Y,"Four Stars","Good quality",2015-03-03
US,51735467,R1MIF93CT02L2Q,B00817RYCG,458864358,Catch-22,Books,5,0,0,N,Y,"When you find that your life situation can only be described by quotes from the book, it's time to get out of Dodge","Bought a copy to have on the road. There's very little left to say about Catch-22 except perhaps this - when you find that your life situation can only be described by quotes from the book, it's time to get out of Dodge.",2015-03-02
US,13557207,R2XDELG35HOBAA,0684833395,458864358,Catch-22,Books,5,1,1,N,Y,"Funny!","A real classic!",2015-02-11
US,34647526,R1VPF5B70XM74M,B00ES29QW4,458864358,Catch-22,Books,5,0,0,N,Y,"Five Stars","Awesome seller, book met our expectations",2015-01-20
US,51416535,R2LHQAN8F3O5BH,0684833395,458864358,Catch-22,Books,5,0,0,N,Y,"Five Stars","Very possibly the best book ever written.",2015-01-15
US,17700116,R9HLWY6X0FSBX,0684833395,458864358,Catch-22,Books,5,0,0,N,Y,"Five Stars","Excellent.",2015-01-03
US,1735431,R1YL8Q4U8GSGT1,B00817RYCG,458864358,Catch-22,Books,5,0,0,N,Y,"Five Stars","All teenagers need to read this as do people dealing with them!",2014-12-23
US,11172584,R2W2NSCSTGLYSN,B00ES29QW4,458864358,Catch-22,Books,5,1,1,N,Y,"As","Advertised. Got here on time and on the condition stated. The book itself is of course a classic.",2014-12-13
US,23872154,R21GUCD26YNJ0E,0684833395,458864358,Catch-22,Books,4,0,0,N,Y,"Hilarious","Recommended. You will laugh at the idiocy of military logic even if you aren't familiar with all the jargon. Great book.",2014-11-23
US,16043841,R3O4A4NIRYNCBS,B00817RYCG,458864358,Catch-22,Books,5,0,0,N,N,"Five Stars","Item as descrbed",2014-11-10
US,12488728,R1O8IVUBOZ44CH,0684833395,458864358,Catch-22,Books,5,0,0,N,N,"My Favourite Book (As Measured By Number of Re-readings)","I'm not a re-reader but I've read this book 4 times, starting in 1971.  It took that many times for me to see past the humour to the horror of what was happening.  But, although I don't plan to read it again, it still stands as a tour de force.  At very least: what did we call &#34;catch 22's&#34; before it was written???  It's a book I don't think you'd ever forget having read.",2014-11-06
US,49708529,R1WS850N94SB4A,B00817RYCG,458864358,Catch-22,Books,5,0,0,N,Y,"I still need to read this though I've heard wonderful things about it","I still need to read this though I've heard wonderful things about it. Perhaps one day when I retire.",2014-10-21
US,30484247,R6E4YUKIW9K1N,0684833395,458864358,Catch-22,Books,5,0,0,N,Y,"Five Stars","Would deal with this dealer again",2014-10-16
US,34095325,R1BG7L7LZDKBQ8,B00817RYCG,458864358,Catch-22,Books,5,2,2,N,N,"Irony, sarcasm and satire my favorite flavors!","I love this story, even as patriotic and right wing  as I am I can completely identify with Yossarian, I hate incompetance, corruption, senseless-wastefulness and the shameless profiteering we see throughout the story and in real life. As an indictment of the worst aspects of society it is a humorous and ironic portrait of what is wrong with any organization when there are no checks and balances. There is a good bit of tragedy in it as well, if you were not in the military some of this may not resonate so much but it is still well written and entertaining, especially the dialog and the circular arguements. LOL, I am surprised the US government has not adopted catch 22 in real life as it's primary operating principle. Or maybe they have?",2014-10-14
US,41806010,R2FG7EQGZG1MH7,B001Q3KM9E,458864358,Catch-22,Books,2,0,0,N,Y,"Two Stars","Way overrated",2014-10-05
US,51972301,RLE9L7YY9J3A7,B00817RYCG,458864358,Catch-22,Books,3,1,1,N,N,"A Classic, but Not For Me","I understand why this book was a classic.  However, to my eyes, from my own &#34;historical epoch&#34; I found the characters to be draining.  Maybe a few laughs here and there.  Perhaps if I had been in the military I would have understood this humor better.",2014-09-24
US,1482192,R2QDJZ5IM6WUJF,B006RK9EK4,458864358,Catch-22,Books,5,0,0,N,Y,"Great price.","Purchased for child for school. Price was excellent. Others purchased for up to $35. Great buy.",2014-09-06
US,42689634,R1LIB18BYV2VC8,B006RK9EK4,458864358,Catch-22,Books,3,0,0,N,Y,"the book was a summer project for senior project, ...","the book was a summer project for senior project, there were to many people and place in this book. Very hard to follow.",2014-08-25
US,50187972,R34HQJ3CSNTO2O,B00817RYCG,458864358,Catch-22,Books,4,0,0,N,Y,"Solid Classic","Well written articulate book. Gets a bit long for a while in the middle, but the way daily life in a war time military is conveyed with truth.",2014-08-19
US,45303159,R21PL4OIWOBWCZ,0684833395,458864358,Catch-22,Books,5,0,0,N,Y,"Classic","Amazing book, difficult to put down! Loads of humor.",2014-08-04
US,48403947,REJDTQQJCDCSH,0684833395,458864358,Catch-22,Books,5,0,0,N,N,"Treasure the absurdity","Yes, this novel coined the famous phrase. In this classic novel, the protagonist Yossarian is subjected to the horrors of war . . . and war is made to look as absurd as it really is. Of course, &#34;catch-22&#34; refers to when a person is allowed to get out of flying bombing missions: You can't fly if you're crazy, but if you admit you're crazy because you want to get out of flying them, then you must be sane, because nobody sane wants to go on these missions. But if you want to get out of flying them, you're sane and you have to. Which is crazy. Ahem.",2014-07-24
US,37282763,R3478AM5JWTLQ0,0684833395,458864358,Catch-22,Books,4,0,0,N,Y,"It was as good a read as ever but the binding (being a ...","I bought this book to re-create my childhood library.  It was as good a read as ever but the binding (being a paperback) could have been better.",2014-07-20
US,1281541,R2Q38O2T661SX,B006RK9EK4,458864358,Catch-22,Books,5,0,2,N,N,"Five Stars","1506 not 1406",2014-07-01
US,52839370,R1QP7OB4D9WDX,B00817RYCG,458864358,Catch-22,Books,5,0,0,N,N,"Laugh out Loud","I have never laughed so much reading a book. I read it many years ago and should read it again, but I still am reminded of the funny things in the book.",2014-05-06
US,11069730,R27H5F25CXA2Y2,B00817RYCG,458864358,Catch-22,Books,5,2,4,N,N,"Against wars","Basically, the main character of the novel is a flyer to be declared crazy not to carry out a mission. But if he declares crazy shows that it is not. There are a number of characters that accompany it, each with its peculiarities. In the background is a simple plot but written in a confusing manner. At first you are totally lost. It is only at the end that one gets to see the plot. It is not a common novel.",2014-04-17
US,5835115,R1PE69BHMCZJFB,044011120X,458864358,Catch-22,Books,5,0,1,N,N,"The book that wrote the book","I have read this several times, and each time it seems like a new book. A must read for anyone who wants to understand modern lit.",2014-04-04
US,11588814,R14U7O74F9MKK7,0684833395,458864358,Catch-22,Books,4,0,1,N,Y,"catch 22 review","There was 5 pages that were never separated and I had to rip the edge to get to them in the middle of the book but was Still usable and everything else was fine.",2014-04-02
US,25481646,RY1BFE0JLOYFU,044011120X,458864358,Catch-22,Books,3,0,2,N,Y,"Meh","Ordered on 3/20 got it 3/31 from NJ. I am in NC. Book was in fair shape. OLD paperback with scuffed cover and faded pages. Ordered a book &#34;same condition&#34; from Cali. on 3/27. Both arrived today/ Book from Cal. was almost new. I won't order from here again.",2014-03-31
US,15008761,R203BHCH8HOV3T,044011120X,458864358,Catch-22,Books,4,1,1,N,Y,"Kafka meets M*A*SH* with a little Hitchcock and Serling thrown in","Catch-22 is a slow burn, not a fast moving page turner.  The premise of absurdist comedy and dark humor guides the reader through the moral chasms of bureaucracy, war, command, politics and self-interest in this deep and well written classic.  As noted by many of the other reviewers who did not give the book 5 stars, the book was written for a time and a culture that has changed in 60 years.  So, while the human nature and the brilliance of the writing - as well as the depth of meaning - remain, the modern reader will find the book a bit of a slow go.  Additionally, the writing style was emergent and edgy in the 1950's became more mainstream with the likes of the Twilight Zone, Stephen King, M*A*SH* and other books, movies and stories that take some of the complete stylistic shock out of the read.<br /><br />The book is one of the defining reads of the 20th Century, and explores humanity in a creative and darkly humorous way.  Worth picking up, and probably still deserves a place on a must read list.",2014-03-30
US,43311567,R3BK7L2R69P732,B00817RYCG,458864358,Catch-22,Books,1,4,16,N,Y,"Awful","The book has been a huge seller. As a PhD in English I say that it's an overlong piece of smart-ass not very amusing junk.",2014-03-15
US,13163998,R2I6N57XHUBOEQ,B00817RYCG,458864358,Catch-22,Books,5,0,1,N,Y,"strange book","Is an odd book but the more I read it the more I enjoyed it and helped me understand the state of mind a person would be in being involved in a war situation",2014-03-01
US,14139609,R1Y3WEVOU3YECO,B000RMR16W,458864358,Catch-22,Books,4,0,1,N,Y,"It was a Christmas gift.","The recipient liked it. The content was funny and they watched and laughed.  I was not a huge fan of this one but as long as they liked it, I am fine.",2014-02-18
US,32517249,R20I849H0OEO7S,0684833395,458864358,Catch-22,Books,5,2,3,N,Y,"Great Book!","Classic story. I love this book. My wife and i both read it (out loud to each other). Fun book.",2013-12-05
US,20488303,R2IX15EMQN1BQK,0684833395,458864358,Catch-22,Books,2,0,2,N,Y,"Not worth the Purchase","Should have waited until the local library had this book available to read.  I read it in HS but thought I should read it again in later life.  Did not appreciate it the second time and was a waste of money.",2013-12-02
US,19652737,RK0KSIF2ONELQ,0684833395,458864358,Catch-22,Books,5,0,1,N,Y,"Catch 22","FEED ME.  I will never forget those words.  They make the book.  It is a great book, and I have empathy for those involved in the insane war.",2013-11-22
US,11995464,R1SJ2193E2RKBV,0684833395,458864358,Catch-22,Books,5,0,1,N,Y,"Trifecta","Bought this, and Brautigan's Trout Fishing in America and Pynchon's Gravity's Rainbow as decompression reading for someone returning to the USA after an eventful and adventurous time in a combat zone. The recipient was one of the few people I know who could approach and appreciate each of them separately and also altogether.",2013-10-22
US,40522144,R3E3FH832ZT4FT,B00817RYCG,458864358,Catch-22,Books,5,0,0,N,Y,"Excellent","An excellent book that came to me in good condition that is definitely worth reading again for fans of any novel.",2013-08-26
US,38041463,R2I5S551HNHM88,0886461251,458864358,Catch-22,Books,5,0,1,N,Y,"First rate reading","Although this was an abridged edition we really enloyed Alan Arkin's reading.  Having read Catch 22 several times I was dubious about getting an abridged edition but this was great.",2013-07-25
US,36751889,R2B2TXS435A7QI,B00817RYCG,458864358,Catch-22,Books,4,0,1,N,Y,"Nice Classic","I enjoyed the story.  My daughter did not but it was a school requirement which always makes it more difficult.",2013-07-21
US,14650157,R1DXTQA8WEW7HW,B006RK9EK4,458864358,Catch-22,Books,3,2,4,N,Y,"OK condition","It's labeled as good condition.<br /><br />It looks clean but the book is really worn. Nice read though. Next time, will check with the seller on the book condition.",2013-07-18
US,52692127,R2G8OYK9CNMJM6,B00817RYCG,458864358,Catch-22,Books,5,11,12,N,N,"It was love at first sight.","I've probably read Catch-22 ten times.  I've taught it at the college level.  I frequently gifted it and I've talked about to anyone who will pretend to listen.<br /><br />It was good when I first read it and it's gotten better with each subsequent read.  There's so much here, it's almost mindboggling to think how Heller wrote this without the aid of spreadsheets and computers.  Oh, the migraines it must've brought on.<br /><br />Ex-PFC Wintergreen. Dunbar.  Milo the Mayor.  Just writing this review makes me want to read it again.<br /><br />The opening lines brilliantly represent the book's tone throughout.",2013-04-05
US,15998294,R220XOROR1PVEH,0684833395,458864358,Catch-22,Books,5,0,1,N,Y,"Classic","A really quality book, an overall good read I recommend it to everyone.  Book's physical quality was good as well, no big deficiencies.",2013-03-26
US,36879941,RL06T6WLADYAL,0684833395,458864358,Catch-22,Books,5,0,1,N,Y,"fine","God I get tried if writing reviews, I just want to buy a product and go on with my life<br />Sorry<br />David",2013-02-28
US,32866877,R281V4IL05THJ2,0684833395,458864358,Catch-22,Books,5,0,0,N,N,"Hilarious look at the bureaucracy, and ultimately the underlying seriousness, of war","Catch-22 is the story of Yossarian, a member of the US air force in World War II. The story loosely chronicles his time on the base. But mostly, it's an extended exercise in ridiculing military processes, thought, and actions, and at demonstrating just how crazy war is. The ridiculously exaggerated characters and their foibles make the story. They're so bizarre and chaotically presented as to almost make it difficult to follow -- but the humor is so excellent that it doesn't matter. It's a long book, worth the time to read.",2013-02-17
