marketplace,customer_id,review_id,product_id,product_parent,product_title,product_category,star_rating,helpful_votes,total_votes,vine,verified_purchase,review_headline,review_body,review_date
US,38462413,R1WL3MX0MMK19C,0684833395,458864358,Catch-22,Books,5,8,9,N,N,"Insane people don't care about their lives","My daughter says...<br /><br />The story of Catch-22 opens with the introduction of Captain Yossarian. Captain Yossarian, quirky and extremely paranoid, is the protagonist of the tale. Throughout the story, he is paranoid that everyone around him is trying to kill him. Yossarian's only wish is to fly the required number of missions, seeing as he is an American bombardier during World War II, and return home. However, due to the prideful actions of his Colonel, Yossarian has difficulty fulfilling his goal. Colonel Cathcart continually raises the number of missions his bombardiers have to fly in order to increase his own glory. Catch-22 is an accounting of the actions Yossarian takes to try and escape death, as well as the story of all the interesting, slightly odd, people he meets.<br /><br />When the number of required missions is first raised, Yossarian travels to the Army doctor to try and get the doctor to certify him as insane. However, Doc Daneeka refuses to allow Yossarian to get out of his missions due to the now-infamous Catch-22. According to the army's regulation Catch-22, any soldier who tries to get out of fighting by pleading insanity is showing personal concern. By showing this concern, the person proves himself sane, because insane people don't care about their lives. Men who are truly insane have no trouble flying more missions. However, since the only way to be \\""grounded\\"" is to request that you are, and the act of asking implies sanity, no person can get out of flying their missions. Yossarian, therefore, has no choice but to continue to fly the ever-increasing number of required missions.<br /><br />Yossarian, foiled in his attempt to plead insanity, attempts a number of other measures. First, he pretends to have some sort of liver problem and is checked into the hospital. In order to avoid being bored, Yossarian forges the name \\""Washington Irving\\"" on a number of the soldiers letters home he is asked to censor instead of writing his official signature. This action leads to a huge problem later on in the book as all the officers try to discover who Washington Irving really is. That problem is only compounded as various other soldiers began copying Yossarian. When he is finally thrown out of the hospital, Yossarian moves a line on a map of Italy to avoid flying a dangerous mission.<br /><br />Through the next section of the book, Yossarian has to deal with the deaths of several of his closest \\""friends.\\"" Snowden, the young Nately, and Hungry Joe are all bombardiers like Yossarian who ultimately get caught by one accident or another and die. With these deaths, Yossarian simply refuses to fly any more missions. This has a profound influence on the other soldiers stationed with Yossarian, and they silently begin to support him. Because of this, Colonel Cathcart offers to make a deal with Yossarian. If Yossarian will return back to the states and tell everyone how wonderful his superior officers are, they will let him go home. At first he considers the offer, but then realizing that it would be selling-out his fellow soldiers, Yossarian refuses.<br /><br />Instead, when the chaplain brings Yossarian to the living quarters of Orr, Yossarian realizes that Orr is not lost at sea like everyone believes. Instead, Orr carefully planed his escape by practicing crash landings on every flight he made. This time, instead of returning to the base, Orr had made his was to Sweden. Yossarian decides that he will run away to Sweden and join Orr there so he does not have to continue to risk his life fighting in the war.<br /><br />Review:<br /><br /> Unlike most books about World War II, Catch-22 does not attempt to describe specific battles and provide insight in the course of a war. Rather, it deals with the human interactions that are a part of war. Catch-22 is more than just a war novel, it is a novel about why people act the way they do when put into certain situations. I really enjoyed reading Catch-22.<br /><br />One of themost dominant themes in Catch-22 is that of insanity. In almost every chapter of the book there are examples of people using insane argumentation to make logical points. Catch-22 takes a look at the way people form so-called reasonable assumptions and proves how everyone, it seems, is crazy in their own way.<br /><br />In the very beginning of the book, Yossarian travels to the hospital and meets the army Clergyman. Once he decides that the man is not insane, Yossarian warns him that insanity is contagious, and, indeed, by the end of the book it seems that Yossarian is correct. By the second chapter, Yossarian has determined that war itself is madness. Men fight and die for a crazy notion of patriotism and that doesn't seem to bother anyone. Yossarian's friends think he is crazy because he recognizes the insanity around him, however Yossarian realizes that it is this awareness that will ultimately save his life. Because Yossarian knows he is in constant danger because of those surrounding him, he is prepared to defend himself against anything at any moment.<br /><br />The presence of the Catch-22 itself is a prime example of insanity in the book. It employs insanity to come to an insane conclusion, yet on the surface appears to be a logical chain of reasoning. Even doctors in the book are figures of madness. Yossarian is evaluated by a psychiatrist who determines that he is insane, however, because Yossarian went to the doctor under a different name, the doctor sends a different soldier home even though he knows that person is not the one he diagnosed as crazy.<br /><br />Another example of irrational circular logic occurs when Yossarian proposes to Luciana. Luciana refuses to marry Yossarian because she believes he is insane. She thinks he's insane because he wants to marry her. Luciana tells Yossarian he is crazy, yet she justifies this belief with irrational thinking, proving herself delusional.<br />Perhaps the best irony of the book however, is that Orr, supposedly the craziest of all the men, ends up being the sanest. In the beginning, Orr tells irrational stories and walks around with strange objects in his mouth. He does this so if anyone ever asks him why he has a certain object in his mouth, he can say that he doesn't have that thing in his mouth and pull out something else. He is, of course, utterly sensible in this belief. Orr is also, however, believed to be the luckiest man in the unit, because he is always crashing his plane and making it out alive. In the last chapter of the book, Orr crashes his plane in the ocean and disappears. Yossarian is at first shocked by this news, then stunned, as he realizes that Orr was not actually crazy. Rather, Orr feigned insanity in order to disguise his escape plans. The last time he crashes, Orr went to Sweden instead of simply dying like everyone thought. In the end, Orr used his insanity as his cover, and as his ticket to freedom.<br /><br />Typically, I am not a fan of any book dealing with historical wars. Catch-22 however, caught my interest quickly and held it throughout the book. I would recommend this book to everyone, no matter what kind of genre they usually enjoy.ost every chapter of the book there are examples of people using insane argumentation to make logical points. Catch-22 takes a look at the way people form so-called reasonable assumptions and proves how everyone, it seems, is crazy in their own way.    In the very beginning of the book, Yossarian travels to the hospital and meets the army Clergyman. Once he decides that the man is not insane, Yossarian warns him that insanity is contagious, and, indeed, by the end of the book it seems that Yossarian is correct. By the second chapter, Yossarian has determined that war itself is madness. Men fight and die for a crazy notion of patriotism and that doesn't seem to bother anyone. Yossarian's friends think he is crazy because he recognizes the insanity around him, however Yossarian realizes that it is this awareness that will ultimately save his life. Because Yossarian knows he is in constant danger because of those surrounding him, he is prepared to defend himself against anything at any moment.     The presence of the Catch-22 itself is a prime example of insanity in the book. It employs insanity to come to an insane conclusion, yet on the surface appears to be a logical chain of reasoning. Even doctors in the book are figures of madness. Yossarian is evaluated by a psychiatrist who determines that he is insane, however, because Yossarian went to the doctor under a different name, the doctor sends a different soldier home even though he knows that person is not the one he diagnosed as crazy.     Another example of irrational circular logic occurs when Yossarian proposes to Luciana. Luciana refuses to marry Yossarian because she believes he is insane. She thinks he's insane because he wants to marry her. Luciana tells Yossarian he is crazy, yet she justifies this belief with irrational thinking, proving herself delusional.   Perhaps the best irony of the book however, is that Orr, supposedly the craziest of all the men, ends up being the sanest. In the beginning, Orr tells irrational stories and walks around with strange objects in his mouth. He does this so if anyone ever asks him why he has a certain object in his mouth, he can say that he doesn't have that thing in his mouth and pull out something else. He is, of course, utterly sensible in this belief. Orr is also, however, believed to be the luckiest man in the unit, because he is always crashing his plane and making it out alive. In the last chapter of the book, Orr crashes his plane in the ocean and disappears. Yossarian is at first shocked by this news, then stunned, as he realizes that Orr was not actually crazy. Rather, Orr feigned insanity in order to disguise his escape plans. The last time he crashes, Orr went to Sweden instead of simply dying like everyone thought. In the end, Orr used his insanity as his cover, and as his ticket to freedom.     Typically, I am not a fan of any book dealing with historical wars. Catch-22 however, caught my interest quickly and held it throughout the book. I would recommend this book to everyone, no matter what kind of genre they usually enjoy.",2006-03-25
US,15943361,R1H2OXYDHV1SM7,0684833395,458864358,Catch-22,Books,5,0,0,N,N,"What's the Catch?","Before writing a book review, I always attempt to determine what the intent of the author was and how successfully the desired effect was achieved.  So what, exactly, is the purpose of Joseph Heller's \\""Catch-22?\\"" <br /> <br />Is it to provide a biting satire of the reputed leaders of the Armed Forces?  Is it to illustrate the dehumanization of war by a blind bureaucracy?  Is it to entertain us with a dark comedy and clownish, cartoonish figures like Colonel Cathcart?  Is it, perhaps, to parody the excesses and extremes of capitalism and communism through Milo's syndicate?  Is it to illustrate the horrors of war in graphic detail?  Is it to convey the inevitability of death and futility of escaping your ultimate fate?  Or is it simply an exercise in paradoxical reasoning and illogical logic? <br /> <br />The answer, of course, to all of these questions is yes.  Heller has delivered a masterpiece of a novel, one that works on many levels.  His unorthodox methods prove triumphant in the end.  Through light comedy, absurd logic, and haunting flashbacks, Heller presents a war, which may be fought for idealistic purposes, but is executed in an arbitrary and self-defeating manner, whose only glory lies in the odious commanders.  Although this is not an anti-war novel, it certainly criticizes how the war is fought.     <br /> <br />Catch-22 could be divided into two parts.  The first 2/3 of the book provides a circular timeline, as the non-sequitur chapters help to paint a vivid picture of the lives of Yossarian and his comrades.  At first, only minor details are revealed.  As the chapters progress, though, the details are filled in, like an intricate jigsaw puzzle, and the reader is left to ascertain the meanings of earlier, cryptic inferences and allusions.  In these chapters, a light comic mood prevails, interrupted periodically by such accounts as the siege of Bologna.  Indeed, some of the chapters are high-comedy.  If M*A*S*H wasn't inspired by this novel, it sure borrows some of the same comic elements.  However, Heller reminds the reader that there is still a war going on, as death and destruction come into the forefront periodically.  The last 1/3 of the book provides a linear timeline and marches incessantly toward the final climax.  In these chapters, the mood turns much darker and sinister, as the deaths pile up and the humor dissipates.    <br /> <br />Heller provides a portrait of each of Yossarian's comrades in the squadron.  Some, are comical and absurd, such as the enigmatic Major Major, who only allows people inside his office when he is out of the office.  Some are idealistic and sympathetic, such as Clevinger and Nately.  While others are boorish and brutish, such as Colonel (take your pick).  However, the narrative is told from Yossarian's point of view, so, although we are never told specific details about him, the reader can delve into his mind and discover the kind of person he is. <br /> <br />Overall, Heller delivers a masterpiece.  Catch-22 provides an entrancing, enthralling and interweaving narrative of details and ideals that paints a glorious picture of a war-time bureaucracy gone amok.  If you haven't read it yet, please do.  And if you've already read it in high school or college, read it again.",2006-03-23
US,52898099,R318R7FGMB3TL1,0684833395,458864358,Catch-22,Books,2,5,15,N,N,"Interesting in a bad way, you might say.","I am using my mom's account and so this review is by me, not my mom. <br /> <br />I read this book for a book project. I must say that I was misled by the short description of the book that said that it was \\""full of witty humor\\"". This book makes very little sense. The order of events is screwed up to the point that I was strongly tempted to rip out the pages and put them in some kind of a rational order. The \\""humor\\"" in the book is really not that funny to be honest. The rare moments of true comedy were so scarce as to not be able to justify this books existence. Any morals or \\""big ideas\\"" that you were supposed to get out of reading this book are lost in the nonsensical ramblings that I guess were supposed to be the plot. I gave this book a star rating because I was required to. Actually, I have mixed feelings about its contents and can't decide on a good rating. I guess the absurdity of the book could be a comparison to the absurdity of war. <br />",2006-03-22
US,19001959,R3PQRM2G986OR3,0684833395,458864358,Catch-22,Books,4,1,3,N,N,"Engaging","Catch-22 is a wonderful book, engaging the reader, enabling them to watch these people live, as if right by their side.  At first, I was a bit taken aback, wondering why in the world someone would recommend this book, but the reason soon became clear, diminishing any previous doubts.  Heller is able to bring these characters to life, using his words to create realistic imagery.  The characters become real, living, breathing people in your mind as you join them in their missions.  It even leaves a sort of mystery until the last page or so.  As much praise as Catch-22 deserves, however, there will be some that will argue, saying the language is too harsh, or the context too mature, but it is well written, and a true depiction of the lives of the people at war, or during the time.  With all of the seriousness, though, Heller provides comic relief through Yossarian's sarcastic antics, making the novel somewhat hilarious.  A person expecting a fairy tale, or an easy read, probably should not read this book, but I would still recommend it for readers of various sorts, whether you like action, war books, or not.  It really is difficult to go wrong when choosing to read Catch-22.",2006-03-22
US,14223968,RDZ2VN0DVFC6V,0684833395,458864358,Catch-22,Books,4,0,2,N,N,"Comical from Beginning to End","I'm not going to write a long review, as others have done a well job of it. I just like to say, it was just funny from one page to another from beginning to the end.  The whole book reminded me of M*A*S*H with too many Klingers, or, they all seem to be a relative of him.  All trying to get out of warzone as many of their comrades are dying mission after mission.  I can't believe high schoolers are forced to read this?  Sure, it has SAT vocabs strewn all over the pages, but so is sex.  Shrug.",2006-02-20
US,50890603,RGC09ZFLNFX59,0684833395,458864358,Catch-22,Books,4,1,3,N,N,"CATCH 22","<br /> <br />This is a funny movie but I do believe it helps to have been in the Air Corps and experienced some of this first hand---also to have read the book in advance of seeing the movie.  This will give you a better perspective as to what is happening and why. <br />I thought it to be an excellent movie and well worth the money and time spent viewing it--in fact, I watched it twice--so far.",2006-02-18
US,10952151,RC2Q10TKX5Y3H,0684833395,458864358,Catch-22,Books,5,1,2,N,N,"piercingly, wickedly funny","Without hesitation one of the finest books on war ever written. Painfully funny, fantastically intricate, deviously corrupting, Catch-22 is the standard by which all other books are measured. The first time I read Catch-22 I cried from laughter, and from the bitter truths expounded through the riotous characters Heller created here. An American classic.",2006-02-03
US,11193343,R2QD0C1FJZU5RI,0684833395,458864358,Catch-22,Books,5,4,5,N,N,"Excellent for those who can follow along","And now to explain Catch-22 in a single word \\""circular\\"".  Heller managed to create a variaty of characters and then milk them for all they've got.  For those of you who expect an anti-war book, go read something else.  If, however, you enjoy quality literature and can stand the unexpected, Catch-22 is addicting. <br />Note: This book is very confusing, and to those who can't make sense of it, it will be really bad.  I read it for an english class, but if I tried reading it for pleasure, this reviewed would be titled \\""ADD Overload\\""",2006-01-24
US,32765337,RG8CSS3ASI9KR,0684833395,458864358,Catch-22,Books,4,2,5,N,N,"A comedy with insight","Catch-22 is, in my humble opinion, one of the greatest post-modern books of all time.  The book is halarious, and makes fun of all sorts of politics and religion.  But in the end, \\""Snowdens seceret\\"" reveals great spiritual truth.",2006-01-20
US,49694646,RN1RTVNVEGRWY,0684833395,458864358,Catch-22,Books,5,2,2,N,N,"The defining cornerstone of American literature.....","While reading Catch 22 I wondered when Heller realized that he'd struck literary gold.  Was it during the writing process or later after the book received critical acclaim?  Although Heller wrote numerous other books, I defy any average Joe to name any except for the \\""sequel\\"" to Catch 22 (called Closing Time) and the often considered \\""sacrilegious\\"" posthumous Portrait of An Artist As An Old Man.  Nonetheless Heller ended up writing one of the most endearing, hilarious and poignant American novels ever. <br /> <br />Catch 22 follows the exploits of a WWII American bomber pilot named Yossarian.  We follow Yossarian through numerous missions and extra-curricular events in around his air force base and various locations throughout Europe.  Yossarian is a wise cracking paranoid fellow who often finds himself in the most absurd of situations that end up being revealing slices of life.  It's political satire at its best and one of the book's many strengths is the ability to change the reader's reality so that the absurd seems commonplace. <br /> <br />Catch 22 has many things going for it.  \\""Laugh out loud hilarity\\"" is a phrase I've often heard others (and myself) use to describe Catch 22.  One of the funniest books ever, it gets better with each read...Yossarian and his cronies are loveable characters that you will come to care about root for to survive.  Besides being hilarious the book has many touching and horrifying moments as it deals with monstrosities and casualties of war.  To top it off, Catch 22 is more relevant as a military satire due to current world events. <br /> <br />Amongst my group of peers (mid to late 20 somethings), Catch 22 seems to be the most common \\""all time favorite book\\"" and I would have to say it's top 3 for me as well.  It has a message, it's delivered in an entertaining way, the writing is more than serviceable, the characters are memorable and it has introduced a phrase into the American colloquium.  These are just many of the reasons why the book was a \\""classic\\"" shortly into after it was published. <br /> <br />Everyone should read this book although its length and prose could be a challenge for the uninitiated or inexperienced.  Although some of the material is adult in nature, the book is appropriate for mature high school students. <br /> <br />Bottom Line:  A cornerstone of American culture, this novel is not to be missed.  A genre defining novel that will make you feel like you accomplished something important upon its completion... <br />",2006-01-17
US,14183598,R2DRBZPLN33LO7,0684833395,458864358,Catch-22,Books,4,1,2,N,N,"There's a catch","\\""It's a Catch 22.\\""  It seems I've heard the phrase all of my life and never been able to put my finger on what it actually meant.  Reading the book mostly clarified it.  A Catch 22 is illogical thinking, explained in a logical manner contrived to suit the people who make the rules.  For example:  If you are crazy, you should not be in the army.  How does one go about getting classified as crazy?  You'd have to tell the doctor you are.  Having the insight to tell the doctor though, means you are sane.<br /><br />It's difficult.  I liked it - don't get me wrong, but the man has an extensive vocabulary and really seems to enjoy using it.  Also, he's a bit crazy and reading crazy sometimes makes me feel it.<br /><br />It's an Anti-War story written about the Second WW.  I guess when Vietnam was going on these books were really important - they showed the pain of war, rather than the glory.  I've read a couple of them in the past year or so and I feel almost the same about each.  I get why they were written but I don't identify.  I feel like I've missed something almost by not having a comparative analysis of my own.<br /><br />It's also a black comedy, but by the end I couldn't shake the \\""black\\"" enough to enjoy the \\""comedy.\\""<br /><br />I really did like it, I just don't think for the same reasons it became a best seller.<br /><br />The main character of this book is Yossarian, though he is not in all of the chapters.  He is a philosophical character whose anecdotes constantly put him in center stage.  His demise is heartbreaking, his brilliance is beautiful and his thoughts are totally soulful.",2006-01-12
US,40161385,R343QGX5H4IF9A,0684833395,458864358,Catch-22,Books,5,0,0,N,N,"Catch-22: American Classic","There was only one catch, and that was Catch-22.... <br /> <br />Catch-22 is a book detailing the life and times of John Yossarian, and how war changes his life and his way of appreciating life. <br /> <br />Yossarian, a bombardier in WWII, is constantly faced with the threat of death , when all he wants is to be immortal, or die trying. He is a quirky, witty man, and Catch-22 is full of humor, but one of the great things about this book is the range of emotion expressed by the soldiers. Although they are proud men serving our country, they are also trapped in a powerful bureaucracy focused on nothing but celebrity. Although they should have been commended for their bravery, they were thrust into the most dangerous missions for the most pointless of reasons: aesthetically pleasing bomb patterns. <br /> <br />One of the main reasons you should read this book, however, is for the flashbacks of Snowden. It's a powerful scene that stays with the reader, with vivid description and detail. You feel like your're there with Yossarian and clueless as to what to do about a dying gunner on your plane.But more than anything, this part, along with the entire book, leaves the reader with a new perspective on death and war. War can be a corrupt system, with people supposedly hating people from foreign countries they have never met, and supposedly being friendly with those on their side, when it can be entirely the opposite. War can send young and old to die, and war can drive men crazy. But most of all, war changes a man, as Catch-22 shows. <br /> <br />So if you're considering reading Catch-22, don't think twice...but do it. It's a book you'll never forget, and won't regret reading.",2006-01-10
