marketplace,customer_id,review_id,product_id,product_parent,product_title,product_category,star_rating,helpful_votes,total_votes,vine,verified_purchase,review_headline,review_body,review_date
US,45542590,R2RKOJH6YKK5QG,0684833395,458864358,Catch-22,Books,5,45,51,N,N,"War is hilarious!","To be honest with all you gentle readers, I don't much admire War novels, nor do I stand by the title of my review. Generally, I believe War is truly Hell.<br />But last Winter, in the grips of a bout of quasi-depression-for-teens following a move to the most FLAT province in Canada, I truly thought I was in Hell. An e-mail friend suggested Catch-22 to use up edgy cabin-fever time. Now, let it be known that my attention span for most novels dwindles quickly, especially if the book is slow to pick up. While significantly slower to get 'into' than most of the writing I chase, Catch-22 sucked me in, like Alice down the rabbit hole. It is sharply funny, engaging, and chock full of delightful characters. The main character is a thinker; a young man disheartened by war and his own mortality. His name is Yossarian, and since reading this novel, he has stood out in my mind as being one of the most...sculpted... characters in the history of literature.<br />Put simply, this book is a satire about World War 2. Coming from a kid sickened by the very idea of war, I can say that this book is worth whatever bills you have to fork over for it. It's not about war, per se, but more about the human condition. In addition, it made me laugh a few times, something that only a few other works of fiction have ever been successful in accomplishing. I finished this book feeling oddly... renewed. If you're looking for something 'new' (or, so old it's new) and engaging, I heartily recommend 'Catch-22' by Joseph Heller.",2001-02-26
US,48653948,R2Z3EGIG73QFWT,0684833395,458864358,Catch-22,Books,5,1,2,N,N,"Catch-22, witty, insightful, incredibly tragic and hilarious","In &quot;Catch-22&quot;, Joseph Heller paints an incredibly ludicrous, and simultaneously realistic, view of one man against the military-industrial complex. His writing style is difficult to get accustomed to, however once the reader starts thinking like Yossarian, every page is a welcome adventure. Joseph Heller weaves his tale with great skill, taking the reader from ironic situations so funny you *will* laugh out loud, to mind-numbing tragedy on the same page. My personal favorite? Colonel Cathcart, and his 'feathers in his cap' and 'black eyes'. I recommend this novel to anyone with a slightly twisted sense of humor, rest assured you will have your eyes opened.",2001-02-22
US,52694011,R1KGQXV0CJ3A6J,0684833395,458864358,Catch-22,Books,5,1,1,N,N,"Probably the greatest American novel of the 20th Century...","The way the logic of the book is twisted into the narrative is awesome- such as Heller's description about one lieutennant being attractive, intelligent, friendly, polite etc. , and therefore everyone hated him.<br />My favorite instance of this logic is the best come-back to the &quot;What if everybody did that?&quot; attack: &quot;Then I'd be a damned fool to do otherwise!&quot;<br />I also liked the &quot;It's better to live on one's feet than die on one's knees&quot; exchange.<br />Read the book, get it: there's enough density, puns, and jokes here that you'll find things you didn't  4 re-readings later!",2001-02-16
US,50020501,R2Z8A5HMITYD43,0684833395,458864358,Catch-22,Books,5,1,2,N,N,"Catch-22, A Good Book","Catch-22 lays out an entirely radical yet competent way of explaining war, or rather, of explaining the inexplicability of war.  Portrayed through confusion and satire, Joseph Heller's Catch-22 is simultaneously humourous and cutting.  Given to similarly amusing and sickening, Heller says all there is to say about the insanity and inhumanity of war.<br />Catch-22 opens during World War II with John Yossarian, a bomber in the Air Force, most fixedly in the hospital with liver problems.  However, Yossarian is not actually sick, but is feinting disease to isolate himself from the death of war.  A naturally high temperature leads doctors to believe Yossarian is sick when he is not.  When Yossarian finally leaves the hospital and goes back to his unit, he finds himself stationed on the island of Pianosa, near the Italian coast and the Mediterranean Sea.  It is not clear whether the hospital scene comes before after the next part Yossarian narrates, because his narrative jumps back and forth through time.  It is part of the confusion which controls the reader's perception of the nonsensicality of war.  Out of the hospital, it seems like nobody seems to truly understand that there is a war going on except for Yossarian.  In fact, Yossarian is so set on the death involved with war that he believes that everyone is trying to kill him specifically.  He finds it infuriating that &quot;millions of people&quot; are trying to kill for no fault of his own.  As he says in an argument with Clevinger about the pointlessness and misdirection of war, &quot;The enemy is anybody who's going to get you killed, no matter which side he's on.&quot;  In this perception, Yossarian is unique and practical, decisively demanding that his life is more important than national ideals or abstract principles.  He is completely determined to gain immortality or die trying.  The largest perceived threat on Yossarian's life at the moment is his air missions, and so attempts to find a way to be grounded.Yossarian asks Doc Daneeka if he would be grounded if he were found to be crazy.  Daneeka tells him yes, but there's a catch: Catch-22 says that there's a rule that says for any pilot to be grounded for reasons of insanity must first ask to be grounded.  However, anyone who asks to be grounded must obviously be sane. This is Yossarian's first encounter with Catch-22, but it comes back to meet him and others again and again.  The most poignant description of Catch-22 is given near the end of the book by an old woman mourning in the ruins of what was once a city.  She sums it up by saying that &quot;[The soldiers] have the right to do anything we can't stop them from doing.&quot;  This is portrayed through every bureaucratic move throughout the entire novel.  Higher ranking officers do things to their subordinates simply because they can, or because they believe it will give them a good reputation or promotion.  Yossarian and his companions are simply inhuman resources for their blindly ambitious superior officers to take advantage of.  Their officers would rather their men took pictures of their bombing runs that looked impressive rather than actually accomplish anything.  On top of this, the men can never leave, because higher ranking officials simply raise the number of missions they are required to run before leaving.  In this way, all the men are retained within the authorities control.  All this is done simply because they can.  Because &quot;they have the right to do anything we can't stop them from doing.&quot;  Catch-22 is, in essence, the law that makes war and murder &quot;legal,&quot; the mind-set that moralizes any immoral act, the entire mechanism under which the army can feasiblely run.  Without Catch-22, war could not exist, because of morals, values, ethics, individualism, and anything else that governs rational human thought.<br />A perfect example of the completely nonsensical nature of the surroundings is the power positions.  In this story, the mess officer Milo Minderbinder is the one of the most powerful people in the world.  He has such a hold on economics that he practically control the entire world.  He bombs his own camp as a result of a deal with Germany, he employs the use of every air force in the world for his monetary benefit.  Because he controls so much of the market, he manages to buy a shipment of eggs at 7 cents an egg and sell them at 5 cents an egg and still make a profit.  He manages this because he is in control of both the company which buys the eggs and the company which sells them.  Through subtle and ridiculous manipulation of the market, he probably has more control than any other person in the world.<br />In sharp contrast to this whimsical, comic nature of Milo is the gory, reoccurring scene of Snowden.  Yossarian began his downward spiral into cynicism with the death of his copilot Snowden.  Throughout the novel, the story slow unwinds of the traumatic experience of Snowden being shot while with Yossarian, and Snowden dying slowly in Yossarian's arms with his entrails splattered all over Yossarian's uniform.  Snowden's final words were simply &quot;I'm cold.&quot;<br />Catch-22 is, in my opinion, one of the greatest books written on the insanity of war.  The mechanisms Heller uses in his novel to portray confusion which may be hindrances only enhance the entire read of the novel.  While many war stories manage to encompass the horror and meaninglessness of war, few if any other manage to do so with so much wit and humour.  Nothing is more sickening then to find yourself emotionally connecting the horrible death of a human being with the abstract orders of an ambitious power seeker.  Heller's story of the pursuit of life and the  tragedy of death finds both the core values and issues at and, as well as the humour and insanity forever present in that never-ending reality: war.",2001-02-12
US,45577519,R2RBEP9251NTGY,0684833395,458864358,Catch-22,Books,5,6,8,N,N,"Illogical logic! Sane craziness! And Yossarian lives on...","This dark comedy of World War Two takes place on the small island of Pianosa, off the coast of Italy.  The main character, Yossarian, is an American bombardier, and like his squadron, spends much of his time either flying dangerous bombing runs over northern Italy, sleeping off his exuberances in Rome, or going on some hilarious comical escapade through which Heller is able to satirize the American military bureaucracy.<br />At first glance (or the first reading), this novel appears to be a random collection of character sketches, loosely arranged around Yossarian and containing only confusingly humorous conversational drivel.  But on the second reading, everything makes sense and it is possible to see how the comic absurdity changes from light and fun at the beginning into a dark and melancholy satire by the end of the novel.<br />Joseph Heller first published this novel in 1961, and since then the phrase &quot;Catch-22&quot; has entered into the English language as a &quot;paradoxical problem or situation.&quot;  In this book, Catch-22 is an obscure military regulation that allows for an illogical and absurd system to exist.<br />Completely illogical logic and embarrassingly simple complexity await the individual who undertakes the reading of this excellent novel, which has become both an amusing comedy and a pensive tragedy at the same time.<br />Bottom line? Catch-22 is an excellent book.",2001-01-25
US,45569296,RIUZ6N8Y9F3A6,0684833395,458864358,Catch-22,Books,4,1,1,N,N,"Katie's Review of Catch-22","Book Description: Catch-22 is a tremendous blend of irony and satire.  The book pokes fun at the paradoxes of everyday life in the military as it follows the tour of a young pilot, John Yossarian.  Yossarian spends his tour of duty going from his station in Pianosa and the city of Rome, where the men meet with Italian prostitutes.  While stationed Yossarian has to deal with the loss of many friends and the paradox of the mysterious catch-22, until he finally decides to leave using any means necessary.<br />Review: The satire that Heller uses in Catch-22 is enough by itself to satisfy the reader.  However, he also includes an interesting and action-packed storyline that is enough to make any reader enjoy the book.  Heller's outlook on life, as expressed by the protagonist, offers a unique perspective on its irony.  The use of a mysterious military directive, catch-22, is how Heller describes the irony best.  For instance, Yossarian cannot be grounded from flight unless he asks to be due to insanity.  However, according to catch-22, asking to be grounded demonstrates an appreciation for life, which constitutes sanity.<br />The only downfall to Catch-22 is Heller's extreme use of stream-of-consciousness, the use of jumping through time as the protagonist remembers events.  It is very confusing in the beginning of the book and makes the book difficult to start.  However, as the book continues and more events are included, it becomes easier to establish a true timeline, and the book can fully be appreciated for the marvelous literary work that it is.",2001-01-25
US,45573692,R5EYOO4HD3W5X,0684833395,458864358,Catch-22,Books,5,1,3,N,N,"Wow","Book description: Set in late World War II, Joseph Heller's Catch-22 starts out with Yossarian meeting the Chaplain in the hospital.  Yossarian was a pilot and was the main character in the book.  Catch-22 tells the story of World War II through Yossarian's point of view, from hospital visits to bombing missions to showing up to his medal ceremony naked.  <br />The book also ranges in topic from a Major who everyone was too afraid of to ask his first name to a mess officer who runs a bogus company.  Many topics are amusing, but the majority is not.  They are very human.<br />Review: Catch-22 is the most honest book I have ever read.  It feels like I am sitting on Yossarian's shoulder for the whole book.  I feel all his emotions and thoughts, and they seem so realistic.  The characters are completely believable and I can imagine a real person behaving as they do. I feel like a part of the scenes in the book.<br />The writing style is very good, too. Heller doesn't use flowery language or over describe situations.  His language choice is absolutely perfect for the situations he is describing.<br />Many novels from World War II seem unbelievable and overly heroic, but Catch-22 is not either of the two.  It comes across as very human and realistic, and that is the main reason that I think it is so good.",2001-01-25
US,45571169,RGLKDBOZZDEIB,0684833395,458864358,Catch-22,Books,4,0,0,N,N,"Catch-22","Catch-22 by Joseph Heller (461 pages)<br />Book: Description and Review:  In short \\""Catch-22\\"" is a humorous look at the lives of the soldiers in World War II.  It is more than that, however.  This novel depicts a life of impartiality, pain and boredom.  The war is out side, and inside, but the men have their own ways of putting the horrific details and coping with the loss aside to live.  Through the eyes of many different people the war and those involved are explored from many different points of view.  This technique that Heller uses gives the reader a look at look at their lives and the way they are lived from every possible perspective.  In a personal opinion the narration resembles a Faulkner story.  Through the incessant ranting and frivelous ravings a mind and a story emerge. The \\""average Joe\\"" is given his 15 minutes to shine with every turn of the page.  This novel is recommended to those who not only enjoy war stories, but a good laugh as well.  Heller's source of inspiration (W.W.II) is an admirable source.  He found a quirky humor from the tragic war of the 1940s.",2001-01-25
US,48097507,R10LSQFT1H62TO,0684833395,458864358,Catch-22,Books,1,10,52,N,N,"Overrated","The most overrated book I've ever read. Catch 22 is filled with unfunny, Abbott and Costello-like &quot;Who's on First?&quot; dialogue that goes nowhere. Remember those old war movies wherein the acting was overly sappy and sub par? Well that's Catch 22. You'll find yourself getting the point, and tortuously trudging through several pages for the point to be complete.  <br />A must read for insomniacs.",2001-01-17
US,48240764,R15JH0BUB8W8YN,0684833395,458864358,Catch-22,Books,5,0,5,N,N,"CATCH-22","This book is great.  I read it and its the best book ever. Im not kidding. This book is great. It shows you how life on a bombing base was and Yosarrian is just the coolest character. This book is surprisingly funny to and there are over 50 characters. You should buy this book it's worth the dough.",2001-01-17
US,48240764,RMJZSNN1K1ZD0,0684833395,458864358,Catch-22,Books,5,0,0,N,N,"CATCH-22","This book is great.  I read it and its the best book ever. Im not kidding. It shows you how life on a bombing base was and Yosarrian is just the coolest character. This book is surprisingly funny to and there are over 50 characters. You should buy this book it's worth the dough.",2001-01-17
US,51099163,R2ESRQZ2WETAZ9,0684833395,458864358,Catch-22,Books,5,0,1,N,N,"A True Masterpiece","This is truly one of the best pieces of liturature I have ever read.  It captivated me, I found it hard to put the book down, even to rest my eyes for a minute.  Heller does such a good job keeping your interest.  The characters in this book come alive to you.  You want desperately for Yosarian to make it through the war, and for something terrible to happen to Colonel Cathart.  This book does a great job shedding light on the insanity of war, and of the terribly beaurocratic systems involved with everyday life.  This book makes you laugh out loud, as well as making your stomach turn with apprehension.  Its amazing.",2001-01-09
US,46007521,R33D2DCW87XLBU,0684833395,458864358,Catch-22,Books,5,1,2,N,N,"It was love at first sight.","Catch-22 is simply the funniest book ever written.  It is, in places, a deeply dark satire of the futility of war; where the lives of ordinary men are risked for the unattainable ideals and pointless pursuits of others.  The reason that this book is so impossible to put down is that one moment it will have you rolling on the floor in laughing hysterically and the next  crying uncontrollably over the tradgedy of the characters' situation.  If I could only own one book, it would unquestionably be this one.  If you read it once you'll read it a thousand times.  Buy, read, enjoy. (Once you've read this you might like to visit: clubs.yahoo.com/clubs/yossarianlives  to chat to other fans)",2000-12-31
US,50173388,R2V25ZNMUGJ8PY,0684833395,458864358,Catch-22,Books,5,2,2,N,N,"A classic to behold.","Catch 22 is definitely THE BEST book I've read yet. Joseph Heller's characters are very believable, from Yossarian to Colonel Cathcart. The plot is clear, but has its twists and turns, leaving the reader expecting more and getting it. The amazing amount of paradoxes in the book leave you pondering, and the beauty of it is that they all fit in with the book. Truly a must-read book!",2000-12-23
US,52854456,RLD6EJHY103CJ,0684833395,458864358,Catch-22,Books,5,2,2,N,N,"Heller says it best","Having read this book for no other reason than I thought I should I must say I am frankly envious of those with the opportunity to study it. Anyone who reads Catch-22 will rave about it; no formal dissection is necessary to communicate the mutual wonder which shines clearly out of the ensuing rather incoherant duet of praise.   Convincing the rest of the world is another matter, one I feel I should leave to those who have done more than just read the book. However I remain skeptical that anyone could ever do justice to this novel, no matter how effusive their praise. <br />&quot;He knew everything about literature except how to enjoy it&quot;. Well Heller has created a book that won't let you avoid enjoyment. Enjoy!",2000-12-06
US,46937162,R1KQ1A954O0678,0684833395,458864358,Catch-22,Books,5,0,0,N,N,"A modern classic, Catch 22 is a must-read!","Catch 22 by Joseph Heller is a book about World War II and the brave (or maybe not-so-brave) soldiers who fought in it.  The blunt and truthful view of soldiers' lives is refreshing, this isn't a &quot;war heroes are our friends&quot; type of book.  The satirical humor and twisting plot will keep you up all night long reading this great book.",2000-12-04
