US,52112817,R1JOEWUK0AJ9L6,0395860253,883499455,Dog Soldiers,Books,5,2,2,N,Y,"best novel set in the 60's ever written","Dog Soldiers is one of the most intense chase novels ever written. From the moment the Nietzshean Marine Ray Hicks agrees to carry his old buddy's heroin from Vietnam to Berkeley, the reader is off on a wild rollercoaster ride. And the ride is through America, a crazed,hallucinogenic fun house America on a very bad trip.   The book operates so well, on so many different levels, that it is a like a running commnetary on late 60's culture, even as it is an unchained adventure - the war brought home, and the existential warrior Hicks, trying to maintain his honor even as he moves with, works for, falls in love with (and finally dies for) what he knows are \\""inferior people\\"" to whom nothing means anything, and never has.   \\""Who'll Stop the Rain\\"" was the movie (with Nick Nolte as Hicks), and it is okay. But the real movie of this novel has never been made- maybe it could not be made-maybe the Dog Soldiers\\"" is stone-cold proof that literature can do what no other kind of art can.   Hal Herring   author of:  Famous Firearms of the Old West: From Wild Bill Hickok's Colt Revolvers to Geronimo's Winchester, Twelve Guns That Shaped Our History]]",2008-12-04
US,39452841,R200IITJZRDQCL,0395860253,883499455,Dog Soldiers,Books,3,3,9,N,Y,"A bizarre plot with a twist of twentieth century American history","Being a historian specializing in America involvement in Vietnam, I tried to take a break in reading nonfiction by delving into Robert Stone's \\""Dog Soldiers\\"". Seeing Denzil Washington in the recent movie hit \\""American Gangster\\"" piqued my curiosity in this novel. [[ASIN:B001PO68EC American Gangster: And Other Tales of New York]] Besides, I needed a break from constantly reading nonfiction. Reading a novel allows the reader to absorb without constant attention to detail and historical connection. [[ASIN:0806517697 The Way It Wasn't: Great Science Fiction Stories of Alternate History]] It is also proven to bring up one's reading speed. Thinking topics such as the Vietnam War, the heroin trade that existed during the Vietnam Conflict and CIA complicity in the trade, I was expecting an exciting yarn. Regrettably, I was disappointed. I found the characters, in particular \\""John Converse and his wife, Marge\\"", to be burnt-out losers.<br /><br />You can read other reviews to get an idea of what the plot is about, so without being a \\""plot-spoiler\\"", I felt that with all the drugged-out corruptness, the infidelity of the protagonist's wife, the illogical decisions made by people bent on profiting by the sale of heroin, this book was a waste of time to read. In trying to get any connection to reality, there was the part early in the story where \\""Converse\\"", the protagonist, justifies smuggling a couple of kilos from Vietnam into the U.S. by what follows. [[ASIN:1450248993 Things That Make No Sense]] Stone wrote:\\""The last moral objection (to smuggling heroin) that Converse experienced in the traditional manner had been his reaction to the Great Elephant Zap of the previous year. [[ASIN:0962852422 The Land of a Million Elephants]] That winter, the Military Advisory Command, Vietnam, had decided that elephants were enemy agents because the NVA used them to carry things, and there ensued a scene worthy of the Ramayana. Many-armed, hundred-headed MACV had sent forth steel-bodied flying insects (helicopter gun ships) to destroy his enemies, the elephants.<br /><br />All over the country, whooping sweating gunners descended from the cloud cover to stampede the herds and mow them down with 7.62 millimeter machine guns. The Great Elephant Zap had been too much and had disgusted everyone. Even the chopper crews who remembered the day as one of insane exhilaration had been somewhat appalled. There was a feeling that there were limits. [[ASIN:0060903287 The Politics of Heroin in South East Asia]] And as for dope, Converse thought, and addicts-if the world is going to contain elephants pursued by flying men, people are just naturally going to want to get high. So there, Converse thought, that's the way it's done. He had confronted a moral objection and overridden it\\"". Obviously, this twisted analogy to justify selling heroin made as little sense to me as the end of the story (what happens to the heroin and the people smuggling it). [[ASIN:1555716121 The Elephant and the Tiger: The Full Story of the Vietnam War]]  For me, I need a story that has a semblance of logic, reality and historical connectedness, an attribute I felt \\""Dog Soldiers\\"" lacked.<br /><br />Sorry to any of you that really liked this book, as I know I am going to catch some slack for this critique. Opinions about books are like songs, everybody has their own opinion, and there is no right or wrong answer. [[ASIN:1452879818 Cherries : A Vietnam War Novel]] Personally, I seek in a novel some type of subjective historical tie in that I can use as a framework to relate to. Many veterans of the Vietnam War have written about their tours, using a fictional backdrop to explain their experience. [[ASIN:1934980692 Internal Conflicts]] This assists them in translating their adventure from almost 40 years ago into a fluid, dynamic story, with fictional usage of a storyline to fill in their gaps of memory. A few examples of this are John Podlaski's \\""Cherries,\\"" where through fiction he was able to explain what it felt to be an 18 year old, fresh out of high school, transported 8,429 miles away to rice paddies, jungles and mountain tops. [[ASIN:1450562116 All For Nothing]] Once in Vietnam, he described what it was like to  be shot at by an enemy he knew nothing about nor had any reason to hate. Flint Whitlock's \\""Internal Conflicts\\"" actually describes the author's experience in life, using the storyline to vicariously represent his ordeal. Another excellent example, albeit lengthy, is Clair Raney's \\""All For Nothing.\\"" Both books are winners, true \\""page turners\\"" hard to put down until finished. Regardless, it is simply my opinion.ain what it felt to be an 18 year old, fresh out of high school, transported 8,429 miles away to rice paddies, jungles and mountain tops. [[ASIN:1450562116 All For Nothing]] Once in Vietnam, he described what it was like to  be shot at by an enemy he knew nothing about nor had any reason to hate. Flint Whitlock's \\""Internal Conflicts\\"" actually describes the author's experience in life, using the storyline to vicariously represent his ordeal. Another excellent example, albeit lengthy, is Clair Raney's \\""All For Nothing.\\"" Both books are winners, true \\""page turners\\"" hard to put down until finished. Regardless, it is simply my opinion.",2008-12-01
US,48037087,R3RWMBBBPNPLJG,0395860253,883499455,Dog Soldiers,Books,5,2,2,N,N,"Great Chase!","I remember this book with great fondness. Great characters and a break-neck plot. Good for escape, but also has a message from a terrific writer.",2008-07-24
US,49876220,R36QIOIT5TLDLR,0395860253,883499455,Dog Soldiers,Books,5,5,5,N,N,"A Time Capsule  for the 60s in decline","Dog Soldiers chronicles the promise of the 60s going hideously hay wire.   As the flower generation shifts from pot to heroin, the ugly nature of the drug trade, which we know full well now, emerges:  corrupt officials, crooked cops, addicts and dealers and violence.  This novel captures the wonderful cadences of hippy language.  Once the reader gets beyond the seeming cliché of so many `far outs' on its pages, the musicality of the language is apparent;  Stone had an excellent ear for dialogue, and quite an incisive wit.  All his characters, but especially Converse, express themselves with a minimum amount of words, and much of it slang, but to strong effect.",2007-03-06
US,52152317,R51NSK66S0NH2,0395860253,883499455,Dog Soldiers,Books,4,9,9,N,N,"Michael Herr meets Jim Thompson","I read this novel after Richard Ford mentioned that Robert Stone was one of his favorite authors, someone who in his mind best deserves the accolade of \\""getting Vietnam right.\\""  Or at least, I thought he said something like that.<br /><br />Stone is again pretty famous because he has come out with a memoir of his time in the counterculture -- Prime Green -- and that certainly colored my time with this novel.<br /><br />Stone offers a lot of story in this novel.  This is no aching reflection. It is not about peering through drawn shades on to a street in Vietnam, like Kurtz in Apocalypse Now.  It is a thrill ride of a drug deal gone horribly wrong.<br /><br />I suppose that desperation opens well into the moral ambiguities where these characters live.  In each of the three main characters -- Ray Hicks, John Converse, and Marge Converse -- their lives have taken a break from normalcy.  In Vietnam, Converse runs with a crowd of two faced brothel owners and press corps types.  Back in the states, its more of the same: everyone is grifting -- from the police officers to the hippie commune leaders.<br /><br />My favorite part of this book was the description of the odd stories that Converse wrote while working for his father in law at a second rate tabloid newspaper.  \\""Hungry Skydiver Eats Woman,\\"" was a title, I think:  that makes sense, in a way, because before he was famous, Stone made a living covering wrestling for local newspapers.<br /><br />I am glad I read this book.  It seems like it was an important story when it came out.  I feel glad to have stumbled upon it.  I thought I was going to get something historical, and it turned out to be a yarn and a half.",2007-01-09
US,49671072,R37QABKMK66ELN,0395860253,883499455,Dog Soldiers,Books,1,42,71,N,N,"Thanks, Jorn!","I read about this book on Jorn Barger's website, in the section in which he recommends books. This book is on a par with Conrad and Hemingway. Intensity of mood meshes with character development and descriptions of people, actions, places, weather on a particular day, crowds in different countries, literary allusions. There are a few pages on which a little jargon is used: most English-speakers who grew up in an English-speaking country and don't live in a cave will \\""get\\"" them. A few were even over my head, and I'm not only a native English speaker but a native Californian, who grew up in the 70s drug culture, so I should get all of them (there are about three or four things I didn't understand). But even if you don't know what place June is referring to when she says \\""P.V\\"" (it's Puerto Vallarta), these few phrases shouldn't detract from your enjoyment of one of the greatest American novels. IMnotatallHO, this book beats anything I have read by David Foster Wallace, T. Coraghessan Boyle, Don DeLillo, or anyone in the McSweeney's crowd.  <br /> <br />DON'T TAKE HEED OF ANY REVIEWS OF THIS BOOK WRITTEN BY DISGRUNTLED IOWAN HIGH SCHOOL STUDENTS WHO HAD TO WRITE A REVIEW OF IT FOR A CLASS.  <br /> <br />[Oh yeah: why I gave it one star: I like to give my reviews one star, because then discerning people will read them. I myself usually avoid reading five-star reviews as they are almost always mindless gushing - give me some juicy, bitchy opinionated ranting over simpering tepid praise any day! <br /> <br />On the Dveej-o-meter, Dog Soldiers gets a 9.6 out of 10.]",2006-08-12
US,47693484,R1KWORCBOCCYPK,0395860253,883499455,Dog Soldiers,Books,4,5,8,N,N,"A unique take on the Vietnam era","After reading Tim O'Brien's &quot;Going After Cacciato&quot;, I was sort of in a Vietnam-themed reading mood.  I heard that Robert Stone, who had apparently been a companion of Keruoac, had written a dark adventure novel called &quot;Dog Soldiers&quot; that won the National Book Award.  After reading the Biography.com description of Robert Stone and his &quot;carefully crafted&quot; books, I decided to give it a try.<br />For the most part, the book lived up to my expectations.  It is indeed very exciting and pessimistic, but I did have trouble with some parts.  One of the characters actively practices Zen at great length, but I didn't know much about that subject so much of that character was difficult to understand.  Also, much of the discussion of drugs is written in a vernacular I'm not very familiar with, so a great deal of that was also difficult to understand.  Aside from these shortcomings (which I know were largely my own), I would give the book five stars.",2003-11-20
US,29956171,R3M7I9YJITOVB8,0395860253,883499455,Dog Soldiers,Books,3,13,19,N,N,"Disappointing","I'd read a lot about how prescient Stone was about the drug trade and American involvement abroad, so I picked this book up, excited about a literary author who actually seemed interested in getting the reader's blood pumping.  In any case, I was disappointed: I'm not sure how novel this was when it appeared in the 70s, but many of its scenes have become standard cliches of the movies - the torture scene, the bags of drugs, the shootouts in precarious and picturesque locations.  <br />Perhaps it isn't fair to criticize a book for how much it's been imititated, but a genuine work of art shouldn't lose much of its lustre just because of mediocre followers, and I found myself genuinely bored by a great deal of Dog Soldiers.  The only scene that showed the talent of the author was the surreal conversation between the central character and his slightly crazy mother. I haven't read A Flag For Sunrise or any of Stone's other books, but I'd certainly try those before this one.",2003-06-27
US,52383494,R19NENDQX7X1SL,0395860253,883499455,Dog Soldiers,Books,5,19,20,N,N,"The Darker Side of the 70s","I first picked up this novel about fifteen years ago, after I'd seen the film adaptation of it-the strangely titled \\""Who'll Stop the Rain\\"" with Nick Nolte and Michael Moriarty.  I had never read any of Stone's work before, and I was absolutely blown away by this, his second novel and winner of the National Book Award.  The story of drug smugglers in the waning days of Vietnam, the novel owes much to American Naturalism (Stone has been compared to Conrad, but I think Jack London and Stephen Crane are closer), but filtered through the post-war sensibility of  Ken Kesey or even Hunter S. Thomson.  Fast-paced and utterly plausible, the narrative ranges from the shadowy cafes of war-time Hanoi to the lawless valleys of the American southwest.  Throughout, Stone describes the varying landscapes of moral corruption with equal vividness and intelligence.   For my money, \\""Dog Soldiers\\"" is the best novel of the 70s, and yet it still seems completely contemporary today.   I re-read it every few years and always discover something new.",2003-03-25
US,47064822,R1VQB0T1PVU2KB,0395860253,883499455,Dog Soldiers,Books,5,26,29,N,N,"good good good","I read this book  for a college course on the cold war. I couldn't believe my professor. He actually apologized for putting it on the curriculum! He said that it was perhaps too gross, or graphic.... or something. How insulting!...How are we s'poseta learn about the cold war if the teachers teach with sterilized kid gloves. This book is, to Vietnam, a more accessible version of what Gravity's Rainbow is to WWII. It's harsh  but not without redemption. Dog soldiers is goods good good...",2002-03-28
US,36989061,R18PE5W090HHAH,0395860253,883499455,Dog Soldiers,Books,5,5,6,N,N,"Riveting and Real","I had never heard of Robert Stone when I picked up an old paperback printing of this novel at a flea market.  Reading it blew me away.  If you're an ex-soldier (or marine) who had more than passing contact with the drug/criminal underworld of the 70's (hhmmm - guess I'm in that category) I predict that you will recognize every character and it will blow you away, too.  Without belaboring all the points made in previous reviews, I agree with those made by MacInnes, Rampageous Cuss, and Sam Mills.  Yes, this novel is a \\""trip in time for those who experienced it\\"", but it is also enlightening and thought provoking on multiple levels.",2002-02-27
US,51199159,R3HT8UU4OT2OGS,0395860253,883499455,Dog Soldiers,Books,3,5,8,N,N,"Bleak portrait of emptiness","Framed in a story of drug smuggling gone wrong is a bleak portrait of America in the 1970s and of the people living then, specifically the subcultures. The underlying message appears to be how pointless things actually seemed (the Vietnam War, relationships, justice, life), and yet all the characters (and us as well) just keep soldiering on through the drudge and misery in the hopes that things get better. This is a sometimes difficult read that gets easier as the reader adjusts to the rhythms of the story. As the would-be drug smugglers end up on the run, the storyline picks up speed to its unexpected end.",2001-04-15
US,52484734,R2ICHDJWLHM5,0395860253,883499455,Dog Soldiers,Books,4,2,3,N,N,"Struggling with the Despair","&quot;Let smiles cease.  Let laughter flee.  This is the place where everybody finds out who they are.&quot; -Converse<br />Dog Soldiers is a story laced with despair, paranoia, and several other not so fuzzy moods, and this quote from the main character elegantly demonstrates this mood.  The tone of the book was a point of interest and displeasure for me, since this was one of my first experiences with total negativity, it was a fun struggle for me to understand the point or the necessity of such an angry mood.  At the same time it made me very uncomfortable, sometimes to the point where I would have to stop reading for the day.<br />There is a constant stream of action in this story, which makes it rather difficult to process what's going on as it happens.  The story rarely drags and it is written so that it feels very real and alive.  Slang terms are used often too, which are also hard to understand.  But after the first few chapters it seems that most readers are able to get around this and start enjoying the fast paced style in which the book is written.  This style also adds to the mood of panic and paranoia that encompass the entire book as Marge, Hicks, and Converse try to flee with their dope.<br />Marge, Hicks, and Converse are the book's three main characters, and as the plot follows first Converse's activities and then moves back and forth between Hicks and Converse, these two main characters develop into very complicated people.  Marge's character isn't delved into as much, but it didn't seem to be that she was usually thinking about much besides the next time she could get high.  Some of the things Converse and Hicks did or said still baffle me, just like the characters that are a part of my real life.  Because all of the characters are so weak and hurt each other with such frequency and carelessness, I found it hard to like them, but I liked the fact that not many stories center on people of such violent natures. <br />I had to read Dog Soldiers for aclass, and I'm not sure if I would ever seek out a book of such violent and depressing extremity on my own reading schedule, or even be able to get all the way through it without someone else pushing me along.  It was hard to get into the story's angst and intensity, but once I was able to let myself enjoy such a gruesome story, I decided that Dog Soldiers is one of the best books I have read all year.",2001-04-10
US,53024732,R52FGI06S9F2B,0395860253,883499455,Dog Soldiers,Books,5,8,10,N,N,"High School Kids in Iowa?","Look, this is an American classic, simply one of the best novels I've ever read.  It's way over the heads and hearts of all but a few high school students, yet someone in Iowa City decided a couple of years ago to assign it for class reading and the kids ran screaming here to complain about it -- thus the less-than-stellar starred review you see above.  Read this book:  I lived a lot of the events portrayed in it.  It is right on.",2001-03-17
US,47456376,R34T2LI606P3XY,0395860253,883499455,Dog Soldiers,Books,5,29,34,N,N,"yes, a masterpiece,etc -- but READ ON:","Stone's DOG SOLDIERS is a fine book, but if you happen to see this without exploring the rest of the reviews on Amazon -- access them. The novel was assigned as a high school project in Iowa, and the kids who had to read it seem to have flocked en masse online (perhaps part of the project) to review it. I found reading these reviews very entertaining, and recommend the experience to anyone, though it won't tell you much about the book. I like kids, what can I say.  Now that that's out of the way, Stone is one of the most important (and most strangely neglected) writers of the 20th Century. I think comparisons with Hemingway and Conrad are a bit off the mark; this novel is far more reminiscent of COMEDIANS-era Graham Greene, in his troubled Catholicism and concern for the decline of religion in the 20th Century. While Stone is hardly interested in promulgating any particular religious point of view, he IS a moralist, and a scathing critic of what we've become without a sense of God. This novel can be read, I think, as a crucifixion myth of sorts, made relevant to the 20th Century. It IS dark, but it's brilliantly paced and written, and a fairly accurate look at the time it deals with.  Stone, by the way, talks of a recurring dream he has, where he's bringing drugs or contraband into a country, usually on a ship, and knows that he is about to be caught. This motif informs the paranoid tenor of the novel.  A final point: the title has nothing to do with Lakota warrior societies, and is a bit of a misappropriation. It appears to be a reference to the proverb &quot;better a living dog than a dead lion,&quot; which Converse muses on in the text. The outstanding performances by Michael Moriarity as Converse and Richard Masur (who usually seems to have a limited range) as Danskin are two really good reasons to see the film...",2001-03-02
US,52368100,R3LPU6EA1AORPZ,0395860253,883499455,Dog Soldiers,Books,5,7,9,N,N,"A late twentieth century masterpiece","It's a shame that this book's star average has been kept down by all those lame reviews from Iowa - where presumably it was set as some sort of high school project - because Dog Soldiers is undoubtedly one of THE great novels of the late Twentieth century. And you can enjoy it on so many different levels. As pulp fiction: racy plot; sex, drugs and ultraviolence. Or as post-modern literature: relentlessly bleak, skewed, confusing narrative - culminating in an inspired burst of hallucinatory, stream of consciousness. Or as a profound comment on the legacy of Vietnam in the American psyche. Whatever, the important thing is is that you read it. It's a work of genius.",2000-10-04
US,52572105,R1H9BWV4P3AUFV,0395860253,883499455,Dog Soldiers,Books,3,3,7,N,N,"A nightmare that never ends","Robert Stone's National Book Award winning novel, &quot;Dog Soldiers&quot;, may have a special resonance for the generation of  Americans who lived through the sixties and seventies amidst national angst  over the US' involvement in the Vietnam war and the counterculture that it  spawned, but it's hard for non-Americans like me and those unfamilar with  the seedy underworld of drug smuggling and dealing to decypher and make out  what Stone's writing about. The proliferation of American slang and jargon  made the book a difficult read for me. There are nevertheless tracts in  there which I truly enjoyed - like the disastrous incident with the young  middle class couple who wanted to experiment to experience the real thing -  very much a sign of the times which evoked in me an indescribable sense of  horror. That the novel is populated exclusively by unsavoury characters is  not unexpected or a put off. After all, we're dealing with the underground  world of drug traffickers in a hell that has followed us back to America  from Vietnam, where you learn who you really are. As I was reading the  book, I was thinking to myself, &quot;what a great movie this would  make&quot; not realising that it was made into a movie in the late 70s  under the title of &quot;Who'll Stop the Rain&quot; with Nick Nolte,  Tuesday Weld and Michael Moriaty. While I found much of the book tough  going and confusing - especially the part with Ray Hicks hallucinating -  perhaps seeing the movie will help make the meaning clearer. My feelings  towards the book are decidedly mixed. It's an important book. I only wish  it were a little more accessible to non-Americans like me.",2000-08-08
US,49003096,RUSMQDO3AFKJF,0395860253,883499455,Dog Soldiers,Books,5,4,4,N,N,"Vietnam, USA","Robert Stone's Dog Soldiers is one of the most important novels to come  out of the Vietnam experience. His insight into the counter culture and  American society during the last years of the war ensure that this book  will remain forever in the canon of American Letters. Stone is a remarkable  writer. He takes Hemingway on at his own game and wins. To bring the  Americans out of Vietnam and bring Vietnam and the War back to the US is  Stone's masterstroke. And to manage this in a novel that is as fast paced  as the best pulp fiction is a remarkable achievement for any writer of  literature.",2000-08-05
US,50819793,R2GYXHAFSDYXIX,0395860253,883499455,Dog Soldiers,Books,5,10,20,N,N,"Heeeeeeelllp!","Keep this book away from people in Iowa City, Iowa",2000-01-12
