US,50294162,R1A92ANEEPCKPT,0395860253,883499455,Dog Soldiers,Books,3,2,11,N,N,"Bizarre book!","Drugs and corruption are the themes of this novel by Robert Stone. In a disjointed way, Stone shares his feelings during the time of the Vietnam War. He tells a story of a journalist, a strung out wife, and a dealer.  There is not a single person in this book who is &quot;normal&quot; -all of  the characters are addicted to drugs. The writing is so real and  descriptive that I felt like I really was living with Converse, Marge and  Hicks. The bad part was that their lives were so out of it! There is a  great deal of profanity in this book, which sometimes gets in the way. The  book is very complicated because there are so many characters and each  character is different. If you can keep the characters straight, this is a  good book.",2000-01-10
US,50819793,RSD25HKXT5F6J,0395860253,883499455,Dog Soldiers,Books,5,10,12,N,N,"Quintessential Vietnam War novel","This book is among the top three or four greatest Vietnam War novels ever written -- period. It goes deep deep deep into the human condition, making it, frankly, more than just a book about the war and its aftermath. It's  about the irrevocable stain on the American soul, a stain that got there   long before the atrocity in Southeast Asia (think European expansionist  genocide, think slaughter of the American Indian, think Hiroshima and  Nagasaki -- think, think, think.",2000-01-09
US,50569004,R19INGJA782GOJ,0395860253,883499455,Dog Soldiers,Books,3,2,15,N,N,"my review","While reading Dog Soldiers by Robert Stone,I could not stand it. Iwas shocked by what I was reading. Now that I have finished the book and have thought about it,I feel that Robert Stone meant to shock people with a  story filled with corrupted characters to show hoe life in the counter  culture of the 1970's was. The characters are so realalistic it makes the  reader almost sick to hear their story. Another feature of this novel that  I feel makes it good is after you get into it you don't want to put it  down. Once again I think this is because the reader has been shocked and  like the characters in the novel, they are waiting for their next fix.",1999-12-09
US,50581464,R1VOH998FFK03T,0395860253,883499455,Dog Soldiers,Books,1,3,25,N,N,"Dog Soldiers:  A review","This book is strange, to say the least.  It won the National Book Award in 1973.  The characters are so realistic and involve themselves in what people have the ability to do in extreme situations or when opportunities  arise to gain wealth or power and no negative consequences seem imminent.   The book is very believable because the characters resort to drugs and  illegal activity when the chips are down.  That's how a lot of people in  society deal with problems; either drugs or alcohol.  It's usually the  people who don't fit the typical mold, like Converse.  He's just a simple,  tabloid reporter.  The fact that the book seems to jump around in setting  constantly keeps the reader immersed in the story and wanting to know where  the next page will lead them.  I felt that the book contained too many  characters and each character's purpose and importance were sometimes  unclear.  The sex scenes and drug use were too many and too detailed for  me.  I would recommend this book to an older audience due to the drugs/sex.   It will inform younger adults of the dark side of the 70's/Vietnam  lifestyle or serve as a trip in time for readers who actually experienced  it.",1999-12-08
US,51232557,R2R9587OT426CJ,0395860253,883499455,Dog Soldiers,Books,4,11,11,N,N,"Good, hard-bolied thriller; not to be taken seriously!","I got a BIG kick out of this book which, I suppose, is indeed intended to be social commentary of some kind.  Whether you buy into that angle or not it's an engrossing thriller about a lost generation, a group of people  drifting completely without any moral anchor and the inevitable results.  Although vaguely anti- establishment in tone the story is really deeply  anti- counterculture!  Definitely nihilistic, which is not for everyone!",1999-10-04
US,52854795,R3LMMLS6Z91C4B,0395860253,883499455,Dog Soldiers,Books,5,5,6,N,N,"A great American novel","I first read &quot;Dog Soldiers&quot; when I was a teenager and was deeply impressed by it.  But judging from the reviews here this is a book that you will either love or hate with no in between.  So be it.  Stone is probably  out of reach of most mainstream readers.  The only bad thing I have to say  about Stone is that he sold the film rights of &quot;Dog Soldiers&quot; to  the wrong people.  It was made into a very terrible movie called  &quot;Who'll Stop the Rain&quot; starring the highly overrated Nick Nolte.",1999-08-02
US,51810263,R3ROMTFLRINW9E,9994437062,883499455,Dog Soldiers,Books,4,2,2,N,N,"Keeps your attention","I would just like to say I had never heard of the author or the book until this year. As part of our contemporary Literature course this was the first book which was allocated that we read first. It is part of American Studies  at University of Canterbury in New Zealand.I really enjoyed Stones style of  writing even though it is abit depressing. Overall the book was captivating  and showing students like myself some of the realities and aftermath during  this time.",1999-03-13
US,51849855,R16LLPQDL979TY,0395860253,883499455,Dog Soldiers,Books,4,15,16,N,N,"Vietnam as 'Treasure of the Sierra Madre'","I read this years ago, and saw the movie adaptation, 'Who'll Stop The Rain', and found Stone's take on the questions to what our involvement in southeast asia was and the crippling results of that amoral action hard edged and totally embodied by the pathetic denizens of this novel. From Hicks' stance as a lost samurai to Converse's justification to sell dope and make money it's only natural all who they come in contact with suffer from some delusion or another of what is 'right' . There are no good guys in this book. This was a pretty delusional era and the symbolism of dope as gold as cure all to be lost in the dust of the desert with leisure suited thieves works as a beautiful ending.  A hard book to put down, especially for anyone who lived through this time and like Hicks, has a decent sense of irony.",1998-03-07
US,52984130,R3NKADC0BHPF62,0395860253,883499455,Dog Soldiers,Books,2,9,17,N,N,"This won the national book award?","I may be completely missing the point of this novel, but I found it to be completely devoid of any coherent observations of any culture or &quot;counter-culture&quot; or, for that matter, anything beyond the method the protagonists used to get high on each different page.  I might have been able to give this book a higher rating, despite its lack of commentary, social or otherwise, were it not for the fact that plot dragged along slowly, causing me to wonder if it would ever end...  Perhaps this novel would have been better off at the novella length, perhaps not.  I have the utmost repsect for Robert Stone and have, in fact, thoroughly enjoyed A Hall of Mirrors and Children of Light, but I seem truly to have missed the point of Dog Soldier",1997-07-27
US,53021795,R1COFDFT5ZBSRQ,0395860253,883499455,Dog Soldiers,Books,5,4,4,N,N,"You Need to Read This Book","Stone's books are all filled with drugs and paranoia, but Dog Soldiers, his second novel, is his most on-the-edge.  His vision takes in everything, the obscure details that fill the world, focused in tight-points on the counterculture and that which the counterculture resists, on the idea of America, of respectability.  Dog Soldiers starts in Vietnam with a drug deal, moves to California, where the deal goes wrong, and winds up with one of the protagonists walking through the desert, wounded, toward death.  Welcome, America, welcome",1997-05-08
US,15503354,R1JPOMUAJRA093,B004H1UED6,883499455,Dog Soldiers,Digital_Ebook_Purchase,1,1,6,N,Y,"One Star","Plot is rather confusing and none of the characters is appealing",2015-07-23
US,53066566,REEHTQTNPTXEZ,B004H1UED6,883499455,Dog Soldiers,Digital_Ebook_Purchase,5,1,1,N,Y,"Very Real..","Very well researched and believable.  Very dark with many turns one does not expect at the strangest moments.  Is a good night read as well.",2015-07-13
US,11924133,R2864CSPH6F5D7,B004H1UED6,883499455,Dog Soldiers,Digital_Ebook_Purchase,3,1,2,N,Y,"Three Stars","Ok",2015-05-30
US,53081862,R3OE2909Z788I,B004H1UED6,883499455,Dog Soldiers,Digital_Ebook_Purchase,4,1,2,N,Y,"Somewhat Noir","This book was, of course, a major motion picture.  It was well constructed, and it is apparent the the author knows his craft.  My only criticism is that it the ending was somewhat too noir for my taste.",2015-04-20
US,52473292,R33FDW8AGFGEAW,B004H1UED6,883499455,Dog Soldiers,Digital_Ebook_Purchase,2,1,6,N,Y,"Competently written but derivative","I thought it would be interesting to read about a war correspondent during the Viet Nam war who decides to smuggle heroin.  It was not.  The characters were universally unlikable, pathetic, and slightly irritating.  The story was predictable.  One character is addicted to Dilaudid, an opiate, but nothing I had ever heard of and I thought i was quite knowledgeable about the desirable illegal pharmaceuticals of the period.  On a positive note, the writing is competent.<br /><br />I cannot recall the title, but I know I have read another novel of this period that had a veteran using martial arts techniques to manage pain, like the character, Hicks does, so that's why I consider it derivative.  My husband asked why I bothered to read it, and of course I wanted to get my Amazon Kindle $9.99 worth.",2015-04-19
US,51346832,R2WP0ERAMR3N0G,B004H1UED6,883499455,Dog Soldiers,Digital_Ebook_Purchase,5,1,1,N,Y,"Excellent","Very fine novel from the era I grew up in but just discovered this author recently. Very fast paced noir with many twists and turns.",2015-04-01
US,37497084,R2ARYTPXAVYOVC,B004H1UED6,883499455,Dog Soldiers,Digital_Ebook_Purchase,3,1,3,N,Y,"not sure of its point but the story grabs you","I hope the author didn't intend this as the meaning of the sixties kind of like altamount but I have a feeling some readers/critics took it that way<br /><br />Very well written and a fast read<br /><br />Characters are quickly sketched but not deep<br /><br />I don't know if I'd read another by the guy but I'm not sorry I read this",2015-02-04
US,14645127,RFW1V5K8S9BZV,B004H1UED6,883499455,Dog Soldiers,Digital_Ebook_Purchase,5,1,1,N,Y,"great book","Well written with excellent characters chasing after a smuggled shipment of heroin. The plot is a struggle between  corrupted morals and greed that keeps the reader in suspense until the end.",2015-02-02
US,52848227,R2H8843630QA1Y,B004H1UED6,883499455,Dog Soldiers,Digital_Ebook_Purchase,5,4,4,N,Y,"book of/for the times","As a guy who enlisted in USMC when facing draft (dumb farm boy), retuned to where I was in U of I in the late 60's, I found the novel to have the big and absurd ideas, the tone and time period threads, and recognizable characters.  Glad things lightened fast for me but Stone has the times down cold.  Second read after 45 years but still hooked me.",2015-02-01
US,47742479,R3EAFU7SPE90B6,B004H1UED6,883499455,Dog Soldiers,Digital_Ebook_Purchase,4,1,1,N,Y,"The Sixties; Drugs, Murder, Corruption and Desparation.","I bought this book because of the movie (Who'll stop the rain) which I enjoyed. I like to read certain novels that are adapted into movies for two reasons. One, to see how close the screenplay follows the book.and two, generally the books are better than the movie because they can go more in depth on the story and characters. In this instance Stone does not disappoint. I thought the book was well written and the story was great. With this novel Robert Stone joins other authors I like to follow.",2014-11-02
US,36014892,R2ARNG0ROTR6B2,B004H1UED6,883499455,Dog Soldiers,Digital_Ebook_Purchase,5,5,5,N,Y,"Worth A Second Read","I hadn't picked this book up in years & did so only because I wanted to read a Vietnam War classic & thought I'd grabbed Michael Herr's classic memoir, Dispatches.  I realized my mistake right away, of course, but was pulled in by this epic tale of the end of the war & the end of the counter culture in the US, and the stench of rot that accompanies heroin. You know the story - it was told in the movies as the Nick Nolte war flick, Who'll Stop The Rain.  But the book puts you inside the thoughts of lost boy/war correspondent John Converse, hippie academic wife Marge, & zen punk Ray Hicks, the ex-Marine courier who tries to get the stash from 'Nam to Bay Area.  Author Robert Stone had seen both war & hippie commune from the inside so he reminds you of the hopelessness of each in the final days.  There is humor & despair in nearly equal measure here, often in the same setting (a sordid movie theater; a psychedelic mountain fortress & a burnout guru named Dieter.). Most of all, there is predictable inner dialogue like that of an addict or the unfamiliar conversation w/ self of a dying soldier.  If you've read it before, it works the second time around.  If never - you should if only to experience the heart of darkness that came after the age of Aquarius.",2014-10-05
US,11267377,R1R5FUO4RD2GRE,B004H1UED6,883499455,Dog Soldiers,Digital_Ebook_Purchase,5,2,2,N,Y,"Nitty Grity Look at International Dealing","Wars are started for many reasons. The American press will never give the public the real reasons- for example- Vietnam, Iraq, Afghanistan-etc.even the civil war- but this book describes those individuals who use these global blunders to make money for themselves instead of letting companies like Halliburton and other government controlled defense companies be the only ones to rake in billions. Good ol' American ingenuity. Very interesting read, especially for someone who was there- and for the rest of us who care to know more than the evening propaganda.",2013-12-21
US,49310460,RCICBJ1NGBILW,B004H1UED6,883499455,Dog Soldiers,Digital_Ebook_Purchase,2,3,5,N,Y,"I was disappointed","I bought this because I had read a great short story by Robert Stone.  I thought the novel fell flat.  It was not a compelling tale, the characters had no personality, no depth, nothing to grab onto.  The author has a real talent for describing places, but the dialogue was terrible.  About once every 80 pages or so, some humor would break through, but then nothing again for page after page.  Some people have some heroin and they're trying to sell it, so they go here and they go there and things happen and then it ends.  No character is remotely interesting or even really distinguishable from the other characters, no character really develops, the story goes nowhere, it ends and who cares.",2013-10-26
US,49650131,R2M7FA1P3VN8L6,B004H1UED6,883499455,Dog Soldiers,Digital_Ebook_Purchase,5,2,2,N,Y,"A tremendous book","It is hard to understand the cultural shift that was imposed on America with the Vietnam war.  This book helps you with that understanding.  The movie that was made from this book, &#34;Who'll Stop the Rain&#34; is a great interpretation.  Stone was a colleague of Ken Kesey.",2013-01-18
