marketplace,customer_id,review_id,product_id,product_parent,product_title,product_category,star_rating,helpful_votes,total_votes,vine,verified_purchase,review_headline,review_body,review_date
US,49880010,RWUE6BWQJZB7Z,0140186301,283114178,Lucky Jim,Books,3,0,0,N,N,"neurotic intellectuals in a nerurotic world","I enjoyed the clever satire of the absurdity of British academia where status and pretension can be valuable, and yet luck, both good and bad, can suddenly change everything.  Very smart, but I just didn't feel the connection with the story personally.",2008-08-21
US,52932969,R2FZGG3T3M0WC8,0140186301,283114178,Lucky Jim,Books,5,3,4,N,N,"A Dangerous Novel!","This novel almost cost me my job.  Many years ago I taught a seminar in satire, and one of the books on my reading list was \\""Lucky Jim.\\""   When a senior faculty member heard about this, he tried to rally others in my department to deny me tenure, proving, of course, that the novel's searing attack on academic snootiness was right on.  I got tenure anyway, and the novel still makes me smile.",2008-05-19
US,20455384,R3U5KXIOD7WD73,0142180149,283114178,Lucky Jim,Books,5,7,7,N,N,"""O lucky Jim, /How I envy him.""","The British literary theorist Terry Eagleton characterized Kingsley Amis as a \\""racist, anti-Semitic boor, a drink-sodden, self-hating reviler of women, gays, and liberals.\\"" Well well! And what is the reader of \\""Lucky Jim\\"" to think of such a venomous outpouring of contempt toward the author whose book he innocently holds in his hands? Indeed, Kingsley's famous offspring, Martin Amis, stands accused of following in his father's infamous footsteps. He has had his fair share of literary dust-ups too and is in the middle of a raging and anguished public argument about England's cultural identity. Like father, like son?<br /><br />Certainly, no matter what anyone says about Kingsley, \\""Lucky Jim\\"" stands up as a comic masterpiece. For me it's a memorable and complex characterization of British class differences as shown in the myopic world of academia. The tortured reflections of Jim Dixon, lecturer, as he tries desperately to appease the abominable and self-absorbed Professor Welch are at the crux of this classic. Dixon's troubles only begin with Welch. They also involve two women, one who's highly neurotic and rather plain, and another who's very young, very attractive, and very confused. Margaret and Christine are both unfortunately connected to the good Professor, which sets up drawing room comedy of the highest order. Hilarious confrontations and elaborately absurd schemes inundate the action. But what lifts this novel above the rest is the precise and brilliantly realized writing. Listen, for instance, to this passage about Dixon waking up the morning after an excess of drinking: \\""Dixon was alive again. Consciousness was upon him before he could get out of the way; not for him the slow, gracious wandering from the halls of sleep, but a summary, forcible ejection. He lay sprawled, too wicked to move, spewed up like a broken spider-crab on the tarry shingle of the morning.\\""  Wow! Then there's this passage about having breakfast early at his lodging house: \\""There was something about Miss Cutler's cornflakes, her pallid fried eggs or bright red bacon, her explosive toast, her diuretic coffee which, much better than bearable at nine o'clock, his usual breakfast-time, seemed at eight-fifteen to summon from all the recesses of his frame every lingering vestige of crapulent headache, every relic of past nauseas, every echo of noises in his head.\\"" Yes!<br /><br />I read the Penguin edition with David Lodge's entertaining Introduction (a plot spoiler, by the way, which should be read after you turn the last page of the book). There you can find from Lodge a bit of an apology for Amis' 1950s \\""politically incorrect\\"" characterization of women. From Amis: \\""Christine was still nicer and prettier than Margaret, and all the deductions that could be drawn from the fact should be drawn: there was no end to the ways in which nice things are nicer than nasty ones.\\"" But Lodge is generous about this rather simple view of things, since Amis later on found the \\""nasty\\"" things inescapable. Lodge also places this work in the context of the British literary and theatrical scene of the late-1950s and points out \\""Lucky Jim\\""'s mold-breaking impact on that generation. No question this entertaining work cracked open some stodgily sealed doors and piquantly pointed out British academic and cultural absurdities.<br /><br />O lucky me, to have found this book, warts and all. I highly recommend it.about Miss Cutler's cornflakes, her pallid fried eggs or bright red bacon, her explosive toast, her diuretic coffee which, much better than bearable at nine o'clock, his usual breakfast-time, seemed at eight-fifteen to summon from all the recesses of his frame every lingering vestige of crapulent headache, every relic of past nauseas, every echo of noises in his head.\\"" Yes!    I read the Penguin edition with David Lodge's entertaining Introduction (a plot spoiler, by the way, which should be read after you turn the last page of the book). There you can find from Lodge a bit of an apology for Amis' 1950s \\""politically incorrect\\"" characterization of women. From Amis: \\""Christine was still nicer and prettier than Margaret, and all the deductions that could be drawn from the fact should be drawn: there was no end to the ways in which nice things are nicer than nasty ones.\\"" But Lodge is generous about this rather simple view of things, since Amis later on found the \\""nasty\\"" things inescapable. Lodge also places this work in the context of the British literary and theatrical scene of the late-1950s and points out \\""Lucky Jim\\""'s mold-breaking impact on that generation. No question this entertaining work cracked open some stodgily sealed doors and piquantly pointed out British academic and cultural absurdities.     O lucky me, to have found this book, warts and all. I highly recommend it.",2008-03-08
US,47640708,R3LRE482CD6TGT,0140186301,283114178,Lucky Jim,Books,5,3,4,N,N,"Older but Never Dated","I think you simply have to be an academic to fully enjoy the comedy of Lucky Jim. Not that the jokes lost any of their flair over last half a century, Jim's misfortunes have a slapstick quality to them which can be funny even in Elizabethan comedies. Their full quality, however, is visible only to people who have had some experience with the world of academy. Yet there is a lot for every reader even living in safety far away from the world lead by the watchword \\""publish or perish\\"".<br />I always tell my students who explain to me how good it is to be a university professor to read this book. So why shouldn't you try?",2008-01-12
US,27226251,R2ZJGG625S8ESY,0140186301,283114178,Lucky Jim,Books,2,9,17,N,N,"What's All the Fuss?","kingsley Amis' established himself as a literary celebrity in England with the publication with this short work of comedy, which would continue to occupy a comfortable niche in the academic-farce 'genre' for the duration of the trend. Yet I found Lucky Jim terribly stiff and antiquated; it lacks any of the satirical wit that it must have possessed during time of its publication. We are asked to follow a fairly inept junior professor through a series of contrived situations at a major university amidst a cast of comic-book-esque academic types. I suspect that this brief whimsy will be an object of sociological curiosity rather than a highly regarded work of literature. Kingsley has the ability to reveal the absurdity of a given culture. He does not however, have the ability to make it pulsate with life and mystery the way his son can.",2008-01-04
US,51757266,R3FMWDY1YNQTSO,0142180149,283114178,Lucky Jim,Books,5,2,2,N,N,"Laugh Out Loud Goofball Professor  [T]","Sometimes a book is about undertones, imagery, hidden or hard-to-find symbolism, or dreadful cynical askance of another's work. This is not such a book.<br /><br />This is a great tale - full of laughs about the boyish personality of an overachieving academic named James - who we get to know as Lucky Jim.<br /><br />He doesn't know exactly what or how he got into the university life, and soon learns he is really out of his element.  He is not stuffy enough, he is not arrogant enough, he is not . . . enough.<br /><br />Within a few months, a few hundred pages, he manages to burn his boss's bed and table - and opts not to confess to the embarrassing act, lusts and seeks the love of his boss's son, makes not one - but two - prank calls to the home of his boss, makes numerous false statements face-to-face to his boss, and plunders a speech his boss requests him to give.  Best yet, the plundering involves mimicking his superiors while practically belching his words from his inebriated state.<br /><br />At the end, you almost hear him say, \\""Take that you lout, and `yer whole family too.\\""  But, this occurs in the 1950's, in educated England, where and when people acted and spoke civilly to one another, even when the topic of discussion was anything but civil. So, there is no \\""out loud\\"" in-your-face confrontation like that.<br /><br />As someone who probably grew up reading Waugh, Shaw and Forster, Amis's dialogue richly resembles their great works as it depicts the unique and invariably different method of speech than what we entertain daily in 21st century America.<br /><br />This was a lot of fun to read and \\""full of good laughs, old boy. Good show.\\""",2007-03-14
US,17145253,R10K3PSXWGTIHO,0140186301,283114178,Lucky Jim,Books,1,13,59,N,N,"An Absolute Yawnfest!","When I read stuff on the back of this novel like, \\""preposterously brilliant\\"", \\""a classic comic novel\\"", and \\""Amis was a genuine comic writer, perhaps the best\\"", I immediately snatched this book up and started rummaging through the sentences, paragraphs, and chapters with heightened interest. The book was interesting enough for me to buy it from Borders bookstore 30 minutes after reading a bit. Even though I didn't laugh, I believed I just had to read it from beginning to end. So I took this book home expecting something hilarious; the result: a genuine cure for insomnia. I don't care for all these praises of \\""masterpiece\\"" or \\""this book explores the complexities of human condition and human relations\\"". I want an interesting read; I'm not calling for an action-packed Ian Fleming, James Bond novel, I'm asking for something engrossing. I didn't get what I asked for.    The visually descriptive details in this novel are thoroughly lacking. Amis doesn't bother to write about the setting, the atmosphere, the people (except for Bertrand, Christine, and Margaret to some degree); as a result I have no idea what Welch, Dixon, Beesley, etc. look like. They all could be wearing bedsheets all the time for all I know.     All in all, this novel is not recommended: it lacks physical detail and humor.     P.S. If you search all the previous good recommendations you'll see the high reviews were simply given by \\""a reader\\""; probably the same dude.",2006-12-10
US,43179652,R1UOSFZRKLLKSL,0140186301,283114178,Lucky Jim,Books,3,2,12,N,N,"Time have changed my perception.","Years ago, when I had the first oportunity to read this book, it seemed to be real fun, while today it is just description of general problems of academic enviroment, it looks that nothing have realy change or will change. The stagnation of academia <br />is a pemanent dilema: today teachings are the absolite truths, defended by the old guards.",2006-08-19
US,49818928,RDO4W57LXARZZ,0140186301,283114178,Lucky Jim,Books,5,5,6,N,N,"Amis' Lucky Jim: Humor Hides Frustration","Those who come to LUCKY JIM by Kingsley Amis usually do so because thay have heard that it is a funny book. And so it is. But when one finishes and tries to analyze the source of the humor, one finds, somewhat surprisingly, that the hero Jim Dixon, drifts in and out of situations that construct backgrounds that are patently phony, mostly to the reader and only partly to Dixon himself. It is his reaction to all this encrusted phoniness that serves as the ideology that led to the existence of the Angry Young Men dogma that was then afflicting a post-war England. For Amis, humor was the means by which this frustration at not being able to do anything about it caused him and his readers to laugh at a society whose only saving grace was that what you saw was definitely not what you got.    Jim Dixon is a young college instructor, trying hard to fit in when he quickly realizes that he should not fit in but plows ahead anyway. Since he is non-tenured, his continuing employment depends on the good will of his department chair, Professor Welch, a man who argues that life ought to be unhampered by the restraints of a confining culture, but whose deeds shout out the contrary. Dixon is dating a younger colleague, Margaret Peel, a rather plain-jane type who inexplicably sees in Dixon the salvation to her own need to have free love without the responsibility to maintain it. At a party, he meets Welch's equally pontificating son, Bertrand and his date Christine, to whom Dixon is attracted. The humor of the novel resides in some slapstick scenes, a leading example of which occurs when Dixon falls asleep while smoking with predictable results--he very nearly burns down the guest room of the Welches in which he was staying.            Amis hints early on that his true reason to write LUCKY JIM was his dissatisfaction with the compacency that he saw as ossifying England. He deduced that far too much of England was an empty facade full of empty people performing empty functions. Jim Dixon himself lectures on topics of which he is ignorant but hopes that no one can see his lack. Professor Welch is much like himself, only on a higher level of incompetence. Both Dixon and Welch are involved in an equally spurious revival of folk art. When at the novel's end and Dixon is seen as \\""lucky\\"" in the sense that he has a new job and a new girlfriend, the reader is puzzled what Dixon has done to deserve his luck. And that is the point. He has done nothing to be lucky, but he has had the sense to avoid the excesses that afflict the Welches. Jim Dixon is simply not ossified enough to avoid his luck. For him, coming in third in a four man race is good enough to win the top prize. For Amis, that was not good enough. LUCKY JIM tells the world that.",2006-08-13
US,39802170,R21WL6AO1G2WPY,0140186301,283114178,Lucky Jim,Books,5,2,2,N,N,"Distinctly British, Distinctly Funny","I was assigned to read this book for a class I'm taking, so it seems fitting that a book about a young professor out of his depth at one of England's lesser (or \\""red-brick\\"") universities should be forced upon university students to the modern day. \\""Lucky Jim\\"", for all its faults, is a great look at the madness on the other side of the teacher's desk.<br /><br />Jim Dixon is a young man whose education was delayed by service in the Royal Air Force during the Second World War, and his position as a lecturar on \\""Merrie England\\"" and other topics related to the Middle Ages is both tenuous and unpromising even if he can manage to hold onto it (whether or not he can survive the department head, Welch, or his hideous family, and the temptations of Christine, who happens to be dating Welch's horrid son Bertrand). Over the course of the novel, Jim proves to be anything but \\""lucky\\"" in a series of comic misadventures that other reviewers have covered and which I think should be left to the reader to discover for themselves, as they make up some of the best-written comedic scenes I've run across in novel-writing anywhere.<br /><br />The main arguement anyone might have against the book is that it is \\""distinctly British\\"" and also of its time to the point where it loses relevance. I have no problem with the former, as the novel indeed would be more appreciated if you came to it with a basic understanding of the English class system and the upheavals of the postwar era (one that began with \\""The Angry Young Men\\"" and the Goon Show, led to the Beatles and Monty Python, and finally the punk era). But you don't need a doctorate in medieval literature to understand Dixon's comic plight or the crisis he faces on a regular basis.<br /><br />As far as relevance, there can be an arguement made for Amis' sexism (Jim is torn between the beautiful Christine and the more plain Margaret, who also turns out to be a drama queen). In the way that it portrays the fairer sex, \\""Lucky Jim\\"" is certainly un-PC. But great literature can often transcend the prejudices that color it, and while not making excuses for the manner in which women are viewed, I think it's safe to say that the novel still has some measure of worth as a genuinely comic story of its time, that also helped define a movement.<br /><br />Jim is the first legitimate \\""anti-hero\\"" of British literature (or at least the first commoner to hold that distinction), and he was followed by Alex DeLarge and a slew of others into the present day. \\""Lucky Jim\\"" has something to say about the preposterousness of university life, the idiocy of the very teachers that we're supposed to learn from, the plight of ordinary men in extraordinary (at least to them) circumstances, and finally the triumph over adversity with a certain amount of dignity and hard-earned self-respect.<br /><br />And did I mention how good it is?ainly un-PC. But great literature can often transcend the prejudices that color it, and while not making excuses for the manner in which women are viewed, I think it's safe to say that the novel still has some measure of worth as a genuinely comic story of its time, that also helped define a movement. <br /> <br />Jim is the first legitimate \\""anti-hero\\"" of British literature (or at least the first commoner to hold that distinction), and he was followed by Alex DeLarge and a slew of others into the present day. \\""Lucky Jim\\"" has something to say about the preposterousness of university life, the idiocy of the very teachers that we're supposed to learn from, the plight of ordinary men in extraordinary (at least to them) circumstances, and finally the triumph over adversity with a certain amount of dignity and hard-earned self-respect. <br /> <br />And did I mention how good it is?",2006-08-01
US,52468899,R1DL47LCJOSRVA,0140186301,283114178,Lucky Jim,Books,5,4,8,N,Y,"My new favorite book....","It took me 4 or 5 pages to get into this book. Once that happened I couldn't put it down. It's a masterpiece, not a wasted word, beautifully constructed and very funny. It's sad the time people waste going to the movies or watching television when they could pick up a gem like this and get so much more out of it.",2006-05-13
US,11334331,R3HZAKE2GUDCKU,0140186301,283114178,Lucky Jim,Books,5,0,2,N,N,"Great Novel","I originally bought this book because I had to read it for my English Literature class, but after I actually sat down to read it, I couldn't put it down. <br /> <br />It had it's ups and downs, but for the most part it was just a great British academic comedy.  I would recommend for anyone that would like a good laugh with a feel good ending.",2006-03-18
US,49056791,R31O6MUK6RPSIC,0140186301,283114178,Lucky Jim,Books,3,3,6,N,N,"Agree that it's dated","Lucky Jim is a comic masterpiece - for the 1950s. It fits its time perfectly. However the style is so British middle class,  reserved, mandarin, that it fails to last as a great novel. Bumbling academics, timid and accident prone, every event so gentile, bedded down with thick helpings of classic farce. It is in the manner of Evelyn Waugh, another writer so hidebound by class that he was unable to produce powerful sounding literature and resorted to documenting the foibles of a certain strand of British society.<br /><br />Not to say Lucky Kim is a bad novel. It is a good read for those in bed with flu days when you want something nice and restful to entertain you. There are glimpses of great humour on every page - rising to a climax when Jim delivers his make or break 'Merrie England' lecture: 'Listen and I'll tell you. The point about Merrie England is that it was about the most un-Merrie period in our history It's only the home-made pottery crouw, the organic husbandry crowd, the recorder-playing crowd,the Esperanto...' then collapses inebriated. You get the picture. Warm, fuzzy stuff.",2006-02-04
US,52664262,R2B7CSFIILJHDD,0140186301,283114178,Lucky Jim,Books,4,2,5,N,N,"A good BRITISH read.","This is the kind of book you'll either love or feel so-so about - like British TV comedies (Monty Python)or other British novels. IT'S A BRITISH THING STUPID. I enjoyed this book a great deal.",2005-12-02
US,26973976,R8KLUZBVXMUIG,0140186301,283114178,Lucky Jim,Books,3,8,15,N,N,"Dated, comedic novel just doesn't stand the test of time.","Kingsley Amis's \\""Lucky Jim\\"" must have been quite a shock to its readers when it came out, with its comedic situtations and its anti-culture, anti-academia message, but yet...it seems so dated looking at it today.  You can see a youthful rebellion in the book, as Dixon is a utterly disinterested professor of history.  He absolutely loathes his field, and anything considered \\""haute couture\\"".  He quotes books, but of course won't tell us where it's from.  But Dixon isn't particularly likable, nor a great character, and the rest are two-dimensionional stereotypes(Bertram is the oaf, Christine the desirable girl, Margaret the witch, Dixon's boss a know-nothing stuffed shirt).  Although, the thought of Amis having Dixon say \\""Flithy Mozart\\"" is a work of genius, but that is the lone high point of the novel.  Only merits 3 stars.",2005-10-19
US,20595117,R1T0L80L4GAKHB,0142180149,283114178,Lucky Jim,Books,4,2,18,N,N,"Not a fair review- Read elsewhere for a real review","I have not read this book in years.<br /><br />I am going to try and remember what I thought of it when I read it many years ago in college.<br /><br />First, I remember that it was supposed to be tremendously funny.<br /><br />Secondly, I can remember wondering how people could possibly be the way these people were. It just did not make any sense to me.<br /><br />Thirdly, I can remember wondering whether or not I was supposed to like the main character or not.<br /><br />Fourthly, I was a young person in college, who was very serious about learning, and about ' being in college'. The sense the book gives that the whole world of higher learning is ' ridiculous' threatened me. It suggested that what I was doing in being in college was somehow ' meaningless'.<br /><br />What I have written of course is about myself, and not about the book.<br /><br />It is not a review, and certainly not a fair one.<br /><br />But I think it does show something about the way we read books with our own interests, stage of life. Read, or perhaps I should say , misread.<br /><br />I remember though that some of it was funny. I just do not remember what.<br /><br />Again if you want a real review of this book, please read some of the other reviewers on this page.",2005-06-29
US,39016128,R1D2PCL0H78DGT,0140186301,283114178,Lucky Jim,Books,3,2,17,N,N,"not especially funny","A remarkably overrated book.  The humor, such as it is, is dated, something that Trollope and Dickens, for ex, escape. Suggest you read David Lodge instead; he really is witty:  Small World and Nice Work.  Hynes A Lecturer's Tale is also brilliant.",2005-02-05
US,36036927,R2IBYNGV0HMAII,0140186301,283114178,Lucky Jim,Books,5,8,8,N,N,"Relief for Academics","I read this book roughly three times a year-- whenever the world of academia becomes intolerable. I know the plot and several pages by heart, but it never gets old. <br /> At first glance, it seems like an indiscriminate stab at any intellectual who, a la Welch, is wildly passionate about his or her subject-- Amis pissed off a lot of people that way. My father, a professor, refused to read \\""Lucky Jim\\"" because he remembered all of the intolerable anti-intellectuals who hauled the book around in their back pockets when it was published in the fifties, and it's hard to blame him-- but ultimately, I think the joke is on the anti-intellectuals. Amis is an academic man himself. Once you drop below the surface of it, he isn't jabbing at intellectuals at all-- after all, Jim admits that history, \\""well taught,\\"" is a necessary discipline; it's just that he's not the one to teach it. Michie, for my money the one true intellect in the entire book, is only bad in that he makes Jim feel inadequate; he's revealed at the end to be a perfectly decent person. And the fact that Jim leaves academia in the end for a spot as a personal secretary doesn't necessarily reflect badly on academia; after all, he's simply going to be paid for doing what he already did for free at the college-- he's moving on to a new career as a \\""boredom detector.\\""  <br />You could be upset with this book if you respect learning-- but I wouldn't bother. I am hyper-sensitive to that kind of thing myself, and I think that finally this comes down on the side of REAL intelligence, whether you find it in a college or in the private sector. <br />  Also, for those who think that Welch is an overdrawn caricature, I can report that I had a class from a man just like him. I used to sing the \\""Welch tune\\"" in lecture, just to get through the day.",2004-09-28
