marketplace,customer_id,review_id,product_id,product_parent,product_title,product_category,star_rating,helpful_votes,total_votes,vine,verified_purchase,review_headline,review_body,review_date
US,38810949,R2IVLJ8XWQHRPU,0441569595,769194143,Neuromancer,Books,5,1,3,N,N,"This is IT","So much has been said about this, so I'll be brief.<BR>Whether or not this is the ORIGINAL book of the genre, which is only something debatable on vague rumors of short stories published in university papers and other such weak claims, doesn't really matter...because this is the definitive work of CP.<BR>The Matrix. Terminator. Etc.  Most everything after Neuromancer and some other Gibson works borrowed generously from them.<BR>I would recommend this book whether you like CP or not...if you're already a CP fan, you've either read this, or you really can't say you know much about the genre.  If you haven't, read it...even if you've read other cyberpunk books and didn't like them....this is the rare book that tarnscends it's category.",2002-04-13
US,50762809,RJ888NV9W2945,0441569595,769194143,Neuromancer,Books,2,42,77,N,N,"Undoubtedly influencial, but annoying to read","When a book introduces a new sub-genre, it obviously has ideas that are new, fresh, and exciting.  However, on hindsight, Neuromancer is flawed in many ways.  Clearly the whole cyberpunk genre arose from this book (just look at modern dystopic movies and computer games that borrow liberally from Gibson's language and plot points).  For this reason, I would recommend the book.  In addition, the story is actually quite good.  Although I normally don't like or believe in futures this pessimistic, Gibson gave his world a kind of logic that allows belief.<br />Unfortunately, he then destroys the credibility at key points in the narrative.  It is deeply irritating to me when an author sets up a self-consistent, logical (even scientific) world, and then decides (s)he likes an image or idea so much that it must be included, even if physically/scientifically impossible (Samuel Delany is the worst transgressor of this offense).  I found myself rereading a number of passages in disbelief before concluding that yes, Gibson was indeed defying one law of physics while rigorously adhering to others at the same time.  In addition, Gibson kept introducing new concepts and words invented from thin air, when there are perfectly acceptable words in use today.  Okay, so he's trying to invent a new slang, but nowhere are the new words defined.  You learn them from context, but the context may be several chapters away.<br />Gibson's narrative laziness crops up in his use of pronouns as well - there are passages that are simply incomprehensible because the author refers to all the characters (even those fighting each other) by pronouns.  A typical passage would be something like: &quot;She burst into the room just as she was getting up from the table.&quot;  Is the person bursting into the room and the person getting up from the table the same?  And if so, isn't it physically impossible to do both things at the same time?  Thus, it was with mounting irritation that I approached the climaxto the story.<br />Therefore, while I can recommend this book on an historical basis, or because it has an interesting plot (and the occasional interesting character), I do so with serious reservations due to the infuriatingly lazy writing style.",2002-04-06
US,51012922,R1FHWJ0RILXLYN,0441569595,769194143,Neuromancer,Books,4,0,0,N,N,"Overall original and interesting","If there was one thing Neuromancer has a claim for, it's influencing a ton of other media that's been produced since it was written.  I imagine movies like The Matrix as well as a vast portion of anime would not be in existence if it weren't for this book.  Overall I thought everything was done well and even though cyberspace is a lot closer to reality than it was when Gibson wrote this book, the originality of his ideas still shine through.  So far so good, there are a couple slight problems though.  About two thirds of the way into the book I was in love with it and couldn't put it down.  There was a lot of mystery/underworld/cloak and dagger-type stuff intertwined up until that point and I was very entrenched in the plot.  However when it's crunch time toward the end of the book it shifts to more action-oriented sequences to further and eventually end the plotline.  This may not bother most people but for me I was getting used to how the plot was developing and this change somewhat turned me off.  However at the end I can't argue that I was thoroughly impressed and fulfilled.  Gibson describes the coolest world you'll ever read about and if you're a sci-fi/cyberpunk fan already you'll see some familiarities of Neuromancer's locales that remind you of other worlds you've encountered in sci-fi or anime.  That's because it was all done here first and it shows with style.  That is the main reason you should give this book a shot.  The flow of the plot is hard to pinpoint at times but in the end it's worth it given all I've cited above.",2002-04-01
US,52543428,R1GZHML8DWJXIK,0441569595,769194143,Neuromancer,Books,5,0,1,N,N,"First and Still the Best!","Yeah, I know, Gibson, the Godfather of Cyberpunk, blah, blah, blah...<br />Yup, the genre isn't stylish anymore.  (Kind of ironic for a book that's so dependent on style for its mood.) So what?  It's still _the_ killer of the genre.<br />Intense characters, a completely believable near-future alternate reality and a staccato delivery that just can't be beat.  <br />Love Lara Croft?  Wait til you meet Molly!  <br />Stop wasting time and order the book.",2002-03-06
US,44224653,R30JA445GPIUSX,0441569595,769194143,Neuromancer,Books,3,1,6,N,Y,"Futuristic","It's a good book, but can get a bit boring if you are not highly into Sci-Fi..... Like a futuristic crime city....bizzare, odd.... but good....",2002-02-05
US,41570954,R1L429FZYA951C,0441569595,769194143,Neuromancer,Books,5,4,6,N,N,"Quite the Trip","Neuromancer is known mainly because of its influence, and while creating an entirely new genre is nothing to scoff at, there's so much more to this book.  William Gibson uses his unique universe to touch upon everything from religion, business, technology, and sex in his amzingly efficient laconic style.  Everything in this book is streamlined.  In fact if he had wanted to Gibson could easily have made this book at least five-hundred pages if not more.  This not only has the effect of moving the story along at an incredible pace, but adds a lot of \\""replay value\\"".  I've read the book twice and I've picked up many more ideas the second time around, and I still plan on reading it again.  Perhaps the most intriguing thing about this book are the gnostic ideals inherent in Gibson's subjects.  It adds an intriguing dimension to his world.  Some readers may have difficulty with the bizarre nature of Gibson's writing style and world.  Perhaps the best review I've seen of this book simply states: \\""If you like to expand your mind with..., then read this book\\"".  They gave it one star.",2002-01-27
US,38117212,RYZB3B7RMUTXA,0441569595,769194143,Neuromancer,Books,5,0,4,N,N,"Among the best SF I've ever read...","What the hell is wrong with people from Winfield KS?",2002-01-18
US,46134235,R39UA497WALS5C,0441569595,769194143,Neuromancer,Books,5,2,3,N,N,"Best Ever","This is by far the best novel I've ever read. The characters seem the only purposeful motion in a neon-lit gray world built on the rubble of the past, where everyone else seems caught up in the incessant electric chatter, never to wake to their own lives. It is a pervasively melancholy world Gibson establishes, with the shining exceptions of reluctant anti-heroes. This is the beginning of a world used in the Count Zero/Mona Lisa Overdrive series, and it seems to be much the same universe as Burning Chrome and Virtual Light, Idoru, and his newest explore. Language, culture, and future are Gibson's toys. Let him play.",2001-12-23
US,52719088,R27M39AWZCE42S,0441569595,769194143,Neuromancer,Books,5,1,4,N,N,"I like it","I like it, even if all the characters are vile.  They are, at least three dimensional.  It uses Mark Twain's patented technique of getting rid of uninteresting characters by having them fall in a well looking at fireworks on the fourth of July ;-)  A good plot comes out in spite of that.",2001-11-28
US,50267916,R3BN8HNJ37UCKQ,0441569595,769194143,Neuromancer,Books,5,1,3,N,N,"Sheer magic","Gibson is gifted in the way most other sci-fi writers aren't. He has a habit of coming up with plots and ideas which then come true. Almost everyone else has the Star Trek mentality whereby all the aliens are actually humans - but with funny noses and bad teeth. <br />Neuromancer is best for its dark dub-reggae atmosphere. The plot is a bit wayward, but then when you have such new writing and such depth of imagination you smply don't care. Gibson set off the whole cyber-world genre with this novel. Anyone interested in the internet and its futuristic poossibilities should look no farther than neuromancer. <br />Brilliant.",2001-11-26
US,43338575,R17NIZGMTTKYG4,0441569595,769194143,Neuromancer,Books,5,1,3,N,N,"wonderfuuul , marvelouus.....","This book and burning chrome are the books that got me reading again. Although I read all the time when I was younger I had stopped reading entirely by the time I became a teenager. Until, in 1986, a friend gave me Burning chrome and then Neuromancer. After that I was hooked on reading again. Gibsons poetic and extremely visual style of writing reminded me that a book can be so much more than a movie can. Unfortunatley William Gibson could never write again after these initial novas of creativity. If you've read any of his other books first, before these two, put them out of your mind because its apparently not the same William Gibson, or mabey he got hit in the head or something? If the impact of neuromancer's concepts has been dulled and seems passe now, Gibson is as much to blame for it as anyone. He has made a career out of re-hacking the ideas from his first novel all through the nineties, and he has never been poetic again. My parents loved heinlin and tolkien, And people younger than me swear that snow crash is the last word ( which i tried and despised, go figure!). But to me and many people who read this for the first time in the mid-eighties, the decade of all those great one hit wonders, nothing was finer. And even today these two books are my most cherished and favorite stories ever told.",2001-11-10
US,40754762,R3S0TQ67LJMZQ6,0441007465,769194143,Neuromancer,Books,5,4,8,N,N,"Freefall Future","Neuromancer, a dystopian cyperpunk genre masterpiece has had and will continue to have great appeal to post-modern sensibilities.  A multinational entity, secreted and sinister, mysteriously agrees to re-endow a radically dissaffected, functionally disabled cyberpunk cowboy with the nervous system he needs to act in their interest, as only he can, to outfox a shape-shifting, omni-ambitious transhuman in the quicksilver cyber-realm where reality and dream meld.  Sound intriguing?  You bet it is!  This baby birthed &quot;The Matrix&quot;!  The crafting of it is superb.  Seductive, racy, mind-boggling, suggestive, and visionary, the mercurial plot redefines the term imaginative. Still, anyone enamored of the \\""long split sandwich roll containing a variety of fillings\\"" will find their \\""hero\\"" entirely checked out of the grim future world author William Gibson masterfully conjures; checked out, apparently, with no intention of ever returning.  Instead, we get Case, the amoral protagonist, a thief, a drug addict, a murderer, a talented survivor - and a loser.  Moreover, the future he inhabits is a deeply dark, fully blown cultural wasteland dominated by an ever-evolving artificial intelligence that is recondite, impersonal, archly sinister, morally bankrupt, staggeringly powerful, and intent on absolute hegemony through the development and implementation of a breathtakingly advanced cybertechnology.  It is a world whose internal logic compels as normative the responses personified by the anti-hero Case.  <BR>   <br />Now, a vision of the future that justifies nihilism may not alarm or distract from your pursuit.  Or, perhaps you've noted how the best science fiction proves time and again to be uncannily prophetic, and you may hope to insure your future survival by procuring a peek into one possible future.  In either case, this is a must read.  But if you are enamored of literature that extols classical values then you must needs seek gratification elsewhere, in the wroughtlanguage of a minority of the current singer songwriters, in the fireworks of a few modern day poets, in the &quot;sprezzatura&quot; of a handful of modern day wordsmiths, or in the numerous non-fiction genres that abound, like biography, philosophy, or scripture.  The triumph of good over evil, the exaltation of the love of truth, or strategies and suggestions as to how one may attain to a genuinely ecstatic immortality, all are themes highlighted here only by their exclusion.",2001-11-01
US,49536936,R2J902ACAUP4Y6,0441569595,769194143,Neuromancer,Books,4,3,3,N,N,"Contrasts","Gibson admits this is not his best by far, and indeed the language of the future he creates is at times impenetrable. The revolutionary idea of a physical cyberspace now seems familiar and less shocking. However the corrupted, down and dirty feel of the text, and the contrasts of flesh and technology, perfection and decay, are still powerful and compelling.",2001-10-24
US,52813336,RPAPYEIVDJKUD,0441569595,769194143,Neuromancer,Books,3,6,9,N,N,"Mediocre.","Gibson as a problem: he knows lots of adjectives, and likes to use them. All of them. In one sentence. This causes the reader to skip pages and pages of useless description in order to get to the story, which is extremely frustrating at best, and causes one to lose focus on the story completely. Argh. Listening to this on tape while on the road was even more of a nightmare; you can't really fastforward through it that way. (Besides, he reads with a monotone.)",2001-10-23
US,52954486,R3MANM01TY0OL5,0441569595,769194143,Neuromancer,Books,4,1,1,N,N,"Seminal, extremely influential, the first &quot;cyberpunk&quot; book","I had first read Gibson in the short stories he sold to _Omni_ magazine, lo these many years ago, and when _Neuromancer_ came out, I leaped on it---I've still got the first PB edition in my library.  Gibson shows us a world where high technology has been taken over by the &quot;street,&quot; and takes us into the underworld of Chiba City in Japan, and the mighty Sprawl of cities that covers most of the Eastern United States---although he's careful to never, ever say whether the United States itself, as a nation, is still in business.  His protagonist, Case, is not as vividly drawn as he could be---I felt I knew his partner Molly Millions a lot better, and frankly, liked her more.  Still and all, this book was hugely influential, and anybody wanting to know where the SF field has gone can't afford to miss it, even if they hate &quot;cyberpunk&quot; cliches.  This is where a lot of those cliches were started, back when it was all brand-new and full of life.",2001-10-20
US,52564468,R1YBDHE3WGINSG,0441569595,769194143,Neuromancer,Books,5,1,4,N,N,"I'm unsure what to add.","So much has been said about Neuromancer that there is very nearly nothing left to say. So I will say only this-- it's worth the hyperbole. Definitely one of the best science fiction reads going.",2001-10-20
US,42183581,R1H0NNMTBUPVAG,0441569595,769194143,Neuromancer,Books,2,2,12,N,N,"...Read this book...Um, How about No.","First of all, let me state that I have never been a fan of science fiction.  So, when I began reading this book I was probably bias in many ways.  However, when I actually got into this novel, I realized that it was not my bias that was the problem; it was the book.  The only way you can enjoy this story is if you are a computer techy, or if you happen to know the japanese language.  I spent half of my time online looking for a freaking japanese dictionary so I could understand what the author was talking about.  And, by the time I actually got back to the book, I had forgotten what I had previously read.  If the author had provided a glossary of terms for incomprehensible language he used, then perhaps the story would have been easier to follow.  But, he failed to do this and in the process lost much of his audience.  Do not read this book if you do not have time to spend with it.  Do not read this book if you value your sanity.  In fact...just don't read this book.",2001-10-18
US,40966267,R292J42E4Q5W68,0441569595,769194143,Neuromancer,Books,2,4,9,N,N,"Neuromancer: Worth its weight in Potato Chips","After reading Gibson's Neuromancer, I will thoroughly disappointed with it. Although relativley well written, the novel jumps around a lot, and tends to lack focus in certain places. The character development is decent, although in a book that has been dubbed by some as &quot;one of the greatest novels ever written,&quot; it leaves a lot to be desired. For those of us who are not versed in cyberspace or such technology, we are alientated, and have trouble enjoying the book. <br />The book's few redeeming qualities comes from its imaginitive story line. I think though, that it would take a true knowlege of the material dicussed (cyberspace, etc.) to truly enjoy it. <br />This book is worth its weight in potato chips. However, you are interested, and i mean REALLY interested in the science fiction genre, this book may be for you. If you are not, don't waste your time.",2001-10-18
US,50951620,R1V8TC3UQ4UWYZ,0441569595,769194143,Neuromancer,Books,5,0,1,N,N,"Superlative","Without a doubt, Gibson's best work, and the most entertaining SF novel I've read.  Could not put it down once I started.",2001-10-18
US,49084312,RUASX2GSGNO81,0441569595,769194143,Neuromancer,Books,4,0,0,N,N,"I don't get it. BUT, it's still a hell of a good read.","This is a fun, action-packed, yet it is a very confusing read. It's a book that you need to read at least twice in order to understand fully, but if you want a fun, lean read that doesn't insult your intelligence, and is filled with great dialogue,it is highly recommended.",2001-10-16
US,41456165,RNMWFH3X9PV60,0441007465,769194143,Neuromancer,Books,1,3,22,N,N,"Over My Head","Gibson's style of writing is not what I'm used to. He throws several charecters out at you at once. Also, he jumps into a scene right in the middle of something (which threw me off to the start) with out giving you any detail as to what is going on. I am used to reading books with a preface or something that gives you a little idea as to what is happening at the beginning of the book. If you like books that you definately need a dictionary to read, I recommend this one. Other wise I would stay as far away from it as possible. Totally not for me.",2001-10-12
US,41792838,R1GNR4VTUDPKK,0441569595,769194143,Neuromancer,Books,5,0,1,N,N,"Neuromancer review","Gibson coined the word \\""cyberpunk\\"" in the 80's<BR>Films like The Matrix would not have been possible without this ground breaking conceptual work. <BR>Slated to direct the Neuromancer film is American Director;<BR> Chris Cunningham.  Gibson's themes of low lifes and high technology seem to be an excellent match for the dark visual intensity of Cunningham's work.",2001-10-12
US,41493963,RZSJWJ2FWHH7D,0441569595,769194143,Neuromancer,Books,2,6,10,N,N,"Neuromancer:  Not what I expected","I would have to say that I disliked Neuromancer.  I found it hard to understand from the very beginning.  The characters and plots were just thrown at the reader without much of an explanation, and I was lost throughout most of the story.  I didn't find the whole idea of the book very appealing, either.  I was disinterested from the start, which is probably due to the fact that I had no idea what was happening or what had happened in the book.  Overall, I would say that for all the good reviews the book had, I was disappointed with it.",2001-10-11
US,41526061,R3SW01RGZB6VXW,0441569595,769194143,Neuromancer,Books,4,0,2,N,N,"Highly Recommend It!","For one of my courses, at Southwestern College, I was required to read this book.  As I started reading it, I was able to realize what a wonderful book it was.  Although I have never liked Science Fiction, Neuromancer completely grabbed my attention, in a way, I could easily keep up with the reading.  In sum, I considered this book as highly createful and innovating.",2001-10-10
US,52459466,R15UBG2KJ0PPYZ,0441569595,769194143,Neuromancer,Books,4,2,4,N,N,"Blue Fear beyond the Holocaust Horizon","It takes some serious mental energy to envision life as it was in 1984--not so long ago, granted, but a different era still: riding the ragged edge of the Cold War, Atari and IBM the technological dominant, the future a wide horizon of blue fear...difficult, even for one who grew up in the `excess 80's'.  But I suppose that certain patterns could be discerned by the wide-eyed and wise of that time; imagination filled in the gaps of what social evolution had yet to dictate.  For the budding Sci-fi author, I imagine the prospects of utopia/dystopia were endless and endlessly fascinating: AI, VR, cybernetics and bio-enhancements: so many possibilities as yet unexplored, as yet unexploited!<br />Thus we have William Gibson's cyberpunk manifesto _Neuromancer_, the book that spawned a whole genre by itself and prophesized a chilling existence that, some 17 years after the fact, looks very familiar.   Hackers and viral bombs? -second page news.  The Sprawl? -growing every day.  Cloning, VR, bio-enhancements? -already on the crest of the next wave.  Thus the danger of modern sci-fi and its cyberpunk offshoot: becoming as relevant as a gutter newsrag, stigmatized by well-worn clichés and the dubious nature of experimental prose.  Why would one want to spend their valuable time on yesteryear's fear?<br />Well, when yesteryear's hype contains the febrile energy and insight of _Neuormancer_, the read is worth the time spent.  Gibson fashions a world of vivid and startling imagery, the ugliness and beauty of it leaping from type to the reader's imagination with ease.  The slang and unique aspects of Chiba, the Sprawl etc. are done in a casual fashion, so that one understands the phrases and cultural particulars without getting thrown or distracted.  There is a feel of something _new_ here, even if it isn't all that new by nowadays standards; _Neuromancer_ contains a force of intellect, of testing the boundaries and coming up all aces, that buoys the reader through the overly-familiar space-opera archetypes and, in passages, the stilted self-conscious prose.  A commendable effort that still resonates, unlike most its contemporaries/derivatives.<br />But for all its hyperbole and raw intelligence, _Neuormancer_ does have its share of flaws, some glaringly apparent, others under the surface, within the structure of the novel itself.  Envisioning and detailing this dystopia was an admirable feat, especially considering the time it was written and what hindsight awards the current reader, but so much effort is given to making the environment `real' that the characters themselves--the flesh and blood constructs that the reader is supposed to inhabit, sympathize with, and ultimately understand--the characters become neglected in the process, ending up rote pulp-fiction stereotypes of passing interest.  Gibson tries to inject some pathos for Molly, Armitage and Case midway through the novel, but the attempt is strained and, because it is introduced so late, our neon-jazzed eyes glaze over the heavy `personal crisis' of the climax--we just want these archetypes (ie the author) to get back to the cool stuff they excel at.<br />The story itself is basic pulp-noir--outlaw cowboys running on societies' edge, complete with cyber-shtick saloons and the usual assortment of backstabbing betrayals--and not very interesting pulp-noir at that: both conflict and plot are ambiguous for the first half of the novel, and while Gibson's ultimate ideas are very intriguing (particularly about the cold existence of cyrogenics), the novel ultimately suffers from a crippling lack of tension.  Gibson's writing can be inconsistent, as well: though parts of the novel are extremely well written, other passages become quite convoluted in their (needless) detail.  <br />Four stars--despite its flaws, _Neuormancer_ is a seminal work, and better than ninety percent of the dumbed-down junk competing for shelf space.",2001-09-27
US,47547572,R1H6N74P2BOV7I,0441569595,769194143,Neuromancer,Books,1,2,30,N,N,"Addictive?","If you like to expand your mind with ..., this book is for you.",2001-09-08
US,53011764,R25TW17SIJ6FYO,0441569595,769194143,Neuromancer,Books,5,0,2,N,N,"Spaghetti Western--Pulp Fiction","Okay... this book was required reading for Dr. Frost's ScienceFiction class.  I was so glad he'd required it.  I'd never read cyperpunk before.  I'd seen bits and pieces of Johnny Mneumonic here and there and some comics and graphic novels, but never really thought about it.  I love it.   Some guy earlier slammed it for being a &quot;spaghetti western&quot; and cliched.  Well, it is.  It's supposed to be like that.  That's the way I like it.  I also love Robert E. Howard.  Conan reads the same way to me, only with swords.  But i'm going to check out that other guy's work too... *shrug*",2001-07-31
