US	52173832	R6LE0QHDY7VID	0679723420	755867934	Pale Fire	Books	4	2	11	N	N	difficult but rewarding	Pale Fire is, I think, a brilliant parody of Literary Criticism.  However, it's barely a novel and it hardly warrants it's 200 pages, so I don't think it should make the list.<br />The structure of Pale Fire is unique.  It contains a long poem by &quot;John Shade&quot; &amp; then 200+ pages of commentary on the poem by &quot;Charles Kinbote&quot;.  Kinbote emerges as a complete lunatic over the course of his commentary, reading meanings into Shade's work that are obviously unsupportable.<br />Nabokov, thus, shows that critics bring such a subjective perspective to the works they critique, that they can hardly be considered an appropriate prism through which to view the original work.  I heartily agree with the point, but it becomes somewhat labored when stretched to this length.<br />GRADE: B	2000-10-31
US	50718004	R985XAXCTBVJ4	0679723420	755867934	Pale Fire	Books	5	185	193	N	N	Nabokov's Tour de Force	Pale Fire is the name of a 999-line poem in four cantos by the &quot;distinguished American poet&quot; John Shade, published posthumously in a lovingly prepared edition with a foreword and detailed commentary by the Zemblan literary scholar Charles Kinbote.  Pale Fire is also the name of the novel by Vladimir Nabokov in which the poem is written by Shade and annotated by Kinbote, who are Nabokov's creations.  The novel is actually written in the form of poem and scholarly apparatus, not omitting a thorough index.  It is a perfect and perfectly original union of form and meaning.  It is also wickedly, outrageously funny. <br />The poem itself is a complicated, beautiful, mysterious achievement.  It reveals the character of John Shade so completely and movingly that we have to keep reminding ourselves that it was actually written by Nabokov, himself.  The poem is the heart of the novel, literally and figuratively, although the commentary no doubt constitutes the most interesting reading.  Pale Fire is Shade's final work; possibly his greatest work.  It is the product of every thought and experience in a long, thoughtful life, and it also contains that entire life:  childhood, adolescence, marriage, fatherhood, old age and death.  The title refers to the &quot;pale fire of time,&quot; and is taken from a poem by Yeats and not from Shakespeare, as Kinbote confidently suggests.  Or is Nabokov simply leading us on a merry chase?  Better check Timon of Athens to be sure.<br />And Kinbote is frequently wrong in his confident suggestions in the commentary.  He identifies allusions where none exist; fails to recognize those that are actually there (he is writing his notes in a remote cabin in the Rockies and complains that he has no books to check his references), and suggests interpretations which are clearly, hilariously, wrong.  The hapless Dr. Kinbote has got it into his head that Pale Fire (the poem) is really about himself, and his commentary is an audacious attempt todemonstrate this. <br />So, almost ignoring what is actually present in the poem, he proceeds through the commentary to give a detailed history of his own life and times, often revealing far more than he really means to do.  And it turns out to be quite a good story, because Kinbote, a native of the remote northern European country of Zembla, has had quite an adventurous past.  It is only a pity that it is quite irrelevant to Shade's poem.  Kinbote just happens to be a man who doesn't do anything by halves; even the most innocuous phrase of the poem is &quot;demonstrated&quot; to be a cryptic reference to some event in Kinbote's life.  Pale Fire is nothing if it is not great fun. <br />But Pale Fire is not merely amusing and inventive.  Kinbote's commentary seems to be everything literary criticism should not be; but it is actually only an extreme, exaggerated version of what literary criticism truly is.  Kinbote attempts to rewrite Shade's poem in his own image and likeness, but this is true to a greater or lesser extent--or a more or less subtle extent--of every critic, amateur or professional. <br />Pale Fire is thus a complex, and ultimately rather touching, demonstration of the way people have of reading their lives into books and reading books into their lives, like Kinbote.  (And also, the way we have of writing our lives into books and writing books into our lives, like Shade.)  It is an affirmation of the power of literature, of the power of books to help us make sense of our lives, and of the impossibility of distinguishing precisely where art ends and life begins.  To quote John Shade: <br />          I feel I understand/            Existence, or at least a minute part/            Of my existence, only through my art,/            In terms of combinational delight;/            And if my private universe scans right,/            So does the verse of galaxies divine/            Which I suspect is an iambic line.<br />Almost every reader can remember that oneparticular novel, poem or play that seemed to have been written for him and him alone.  The one the reader took so personally, it changed his entire outlook on life and which even now he cannot discuss rationally or impartially.  Every passionate reader knows of just such a book or even books.  So, perhaps we should spare one or two sympathetic thoughts for the poor, but smitten, Dr. Kinbote even as we laugh uproariously at his well-intentioned mistakes.	2000-10-02
US	47898026	RVQZN3MJ9QGGC	0679723420	755867934	Pale Fire	Books	5	5	8	N	N	A Key to the Mystery of Life itself!	Nabokov, that Grand Master, has constructed an elaborate puzzle here.  <br />Chess as a metaphor for life itself. Black and white: black letters on a white page, moieties, the two players that mirror each other like lovers caught up in an almost infinite game of possibilities and permutations, the two parts of the text itself and the syzygy of sun and moon.<br />But as one reads and rereads the novel, immersing oneself in the substance of the text one realizes that at heart Pale Fire is about the transmutation of grey.  The grey of shades, shadows, indeterminate hues (hazel!), fumbled moves, grades and degrees, obfuscation and hesitation is gloriously transformed into the texture of life itself.<br />And as the game begins and the players cross the invisible line of the mirror and make incursions into foreign territory or surround each others pieces in ever-changing arabesques, the two-dimensional black/white grid morphs into a three-dimensional matrix with interstitial spaces and other facets reclaiming their position in the light. Gray is now about resonance and reflection, refraction and submersion, give and take.  Text is now enmeshed in texture, the syzygy of sun and moon is now immersed in the waters of the ocean.	2000-09-24
US	50732707	R2O4B1NMAKYAEA	0679723420	755867934	Pale Fire	Books	5	12	15	N	N	Beautiful, annoying, hilarious, sad	If I had to take one Nabokov novel to a desert island, it'd probably be &quot;Lolita&quot;, but that's daft, it's never going to happen; so after a few years' hemming and humming I concede defeat and admit that &quot;Pale Fire&quot; is VN's _other_ English-language out'n'out masterpiece.<br />I've always had a bit of a problem with &quot;Pale Fire&quot;, in that Nabokov's cunning is designed to make me be more interested in the demented Kinbote's delirious commentary than John Shade's measured, reasonable poem, whereas in practice I find Shade much more congenial company than his loony editor, and find myself skipping through the book on rereads for snatches of the poet in action.  But having just started it again for the, oh, fifth or sixth time, I confess that knowing Kinbote's quirks and secrets as well as I do, his goofy selfishness and insensitivity are truly hilarious.  (e.g.: I love the way that, in the Foreword, he can't mention his car without prefixing it with the defensive epithet &quot;powerful&quot; - perhaps VN was hinting here at a cod-Freudian relationship, Kinbote unconsciously imagining car as phallic substitute, I won't go on, but you get the idea.)  <br />Having also just reread Brian Boyd's mighty biography of Nabokov, I'm very attracted to the idea that Kinbote is Shade's invention.  It does make the book tie up with fantastic neatness - although it also takes a lot of the impact out of Shade's senseless death.  If Shade didn't really die, then the book isn't as subversively moving as it might have been - although, now that I think about it, it's moving in a rather more realistic and complicated way; damn these biographers and their privileged insight!<br />&quot;Pale Fire&quot; is both puzzle and lyric.  It zigzags wildly around the heavens while keeping its focus firmly on that frozen swamp in which Hazel Shade disappears.  Most of Nabokov's imitators copy the verbal exuberance, but fail to appreciate the beating heart.  His best books throbwith life as much as they crackle with wit and intelligence, and a book as clever and as lively as &quot;Pale Fire&quot; almost makes me want to forgive the author for condoning the bombing of North Vietnam.  Not quite, mind you.  There are limits.	2000-09-22
US	49188977	R3S0U68ZBMZ8QB	0679723420	755867934	Pale Fire	Books	5	4	5	N	N	The Strangest and Most Beautiful of Mysteries	Pale Fire is essentially a mystery story. It presents facts and the  testimony of a deranged man, and allows the reader to do the detective  work. The task presented the reader is daunting as the plots, subplots, and  character sketches twist in ever tightening involutions, levels of  complexity stacking one on top of another. Nabokov is kind though. Ever  conscious of the novel as entertainment he allows the proccess to be fun.  He gives away many of the mysteries in ways that lead the reader to believe  that he or she has made the discovery. He also leaves some that are so  complicated that it would take multiple rereads (or a good companion  reader) to make the discoveries. This book is without a doubt my favorite  of Nabokov's works, and there are few that I would not recommend it to. My  only warning is that you will get out of this book exactly what you put in  it. If you read straight through and put it down, you will only scratch the  suface of what this novel offers and intends. Though even this will eb an  enjoyable experience. The more time you invest and the more you  investigate, the richer the experiece will be, and in my opinion, the more  fun you will have. Pale Fire is a beautiful and entrancing puzzle capable  of almost infinite entertainment.	2000-09-12
US	52935652	R1L7Q25EOCH7LC	0679723420	755867934	Pale Fire	Books	5	12	13	N	N	Nabokov's Second Best Novel--A Work of Genius	Among Nabokov's very best books, few present such serious challenges to the reader as &quot;Pale Fire&quot;.  Even fewer provide such enormous  rewards, especially if said reader brings an open mind and a serious  attention to detail.  What kind of book, exactly, is &quot;Pale Fire&quot;,  anyway?  A longish poem with annotation and index?  A wildly experimental  novel that flaunts every convention for the sake of innovation?  An elegiac  reflection on days gone by or a wickedly comedic parody of scholarship and  the artistic urge?  It is all those things and more, a watershed in  English-language literature, the apotheosis of Nabokov's craft as writer  and satirist.  For the record, the crazed, domineering Prof. Kinbote  (mastermind or madman?  You decide) is rivaled only by Humbert Humbert when  it comes to delusional, obssessive narrators--talk about unreliable, not to  mention fascinating beyond belief.  What are we to make of his claim to be  the exiled King of Zembla? Where, if not only in his over-ripe imagination,  is Zembla and what, if anything, does this country have to do with the poet  Shade and his dead daughter?  There is the question of the hired assasin  &quot;Jakob Gradus&quot;, too, though, like Zembla, Gradus might or might  not be anything more that an invention of Kinbote's (if Kinbote himself is  actually Kinbote and not an imposter claiming to be a man who might be an  imposter as well...you can see where this is going, can't you?)  &quot;Pale  Fire&quot; is a puzzle, one that makes strenuous demands upon the reader,  one that cannot be read straight-through (there are page references in the  annotation, after all--you'd do well to pay attention to them) or merely  &quot;skimmed&quot;.  If you have the patience to immerse yourself in  Nabokov/Kinbote's topsy-turvy world of intrigue, artistry and (perhaps?)  the supernatural, you are in for a bracing read.  There's no other book out  there like &quot;Pale Fire&quot;, it could only have come from the  brilliant mind of Nabokov and it is splendid, indeed.  A word to the wise:   Read the book ALL THE WAY to the very end.  What might seem like peripheral  information is actually critical if you intend to crack the novel's  deviously intricate code.	2000-08-08
US	51204129	R3071HCPLI7V6N	0679723420	755867934	Pale Fire	Books	5	6	8	N	N	A few things to consider	1.  Do not read the introduction. 2.  Stick with this book to the end at all costs, like I did. A good friend said it was a great book and I stayed with it. 3.  If you are confused and unsure when reading this, your  discomfort will be rewarded 100-fold. 4.  Consider that Engish was  Nabokov's second (or third language)and be awed by the prose. 5.  Resist  whatever temptation you have for reading reviews that even begin to suggest  what this story is about. Please don't do it.  I urge you. Read the reviews  only after you read the book. A completely naked take on this book was in  the end what made it most gratifying for me.	2000-06-11
US	52947077	RS75TA9S12JZU	0679723420	755867934	Pale Fire	Books	5	32	40	N	N	A Brilliant Rollick	Pale Fire is a wonderfully enjoyable work of fiction, although it is not in the form of a traditional novel.  The story unfolds in an introduction to, and commentary to a 999 line poem.  It appears that Nabakov had great  fun constructing this masterpiece and I think the reader will have fun  deciphering it.  The introduction and commentary are &quot;written&quot; by  a slightly insane, slightly delusional professor, Charles Kinbote, who is  perhaps a deposed king on the run, perhaps not.  He believes he has  inspired the poet to construct a poem about his former kingdom, but alas,  the poem is about the poet's life.  Kinbote is greatly disappointed, but in  his commentary manages to find allusions to his former kingdom and rambles  on and on about it.  The results are often hilarious and always thought  provoking.  Nabokov has such a good time writing in English and because it  is not his native toungue, he sees things in the words that native English  speakers wouldn't.  It's fun to watch him play with the words, as it's fun  to watch him play with our conceptions of reality.  The whole book plays  around with what is reality, who is the narrator.  Is it Nabokov pretending  to be Kinbote, is it just Nabokov.  One wonders what really happened in the  story.  Kinbote tells one version, the characters he speaks of tells  another, as does our poet, John Shade, Nabokov is telling yet another.   There are so many layers of story and illusion.  I found myself wondering  what really happened, but it's fiction, nothing happened, or everything  happened.  I really enjoyed this book a great deal.  It even took my mind  off of being in the dentist's chair.  I highly recommend this book to  anyone who isn't afraid of slightly experimental fiction.  Fans of Infinite  Jest and House of Leaves will certainly enjoy Pale Fire.	2000-05-12
US	50312224	R1FW3ND6PNN0PI	0679723420	755867934	Pale Fire	Books	5	0	0	N	N	Ridiculous and Sublime	This is one of the most amazing works of literature of all time.  It is both a parody and a work of amazing intricacy and depth.  It stands in a category all its own. The 999-line poem upon which the book is supposedly  based is a great piece of literature all by itself.  Don't skip over it!   There are belly laughs interspersed throughout the book.  I wish Pale Fire  had been on the reading list in one of my college lit courses to provide  some comic relief.	2000-05-12
US	50723678	R1VCHMQVZOZBPL	0679723420	755867934	Pale Fire	Books	5	1	2	N	N	Delicious, wicked delight	Oh what a treat it is to be re-reading this book! I first read it in 1967 in a cruddy one-room apartment in Port Arthur, now Thunder Bay, Canada when I was broke and hungry. As I read that marvel named Pale Fire, hell, I  thought, who needs food? I'd always had a deep hankering to re-read it. I  bought a brand-new copy and what fun it is again!  It's one of the few  books I know I'll re-read yet again. Don't miss it!	2000-04-27
US	51362690	R18LB56Z2C86RN	0679723420	755867934	Pale Fire	Books	5	51	72	N	Y	A fantastic literary overture!	Vladimir Vladimirovich Nabokov has an absolutely marvelous sense of humor that is unbecoming a professor of literature at Harvard.  Good for him!  The humor of this book is unmistakable &amp; is transparent to even the most naive of Nabokov's readers.  That this gentleman can write a book that  is hilarious and at the same time a work of depth and genius is awe  inspiring.<br /> &quot;Pale Fire&quot; is the tale of a pedantic, psychotic,  misogynistic literary critic who attempts to write an overly-elaborate  critique of a poem written by a recently deceased scholar.  What is so  amusing is how this academician commits so many undergraduate fallacies  such as reading too much into a poem and saying &quot;the poet must have  had me in mind when he wrote this.&quot;  He catches erudite allusions only  to miss the most obvious references.  In the meantime, he also grapples  with the demons of his hypochondriac unconscious which make him think that  someone or something is &quot;after&quot; him.<br />This is a wonderful book  that has very few peers.  For those other reviewers who found that it  lacked depth, I would suggest that they read it again.  If they still don't  find profundity, I would recommend that they read it a third time....a  fourth time, etc. until they see what is really &quot;going on&quot; and  that the book may be all fun and games, but is fun and games centered  around a recondite maze of allegories.  A book for the more daring spirits  amongst us (and for those who have been waiting a book that makes fun of  literary critics......)	2000-03-05
US	53010358	RXSFXKJNPW7SQ	0679723420	755867934	Pale Fire	Books	4	3	8	N	N	A good read	This book grabbed me from the very start. Do NOT read the introduction, like most introductions it spoils the actual read. Funny, engaging, great	2000-02-25
US	50420996	R1810FXCWKEOV5	0679723420	755867934	Pale Fire	Books	3	6	23	N	N	Brilliant, but perhaps not worth the effort	No one reading this book carefully could doubt Nabokov's genius.  However, the novel is so dense and frustrating that I nearly gave up before finishing it.  There are infinite puzzles to be worked out here, and  frankly I felt the puzzles overshadowed the story itself.  I loved Pnin,  but this one took it too far.<br />I reccomend the poem in itself though-- a  beautiful work.	2000-01-13
US	52130985	R82C6F0A731GQ	0679723420	755867934	Pale Fire	Books	5	5	11	N	N	Artistic and Intricate	Pale Fire was a fascinating novel to read, though difficult to interpret.  I found the explanation in Nabokov's big 2-part biography to be the best. It was fun to puzzle though this novel, flipping pages back and  forth.<br />However I must reiterate a position I made earlier in my review of  ADA.  Nabokov did not &quot;love&quot; many of his characters.  Nabokov  detested the characters of both Humbert and Van Veen (or for that matter,  the narrator of &quot;Despair&quot; and &quot;King, Queen, Knave&quot;.   And clearly, Kinbote, to the extent that he existed was an insane man and a  bad man.  <br />Nabokov assumed that you the reader could judge these  characters immoral yourself, and that despite their narratorial efforts,  you would not be fooled by their delusions of self-worth. Nabokov's best  readers avoid getting suckered by his suspect narrators because the real  moral message of his books lie underneath this confused surface.	1999-10-06
US	51202123	R2YXRLSO4A6AQD	0679723420	755867934	Pale Fire	Books	5	6	6	N	N	Beautiful, heartbreaking, inenubilable, and perfect.	This is a beautiful, heartbreaking, inenubilable and perfect novel.  Its only flaw is that I did not write it.  It is a novel that makes one demand that all great novels make of the reader: that you approach the book with  intelligence, imagination, and attention to detail.  If you do, you will  find its core of humanity in the buried stories of Charles Kinbote, the  grief of the Shades for their lost daughter, and the yearning for physical  and artistic immortality. The reviewers who found the book lacking in  heart, or to be no more than a literary funhouse, should reread the novel.   Try, this time approaching the novel from the index - the funniest part of  the book (Shade, Sybil, passim) - and try to figure out why the index  descriptions, such as the one where Kinbote refers an index entry about a  person who &quot;betrays a noble heart&quot; to a commentary that discusses  a green-jacketed shadow.  Try to follow the trail of Kinbote's heartbreak  and madness, and then tell me that there is no heart to this book. Oh, and  the reviewer who felt that Nabokov did not love Kinbote as he loved Humbert  Humbert and Van Veen should reread those books.	1999-08-01
US	51279637	R121JBFR3JZFI8	0679723420	755867934	Pale Fire	Books	5	2	7	N	N	Yes, yes, brilliant.  but...	This is a fantastic book.  Of course.  The wordplay is dazzling, the games intricate, the scope both ambitious and fully realized.  It will ever earn five stars on Earth.  That being said, in some alternate universe (Terra,  perhaps?) where Steven King is Vladimir Nabokov, I would only give it four  stars.<br />It isn't as good as Ada, Pnin or Lolita, despite being technically  superior to the latter two.  Why?  Because Nabokov doesn't love Charles  Kimbote - and hence, we don't (contrast Van, Timofey and Humbert).  And - I  know - with circumspection, Pale Fire can be viewed as a triple-joke -  being about John Shade after all, to whom Nabokov is much more kind.  Or  even that Shade and Kimbote are one and the same, etcetera ad nauseum.   But, in my final analysis, for all it's technical intricacy, ambition, and  florid prose, this book fails to move my heart as well as dazzle my  mind.<br />Or maybe I just don't get it.  Regardless, I highly recommend it.   Right behind Ada.	1999-07-19
US	52377838	R2B91I2ILFA6QB	0679723420	755867934	Pale Fire	Books	5	1	2	N	N	One of the best books I've ever read	This a dizzyingly entertaining work of art that defies description. One note I'll add to the reviews already here is that this book had a huge influence on , and is alluded to in, the best X-FILES episode of all-time,  &quot;Jose Chung's 'From Outer Space'&quot; (3rd season - '95/'96), an  episode written by the brilliant Darren  Morgan (who won an Emmy for an  earlier episode that same season).	1999-05-26
US	52244987	R134F3S8LWMXCS	0679723420	755867934	Pale Fire	Books	5	3	3	N	N	only because i can't give 6 stars	hands down, my favorite nabokov novel of all (with the hallucinogenicly poetic &quot;invitation to a beheading&quot; a close second). this book operates on so many levels, and it doesn't give them up on the first read.  anyone seeking answers after reading &quot;pale fire&quot; should read the  index VERY carefully. the comparisons with &quot;ulysses&quot; are totally  valid. where joyce uses narrative experimentation to provide the total  picture of his characters' inner lives, nabokov uses literary criticism.  these characters are so rich!  interesting note--nabokov wrote this after  translating and annotating a 10-volume edition of &quot;eugene  onegin.&quot; the question you have to ask yourself when reading this book  (for the first or fiftieth time) is this: who is the real author of this  book--shade or kinbote? and are they one in the same?	1999-04-23
US	51760269	RVP7YF8G6GLTK	0679723420	755867934	Pale Fire	Books	5	1	2	N	N	Incredible	To anyone who has ever doubted the literary merit of Vladimir Nabokov, read Pale Fire.  More than once.  To anyone who has ever wondered if creativity was on the wane, read Pale Fire.  More than once.	1999-03-24
