US	32334747	RF3Z8WVY4NIIK	0679723420	755867934	Pale Fire	Books	5	0	0	N	N	Mind bending!	A story within a story, a madman reworking and annotating another's poetry and attributing minute details as if they were secret references of his life. How perfect a story Nabokov has written. A jewel of a book.	2008-03-20
US	44214420	R2K96ZVIHEXSVL	0679723420	755867934	Pale Fire	Books	5	0	0	N	N	brilliant	I adore books that change and grow as you read and reread them. Nabokov's Pale Fire definitely fits the bill. This novel really exemplifies the excessive amount of freedom within Nabokov's creative process - it is boundless, performative and very much alive. It's almost as if Nabokov makes his very own strict set of literary rules and then turns right around and breaks them for no other reason then purely enjoying smashing boundaries into infinite pieces and reworking them into a unique masterpiece. It's almost as if he deconstructs his writing himself only to let the act of reading it serve as a creative process in its own right, which then carefully reconstructs his words into something very, very special. Strange disconnects surface more than occasionally,  bobbing their heads up and down in the story - yet these are done in such a fluid, effortless manner that the resulting effect is nothing short of awesome(to borrow a favorite word of my brother, Alex).  I highly recommend this.	2008-03-03
US	41526681	R3R77LM4BM6Y3T	0679723420	755867934	Pale Fire	Books	5	1	2	N	N	Nabokov's king is a queen...	Who else besides Nabokov could pull this off? That's not a rhetorical question: I really want to know. Here, the Russian savant assails the conventions of the novel, and produces a work that is readable, fluid, innovative, accessible, entertaining, and astonishingly impressive on a purely intellectual level.    Joyce? The foremost big-brain of the 20th Century, perhaps, but his monoliths are, to most people, as impregnable as an eighty-nine-year-old nun.    Gide? No slouch, but his chops do not enter into radar range with ol' Vladders.    Anybody? I confess, I'm stumped.    This book would, for anyone else, be the defining career magnum opus. (Anyone besides the guy who gave us Lolita, of course.) Nabokov gives us a forward, a poem, and then a narrative commentary on the poem. All are brilliantly conceived, constructed, and created. The prose and verse are nonpareil, the characterizations apposite and hilarious, and the satire superb. (Nabokov also fulfills his penchant for tweaking sexual mores of the time by making his narrator--the erstwhile king of Zembla, and current university lecturer--a randy pansy.)    This book clocks in at #53 on the MLA 100, which underrates it enormously.	2007-06-19
US	30652561	RF49JDY35C81N	0679723420	755867934	Pale Fire	Books	5	11	12	N	N	Pale Fire	At its simplest, Pale Fire is an examination of the 999-line poem in four cantos, 'Pale Fire' by respected Zemblan scholar Charles Kinbote, a friend of the recently deceased poet, John Shade. The novel becomes less simple when we realise that John Shade is a fictional poet, that Zembla may or may not exist, and that our friend Charles Kinbote is either the King of Zembla or insane, or perhaps both. <br /> <br />The novel opens, appropriately, with an introduction to the text about to be studied. Kinbote goes to great lengths to assure us that his land of Zembla and his 'great secret' are a major theme of the poem. He also repeatedly affirms his friendship with Shade, though the remainder of the text allows a severe amount of doubt as to the strength of their relationship. <br /> <br />John Shade, poet par excellence, is presented as an earthy, ugly man. Kinbote tries to exalt him to a higher plan at times, though textually we only ever see Shade for what he is - a poet, a great poet perhaps, but a poet. He isn't a God of letters or the Saviour of a nation, he is a man. But Kinbote has this to say of Shade's creative process: 'I am witnessing a unique physiological phenomenon: John Shade perceiving and transforming the world, taking it in and taking it apart, re-combing its element in the very process of storing them up so as to produce at some unspecified date an organic miracle, a fusion of image and music, a line of verse.' <br /> <br />Once the introduction has cleared, we are able to read the poem itself. It is 999 lines long: 166 for Canto One, 334 for Canto Two and Three, and 165 lines for Canto four. Kinbote tell us that the poem should in fact be 1,000 lines, with the first line of the poem repeated as the last, '...and would have completed the symmetry of the structure, with its two identical central parts, solid and ample, forming together with the shorter flanks twin wings of five hundred verses each, and damn that music.' <br /> <br />We are told in theintroduction that the poem is about Zembla, which means that when we read Pale Fire, we are searching for references and commentary on this (presumably) mythical country. Canto One and Two incite doubt, Canto Three assures us, and Canto four confirms that there will be no references to Zembla. From the first, we are unsure of our narrator. <br /> <br />To the meat of the text, then. Kinbote offers to explain verses and lines, sometimes in great detail. A number of these are purely literary in explanation. He locates references, comments upon the language used (both negatively and positively), and generally acts as a normal editor would. These comments are usually clever, accurate and informed. <br /> <br />But the bulk of the text comes from Kinbote's other comments. As we know from the introduction, Kinbote is desperate to prove a link between the poem and himself. He is so certain of his great friendship with Shade that surely it must be inspired by his majestic Zembla? A word ('Today' on one occasion, 'parents' on another) can spark a multi-page discourse on Zembla, on Kinbote, on the perceived connections. As we read, it becomes clear the lengths that Kinbote must go to prove any connection at all. At first, this seems the enthusiastic ramblings of a friend, but as we read, it becomes clear that Kinbote is not quite sane. He spies upon Shade, he creates connections that aren't there, he believes everything is stronger than it is. Why, we are unsure. Is he a fan, become obsessed with his favourite poet? <br /> <br />A third story - and we are crowded with them, it seems - is that of Gradus, a man hired to assassinate the deposed Zemblan King. As the analysis of the poem approaches an end, so to does Gradus come closer to finally killing Shade. This is not a spoiler - we are told from the start that Gradus killed Shade. But what we don't know is the motive. Was it to kill the King? Or was it case of mistaken identity with a Judge? Again, we are unsure, because Kinbote is so unreliable. <br /> <br />I say unreliable, yet he is reasonably consistent within himself. Zembla is an astonishing construct, with history, geography, culture and customs. Add to that the fact of Kinbote working at a university teaching Zemblan, and we remain unsure as to the truth of, well, everything. <br /> <br />So, a detective story. It is horribly complicated, yet at the same time completely straight forward. All of the plot lines begin at the start of the novel and are resolved in a straight forward manner. Kinbote does not reveal himself to be the exiled King at first, but that is a simple matter of reading between the lines - he goes to no real effort to hide the fact. And Shade is dead, we know that from the start. No, the 'detective' aspect of Pale Fire is that we don't know what to believe. There are multiple interpretations for everything, but the only detailed interpretation we have is Kinbote's, and his is so fantastic that it should be automatically discredited. Yet we cannot, due to the sheer confidence with which he tells his story. <br /> <br />A word on the poem. It is by turns beautifully written and evocatively plotted. The Second Canto deals with Shade's daughter's death, and is very sad. The language is impeccable, as all poems must be. 'How to locate in blackness, with a gasp, Terra the Fair, an orbicle of jasp' is lovely. <br /> <br />Similarly, the rest of the novel crackles with inspired description and wordplay. Nabokov is known for his love of language, it is quite astonishing to realise that English was his second language. We have such gems as 'Would he have crept, pistol in hand, to where a sun-bathing giant lay spread-eagled, a spread eagle of hair on his chest?'. <br /> <br />There is a lot to consider with Pale Fire. The beauty of the novel is easy to enjoy, and the plot, for what it is, works. The greatest enjoyment comes from the mystery of what is real and what is not, but a side entertainment is certainly available in the form of Kinbote's literary criticism, some of which is biting. We may assume that this is Nabokov speaking, as he was known for his harsh judgment on literature. <br /> <br />To end, Pale Fire is complicated and complex, but the rewards are great. If the idea of a novel wrapped around the analysis of a poem is not appealing, then stay away. But if beautiful language, wonderful prose and excellent literature is to your taste, by all means, read Pale Fire.	2007-01-15
US	23970004	R18LOCQOS6RL8L	0679723420	755867934	Pale Fire	Books	5	7	8	N	N	A tour de farce	Nabokov was one of the wittiest, most elegant writers of English prose of the 20th century. That's remarkable - his native language was Russian. He's probably best known to English language readers for his novel, \\"Lolita,\\" but I think that \\"Pale Fire\\" is his masterpiece. It's just plain brilliant.<br /><br />\\"Pale Fire\\" is something of a literary platypus. It isn't a novel, it isn't autobiographical, it isn't prose or poetry. It has elements of all of them while being none of them. It's completely original. It's a farce and a satire, a skewering of academia, a riff on the pretentiousness of professors, a slam of postmodernism before many people were even talking about that academic development. In spirit its closest modern relatives are Alan Sokal's fraudulent 1996 article (parody) in the journal \\"Social Text\\" and a sendup of MLA procedings in \\"Postmodern Pooh.\\" It consists of a foreward, a poem in four cantos, commentary, and an index. It's all supposedly written by an apparently demented academic, Charles Kinbote, except for the poem, written by his former colleague (and object of both child-like and sexual desire?), John Shade.<br /><br />We learn more about Kinbote in his work about Shade's poem than we learn about the poem or its author. As far as Kinbote is concerned, everything is about him - the poem, academic intrigue, revolution in his homeland, everything. His analysis of the poem is almost an exercise in solipsism - he sees and discourses on himself at every turn. And thus, I think, was Nabokov's view of American English departments - collections of talentless, naval-gazing frauds.<br /><br />This book isn't just a satire of university English departments. It's also a mystery and a puzzle, pulling us into the world of Kinbote and feeding us clues about the place so that we can form a picture of it, understand why Shade is dead and Kinbote is holed-up in a motel to finish his commentary. But it isn't a book about a mystery. It's just a really strange book, and just plain brilliant.nge book, and just plain brilliant.	2006-12-11
US	51757266	R3DYFZ0YKRU0RZ	0679723420	755867934	Pale Fire	Books	5	5	6	N	N	This is Not Light Reading [T]	This is about as close to a college English review of a novel as I have encountered in 30 years. The style and the annotation are similar, if not identical, to how a long poem would be analyzed in a class.<br /><br />After reading the forward, where you are told that the narrator, maybe on the sly, impounds the 999-line poem written on the death bed of his beloved rhyming neighbor.  He then delivers the poem to us -- in a consistently written 10-beat rhythm -- which discusses many aspects of regicide of the late and great King of the foreign land of Zembla.  Zembla's King Charles is lost, or is he the rhyming neighbor in disguise? We are never sure.<br /><br />Line by line, a thorough review of what is meant by some of the unique passages is delivered to us by the narrator, who proclaims to know more than anyone what this epic poem is about. This is like college class. This is very entertaining.<br /><br />Poems do not move quickly, and this one is no exception.  Moreover, Nabokov's thorough usage of the English language may deliver you to the dictionary on frequent occasion as his prose is as detailed and thick as many poets.<br /><br />We are toyed with by Nabokov, but what else is new? In the end, we know little more than we did in the beginning.  But, it was fun.<br /><br />This is a book which you may want to own.  Reading it again and again is probably the correct thing to do as this novel has layers upon layers. And, that is exactly what Nabokov did on so many occasions.  He was  a master of multiple perspection, he delivered us fiction which could be read different ways on different occasions.	2006-10-17
US	51050156	R39SKYA5SVQKLI	0679723420	755867934	Pale Fire	Books	5	4	6	N	Y	Sheer joy..a verbal jig saw puzzle.	This is my favorite book ever. Naturally I'll glow about it. It defines a clever masterful writer at his peak. Pale fire is the moon, a mirror and a muse that teases our brains as we try to decode its contents.<br /><br />As easy as it is to read, Pale fire is not an easy book to grasp at first but it is worth reading and re-reading to figure out where all the prurient, silly things, crown jewels and nick nacks Nabokov chucked in are. Pale Fire is both sheer nonsense and serous prose all in one.	2006-08-14
US	50881246	R2SX2U6A5NBLL2	B000CEMRGY	755867934	Pale Fire	Books	5	1	1	N	N	Mad bad and glorious to know	Take everything you knew or thought about Vladimir Nabokov, and stuff it in the trash. Experimental novel \\"Pale Fire\\" is a strange, haunting, magical experience, and as different from most novels as it can get. Like a textured surrealist painting, that is hard to take in on only one reading, let alone describe to someone who's never read it.<br /><br />\\"Pale Fire\\" is a poem, 999 lines and divided into four cantos, written by poet John Shade. It's moving, vibrant and breathtaking. And it's posthumously annotated by scholar (and head case) Charles Kinbote, supposedly from the fictional Zembla (don't ask). In the \\"backwoods,\\" Kinbote overdissects and reexamines the strange poem. Increasingly he is drawn into the web of words, stuck on the poem and believing it to be about him.<br /><br />A strain of subtle, dark humor runs through \\"Pale Fire.\\" Not funny-ha-ha humor, but one that only becomes apparent if you study it. In a nutshell, the humor here pokes at critics who read what they want to see into literature. Everyone has seen a passage or a line that strikes them to the soul. The entirety of \\"Pale Fire\\" does this to Kinbote, and his obsession with making it about himself is weirdly hypnotic.<br /><br />Most unique (and funny) is the sort of analysis that Kinbote does of \\"Pale Fire.\\" It's overblown, unlikely, and tailored to his delusions. He sees what he wants to see, and tries to turn ordinary phrases into deep allusions, and even adjust the whole point of the poem. What else do literary analysts do? It's hilarious to see Kinbote bend, twist and mangle every little phrase to fit. After all, who hasn't heard that \\"Lord of the Rings\\" is about World War II or the atom bomb? Or listened to a professor pinning a mess of Freudian theory on poor Hamlet?<br /><br />The poem \\"Pale Fire\\" is the soul and core of this unorthodox novel. Perhaps only in A.S. Byatt's \\"Possession\\" does another poem so completely show the soul of a fictional character. Nabokov's poetry has the classic flavor of his prose. It's delicate and evocative without being overdescriptive. \\"I was the shadow of the waxwing slain/In the false azure of the windowpane\\" is among the loveliest excerpts, from the very beginning of the first canto.<br /><br />And Nabokov's narrative is both dizzying and madly brilliant. He takes us on a ride into Kinbote's very, very disturbed mind and makes the journey stranger as the book goes on. At the same time, he crafts this as a puzzle. Not a mystery, a puzzle. Hints are dropped, questions are raised, and just try to dare to overanalyze any of it.<br /><br />\\"Pale Fire\\" is a book that has to be read to be believed: A satire within a poem within a novel. Unique and witty, spellbinding and avant-garde, this is a thinking reader's classic.he classic flavor of his prose. It's delicate and evocative without being overdescriptive. \\"I was the shadow of the waxwing slain/In the false azure of the windowpane\\" is among the loveliest excerpts, from the very beginning of the first canto. <br /> <br />And Nabokov's narrative is both dizzying and madly brilliant. He takes us on a ride into Kinbote's very, very disturbed mind and makes the journey stranger as the book goes on. At the same time, he crafts this as a puzzle. Not a mystery, a puzzle. Hints are dropped, questions are raised, and just try to dare to overanalyze any of it. <br /> <br />\\"Pale Fire\\" is a book that has to be read to be believed: A satire within a poem within a novel. Unique and witty, spellbinding and avant-garde, this is a thinking reader's classic.	2006-06-22
US	13914425	R28HFHJ1O0D1QL	0679723420	755867934	Pale Fire	Books	5	7	8	N	N	Wonderfully original, beautiful presentation.	Pale Fire is like no other novel that I have read. Strictly speaking, Pale Fire is a poem of 999 lines, presented in four cantos. In a Foreword written by Charles Kinbote we are introduced to this form and given some details about Pale Fire's author, John Francis Shade. The majority of this volume is Dr. Kinbote's commentary, published after the conclusion of the poem.<br /><br />Kinbote, Shade, and others discussed in the Foreword and Commentary are, of course, inventions of the novel's author, Vladimir Nabokov. Some we meet for the first time, and others (such as Professor Timofey Pnin) we fondly remember from other works written by Nabokov.<br /><br />As a work of art, this work deserves the attention it receives. It is hugely ambitious and places some demands on the reader (as no doubt was true for its author!) but these demands are not senseless; the reader that endures will find the experience worthwhile.<br /><br />In reading through the text, I'm reminded of something Nabokov asserted in his classes on Literature: that there is no reading, there is only re-reading. Even if following Kinbote's recommendation to read the Commentary first, then to read the poem, there will still be quite a lot of read to re-read, to fix certain details more firmly in the mind understanding how they appear at various points throughout the poem and its commentary.<br /><br />Several themes emerge: one is a simple one, the personal life of John Shade, his relationship with Kinbote, his wife, and the broader University community. The larger theme is of Kinbote's native Zembla, the revolution that took place there and led to the flight of many. The similarities between Kinbote's Zembla and Nabokov's Russia are difficult not to notice when reading various details of the new government in power in Zembla, telling us such things as \\"the streak of stupidity that fatally runs through the most competent tyranny.\\"<br /><br />Pale Fire is a masterpiece, a novel whose original presentation beautifully conveys a suspenseful story of intrigue, comedy, tragedy--of timeless human truth.entation beautifully conveys a suspenseful story of intrigue, comedy, tragedy--of timeless human truth.	2006-06-08
US	48657772	R37NNGCH63UGR5	0679723420	755867934	Pale Fire	Books	4	2	5	N	N	It makes you think	This book is amazing. I'll try and explain why as best I could without taking away from the book. There is a poem and the man who wrote it died, and there is a commentary to that poem written by a fellow professor at a local college. This Professor Kinbote is writing the commentary from his point of view which is rather obsucerd. Because of this, you don't know if what he tells you is true or not. By this, the reader has to come to his or her own conclusions of the stories that Kinbote tells us and the end scene. There has been much differing of beliefs between readers as to what actually happens in the novel. This element of the story makes it a must read. Another thing I noticed is that I, the reader, wasn't able to identify the plot in the beginning of the commentary section. But as stories go on and situations in the past unfold it becomes evident to the reader that all is not right in the mind of the storyteller.  <br /> <br />A must read for those who want to experience a great book that can open up the senses and observe details to the finest degree. Pale Fire is great.	2006-05-04
US	49498389	RTT9NQNF3VRNE	0679723420	755867934	Pale Fire	Books	5	7	10	N	N	Apex of the C20th	This is the greatest novel of the 20th Century: in the same way that Last Year at Marienbad is the greatest film. It is as superior to Ulysses as Marienbad is superior to Citizen Kane. It cannot be accidental that both artworks, book and film, were produced at almost the same point in time, circa 1961-63. Commentary is superfluous. If you don't agree with what I've said so far, I'm not going to attempt to convince you. Some things just are.	2006-04-12
US	12668384	R179QUCCWUHLF1	0679723420	755867934	Pale Fire	Books	5	5	6	N	N	Holy Wow!	Isn't it a stupendous feeling when a book not only meets but exceeds one's expectations? There's almost the feeling of euphoria like you yourself are the one responsible for  its greatness. <br />So, first things first: Is it better than Lolita? It's really pretty hard to compare the two, though it is much more engaging (literally) and out right funny than that book (if, ironically, less poetic, but that's the point, isn't it?). I never felt more certain that Nabokov really was the genius that your asthmatic literature professor professes him to be as when I finished this book.  <br />Mr. Vladimir here pulls the most amazing feat imaginable, in fact, he seemingly does the impossible: he successfully destroys whatever generic expectations and boundaries are inherent in a novel while simultaneously telling an amazing story. And he does with such ease that it almost makes one sick with giddiness. Its a book that completely enraptures and ensnares.  <br />Just a few things to consider however: firstly, don't read the Amazon review if you really find yourself wrapped up in the plot; it gives away much more than you would expect. For somehow, this novel told in the form of a commentary on a poem is gripping and compelling. But, if you do, don't worry, this is one of this handful of books where there is just as much pleasure in the words as in the plot. Secondly, and most practically, I would suggest not forgetting that, even if it is a novel, it is written as a commentary and its helpful to read it as such. I would recommend usinf two bookmarks, one for the poem itself and one for the commentary: it makes things much more enjoyable and even helps out with hiccups in the plot. Also, read it again to go back over it and notice all the little notes and jokes that are easily missed the first time through. It might be more work than your average novel, but trust me (and most of the other people on here) it is truly worth all the time and energy you give to it.	2005-12-01
