US,51022984,R3KIT45UWT73GA,0449205061,437546793,Rabbit, Run,Books,3,1,1,N,N,"Rabbit looks in better shape than I am","John Updike, at least in the opinion of his fans, made constructive use of a Guggenheim fellowship by writing 'Rabbit, Run,' which grew into a four-novel series chronicling the life of an average American man.  The series, much like Rabbit Angstrom, ran away with itself and became a landmark of the twentieth-century American novel.  By the time of his death in 2009, Updike's Rabbit tetralogy was best-selling and the recipient of two Pulitzers.<br /><br />First published in 1960, 'Rabbit, Run' was the second novel of Updike's career and broke ground in ways similar to his 'Couples' of 1968.  Never one for self-censorship, he laced 'Rabbit, Run' with an audacity and sexual frankness that writers such as Philip Roth, Norman Mailer, and William S. Burroughs also championed through the 1960s and 70s.  Updike was certainly not alone in overcoming literary taboos, but he stands apart from his contemporaries in using a Protestant, middle-class perspective that combines issues of family, sexuality, and politics with bourgeois life and religion.<br /><br />'Rabbit, Run,' written by Updike in his mid-twenties, was a reaction to the social climate of America as it moved out of the 1950s, a decade marked by vast prosperity and, to many, extreme conformism.  Updike made reference to Americans feeling 'stuck' in the 50s, when the United States advanced through early phases of the Cold War to become a military and economic superpower.  His characters from this period, usually middle-class suburbanites, lack direction and personal fulfillment in a post-Second World War malaise that overshadowed the Eisenhower administration.<br /><br />Set in the fictitious Pennsylvania town of Mt. Judge, Updike often uses the word 'net' to describe a late 1950s atmosphere that Harold 'Rabbit' Angstrom feels trapped in.  Harry, once a star on his high school's basketball team, is now 26 years old.  He is dabbling in the working world as a kitchen gadget salesman while caring for his pregnant, alcoholic wife Janice Springer and 2 ½-year-old son Nelson.<br /><br />Harry, from the opening pages, is facing a mental and spiritual crisis.  While swamped in an unhappy marriage, he deals with flak from his parents and in-laws to keep the Angstrom and Springer names unblemished, pressure from his Christian faith, and demands by society to have a chicken in the pot and two cars in the garage.  Unable to cope much longer, he hops into his Ford and drives to the Mid-Atlantic states with no intention of returning.<br /><br />Dogged by family obligations, Harry drives back to Mt. Judge and joins Marty Tothero, his old basketball coach who is living in the attic of a social hall.  Harry always looked to Tothero for advice but finds his pep talks outdated and stale. Yet it is through Tothero that he meets Ruth Leonard, a heavy-set woman who seems to make ends meet through prostitution.  A morbid affair, based on domination rather than love, begins and Rabbit finds himself more at odds with his conscience than ever.  This guilt is heightened by Jack Eccles, an Episcopalian minister who has been asked by the Angstroms and Springers to 'convert' Rabbit back into family loyalty.<br /><br />It does not take long to sense an absence of emotional depth in Harry, which causes his undoing in 'Rabbit, Run' and over the three later novels.  Still living on the glory of his basketball days, Rabbit seems to lack consideration for most anyone outside of himself.  He has no patience in helping his drink-quaffing wife and is repulsed by her second pregnancy.  Except for his son Nelson, he cannot seem to form any direct connection with another person's feelings; men are negative forces that pose threats and women are vessels for his rampant sexual desires.<br /><br />His behavior is impulsive, almost animal, and the work of Eccles to steer him onto the righteous path seems hopeless.  Yet Rabbit is himself aware of what is lacking.  Unhappy with his life and clinging to what little of his Christian faith is available, Rabbit senses a reality beyond Mt. Judge but cannot find his way.  Against a static backdrop where there is little hope of improvement, it is no wonder that Harry feels like skipping town.  Updike asks whether our ties to other humans are truly strong enough for Rabbit to go back.<br /><br />While an engaging, often funny, and ultimately painful book, 'Rabbit, Run' is a product of the early Updike, the writer who has not fully set down his method.  Like Updike through all periods, the novel is rich in detail and brings us to the heart of its protagonist, but it does not have the total balance and polish that his later fiction carries.  Updike had published just one earlier novel, 'The Poorhouse Fair,' in 1959 and was still a distance off from the pristine narrative and impeccable form of 'Rabbit is Rich,' a superior, Pulitzer Prize-winning novel released in 1981.<br /><br />As usual, Updike does not divide the novel into chapters but into loosely-based sections that run for dozens of pages.  'Rabbit, Run' is told in third-person semi-omniscient, telling most of the story from Harry's point of view but stepping away to relate other characters' predicaments, such as those of Janice and Eccles.  This keeps the reader fully aware of the developments.  The book functions well as a unit, but Updike might have created a more suspenseful novel by revealing some of the events after they happened.<br /><br />Updike, who thought of 'Rabbit, Run' as a film on printed pages, admitted that the novel was written 'carelessly' in order to gain a narrative freedom.  At times, his writing seems too free; besides detail-packed sentences that leave out punctuation to maintain flow, Updike tinkers with stream of consciousness to describe characters' innermost thoughts.  This actually breaks the narrative rhythm more than it sheds light.<br /><br />These problems are overridden whenever Updike gives meaning to drab, ordinary lives.  Updike's characters and settings are unpleasantly real and cause us to think we've been in the exact situations before.  While his narration is a bit too verbose, Updike's dialogue is some of the most beautifully conceived in American literature.  A typically Updike combination of pleasure and pain, 'Rabbit, Run' and its three successors make up a commentary that will remain popular for at least the near future.<br /><br />Those interested in the social history of America should read at least one of the Rabbit novels, beginning with 'Rabbit, Run' in 1960 and ending with 'Rabbit at Rest' in 1990.  A novelette based on the Rabbit series, 'Rabbit Remembered,' was also published in Updike's 2001 collection 'Licks of Love.'  'Rabbit is Rich' and 'Rabbit at Rest' won the Pulitzer Prize for Fiction in 1982 and 1991, respectively.<br /><br />'Rabbit, Run' is in wide circulation at bookstores, libraries, and on the Internet, including as a 284-page Fawcett Crest paperback.  The 1993 Fawcett printing has small but clear type and a cheerful blue cover.  Earlier hardcover releases by Alfred A. Knopf with Updike's familiar jacket design are also available.  Harold Angstrom has been the wellspring of Updike's fame during his lifetime and will almost certainly make up the bulk of posthumous fame that Updike enjoys.beyond Mt. Judge but cannot find his way.  Against a static backdrop where there is little hope of improvement, it is no wonder that Harry feels like skipping town.  Updike asks whether our ties to other humans are truly strong enough for Rabbit to go back.    While an engaging, often funny, and ultimately painful book, 'Rabbit, Run' is a product of the early Updike, the writer who has not fully set down his method.  Like Updike through all periods, the novel is rich in detail and brings us to the heart of its protagonist, but it does not have the total balance and polish that his later fiction carries.  Updike had published just one earlier novel, 'The Poorhouse Fair,' in 1959 and was still a distance off from the pristine narrative and impeccable form of 'Rabbit is Rich,' a superior, Pulitzer Prize-winning novel released in 1981.    As usual, Updike does not divide the novel into chapters but into loosely-based sections that run for dozens of pages.  'Rabbit, Run' is told in third-person semi-omniscient, telling most of the story from Harry's point of view but stepping away to relate other characters' predicaments, such as those of Janice and Eccles.  This keeps the reader fully aware of the developments.  The book functions well as a unit, but Updike might have created a more suspenseful novel by revealing some of the events after they happened.    Updike, who thought of 'Rabbit, Run' as a film on printed pages, admitted that the novel was written 'carelessly' in order to gain a narrative freedom.  At times, his writing seems too free; besides detail-packed sentences that leave out punctuation to maintain flow, Updike tinkers with stream of consciousness to describe characters' innermost thoughts.  This actually breaks the narrative rhythm more than it sheds light.      These problems are overridden whenever Updike gives meaning to drab, ordinary lives.  Updike's characters and settings are unpleasantly real and cause us to think we've been in the exact situations before.  While his narration is a bit too verbose, Updike's dialogue is some of the most beautifully conceived in American literature.  A typically Updike combination of pleasure and pain, 'Rabbit, Run' and its three successors make up a commentary that will remain popular for at least the near future.    Those interested in the social history of America should read at least one of the Rabbit novels, beginning with 'Rabbit, Run' in 1960 and ending with 'Rabbit at Rest' in 1990.  A novelette based on the Rabbit series, 'Rabbit Remembered,' was also published in Updike's 2001 collection 'Licks of Love.'  'Rabbit is Rich' and 'Rabbit at Rest' won the Pulitzer Prize for Fiction in 1982 and 1991, respectively.      'Rabbit, Run' is in wide circulation at bookstores, libraries, and on the Internet, including as a 284-page Fawcett Crest paperback.  The 1993 Fawcett printing has small but clear type and a cheerful blue cover.  Earlier hardcover releases by Alfred A. Knopf with Updike's familiar jacket design are also available.  Harold Angstrom has been the wellspring of Updike's fame during his lifetime and will almost certainly make up the bulk of posthumous fame that Updike enjoys.",2011-02-28
US,16873778,RKZIEL2N91XFA,0449911659,437546793,Rabbit, Run,Books,1,7,18,N,N,"Terrible","If you want to read a terribly depressing story that has a plot which goes nowhere, read this book.  If not, stay away.  This was an easy read but hard to finish book.  If it had not been a gift I would not have finished it.",2011-02-03
US,13459576,R1U3ERXIKIUO10,0449911659,437546793,Rabbit, Run,Books,4,1,1,N,N,"So mixed","*spoiler alert*  The reader who usually dislikes books with clogged arteries from too much description (so, 4 instead of 5 stars), might enjoy reading Rabbit's story, and understand his erratic mindset a bit when Janice turns out to be a vapid drunk and mama's girl...  ... when all of a sudden the reader might be knee-capped about 50 pages from the end, upon Rabbit leaving Janice for the second time.    Updike gets into Janice's head then, and the way he describes the terror and desolation of the mommy abandoned with babies -- very, very real.  The anger, the pain and worry for the children, the hemorrhaging of confidence and capabilities, the unanswered questions, the shut door and the silence, all terribly true.      But of course most abandoned mommies do not become drunks and everyone survives more or less intact.  And years later, when all is more or less forgiven and forgotten, the reader might happen to be in a public place and reading this part of the book and a wound reopens as if new, you might start crying, and it is not a pretty crying, it is the crying of the lost, of the abandoned, of the forgotten, of the rejected.  The rage, the hopeless way the reader with bad old memories might appear will cause those nearby to move away, to ask cautiously \\""are you okay?\\"" and the reader has to marshal the forces of survival back up and say, \\""yeah, fine\\"".    Don't say you haven't been warned.",2011-01-22
US,31753042,R3M8AP5H9Q8BEE,0449911659,437546793,Rabbit, Run,Books,4,0,1,N,N,"Rabbit, Run","`Rabbit, Run' is the first instalment in Updike's four part Rabbit series and it follows Harry `Rabbit' Angstrom as he goes through a mini mid life crisis and leaves his pregnant wife when he feel trapped by the mundanity of suburban life. This book has a main character that is hard not to like, even though he behaves in a pretty reprehensible way and it portrays the cloying nature of some marriages and the day to day grind of working life very well. You really understand why Rabbit ran and his behaviour throughout the book, although it has to be said he is a very indecisive chap! I came to Updike via his short stories and whilst I enjoyed this novel I have to say I enjoy his short stories more. This seemed to lack the melancholy and moving narrative of his short stories, although the writing here is just as stunning and his turn of phrases and descriptions are amazing, they just moved me less than his other shorter pieces. This may well be personal preference. After reading this I want to get the other `rabbit' novels to see where Rabbit's life goes and no doubt once you read this you will want to do the same. There is also an afterword by the author exploring the writing of this and the other Rabbit novels and if you are unfamiliar with them some of the points raised may go over your head, but it makes for informative reading never the less. This is a great introduction to Updike's novels, but if this fails to move you don't give up, but try one of his outstanding sort story collections instead. Whichever you read I guarantee you will be impressed.<br /><br />Feel free to check out my blog which can be found on my profile page.",2011-01-09
US,23610994,R1PXUR2D8FHPAW,0449911659,437546793,Rabbit, Run,Books,3,0,2,N,N,"Horrible Characters","Harry is trapped in an unhappy marriage.  His wife is pregnant and an alcoholic, and they have a two-year-old child.  Everything gets to be too much for Harry, who was a superstar athlete in high school and somehow feels like he deserves more out of life than this.    One evening without warning, he leaves his wife and child, drives for awhile, and eventually comes right back to his own city to live with another woman.    Other people touch Harry's life through this transition, especially his former high-school basketball coach who is a bit addled, and the minister of his church, with whom he begins a weekly golf game as the man attempts to save him and make him realize he ought to go back to his wife.    Harry remains untouched, though, and continues doing whatever feels right to him at the time, justifying the hurt he causes to all those around him.    The writing in this book is excellent.  The way Updike carves out a sentence is breathtaking and his metaphors and use of language are mesmerizing.      However, I hated every single character and couldn't muster any sympathy for any of them.  It was hard for me to continue reading about characters I disliked so intensely, and I can't imagine ever picking up the sequel to this book.",2010-12-22
US,11257866,R1A0ZHNM2KHTR8,0449911659,437546793,Rabbit, Run,Books,5,1,1,N,N,"Going Nowhere Fast!","The first Harry 'Rabbit' Angstrom book and Rabbits glory days are past. From basketball hero he now has a dead end job and a stagnant marriage; one child and one on the way. Washed up at 26 he seeks a new life; a new begining,but all his plans are hampered by his indecision and lusts.<br /> This is a great read and 50 years on is still fresh and ground breaking in its sexual detail and exploration of the failed American dream. Updike's prose style is descriptive and poetic and somehow achieves the near impossible in making in making Harry sympathetic despite his amoral attitude to life and the damage he does to those around him.<br /> I avoided Updike for years despite recommendations and only recently took him up with 'My Fathers Tears'. That was excellent and 'Rabbit Run' serves to show how much more of his work I have to enjoy. This certainly measures up to comparable novels such as 'Revolution Road'.",2010-11-13
US,18399830,RAZJVUENSUYF5,0449911659,437546793,Rabbit, Run,Books,4,0,1,N,N,"Running from Reality and Responsibility","Harry a.k.a., Rabbit Angstrom, in this first installment of John Updike's tetrology, is a case where fallen human nature displays itself in actions and attitudes reinforced by a number of factors. The first is the family upbringing and the kind of theology one grew up with. Here Updike alludes that theology matters. We see this from Rabbit's interaction with Jack Ecles, an Episcopalian minister who despite a sincere desire to restore his broken relationship with his wife and in-laws, fails miserably in his efforts due to a defective view of man, sin, God and atonement. The people Rabbit grew up with are also a big influence that makes him the person that he is; his buddies in the army and his high-school basketball coach Marty Tothero. All these factors seem to work together to mold Rabbit into an irresponsible person who can't stand the painful realities and responsibilities in personal relationships, specifically in marriage that tragically leads to the death of his baby. I don't view the characters in this story derisively; Rabbit, his wife Janice, his parents and in-laws, Marty, Ruth, and Jack, but with sympathy since everyone is liable to similar predicaments. From a Christian perspective, they underscore the need of the gospel of  Jesus Christ that deals head-on with the fundamental problem with humanity, namely, sin.",2010-09-04
US,48505806,RP2U2X939AO38,0449911659,437546793,Rabbit, Run,Books,4,1,2,N,Y,"Rabbit adictive","Updike writes with such detail it's like he's painting a picture in my mind. Normally mundane life bursts off the page and I can see what he is writing about. I am now on to Rabbit Redux which jumps ahead a few years and is even better, I can remember what I was doingin 1971 when that was published, a much more political time and Updike is in the middle of it all.",2010-07-20
US,11839422,R84WP1SB94GIQ,0449911659,437546793,Rabbit, Run,Books,4,0,0,N,N,"Where it all started","The Updike Rabbit series deals with contemporary issues respective to each novel - and Harry's unique, but disarming, take on each.  But Rabbit, Run is where it all started and essential reading for the series (and serious reader).  It's when you begin to emphathize, instead of sympathize, with Rabbit that the power of Updike begins to surface.",2010-06-25
US,36032259,R2K8M6EP4GIZ4I,0449911659,437546793,Rabbit, Run,Books,3,2,3,N,N,"Where's the payoff?","I've wanted to read Updike for a while and 'Rabbit, Run' is my first foray. It's clear from the beginning that this isn't a novel of the casual-reading variety that will allow your eyes to dance across rapidly turning pages. It doesn't pull you in like that. Updike has a gift for descriptive prose (in fact that's what you're going to get throughout the novel) and as such you have to invest time and effort to absorb and immerse yourself into the whole of it. By committing and submitting yourself to this narrative you allow Updike to use his primary vehicle for relating his characters.     The prose can be challenging, especially at first, like listening to a foreigner trying to speak English, you have to shift gears and give yourself time to attune to the flow and pattern of this delivery. As such, I viewed the approximately first 30 pages as a disembodied, boastful and self-serving exercise in prose designed to show off the prowess of a clever writer as opposed to the delight encountered upon finding a novel that has an ability to grab you right away and immediately begin advancing the story. The descriptive text can be numbing and I catch myself reading individual words and individual sentences, focusing on the wordplay instead of absorbing the character and story. I force patience in myself and as the characters and style become more familiar the verbosity of prose begins to feel less burdensome.    If you're the type of person whose heart sinks at the sight of a paragraph that extends a page or more, and there are definitely a few of those in here, then this book is probably not for you. But it's not just that the paragraphs can be (and feel) long, rather it's the feeling that each paragraph and each descriptive little nugget within seems to relate a quality or feeling of grotesqueness and distortion, and the longer the paragraph the longer you're submerged, held under, gasping for breath. Some might say 'that's the point, to be unsettled' and I can understand this argument but the story is filled primarily with this manner of textual undertow, and, combined with the accompanying tragic characters (even the children are made to feel tragic), the reader is pulled relentlessly into an unsatisfying, spiraling morass. At the end, characters' positions may change but the changes are slight and circumstantial at best (not dictated by realization or self-determination) leaving the reader to ponder only the lack of growth, reward, justice, and ultimately payoff.",2010-02-25
US,52801156,RSH9508VX9MGT,B000IMHQ7K,437546793,Rabbit, Run,Books,5,1,1,N,N,"Written in the year of my birth","My local library put out a reading challenge to read any book written in the year you were born. How strange to think that while my parents were expecting me, John Updike was writing this! I had not read Updike before and I was absolutely struck by the intensity and beauty of his prose.<br /><br />This book is the story of an average guy who was a basketball star in high school and now sells vegetable peelers. He has a child and a pregnant wife. Feeling trapped, he tries to run away but can't quite take the big step. Instead, he ends up living with what must have been at that time called a 'loose woman'. Things tumble downhill for Rabbit, his wife, and his lover. Eventually, Rabbit returns to his wife but his troubles are far from over. In a mind-blowing climactic scene, the worst possible thing happens.<br /><br />I will definitely be reading the rest of the books in the series. Poor Rabbit. It really isn't his fault, and yet, it all sort of is.",2010-02-12
US,49964841,RAJ8JY0JJPACH,0449911659,437546793,Rabbit, Run,Books,2,9,12,N,N,"I don't see the point of this book","To head off the inevitable criticism, let me start off by saying that I generally like reading great literature, and can enjoy books even if (or especially if!) they are depressing or have unhappy endings. But even for such books I need a reason to care about something: either the characters or the themes or the writing. This book gave me nothing to care about. The central character [Rabbit] has no redeeming qualities: his predicaments are interesting (and had the potential to be relevant as an illustration of people who drift through life), but Rabbit is not just a 'drifter'; he's a jerk who commits not one selfless act the entire book. Does the book offer anything else? The themes explored here may have been considered revolutionary at the time the book was published in the early '60s (I don't know), but by today's standards are weaker than what you would find in a good independent film. The writing is ok, but there are several authors out there who write better.    What I don't understand is why this book is considered a classic, and why so many others on amazon liked it so much.",2010-02-03
US,39842924,R3EOEW58ZN07AG,0449911659,437546793,Rabbit, Run,Books,4,1,1,N,N,"American anti-hero","Harry `Rabbit' Angstrom is an anti-hero for 1960s America and for modern times: self-centred, irresponsible, sybaritic, pusillanimous. Rabbit is an ex-college basketball player. He is spoilt, though he does have an intermittently functioning conscience. And he decides his layabout wife and his job as a potato-peeler salesman are not what he expected from life: such is the premise of Rabbit, Run, a self-contained novel that became the first piece of a four-part series.    Rabbit, Run brushes aside money to suggest sport and religion are what American mores are about. For despite its premise, the book soon parts with beat-generation road-novel stereotypes. What interests Updike isn't so much that giddy ride into the unknown, but what happens back home, the tug-of-war of flight and gravity more than flight itself. Rabbit, Run thus resembles a darker version of the movie The Graduate more than On The Road. Rabbit becomes involved with a loose woman as he is chased about by a local pastor. This makes for a slow, sometimes un-engaging middle third of the story, especially since Updike's characters are meant as realistic more than appealing. Nevertheless, the novel picks up pace towards the end. And if it has mildly aged since it was written - one scene, involving fellatio, was evidently expected to shock and was indeed censored in the first edition - Rabbit, Run remains highly readable and interesting.",2009-12-11
US,44491436,RUWPV9DVSIKZA,0449911659,437546793,Rabbit, Run,Books,5,0,9,N,N,"Great!","I was quite impressed with this item and the ease that the transaction took place!",2009-09-14
