US,50349210,R3RGMRZK03MXVB,0449911659,437546793,Rabbit, Run,Books,3,14,20,N,N,"A let-down","The &quot;Rabbit&quot; legend has been so inflated in American literature, perhaps it was impossible for Updike's novel to live up to my expectations.  In any case, I finally got around to reading &quot;Rabbit, Run&quot; and was quite disappointed.  As novels go, it's perfectly fine: a simple story of a young man itching to shed his ordinary, middle-class, suburban life for some nebulous nirvana of love and excitement.  The problem:  I found Rabbit remarkably irritating and shallow, and the supporting cast (Ruth excepted) one-dimensional and unremarkable.  The prose, with occasional exceptions, is drab and lifeless--perhaps it was a stylistic choice made by Updike to complement his dreary story, but I doubt it.  Suburban malaise, the restlessness of American Everyman, marital hypocrisy--all of it has been done, redone, and re-redone in American literature before (talk about redux), and often with far better results (check out Richard Yates' &quot;Revolutionary Road&quot; for a glimpse of an unusually brilliant example of this type of novel).  Maybe &quot;Rabbit, Run&quot; was sharper when first published in 1960; but as a reader in 2002, I am unimpressed.  There's nothing in particular wrong with this book; but in my opinion, there's nothing much extraordinary about it either.",2002-03-10
US,43850200,R1JTZKG2WOJ5PU,0449911659,437546793,Rabbit, Run,Books,4,25,29,N,N,"Luminous Prose, Slight Story","Reading Updike's sentences is a breathtaking experience. He has a rare ability to transpose ordinary experiences into rarefied grounds without falsely heightening experiences themselves. Each sentence, each event in the novel is carefully considered and calibrated, so that no sentence or description seems wasteful. The technical facility of Updike is truly something to marvel at, even surpassing the lyricism of Cheever. The way he writes about sex, adultery and guilt in this book is unparalleled in 20th century American fiction, and I haven't seen any other writer come close.<br />Taken as an individual novel, however, it fails to rise to the status of a 'great american novel.' Although the writing is unsurpassingly beautiful, the plot is a bit thin, and ideas it expresses, commonplace. Minus the prose, the story tracks the  wanderlust and guilt of Harry Angstrom, a man who still wants to hold on to his glorious boyhood, and seeks to escape his oncoming adulthood and life of ordinariness. It's a well-traveled premise for a novel, but executed and polished to a hilt. <br />As we see Rabbit Angstrom struggle to keep apace with his given life, we are meant to see the social milieu that he lives in. Readers do get an acute sense of time and place, but what of it? Not that all fiction should strive for the Meaning of Life (how dreadful would that be?!), but the feeling you get after reading 'Rabbit, Run' is that of caffeine rush which you know will fade. And it does.<br />I don't mean to slight Updike's legacy - he is one of the best writers we have in the States. And read as a tetralogy, the Rabbit books do encapsulate four decades of Americana with a sprawling and lyrical sweep. It truly is an accomplishment. As an individual novel, 'Rabbit, Run' is emotionally involving and a hell of a good read. But it moves us tantalizingly close to showing us what literary greatness is, then ultimately leaves us short.",2002-03-01
US,52944767,R2EN9FPPHZLR4K,0449911659,437546793,Rabbit, Run,Books,5,23,25,N,N,"Compassionate realism: a young man reaches the end of youth","What makes &quot;Rabbit, Run&quot; such a staggering masterpiece is -- paradoxically -- its very ordinariness.<br />The novel is about a former high school basketball star, now married, with a family, who is finding his adult life claustrophobic.  He misses his youth -- the adrenaline rush of sports, the sense that life is full of possibilities.  He doesn't know what to do about it.  He tries to make some kind of change, with what's left of his youthful energy. He's self-centered, but he's also a dreamer.<br />The book is sad, in that it offers no &quot;solution&quot; to the frustration of leaving youth behind.  But it's also reassuring and poignant, because the theme is so universal.<br />Updike manages to keep this apparently ordinary story interesting without being philosophical or tedious.  His vivid, compassionate descriptions of characters and their neighborhoods are phenomenal.  He has a way of illuminating the inner workings of American optimism (sports heroes, suburban consumer culture) without looking down on it.  In fact, he seems to cherish it, focusing his lens on the  unspoken dreams that make our society and our personalities what we are.<br />This book -- along with its sequels -- is one of the great pieces of American literary art.<br />PS If that's not enough to grab you, read it for Updike's incomparable descriptions of lovemaking.  Arrestingly specific and vivid.  Only a handful of authors can actually describe sex -- I mean, really describe it -- and show the way people's personalities are played out in bed just like they are anywhere else.  The main character is a charismatic, self-absorbed yearner, in search of his lost youth at all times -- even during sex.  In Updike's world, sex isn't pornographic -- it's part of life.",2002-01-06
US,39686619,RTGEZ0MB0NC26,0449911659,437546793,Rabbit, Run,Books,4,4,6,N,N,"Even if you hate Rabbit, you can still love the book","I'll admit it - I toyed with the idea of putting this book back on the shelf at times. Like Wolfe or Faulkner, the prose is rich and decadent; each sentence conveys a great deal of meaning and can't be assimilated quickly. I stuck with it, and by the 50th page or so, the style became more natural and the characters opened up to me.<br />You'd have to possess a dark and vicious world-view to think of this as the story of an Everyman, an average-Joe, a typical American male of his generation. Rabbit exists in a moralistic void, a near-complete vacant solipsism making him react in ways more animal than human. Rabbit fails to choose a particular path simply because he never seems to realize that he has choices to make. He's fully accustomed to getting by on an innate likeability and his athletic grace; a fact which perhaps has stunted his development and lead him to his state of sociopathic carelessness for the feelings of others.<br />Reading this book is an exciting experience and I recommend it highly. Mt. Judge and Brewer are populated with interesting people - whether ultimately, you hate Rabbit Angstrom or love him, you'll find someone there who agrees with you.",2001-12-17
US,50200864,R2YJK6KG56IMEF,0449911659,437546793,Rabbit, Run,Books,5,3,10,N,N,"THIS RABBIT STILL RUNS","As an author with my debut novel in its initial release, I am amazed by works like John Updike's RABBIT, RUN that seem fresh forever.  Published originally over four decades ago, it captures its time and its place with utter accuracy yet the novel still applies to our society that has been transformed in many significant ways since Rabbit Angstrom first appeared on the literary scene.  While he is destined for greater material success in Updike's later Rabbit novels, Rabbit is a salesman living a marginal life with an alcoholic wife in RABBIT, RUN.  Brilliant prose stylist that he is, Updike spins a winning story about these characters, and it is a story that will seemingly survive upon the American literary landscape for as long as there are readers of fine books.",2001-08-05
US,42786418,RN75DMJUB8E5Z,0449911659,437546793,Rabbit, Run,Books,2,5,22,N,N,"Reader, Run","I was glancing through a time-life &quot;history of the last century&quot; book during a job interview and came across john updike in the 1960's section. he was praised for his great american novel &quot; rabbit, run&quot;. they went on to explain how it's about alienation and confusion of suburbia etc, etc. being a musician, i love stuff about alienation and following your heart and freedom and all of that stuff. i love springsteen and dylan but i didn't enjoy this book. it took me nearly 2 months to read a book that is only 280 pages! that's how slow this book is. it started off great. i'm from a small town in PA so i can relate to the setting. harry angstrom was just far to marose. it was like he was a complete pessimistic, childish, cry baby. i can understand leaving an alcoholic wife who's not your intillectual equivilant, but leaving your 3 year old son? what did he ever do? what was wrong with Ruth? he treated her like a common whore and complaining about her weight and acting like he was entitled to do whatever he wanted to to her. updikes prose is way to convaluted and trying to dazzle the reader with his style. the sentences were to long and the descriptions were just far to out there. it was like i was reading science fiction at some points. the ending was also terrible. is harry forrest gump? is he just going to run across Pa to California? People think that Stephen King is a hack, but i feel the guy can tell a great story, develop interesting characters, and can get deep without being confusing. i don't like fluff, but i don't wan't to have to get cliff notes to understand what the author is trying to say. i think simplicity and directness is often the better road to take.",2001-08-03
US,49404909,RDSPPDH9P9TT8,0449911659,437546793,Rabbit, Run,Books,5,18,19,N,N,"Rabbit Angstrom :  Born to Run?","I am somewhat embarrassed to admit that, prior to checking out \\""Rabbit, Run\\"" from the library a few days ago, I had never read ANYTHING in my 38 years by John Updike.  What a mistake!  First, as many other reviewers (here and elsewhere) have pointed out, Updike is an amazing, powerful, beautiful prose stylist.  In my opinion, and admittedly having only read one Updike book (\\""Rabbit, Run\\"") now, I would say that he ranks up there as one of the greatest American fiction writers of the 20th century.  In some ways (stylistically and thematically), Updike reminds me of another great (albeit problematic) American 20th century writer, Norman Mailer (his masterpiece, \\""The Naked and the Dead,\\"" specifically comes to mind).  Second, I'm just in awe of how clearly, accurately, and powerfully Updike - at only 28 years of age (!) - was able to say so much in \\""Rabbit, Run,\\"" capturing the zeitgeist of a time and place (drab, grey, conformist, late 1950s suburban American hell, as epitomized by Brewer, Pennsylvania), and presenting his characters with such nuance, balance, wisdom, honesty, and - most importantly - truth.  Incredible.  Finally, I don't feel that it's an exaggeration to say that \\""Rabbit, Run\\"" (and its sequels, which I haven't read, but have read about) is one of the most important achievements in American literature EVER.<br />So, what is \\""Rabbit, Run\\"" about?  In terms of themes, we've got a huge amount of material here (this is one big, meaty \\""rabbit\\"" of a book!).  Life, death and sex -- in fact, lots of sex (\\""Rabbit\\"" is  certainly an appropriate nickname in this context!!).  Courage to face life (and marriage, children) vs. giving in to \\""rabbit-like\\"" fear.  Commitment/responsibility vs. freedom/running away.  Religion vs. true faith (and what, if anything, such true faith might consist of).  Sin vs. redemption.  The fate of an individual attempting to find meaning and identity while fitting in (or not) to a stultifying, stifling, conformistic society (and ones' particular place/role in it).  The romantic fantasy of busting loose, hitting the road, and finding a better place. (Personal note: as a huge Bruce Springsteen fan, I was strongly reminded in \\""Rabbit, Run\\"" of \\""Born to Run,\\"" \\""Darkness on the Edge of Town,\\"" etc. with their many similar themes). Physical perfection/athletic achievement as potential sources of meaning, especially when you're past your \\""prime\\"" (\\""Rabbit\\"" was a high school basketball star, but now mainly relives his fading \\""glory days,\\"" as Springsteen would say).  Growing up vs. remaining an eternal youth.  Order vs. chaos.  And, ultimately, the difficult balancing act between ones' quest for PERSONAL happiness and fulfillment vs. the needs of family, friends, employers, society.  And much more.<br />Is this book, as some reviewers here have stated, \\""depressing?\\""  Well, actually, I'd have to say yes.  For one thing, Updike presents no definitive answers to all the important, dark, disturbing questions he raises here (nor could he, nor, as an artist, SHOULD he, in my opinion!).  Meanwhile, almost everything his main character (Rabbit) touches somehow turns out wrongly, or tragically (the misery and alcoholism of his wife, leading to the book's climactic tragedy, being the greatest example).  Plus, the setting of \\""Rabbit, Run\\"" is inherently gloomy (dreary, \\""dung\\"" colored apartment buildings which smell of \\""cabbage cooking\\"" or \\""something soft decaying,\\"" a deserted ice plant with \\""rotting wooden skids on the fallen loading porch,\\"" etc.).  People are mainly unhappy, or trapped, or scared, or confused, or looking for a little excitement to brighten up their dreary existences, or all of the above.  So why read such a depressing book?  Here are just a few reasons: to learn, to experience the world through the eyes of a great artist (Updike), to challenge yourself, to enjoy the sheer beauty of top-notch writing.  Finally, a philosophical question:  is the point of reading (or any other activity) simply &quot;pleasure?\\""Should we run, like a rabbit perhaps, from anything that might scare us, or threaten us, or even depress us?  Or should we stand our ground, look those things straight in the eye, and - unlike Rabbit Angstrom - NOT run.  Personally, I vote for the latter option!",2001-07-14
US,50952419,R1P62QLFXJETVJ,0449911659,437546793,Rabbit, Run,Books,1,23,44,N,N,"Not all good writing makes for good reading","Now at 53 years old I was what you would call a &quot;mature reader&quot;.  I've read a lot of books &amp; I know the difference between reading a book to build character and reading it for enjoyment.  Rabbit Run did neither.  I'd heard John Updike interviewed on a public radio program &amp; he sounded like an interesting &amp; intelligent guy, so it was about time I tried him out.  But I was not inspired to find out more about Rabbit in the other books--he is way too ordinary &amp; unappealing &amp; shallow.  And John Updike may get an &quot;A&quot; from his writing teacher, where form is more important than substance, but I challenge anyone to make sense of this quote--granted, it's out of context, but you'd have to have a strange imagination to dream up a context for it.  Here goes:  &quot;And further inside, so ghostly it comes to him last, hangs a jagged cloud, the star of an explosion, whose center is uncertain in refraction but whose arms fly from the core of pallor as straight as long eraser-marks diagonally into all planes of the cube.&quot;  If you like cute punctuation, you'll like the last sentence of the book:  &quot;...quicker and quieter, he runs, Ah: runs.  Runs.&quot;",2001-07-10
US,43613625,R3ME11FBFCFCCK,0449911659,437546793,Rabbit, Run,Books,2,7,18,N,N,"Rabbit Run Amok","Harry Angstrom, a.k.a. Rabbit, is the main character who runs away from his wife and lives with a fat prostitute named Ruth. He has wild mood swings during which he runs back to his wife, then runs to a friend named Eccles, runs back to Ruth, and finally runs away after his daughter's funeral. Harry is someone totally irresponsible of his actions and acts hopelessly immature. If my summary of the book sounds pointless and confusing to you, then you have gotten the idea. Don't read this book if you're not a pious fan of John Updike.",2001-06-11
US,44291515,R3PW0MAGAZH1PH,0449911659,437546793,Rabbit, Run,Books,4,3,4,N,N,"a favorite book","Yes, Rabbit Run is almost unendingly depressing and gives very little hope for humanity.  The main characters range from the disturbed to the despicable; however, all of them are extremely believable.  Updike paints a picture of the protagonist, Rabbit Angstrom - a self-centered infidel, a lousy father, who by all means ought to be completely unsympathetic - and yet I can genuinely empathize with him.  Ultimately, I think that Rabbit is redeemable.  Also, Updike's prose is - as always - spare and beautiful, and though he tends to only write about one topic - WASPs having affairs - he does it well enough to make it almost universal.",2001-04-20
US,44524011,R277N2NASVLW2E,0449911659,437546793,Rabbit, Run,Books,2,4,15,N,N,"Don't Do as I Do","If Updike deliberately intended for this book to portray a person who's life you definitely should NOT imitate, then maybe this book should get 5 stars.  But I wish that he had stated that a little more plainly.  Harry &quot;Rabbit&quot; Angstrom is, as a character in the book says to him, totally self-centered and spoiled.  It made me want to scold this fictional character's parents for doing such a poor job of raising him.  The story is almost unrelentingly depressing.  He thinks only of himself, and doesn't care who he hurts in his pursuit of his latest whim.  It would be nice if he learned something positive by the end of the book, or at least acknowledged some of his shortcomings, but alas, that is not the case.  The only redeeming quality in this book is a positive portrayal of a minister -- a man who is good, doing his best, yet human.  That's a creature most writers today don't even know exists.",2001-04-13
US,52402330,R35GJNPVR070NW,0449911659,437546793,Rabbit, Run,Books,3,10,14,N,N,"I have a problem with Updike","I have to make a confession up front.  I'm not a big fan of John Updike.  I've read the first two Rabbit books, and I'm not impressed.  The writing is excellent.  The prose is fine and moves the story along.  I don't mind an unsympathetic protagonist, i really don't.  There is just something in the character of Harry Angstrom that made me dislike the book...<br />Perhaps there is greatness in this book.  I wouldn't doubt it.  I didn't find it, though.  It has been said that people have two choices.  1. To act.  2. To not act.  Even through inaction, people are making a choice, setting themselves down a specific path from which they refuse to leave.  This is what Rabbit Angstrom does.  His crime is not that he is a bad person, his crime is that his inaction and personal irresponsibility causes more harm than if he intentionally set out to hurt.<br />This novel is an excellent character study.  It examines motives and truths about Harry Angstrom as Rabbit acts, thinks, doesn't think, and doesn't act.  Rabbit, Run works as a character study novel.  It is an extremely well crafted one at that.<br />One more thing: All the technical craft in the world can't make a person like a book.  Rabbit, Run is a book i felt i should read.  So i did.  It is also a book i have no intention of reading again.",2001-02-23
US,50776010,R3AJXVZ06O3SCJ,0449911659,437546793,Rabbit, Run,Books,5,8,13,N,N,"Rabbit runs from responsibilities","John Updike's first in a series of \\""rabbit\\"" novels is about a washed up high school basketball star that struggles to find success during his post-basketball crowning.  Harry \\""Rabbit\\"" Angstrom finds himself running from mostly everything - including his wife, child, job, and himself.  He shacks up with a local whore, Ruth, and relates to Ruth really well in the sexual manner, but seems awkward during everyday situations.  He inevitable becomes attached to both his wife and Ruth and has a hard time deciding which fate suits him better - or another alternative is neither lifestyle.<br />This is the first Updike novel I have read, and I was so impressed by the impact of each sentence and the deep rooted meaning and symbolism in every passage.  I think in a way, Updike has unfairly been labeled a misogynist, even though he has little respect for Rabbit's wife, Janice.<br />I found the book to be extremely sad, but quite touching.  I imagine many men have gone through this agonizing ordeal of not knowing where there life is heading and if it is even heading in the right direction.  Some just run from their problems - like Rabbit.",2001-01-08
US,50121460,R2XAI7WSNMXQXS,0449911659,437546793,Rabbit, Run,Books,4,1,4,N,N,"the story of a coward...","this is not an easy book to like. harry &quot; rabbit &quot; angstrom is a coward who takes the easy way out, abandoning his pregnant wife and kid and moving in with a prostitute. but when you really get into the story and get the details of his life ( his relationships with his in-laws, his parents and his wife )you understand why he hates his life.    his parents wanted him to live a blue collar life. rabbit has higher goals, but he doesn't know what they are. he begins the story working as a magipeeler salesman, then later works for his father-in-law, as a used car salesman, and ends up hating the business and what he represents. the only reason he married janice was because he got her pregnant and he had to. back in those days, when a guy got a girl in trouble, he had to keep her honest, whether he liked it or not; people married and stayed married usually for the sake of their kids.     with ruth, rabbit finds the joy he could never had with janice, because he never felt he had to be obligated to her. ruth likes rabbit because he makes her feel good about herself and he doesn't care that she is plump. their relationship is volatile, yet out of the inferno they find true love.      updike writes in a style that's part poetry/part stream-of-consciousness. it's hard to believe he actually writes like this on purpose, beacuse it seems trippy and spontaneous, yet it works.     the best passages in the book that showcase his fluid style is when he describes rabbit and ruth's first sexual encounter and later, when janice goes on a drunken bender.     it's not the brady bunch, you'll either love it or hate it. i don't think updike really wanted anyone to love rabbit, but wanted to show what happens when people live their lives for others and not for themselves.",2001-01-03
US,52061053,R3GC12HOA67FZZ,0449911659,437546793,Rabbit, Run,Books,5,2,2,N,N,"Rabbit Angstrom and the Fight to Change","What's so thrilling about a washed-up basketball star trying to recapture something of his former glory, in any way he can? Everything, in Updike's hands. Rabbit Angstrom coasts through his post-school life before waking up suddenly one morning and asking what it's all about. He suddenly yearns for salvation, which he confuses with greatness - and grasps for both in one of the most bumbling, destructive yet heartfelt spiritual journeys ever portrayed in American fiction. <br />One of the signatures of this book is something I found compelling in certain filmmaking, such as Lumet's NIGHT FALLS ON MANHATTAN: An ability to take your emotions from 0 to sixty in no time flat. Lumet suceeds by contrasting sudden bursts of violence with minutes of dead calm. Updike takes radical left turns with a long elliptical orbit - it takes you a minute to realize you've suddenly shifted direction. Rabbit's sudden interstate voyage aimed at the Florida keys, or his callous rebuke of his wife at the funeral, take you aback in their brashness, but then, suddenly, they come alive with their own inner logic. When Harry tunes into the news and wonders along with the broadcaster, &quot;Where is the Dalai Lama?&quot;, you learn just how far gone he is from understanding both the world around and the world inside him. <br />Rabbit is a typical American male in many respects: trapped by images of former glory, resentful of his &quot;normal&quot; life, unable to relate to women outside of a sexual context. But what Updike captures best in Rabbit is the universal human trait of equivocation. Bad fiction rests on a single, life-turning momentous event, after which any struggle the hero endures is external. Running back and forth between his wife and Ruth, between family and &quot;freedom&quot;, and finally running away from the whole sordid mess born of his own indecision, Rabbit reminds us just how hard it can be to change one's oldest habits.",2000-12-14
US,51766472,R2VSV68L8AES04,0449911659,437546793,Rabbit, Run,Books,5,0,0,N,N,"Motions of Grace","I'm surprised how many people don't get Harry Angstrom.  He's trying to survive like all of us, and at the same time achieve a few &quot;motions of Grace&quot; here and there.  He steps all over himself and others, but he has heart.  He's not always smart, but he's oddly tolerant, understanding--most of the time.  He's a jerk, too, sometimes, but who isn't?  If you're never a jerk here or there, you're most likely playing things a little too safe.  Maybe you've given up too much individual freedom.  Harry Angstrom, thoughout the four novels, never quite does that, never succumbs fully to social norms, obligations.  &quot;Motions of Grace, hardness of heart; external circumstances&quot;; it's all right there on page one of Rabbit, Run.<br />And, finally, thank you, thank you, J. Updike, for prose that makes you think.  Prose that's anything but conventional.  Prose that takes chances.  Rabbit, Run isn't for everybody.  If you're looking for something &quot;safe,&quot; better look elsewhere.",2000-12-11
