US,49517851,R19O4U1Y1UMSX2,0449911659,437546793,Rabbit, Run,Books,3,8,11,N,N,"Very well written, somewhat flawed","Harry \\""Rabbit\\"" Angstrom is a young married man with one child and another on the way. But he's feeling overwhelmed. His wife spends her days drinking and there is little affection between the two of them. He realizes that in fact, he doesn't love her anymore. He can't stop remembering when he was in high school and was the star of the basketball team. Life was easier then, he was a big shot and everyone loved him. <br /> <br />So Rabbit runs. He takes off to go down south but only gets to West Virginia before turning back for home. He doesn't go back to his wife, though, he goes to his old basketball coach for advice. The coach is a pathetic character who ends up taking Harry on a double date with two some-time prostitutes. Harry ends up moving in with this new girl, Ruth. When his second child is about to be born, Rabbit goes back to his wife only to run again after a tragic accident. <br /> <br />It's easy to understand Rabbit's feelings in this book. Updike does a good job of getting you inside his head and feeling the pressure of being trapped in a marriage that makes you unhappy with an unfulfilling job to top it off. Rabbit is, however, an unsympathetic character. He rarely thinks about anyone but himself and what he wants. In the time he is apart from his wife before he returns to her, he never tells her where he is or if he's ok. He never goes to see his son, even once. The new woman he is living with changes many things about her life for him, but Rabbit remains Rabbit. He gets by in life due to his charm, but that charm rarely comes though the pages of the book.  <br /> <br />I couldn't figure out why Ruth lets him move in because she never says a kind word to him. They never have the kind of conversation that two people in love would have and yet they live and breath as a couple. It just never makes any sense. This is the first Updike book I have read and he certainly has a way with words. Some of his sentences will make you stop and pause, they are so beautiful. There are times, though, that he becomes too enamored of his own ability and strings together alot of lovely words that signify nothing. It then takes him awhile to get back to the story. <br /> <br />Rabbit, Run is very well written and interesting to a point. Your obstacles are dealing with an unsympathetic main character and long stretches where not much happens.",2006-09-06
US,52559350,R32HDJVH29KMRY,0449911659,437546793,Rabbit, Run,Books,5,3,4,N,N,"Surprisingly Insightful","Considering Updike was 28 years old when he wrote this book, it has to be considered one of the most promising books any up and coming author has ever laid at the feet of the literate public. As much as I enjoy Tom Robbins, who graced us with Another Roadside Attraction at roughly the same age, this stands above that as a precursor to what would come later. Rabbit, Run is a great start to what turned out to be an outstanding writing career. <br /> <br />The book deals with middle America, the loneliness and sexual frustration which exists there. This seems a common theme for Updike, as his book Villages, written 45 years before this, addresses many of the same topics, albeit with a somewhat different twist in a similar but not identical setting. One thing we can assume is that Updike subscribes to the adage to write what you know. But then he also penned the Witches Of Eastwick as well as his latest, Terrorist. So take that for what it's worth. <br /> <br />In any event, Rabbit, Run deals with a Twenty something Everyman unhappy in life and unhappy in marriage, living unhappily in a blue collar Pennsylvania town. Once the star of his high school basketball team, Rabbit has not gone on to bigger and brighter things. More accurately, Rabbit is mired in a rut, burdened with the every day slump many in the same situation find themselves in. To escape this rut, he does as the title suggests. He runs. <br /> <br />The running is dealt with brilliantly in the pages. Human tragedy, frailty, emotion - all are covered here. The reader is squeezed through the wringer as we rise and fall with Rabbit's actions, his decisions, and his ultimate cowardess. From his wife, to another, back to his wife, then away, there is nothing for Rabbit to do, nothing he knows how to do, but run to escape his misery. Behind him, nothing remains but a path of destruction. <br /> <br />This book is a brilliant example of required American literature. Given the plight of society, this book - which is now 46 years old - is no less accurate than the day it was written. As we move to the later half of the book, the pages turn faster, even though they're often devoid of dialog and thick with narrative. Updike brings magic to these pages and to the actions of the Everyman Rabbit, who does not fancy himself an Everyman at all, but as unique from everyone he meets. <br /> <br />This is a complete book, in my opinion worthy of every accolade ever heaped upon it. While it is an old book by today's standard, it is every bit worth the read. I greatly look forward to picking up the next in the Rabbit books, Rabbit Redux.",2006-07-10
US,52873025,R1SQL15ZJIGA7X,0394442067,437546793,Rabbit, Run,Books,4,92,101,N,N,"I hated it so much I read the sequels","This is a Great Book - it must be - the NYT and other literary experts say so. Rabbit's life is awful - his wife's a drunk, his job sucks, nothing is really what he thought life would be. He tries to run away and fails at that too. According to Time magazine, Rabbit Angstrom is \\""an unflinchingly authentic specimen of American manhood\\"". Yikes! Let's hope not - but maybe there is more truth in it than one likes to admit.<br /><br />It's hard not to recommend reading this book even though reading it is really not an enjoyable experience. Rabbit evoked powerful emotions in this reader - especially anger and depression; maybe a little anxiety. You are almost guaranteed to feel worse after you read this book - especially if you can identify with any part Angstrom's angst. On the other hand, the mature reader (er, middle-aged) who has experienced the fullness of life's sorrows may sort of shrug at Rabbit as if to say 'what did you expect from life? Pull yourself together, son.'<br /><br />Read at your own risk.",2006-06-06
US,52350617,R2ZT76FRE61BX2,0449911659,437546793,Rabbit, Run,Books,3,6,7,N,N,"Rabbit's charisma doesn't come off the page, which hurts","Rabbit, Run is an undeniably well-written novel about a man who is a semi-sympathetic lout.  I think the main problem is that the author and, obviously, several characters in the book find him irresistable, and that just doesn't come across to the reader.  An unlikable character is obviously a backbone of fiction, but they have to be captivating, and Rabbit Angstrom really isn't. <br /> <br />The story, however, is, and so is the prose.  It's a very well-written book -- the first two sentences, in tandem, sold me.  It's worth a read, absolutely, and I've started the second novel; my understanding is that they get better from here.",2006-05-24
US,23550407,R1K51JHWK60L6S,0449911659,437546793,Rabbit, Run,Books,3,5,33,N,N,"Bullox to the pretention of the blathering Updike","In essence Updike is an arrogant clown. The 'About the Author' on the back flap of the book states his name, where and when he was born, that he attended Harvard and Oxford, wrote for the New Yorker, and that he writes books. In the picture he effeminately holds a cigarette needlessly close to his face so it will be captured, along with his coy clown grin, in the photo. Then, in unparelleled audacity, there is a blurb from a review that is entirely in French (so 1 in 10,000 English readers will understand it) and another from the French review. To quote Harry from 'Dumb and Dumber:' \\""I don't know, Lloyd, the French are @ssholes.\\""<br /><br />Updike is one of the wise fools, too intelligent to be a worthy human being. I imagine he starts his day by elevating his nose with a stick before placing said stick in his @ss and ends his day by thinking up cutting remarks he can use to belittle those people who have souls before talking in his sleep just so he can hear the sound of his own voice all the time.<br /><br />That being said I really wanted to hate this book, and the first third is really quite terrible, but the second half is well done, redeeming the work as a whole. Outside of a few literary gimmicks, needless descriptions and pseudo-symbolism this may actually be a great novel, and I will pick up the second of the series.",2006-05-08
US,50234666,R26HENL1HCY9B1,0449911659,437546793,Rabbit, Run,Books,4,6,6,N,N,"Puts pressure on your chest","\\""You don't think there's any answer to that but there is. I once did something right. I played first-rate basketball. I really did. And after you're first-rate at something, no matter what, it kind of takes the kick out of being second-rate.\\"" This is how Harry Rabbit Angstrom explains why he walks out on his marriage with no warning one day. He was a star in high school, and now he's just a mediocre salesman of MagiPeel kitchen devices. Unable to handle this pressure, he runs. He drives through the night into Virginia, then turns around and returns almost home to a neighboring town where he looks up his old high school basketball coach and eventually moves in with a prostitute. RABBIT, RUN is a gritty, ugly story about an unlikable protagonist who always considers doing the right thing but in the end always acts out of selfishness or fear. Like other characters in the story, we're lured in again and again by Rabbit's charm and promise only to be burned by the reality of his decisions. Updike weaves a dramatic, emotionally involving, and ultimately heartbreaking tale with inventive, often poetic prose.<br /><br />One Amazon reviewer called RABBIT, RUN the American version of Camus' THE STRANGER. While the characters certainly share a certain immorality, or amorality to be more precise, Rabbit is a much more involving book for the reader. And while Camus' protagonist is eventually held responsible for his decisions, Rabbit, as the title says, always manages to run from his. I'll be interested to read the next books in the series and see how Rabbit's decisions affect the rest of his life.",2005-11-29
US,14244739,RBIB4C1688799,0449911659,437546793,Rabbit, Run,Books,3,12,18,N,N,"I bought the Rabbit ""tetralogy,"" and I will finish it (if it's the last thing I do)!","When I was in tenth grade, my English class was assigned John Updike's \\""Rabbit,Run,\\"" which I found to be an unpleasant reading experience, indeed.  I seem to recall thinking how strange it was that, although Updike was widely considered a classic American author, we were reading a book about a completely immoral (or, at the very least, ammoral) main character who leaves his pregnant wife, and lives with a prostitute, with whom he engages in some fairly explicitly described activities.  However, even then, I figured someday I'd read it again when older and wiser.      Not quite 30 years later, while browsing at a bookstore, I came across the 1500 page \\""Rabbit Angstrom, The Four Novels,\\"" which I figured would serve the dual purpose of not needing to buy another book for over a month, while reading quality literature. After completing the first book, \\""Rabbit Run,\\"" it's not that I regret starting this lengthy work, but rather that I give more credence to my earlier self.     Now I know that Updike is considered one of the great American writers of the second half of the twentieth century.  Perhaps that's true, but I don't really see it in this book.  Of course, I do notice the unique use of stream of consciousness, shifting of character perspective, heavy use of metaphor and simile, and interesting descriptive observations; but I've seen it elsewhere, presented in a more compelling style.  Updike reminds me a bit of Kerouak, Fitzgerald, and Tennessee Williams, all considered to be classic American writers, and all whom I think are somewhat overrated.    Let's look at a typical example of Updike's prose in \\""Rabbit, Run\\"" (page 167):      \\""The St. Joseph's parking lot is a striped asphalt square    whose sides are lined with such city trees; and above their tops, in this hard open space, he sees the moon, and for a second stops and communes with its mournful face, stops stark on his small scrabbled shadow on the asphalt to look up toward the heavenly stone that mirrors with metallic brightness the stone that has risen in his hot skin.\\""      Okay, obviously Updike has superior descriptive writing skills, but just maybe he can do a little better with syntax, and break his thoughts down so the reader doesn't have to read the sentence three times in order to figure out what the author is trying to get across.     Then there's the story itself.  I'm not usually the type of reader who needs to like the main character to enjoy the book (I'm a Harry Crews fan, for crying out loud!) but I have to understand his/her motivations and sympathize just slightly.  Rabbit Angstrom exudes a self-centered \\""I don't care about the consequences\\"" attitude that makes him abhorrent, even though certain people seem to like hanging out with him.  Sure, we can understand why a man marrying in his early twenties to a vacuous woman (pregnant with their second child) -- already showing signs of alcoholism and losing her looks -- can feel trapped and decide to escape.  I can even appreciate why he might seek solace with a prostitute.  But what about pretending to fall in love with the prostitute, whose life he also almost ends up destroying?  Or returning to his wife (who has given birth), only to go back to the prostitute at the first sign of trouble?  Not to mention the horrible thing Rabbit says to his wife after the seminal event in the book.  I'm sorry, the only rational way to deal with someone like Rabbit would be to show him complete disdain, or total rejection (think about if someone you knew behaved like this).    Enough of my stream of consciousness!  I've just started book two: \\""Rabbit Redux,\\"" and hoping for improvement.",2005-10-23
US,34357835,R33FKLMGOL7X50,0449911659,437546793,Rabbit, Run,Books,5,0,0,N,N,"A Perfect Set-up for the Rest of the Rabbit Series","\\""Rabbit, Run\\"" is a story about a young man who is trapped within a flawed, though privileged life. He has a wife and child, parents and in-laws, a job and a sports legacy, though none of these elements are truly perfect and fulfilling for him.  But when is life perfect and flawless?  <br /> <br />Rather than accepting life's imperfections and trying to work them out and improve them, he decides to physically and mentally run away from hardships and challenges time and time again, constantly seeking out a more meaningful life he thinks he can find.  In reality, he doesn't have a clue where satisfaction and fulfillment lie and ends up dissappointing everyone who once loved him.  <br /> <br />The book is funny, sad, and amazingly written in Updike's unique prose.   <br />",2005-10-13
US,14914874,RDKTLRN4QHGDC,0449911659,437546793,Rabbit, Run,Books,5,0,1,N,N,"Supremely influential and deeply resonant","Read it ten years ago and still it stirs inside.  <br />If you enjoyed this book, \\""The Devil's Advocate\\"" by Morris West is another notable work with themes of equal depth.",2005-05-16
US,52986477,R1Z92B8MM9J6IC,0449911659,437546793,Rabbit, Run,Books,5,49,57,N,N,"The first - a burst of intensity","I always find it interesting that in a lot of extended series of novels, the first book tends to be compact and to the point, while later novels tend to be more sprawling and expanded. Glancing over my line of Updike's Rabbit novels, of which this is the first, that seems to be the case, but time will tell whether those later books successfully trade the taut intensity of this novel for a more spacious feel.  The Rabbit novels take up four books, all tracing the life of Harry \\""Rabbit\\"" Angstrom, a man growing up in the latter part of the twentieth century, with each book taking place in a different decade, highlighting not only the changes in Harry but the changes in the country itself as it winds through the crazy years of the 1900's.  This book takes place in the early fifties or late sixties and introduces us to the man himself, Rabbit, who does his best to fulfill the verb embedded in the title and run as far as he can.  Harry feels trapped in his marriage, with a three year old already present and his wife heavily pregnant and drinking all the time, he takes a look at his dreary life and wigs out, trying to drive as far away as he can before coming back and attempting to find himself, with increasingly flailing results.  His quests lead him to encounter a priest, a prostitute, an old coach and his parents and in-laws, all of whom have advice and none of which seem to have the right advice.  So Harry tries to forge his own way but that might not be right either.  The book doesn't have so much of a plot as it consists of shifting stream of consciousness impressions, all told with Updike's carefully controlled prose, lunging from beautiful descriptions of the outside world and the people in it to searingly brutal internal monologues that are only matched by the terrible things people say to each other.  There's hardly a likeable character in the entire novel and that's where the real truimph comes in because even when you have all these imperfect people you keep reading anyway, watching them trying to find meaning in their grey lives, with nobody really sure what to do.  And in the center of it all runs Rabbit, serving to cause everything even as he's only reacting against what's happening to him.  People throw the word \\""anti-hero\\"" around when describing him and it's not too far off, he's selfish and hypocritical and impulsive and utterly self centered but yet there's a fascinating sincerity about him, a tragic sense that he's certain he's doing the right thing even as he brings it crumbling down even further.  None of the characters are angelic, all hide their own motives and quirks and it only makes them more sympathetic because they're dealt flawed cards to begin with and sometimes in trying to make the best of it they only muck things up further.  The latter half of the book is remarkably intense considering it's about suburban life and the pivotal moment goes by like a slow motion car wreck, a horror far worse than anything Stephen King ever crafted unfolding before you.  You know what's going to happen about halfway through and you keep reading in the hopes that your intuition isn't true.  Updike's words masterfully give voice to the numbness inside all of them and even if he's wordier than he should be at moments it doesn't matter because the sheer tide of his telling carries us through.  The book depicts people who are alternatively saints and monsters and really none and so fall somewhere in between, just like any of us.  Rabbit runs, but it gets him nowhere and with a character this rich, readers have to know that we'll eventually see what happens beyond the ending.  And yes there are three more books.  But even if you can only read one, this is enough.  That there's three more waiting is just an afterthought, a way to see what happens in the movie after the credits stop rolling and everyone else has gone home.  Regardless of anything else, here's where it starts.ading anyway, watching them trying to find meaning in their grey lives, with nobody really sure what to do.  And in the center of it all runs Rabbit, serving to cause everything even as he's only reacting against what's happening to him.  People throw the word \\""anti-hero\\"" around when describing him and it's not too far off, he's selfish and hypocritical and impulsive and utterly self centered but yet there's a fascinating sincerity about him, a tragic sense that he's certain he's doing the right thing even as he brings it crumbling down even further.  None of the characters are angelic, all hide their own motives and quirks and it only makes them more sympathetic because they're dealt flawed cards to begin with and sometimes in trying to make the best of it they only muck things up further.  The latter half of the book is remarkably intense considering it's about suburban life and the pivotal moment goes by like a slow motion car wreck, a horror far worse than anything Stephen King ever crafted unfolding before you.  You know what's going to happen about halfway through and you keep reading in the hopes that your intuition isn't true.  Updike's words masterfully give voice to the numbness inside all of them and even if he's wordier than he should be at moments it doesn't matter because the sheer tide of his telling carries us through.  The book depicts people who are alternatively saints and monsters and really none and so fall somewhere in between, just like any of us.  Rabbit runs, but it gets him nowhere and with a character this rich, readers have to know that we'll eventually see what happens beyond the ending.  And yes there are three more books.  But even if you can only read one, this is enough.  That there's three more waiting is just an afterthought, a way to see what happens in the movie after the credits stop rolling and everyone else has gone home.  Regardless of anything else, here's where it starts.",2005-04-12
US,48824740,R1NSD9GETDY3TI,0449911659,437546793,Rabbit, Run,Books,5,2,3,N,N,"Read Rabbit","What a stirring, marvelous book!<br /><br />Updike manages his stream-of-consciousness narative with finesse, evoking an almost tangible aura of dissatisfaction and sexual frustration. His depiction of late 1950's suburban life is brutal, and I can only imagine, all too real. The mastery in which he switches from Rabbit's to Rabbit's wife Janice's point-of-view, is breathtaking.<br /><br />I have to admit, about 160 pages in I was annoyed, ready to label Updike a pig, and about to shut the book.  Some unameable instinct kicked in, and I kept going, and thank goodness.  The narration redeemed itself with a shift into deeper complexity, and moral amibiguities.  I recanted my distaste 10 pages later and completed the book in awe of Updike's skill.<br /><br />The novel more than holds its own 40 odd years after its initial publication. Do yourself a favor.  Read it.",2005-03-01
US,38385235,R3UH6EMT251N1X,0449911659,437546793,Rabbit, Run,Books,5,4,4,N,N,"Beginning of a Dynasty","Though the later Rabbit novels would win the awards (Pulitzers and National Book Awards for the last two), the original Rabbit, Run is a towering and memorable book.  The character Rabbit Angstrom was fantastic, and although many people complain about his decision-making and morals, I find Updike's search for complex humanity and drive in such a character to be a great achievement.  Who wants the vanilla do-gooders from factory belt novelists when you can have the perfect imperfection of Harry \\""Rabbit\\"" Angstrom?  Other great acheivments in this book lie in the moments; conversations, sudden reactions, streams of consciousness, epiphanies.  The way he structures a conversation alone is mesmerizing: we read what Rabbit thinks, how he wants to steer the dialogue to his advantage, and then witness the battle of words in between.  The only difference between this Updike and the later Updike is the descriptions; his prose hits on all cylinders, but sometimes it is too verbose, as if he is swelling himself outward to impress to the extreme.  One of the unspoken rules in writing is to not lay all your cards on the table talent-wise, to reign yourself in a bit and make the story matter more.  A little bit of that urge to show it all seeps through the cracks here.  Regardless, the book is fantastic, one of amazing characters and talented prose.",2005-01-24
