US,31920444,R3A225J1FC39I2,0449911659,437546793,Rabbit, Run,Books,5,0,0,N,N,"Fantastic!","This book should be mandatory reading for all men in their 20's",2015-07-22
US,17637506,R42SNEJWE90QR,0449911659,437546793,Rabbit, Run,Books,5,0,0,N,Y,"Good book! Had to write an 8 pg paper ...","Good book! Had to write an 8 pg paper on this and had no issues with content. Starts off long & drawn out but gets more concise at halfway mark. Won't be disappointed by time you're done.",2015-07-18
US,40512300,R2EQLR0R2GRPZ9,0449205061,437546793,Rabbit, Run,Books,5,1,1,N,N,"A Masterpiece of American Masculinity and American Repression","It took me a while to get around to writing a review of this incredible book by John Updike. Processing the intense feelings and experience I had reading this piece was difficult, as I was reading it during the two weeks or so before and after my newest baby boy was brought into this world - and in no way did I expect the book's powerful statements to knock me down and drive over me like the ka-clack of a steam engine towing a hundred cars with wheels that cut and sliced my heart.<br /><br />When I started the book I was completely uninterested. The first twenty-five pages of the action was a street pickup basketball game, but I am the type of guy that always needs to finish a book regardless of how much I hate it. Besides the needless (and frankly out-of-place) Matt Christopher opening, the book continues by delving into a desperate series of life choices that lead events that are so terribly American and so tragically male. While I almost put it down at the beginning for sheer disinterest, I am so glad I stuck with it.  It wasn't until later that the meaning and the need for the opening  became clear.<br /><br />As the young retail salesman Rabbit Angstrom travels through his life, a once popular and record breaking high school basketball star who pushes kitchen trinkets to afternoon housewives, he learns that his life has not had the amazing sparkle and energy that he thought it would. He is a father, and is expecting another child, and recognizes that his job, pay,  marriage, possessions, and family - all of the elements that make up the life of a man - leave him disaffected and dissatisfied.<br /><br />Many would likely hard time feeling bad for some of the frustrations that Angstrom has throughout the book - but there is no mistaking the feelings of boredom and isolation that resonate through Updike's pages about his protagonist as a part of the American male psyche. It gets strange, of course, as Updike (and myself) are both highly educated professionals, and we have Rabbit complaining about his life choices and situation regardless of the fact that he has done nothing more than graduate high school to further his professional and social goals... But the main undercurrent of his frustrations of &#34;is this it?,&#34; running on a hamster wheel of mediocrity, resentment, and the inability to process his sexual, social, emotional, and marital disappointments throughout one's life is almost definitively part of the American male idiom. Angstrom seems to be a secular man whose struggle with the expectations of the others around him, and in reality he is incredibly immature. But Angstrom’s immaturity arises from a grand unfulfillment based on a cistern of popularity and success that was an illusion - rising through the ranks of his high school basketball team to the siren song of the cheers and the notoriety of broken records and fame. In his small circle, Angstrom was a god, so he did not need god to supplicate his hungers and his satisfaction with his life on earth.<br /><br />The importance of his new lifestyle, his wife's life choices, and the overall binary opposite of the involvement of the family's minister and his wife highlights the importance of the themes of Updike's novel. What is good? What is satisfying? What is real and genuine, and what is the artifice of happiness that we worship behind our picket fences? Where are the true emotional, spiritual, and physical fulfillments?  Do we leave them in the halls of our high school, along with the promises of The American Dream, safety, irresponsibility, and luck?<br /><br />Updike answers this with the sugar-rimmed gun, introduced in the first act that must go off by the fifth.<br /><br />As I finished this book, I found that I had set myself up as the emotional avatar of Angstrom as a man whose dreams and needs sometimes peter into daily routines and disappointments (and who has a child and whose own wife was due to have a child any day), the shocking tragic endingturned me inside out. I was a man who picked this book up thinking that he was on keel to ride constant references to basketball, bored to death, and by the end I was destroyed at the cruelty of fate and how we all must pay some sort of price for our lust, vanity, and greed. It seems that do avoid this, one only needs to be satisfied with the miracle of being here, and that the promises of high school and a future of similarly artificial industrialized camaraderie is, for most of us, an illusion.<br /><br />Heartbreaking and true, Rabbit Run is a masterpiece of the bravado and ignorance of the loneliness of American New-Adulthood, and what happens when our social, emotional, and sexual repressions - or at least the unfulfillment of high school’s folklore of these - get the better of us.<br /><br />A beautiful masterpiece of plot, storytelling, and language.turned me inside out. I was a man who picked this book up thinking that he was on keel to ride constant references to basketball, bored to death, and by the end I was destroyed at the cruelty of fate and how we all must pay some sort of price for our lust, vanity, and greed. It seems that do avoid this, one only needs to be satisfied with the miracle of being here, and that the promises of high school and a future of similarly artificial industrialized camaraderie is, for most of us, an illusion.<br /><br />Heartbreaking and true, Rabbit Run is a masterpiece of the bravado and ignorance of the loneliness of American New-Adulthood, and what happens when our social, emotional, and sexual repressions - or at least the unfulfillment of high school’s folklore of these - get the better of us.<br /><br />A beautiful masterpiece of plot, storytelling, and language.",2015-04-10
US,44822011,R2K3D5IY1C2ER8,0449911659,437546793,Rabbit, Run,Books,5,0,0,N,Y,"Great read, already ordered the next book","Very interesting looking back on the sixties. A very interesting ending; a definite should read.",2015-03-26
US,52322417,R356NJ4K9BDHYF,0449911659,437546793,Rabbit, Run,Books,5,0,0,N,N,"This book is wonderful, oddly decadent","This book is wonderful, oddly decadent, and helps us to not feel alone in our darknesses and doubts.Set in the 60s, we follow basketball star Harry &#34;Rabbit&#34; Agnstrom as he ages and copes with his own mortality and sense of use. The first in a series, you can relax into an all-too-human tale that both invigorates and depresses. Best read when going though a life-change, but make sure you can resist the tug.",2015-02-20
US,23077975,R2XT1SJU58W6LY,0449911659,437546793,Rabbit, Run,Books,5,0,0,N,Y,"Five Stars","as promised",2015-02-16
US,52774877,R1QLS8WZMATW5M,B000HVDH7K,437546793,Rabbit, Run,Books,5,0,0,N,Y,"Five Stars","very good",2015-02-06
US,24810751,R2WBGXA3RKU3HO,0449911659,437546793,Rabbit, Run,Books,2,0,1,N,Y,"Poor Quality","book was nasty, didn't even want to touch, yellow pages, nasty cover looks like it is 100+ years old or laid in a wet basement floor and was water damaged disappointed when book was described as good condition not poor.",2015-02-03
US,16891385,R36L66SJ44KP0D,0449911659,437546793,Rabbit, Run,Books,2,0,0,N,N,"What was no longer is","John Updike was one of those writers who was made unfashionable by his prominent place in college anthologies. What was trending then and in short stories with odd pictures has been replaced by a faster society that knows more than children of the 1930s would be able to print. Rabbit, Run is always associated with basketball. What this novel produces about basketball would not fill a girl’s middle school PE class. Harry “Rabbit” Angstrom is tall, at one point in the book is described in his whiteness, and the pickup game in the beginning has none of the characteristics of current basketball and its cool points. The references to his high school prowess don’t develop his character or any reader’s interest in the sport. He could have been a rugby player for all the connections made to the storyline.<br /> After the game, the uninspired plot leads to the first episode of drifting. But it’s just Updike recreating what could have been one afternoon’s road trip across Pennsylvania or Maryland. By page 100, I was highly disappointed and bored, waiting for some element of surprise or intensity, waiting for a scene any writer could not have contrived. The book is published in 1960, so I suppose the appeal was from the “groundbreaking” taboo of a man whose mind is open to adultery and fantasy. The language and the sex will get there, and the intensity of the character’s aimlessness persists so that by page 200, coupled with the interference of a priest who could play opposite Clint Eastwood for all his own challenges, Rabbit is a dynamic character that temps me enough to want to see him succeed. Ruth, the random and ordinary call girl who took him away from “dumb” Janice, is not an opposite but just a respite. This can be tedious too. His job, at which he never works, is tedious. Even the baby talk from Nelson reminds me of writing that I have to humor, like children’s literature. Eccles’ wife is the page-turning character in the book, the real taboo. Eccles himself meddles like the overly-involved mediator from Light in August, so I feel pretty strongly that Updike was reading from Faulkner.<br /> This is a linear, one-dimensional tale that can be summed up in one paragraph. The language is not as superior as Philip Roth made it sound when he said that Updike could write the world’s most expressive sentence. John Updike was simply confident in his idea. I can imagine him pushing through page after page insisting that this is all a modern novel has to be. There is no research involved in morality.",2015-01-15
US,43606364,R1QBARF13B7YGZ,0449911659,437546793,Rabbit, Run,Books,2,1,3,N,N,"Most overrated living American author","Have only read three Updike books-- two Rabbits, one Widow. He specializes in what might be called f--k fiction. Mild for the genre but always going for the sensational, the cheap shot. If his characters are America, America is in bad trouble. Don't see the redeeming value...",2015-01-13
US,51121497,R2LKJC1MUUF3GI,0449911659,437546793,Rabbit, Run,Books,5,0,1,N,N,"read this","great 20th century novel of america",2014-11-03
US,45545202,R2GGVGHGQ04YDM,0449911659,437546793,Rabbit, Run,Books,5,0,0,N,Y,"Prose is superb.","I found the prose to be superb. Very difficult to find someone who can put words together this well. The plot, story, and characters were well developed. I'm a new fan of John Updike. If you like poetry, prose, or anything from &#34;old school&#34; days of writing, you will enjoy this novel.",2014-10-21
US,13837152,R1KXEIAOLQ82NO,0449911659,437546793,Rabbit, Run,Books,3,0,0,N,Y,"Mid 20th Century guys' hangups","Actually quite interesting though these mid 20th Century writers had a real hangup about sexuality which does get tedious for folks from the post-sexual revolution generations.  The Rabbit series is an interesting idea and the book evokes an era and type of place well.",2014-10-17
US,14663211,R2E97EU63DBLD,0449911659,437546793,Rabbit, Run,Books,1,10,14,N,N,"Rabbit, Run into traffic. PLEASE.","This is a man's book, maybe that's why I hated it.  Rabbit is an awful human being.  It's hard to like a book when you wish the protagonist would drop dead.  He's not a trapped, unappreciated man, he's a self-centered jerk who alienates everyone around him, including the sad prostitute he takes up with.  He's awful and he probably continues to be awful throughout the entire series but I wouldn't know because you couldn't pay me to read the rest of it.",2014-10-07
US,11191604,R7Y1S4CI3KBE2,B000HVDH7K,437546793,Rabbit, Run,Books,4,0,0,N,N,"Rabbit Runs On...","Rabbit Redux (1971) is John Updike’s first sequel to his breakthrough Rabbit Run, published a decade earlier. Redux is very much an artifact of its time, the tumoltuous end of the 60s, as well as of a man approaching middle age with little in the way of prospects, either personal or professional.   Whereas Rabbit Run had focused on Harry “Rabbit” Angstrom’s attempt to break out of his life path when still in his mid 20s, Rabbit Redux is about a similar attempt by Rabbit’s wife Janice, who leaves him to live with a smooth talking salesman. Meanwhile, Rabbit, now in his mid-30s and set in his ways, is left to take care of their on-the-brink-of-adolescence son Nelson.  He also gets involved with Jill, a teenage runaway, and Skeeter, a black would-be revolutionary. Frankly, I wasn’t totally sold on either of these characters, especially Skeeter, who talks like how a white egghead thinks a smartass black guy from the streets would talk. Meanwhile, the waif-like Jill is an almost too conveniently carnal corrective for the suddenly spouseless Rabbit.  I did very much like the sense of displacement surrounding Rabbit as the world around him shifts away from the verities he grew up with and still clings to. He comes off as a perhaps almost too decent individual who lets the people around him manipulate him while plugs along trying to do the best he can to do his duty to his family, employer and society. Of course, not all of them return the favor…",2014-09-30
US,42984470,R1YEOJ2AF5AHYI,0449911659,437546793,Rabbit, Run,Books,4,0,0,N,N,"amazing last 100 pages","This book really gets into gear after first 220 pages. The first 220 pages describe how Rabbit (Harry Angstrom) leaves his wife and child to go &#34;on the run.&#34; We get some background on how this happened - once a promising high school basketball player, Harry is now approaching 30 with a wife who drinks, a child and a dead end job as salesman of household appliances. So he leaves and goes on a long bender. This reads a bit monotonously as the story line is a bit lacking in nuance. However, the last 100 pages take the reader on an emotional roller coaster ride with few parallels in literature. We have redemption followed by breakdown followed by unspeakable tragedy followed by attempted cover up and finally its back to the exits for Rabbit.<br />This section adds considerably more nuance to understanding Harry and his sense of despair. After all, who can blame him when he faces a situation in which his wife commits a tragic act and her parents tell Harry they will accept him in the family as long as they can blame it all on him. Updike creates few positive heroes in this novel. The priest maybe, but otherwise the book shows an unpleasant lot of people as it describes the breakdown of family in this early 1960s small town America. A very good read full of brooding and unpleasant characters and a masterful last 100 pages...",2014-09-27
US,28501433,R3L4XRL5FPXTHN,0449911659,437546793,Rabbit, Run,Books,5,0,0,N,Y,"Five Stars","Such prose and unparalled in description.",2014-09-20
US,31447085,R386DKT1MY75KC,0449911659,437546793,Rabbit, Run,Books,4,0,0,N,Y,"Beautifully Written","Beautifully written but not a page turner for me",2014-08-04
US,31074888,R6T1YHA2Q02O6,0449911659,437546793,Rabbit, Run,Books,5,0,0,N,Y,"A good read.","Well written.  A good read.",2014-08-02
US,52825207,R3OPPRMUAOXVZD,0449911659,437546793,Rabbit, Run,Books,4,10,10,N,Y,"Mastery of Language, Though Sometimes Without a Point","John Updike's troubling novel Rabbit, Run is of very uneven quality.  Fortunately, the farther the reader gets into it, the better it is.  Throughout the book, Updike demonstrates that he is a master of descriptive detail, something that his command of language enables him to apply to just about anything that life has to offer in the small, not particularly interesting city, where his story is located.<br /><br />Too often, however, especially in the first half of the book, Updike becomes so intricately involved in finely nuanced descriptions that one loses sight of the context and wholeness of whatever it is that's caught the author's interest.  There is a good deal of sex in Rabbit, Run, but Updike's disposition to capture every shadow, reflection, curve, ringlet, twitch, thrust, vocalization, shift in the position of an elbow ... sometimes disassembles it until it's almost unrecognizable and decidedly lacking in eroticism.  No, Updike has no obligation to write in a way that his readers find titillating, but there should be a reason for his determination to capture every discrete part of every performance, and sometimes there is none.  His lengthy visual deliberation on the scene when Rabbit Angstrom, his protagonist, first makes love to Ruth is so thoroughly dissected that the whole is almost unrecognizable.  Yes, it's really clever of him to be able to accomplish this transformation, but what's the point.<br /><br />On the other hand, when Updike brings his remarkable linguistic and descriptive skills to bear with purpose, as on pages 245 to 250, we see vividly, in just a few paragraphs, the oneness of Rabbit's wife with his suckling baby daughter, the uncharacteristically joyous religious fervor prompted by Rabbit's momentary gratitude for his familial good fortune, and the excitement roused by brief glimpses of the partial profile of the Episcopal minister's wife as shielded-and-revealed by the brim of her straw hat.  Updike uses words masterfully, sometimes to good purpose and sometimes as if he were engaged in an exercise, complex combinations as ends in themselves, a virtuoso who wants to make sure that the reader knows he's a virtuoso.<br /><br />But perhaps I'm misinterpreting Updike.  Rabbit Angstrom is engaged in a never-ending search for meaning, purpose, a foundation that won't wobble, tumbling him into a void of meaninglessness where nothing really counts and any sense of permanence is chimerical.  Maybe this explains why Updike sometime overdoes his descriptive detail, deconstructing commonplace activities:  both he and Rabbit want to see if there is anything durably consequential to be found.  In short, this is the author's search and his protagonist is his instrument.  One can think and explore with fictional characters, even with their own needs and limitations, and that may be what Updike is doing.  The world he is creating, after all, is one in which even some clergymen are not convinced that there is a God or a hereafter, with some actively rejecting both.  Others, however, remain rigidly, even angrily steadfast in what we are told is their faith.  Whatever the makeup of the clergymen, however, their congregations are dutifully respectable and publicly obedient.  Deconstruction does seem to be in order.<br /><br />Updike enables us to see and feel the uncertainty, uneasiness, and discomfort of his characters, as well as their inability to reliably understand those around them,  He does not, however give us much of anything or anyone to like.  Ruth the prostitute is honest, forgiving, though not to the point of self-destruction, and she doesn't go  out of her way to hurt anyone, nor does she hold grudges over trivial matters.  She is the closest thing to a whole, rational, and compassionate person that we find in Rabbit, Run.<br /><br />Ruth's willingness to risk pregnancy and degradation while unmarried and without prospects are things she does for Rabbit, though only in response to his quirks and sillyselfishness.  Evidently, for a time, she really is afraid of losing him, though she's smart and experienced enough to see him for the lost, self-serving soul that he is.  Still, in spite of this lapse in self regard, she remains the only character worth caring about in this small-city menagerie taken from the 1950's.<br /><br />The last thirty or so pages of Rabbit, Run are a linguistic tour de force.  Again, however, they lead to nothing but a road that Rabbit has traveled before.  Rabbit is free, and for the moment his lack of fetters gives him joy.  He has achieved an existential coward's victory, and it suits him quite well.  The reader can only ruminate over the damage he will do and the prices he will refuse to pay in the future.  As for his sense of emptiness, perhaps he will accept it and turn it to his advantage, construing the cruelty and the harm he inflicts on others as just transient epiphenomena in a world devoid of meaning and purpose, a place where nothing really counts.<br /><br />This is not the sort of book I would seek out.  Updike sometimes writes like an established and deserving master, but other times like a marvelously precocious amateur, someone too short on life experience to give his characters substance, someone whose talent lets him stumble unharmed from one literary misadventure to another.  He's a lot like his creation, Rabbit Angstrom, except that Angstrom plays with people's lives.  Perhaps that's Rabbit's answer to the Babbitry of life in America of the 1950's and to eternal existential emptyness:  manifest one's concrete reality as an individual by manipulating others into outcomes they would never choose.selfishness.  Evidently, for a time, she really is afraid of losing him, though she's smart and experienced enough to see him for the lost, self-serving soul that he is.  Still, in spite of this lapse in self regard, she remains the only character worth caring about in this small-city menagerie taken from the 1950's.<br /><br />The last thirty or so pages of Rabbit, Run are a linguistic tour de force.  Again, however, they lead to nothing but a road that Rabbit has traveled before.  Rabbit is free, and for the moment his lack of fetters gives him joy.  He has achieved an existential coward's victory, and it suits him quite well.  The reader can only ruminate over the damage he will do and the prices he will refuse to pay in the future.  As for his sense of emptiness, perhaps he will accept it and turn it to his advantage, construing the cruelty and the harm he inflicts on others as just transient epiphenomena in a world devoid of meaning and purpose, a place where nothing really counts.<br /><br />This is not the sort of book I would seek out.  Updike sometimes writes like an established and deserving master, but other times like a marvelously precocious amateur, someone too short on life experience to give his characters substance, someone whose talent lets him stumble unharmed from one literary misadventure to another.  He's a lot like his creation, Rabbit Angstrom, except that Angstrom plays with people's lives.  Perhaps that's Rabbit's answer to the Babbitry of life in America of the 1950's and to eternal existential emptyness:  manifest one's concrete reality as an individual by manipulating others into outcomes they would never choose.",2014-05-06
US,43896985,R352CQ8YQH9ZS5,0449911659,437546793,Rabbit, Run,Books,5,0,0,N,N,"A Book To Treasure","Updike does a wonderful job of showing small-town America in 1959. Rabbit is a flawed hero that you will never forget. In detailed,<br /><br />rich prose, Updike brings him into our lives.<br /><br />  The dialogue sparkles and leaps. It conveys who everyone is. This is masterful writing by the master.<br /><br />  ----Frank Hickey, writer of the Max Royster crime novels in Pigtown Books",2014-01-28
US,13064347,R1AGM2R8508V8Z,0449911659,437546793,Rabbit, Run,Books,3,1,2,N,N,"Has its moments","The main character Rabbit is basically a selfish immature loser who doesn't take responsibility for his actions & the consequences these actions have on those around him. However I feel this is all too common & still rings true today 50 years after this book was written. The first half of the book is slow & overly descriptive but it gets better & certainly has some good moments although I believe it falls short of being regarded as a &#34;classic&#34;.<br />Moderately enjoyable.",2014-01-06
