marketplace,customer_id,review_id,product_id,product_parent,product_title,product_category,star_rating,helpful_votes,total_votes,vine,verified_purchase,review_headline,review_body,review_date
US,52840999,R1AX3F3PBW4DMM,0553380958,445913,"Snow Crash",Books,5,10,13,N,N,"Language is a Virus","Let's engage in a binary riddle, shall we?<br /><br />The kind of binary riddle that Snow Crash author and cybergeek Neal Stephenson loves so dearly, the kind of binary sorcery that undergirds the glittering silicon-spawned mile-high superstructure of the Metaverse's sprawling Neverland City.<br /><br />Boil all those 0's and 1's down and this is the riddle: DO---and DON'T---Believe the Hype.<br /><br />Do believe the Hype: \\""Snow Crash\\"" is immediately consumptively engaging and deliciously readable, roaring along at light speed with style, flair, intrigue, and brutal aplomb.<br /><br />Don't believe the Hype: for all its techno flourishes and Mata Hari duplicity, \\""Snow Crash\\"" is a simple tale.<br /><br />For all its sound and fury and caterwauls of vicious intrigue, Neal Stephenson's electric cyber-punk 1992 debut \\""Snow Crash\\"" is a simple tale, the simplest, really: it is the story of a poor young knight (with Katana and Wakizashi at his belt, no less) out on an adventure, aided and abetted by at least two damsels, to prevent a Mad Evil Genius from destroying the world.<br /><br />It doesn't get much simpler than that.<br /><br />But wait a minute, now: the glory of the Hunt is the Chase, not the Kill. The dark delights of the gifted Stephenson's ripping good yarn is not the trip from Point A to Point B---which happens, for all of the detours---but the getting there.<br /><br />The poor young Knight: Hiro Protagonist, Knight Errant and warrior Prince of our near future cybernetic Underworld, freelance hacker and information runner, stringer for the Central Intelligence Corporation (formerly Agency, but in this day and age, baby, you gotta incorporate).<br /><br />Oh yeah, and Pizza Delivery Boy.<br /><br />Or rather, Deliverator, as Hiro styles himself---for Cosa Nostra Pizza, which serves up---along with its piping hot, delicious pizza pies---an offer the customer can't refuse: pizza in 30 minutes or it's on us. And you get a free trip to Sicily, and Uncle Enzo landing on your front lawn in his JetRanger 300 series, paying homage to you for the inconvenience.<br /><br />See, Cosa Nostra Pizza turns the Offer You Can't Refuse around on the Deliverator: 30 minutes or less, or the Deliverator is out of a job. And out of a life.<br /><br />By Page 5, our boy Hiro finds himself in the former situation, if not the latter. Out of a career, and back into the guts of hacking. He wields twin katanas, which speak louder than the micro-gun issued by Cosa Nostra to back up pizza delivery fees. He shares a storage locker out by LAX he calls home with underground rocker sensation Vitaly Chernobyl.<br /><br />Oh, and being one of the founding programmer fathers of the Black Sun, along with buddy Da5id, Hiro is a mover and shaker when he patches into the Metaverse, Stephenson's stand-in and prophetic forerunner of the World Wide Web---which he conjured up when the WWW was a faint glimmer cresting the binary monochrome of the old Dos/UNIX command line.<br /><br />In Real Life, Hiro is a nobody. In the Techno underworld of the Metaverse, he's Nobility.And someone is trying to kill the Metaverse and its hacker and programmer princelings, spreading a designer software virus called Snow Crash that crashes your system and fries your brain, reducing you to gibbering, drooling insanity.<br /><br />Talk about a computer bug.<br /><br />Who---or what---is behind Snow Crash? What is the connection between it and telecommunications mogul L. Bob Rife, who bought up the USS Enterprise to use as his own personal yacht, and has since made a few---erm---modifications? Who is this bad dude Raven, him of the Aleut looks, razor sharp javelins, \\""Low Impulse Control\\"" tattoo on the forehead, and a black hog with a thermonuclear warhead joyriding in the sidecar? Why is Uncle Enzo and the Mafia so interested in Snow Crash? Who is this Kourier chick Y.T., and why is Uncle Enzo so interested in her? And will Hiro ever get enough real world dough for a decent pad?<br /><br />\\""Snow Crash\\"" is absorbing, hyper-kinetic, eminently readable, and constantly intriguing: I polished it off in about 3 years one rainy Sunday afternoon. It's like that. For all the Tower of Babel imagery and Sumerian mythology Stephenson weaves in, this is not a meticulous and measured work of literary craftsmanship like Dumas's \\""Count of Montecristo\\"", in which, if you removed a single word or altered a phrase, the entire structure would tilt, topple, and crash.<br /><br />Indeed, Stephenson seems to almost unwittingly channel William S. Burroughs's \\""Cut-up\\"" style: any passage, any chapter, could be cut and pasted before or after any other and it wouldn't make a great deal of difference to \\""Snow Crash\\"".<br /><br />But this is a giddy good read, constantly engaging and neat to poke around with like a new techno toy. Stephenson reads like William Gibson with a sense of humor.<br /><br />Plug in.<br /><br />JSGabout 3 years one rainy Sunday afternoon. It's like that. For all the Tower of Babel imagery and Sumerian mythology Stephenson weaves in, this is not a meticulous and measured work of literary craftsmanship like Dumas's \\""Count of Montecristo\\"", in which, if you removed a single word or altered a phrase, the entire structure would tilt, topple, and crash.     Indeed, Stephenson seems to almost unwittingly channel William S. Burroughs's \\""Cut-up\\"" style: any passage, any chapter, could be cut and pasted before or after any other and it wouldn't make a great deal of difference to \\""Snow Crash\\"".     But this is a giddy good read, constantly engaging and neat to poke around with like a new techno toy. Stephenson reads like William Gibson with a sense of humor.     Plug in.    JSG",2005-04-25
US,50666511,R16TFCXSMH2GHK,0553380958,445913,"Snow Crash",Books,5,0,4,N,N,"WOW, THIS BOOK IS AMAZING","I was recommended to read this book by a fan of Neal Stephenson.  I didn't know what to expect.  This book is probably the most exciting thing I have ever read.  It is a thrill-fest from the beginning to the end.  This book has MOVIE printed all over it (To bad Stephenson has said openly that he will never make it into a movie).  Anyway, It was exciting, fresh, intelligent, can't say enough about it.  It you like science fiction, you have to get this book.  It ranks of there with the best (Dune, Ender's Game, and now SNOW CRASH).  Read this book, you will not be disappointed (I recommend this book to everyone, and they always jump on the bandwagon).",2005-04-23
US,41132002,RJ3TYG5EOQREH,0553380958,445913,"Snow Crash",Books,4,4,6,N,N,"A refreshing change from the crap I've been reading lately","I've seen Stephenson's Crytonomicon around, and thought it looked interesting, but didn't want to start anything that big without knowing if the guy could even write or not.  My brother had this, so I borrowed it, and was surprised by how much I liked it. <br /> <br />I always like it when a writer can craft a believable world with new cultures and technology that are interesting, and Stephenson does this very well in Snow Crash.  The only proble I had with the setting is that it seems to close to the present for everything to have changed as much as it had in the story, even considering it was written in the early 90s. <br /> <br />The characters were really well developed with a lot of interesting relationships tying them all together.  And the story itself was interesting with several different aspects that were woven together pretty well.  The one thing about the story that bothered me was that I didn't think that simply being able to understand binary would enable anyone to gain any meaning from a picture representing something in binary as the story suggests.  Actually, I'm not sure how many programmers today ever work with anything in binary, anyway, much less in the future.  But that was not a difficult thing to dismiss and just accept in the context of the story. <br /> <br />I'll probably give Cryptonomicon a shot now, and I would recommend this book to anyone who likes a little comedic, sci-fi, cyberpunk.",2005-04-07
US,21726329,R1EXDK3UIR1YMC,0553380958,445913,"Snow Crash",Books,1,6,38,N,N,"BORING self-indulgent drivel","Whatever fun and interesting sci-fi creations are present are rendered utterly worthless by the underlying religious mumbo-jumbo PLOT devices. I loved the first hour, but the PLOT--that is the middle four-fifths of the story and the driving power of the story-- was BORING self-indulgent drivel created out of whole cloth in a free-association style that killed my enjoyment of some of the clever sci-fi devices.",2005-03-29
US,41801602,R3MOWJDZFBWMSB,0553380958,445913,"Snow Crash",Books,4,1,2,N,N,"Entertaining, thoughtful","Snow Crash was reccommended to me by a friend who is very much into cyberpunk, and he loved this book.  I like most science fiction, including the cyberpunk genre, and I was not disappointed by this novel.  The characters are all well-defined and unique, and all are likable, even the \\""bad guys\\"".  I was surprised at how much of the book deals with ancient history subject matter, but it does directly pertain to the plot line and the mystery that Hiro Protagonist - the hero/protagonist of the novel, a hilarious name choice - is trying to get to the bottom of.  The character Y. T. (Yours Truly) is a rebellious teen-aged girl who steals the show, in my opinion, and ties all the characters together by her fateful encounters with them. <br /> <br />Stephenson's writing is easy to follow and provides a great amount of visual discription, which makes imagining his world very easy.  There are a lot of neat not-too-distant-future toys that make an appearance in the novel, creating a technology texture for the reader.  The story line is interesting but not so fast that it's unfulfilling. <br /> <br />In a nutshell: Interesting subject matter, fun to read, not as cryptic as some sci-fi can be.",2005-03-27
US,52953416,RWU6BB9E46FFG,0553380958,445913,"Snow Crash",Books,3,4,7,N,N,"Great Vision, OK Story","The opening of Snow Crash has to be one of the best 50 pages in Science Fiction!  It is a high energy romp through an anarchistic future run by the Mafia and a varity of entrepreneurial sovereign nations of which the US goverment (what's left of it) is just one.<br /><br />Stephenson predicted cyberspace before we had a word for it and creates an interesting and compelling story.<br /><br />The story does slow down after a while and the book does not maintain the wild pace of the beginning.  Also there is a section of lectures in the middle given by the \\""librarian\\"" that we could have avoided.<br /><br />Other than that, its all interesting and its all fun!",2005-03-15
US,48338422,R1FHZYPS627WK,0553380958,445913,"Snow Crash",Books,5,3,6,N,N,"First book I've finished in 4 years...","I do a fair amount of reading, usually 2 or 3 books at a time. I have a problem though in that I _RARELY_ finish books that I start becuase I find most modern fiction thin and the characters too underdeveloped. Snow Crash was just great, however, and the comic-book style Hiro Protagonist was surprisingly well developed. Hiro carried the storyline, but all the supporting characters were so vividly \\""drawn together\\"" that the whole story was just a hilarious ride.",2005-02-14
US,49602727,R1B09784J3OLDQ,0553380958,445913,"Snow Crash",Books,3,3,7,N,Y,"Good But Not Great","This is not a funny book despite what some reviewers claim. It is amusing in places but I didn't find it actually funny. It is a good story, but not a great one. It _is_ let down by all the Sumerian myth stuff - pages and pages of boring infodumps on the subject. I don't care if they're accurate retellings or not, they slow down an otherwise well-paced story. They don't fit in very well with the rest of the plot and the rather tortured attempts the author makes to base the Snow Crash mind-and-computer virus on the ancient Sumerians and subsequent \\""mind hackers\\"" is like President Bush's \\""ill fitting suit\\"" in the debates - ugly and weak. <br /> <br />The two main characters, Hiro Protagonist and Y.T. are well done and engaging and Stephenson's description of the metaverse is very good also. Raven is initially a suitably evil villan but then later when Hiro starts communicating with him and suddenly pulls out the connection between their fathers (apparently from thin air) it all gets a bit ridiculous. And what did happen to Raven's H-bomb? We never find out, which I found rather slapdash. Maybe he just left it ashore for his mother to look after while messing about on the Raft? <br /> <br />However, despite the criticisms above there is still a lot of good writing in this novel and the story is engaging overall if a little longer than it should be (God knows Stephenson seems to have gotten worse in that department since!) It was the first Stephenson novel I'd read and I liked it enough that I'll probably read The Diamond Age, and depending on how that goes perhaps Cryptonomicon as well. I don't think I could face the absurdly overweight Baroque Cycle books though - I like SF not historical novels and I really don't expect to live long enough to finish them...",2005-02-09
US,51828153,R2WRIO3MJTQZMR,0553380958,445913,"Snow Crash",Books,5,1,2,N,Y,"Fast Very Very Fast!","<br />This book is the best of the Stephenson novels.  But be prepared, it introduces concepts characters and events at an incredible rate.  This book is not for the faint of heart but what a ride it is.  Pick it up and Hang on because if you can keep up you are in for the ride of your life. <br />",2005-01-26
US,30095884,R2L09NZCPOX37,0553380958,445913,"Snow Crash",Books,4,1,5,N,N,"The first is the best","This is Stephenson's first work, and it shows in all the right ways.  There's a sense of exhilaration and freshness that doesn't come through in his other books.  Moreover, he obviously had been thinking about some of his most memorable lines and thoughts for years and they all come out here.  From a fragmente on comparative advantage on pages 5 and 6 so good that it's quoted approvingly in \\""The Economist\\"" to a description of federal workers required to read a three-page memorandum on toilet paper, this book covers the gamut of the zany, the bizarre and the hilarious.<br /><br />And when he gets down to the plot, he has a pretty solid foundation.  So much writing in SF's \\""cyberpunk\\"" phase was just existential angst and leftover hippie-ism.  Writers dispensed with plots and concentrated on attitude, which will only get a reader so far.  Snow Crash, on the other hand, had an important point to make about the origins, costs and benefits of human interconnectivity, and was able to present the point intelligently and interestingly, even making the pedantic parts (i.e., the Librarian) fun to read.  I don't exactly agree with Stephenson's characterization of the origins of Judaic thought, which seems to be based on an ad hoc ergo propter hoc fallacy, but at least he's talking about interesting and thought-provoking things.  I never learned more from any other source about Sumerian history.<br /><br />My only reservation about the book is its glaring inaccuracy about \\""speaking in tongues\\"" both in the biblical context and as a linguistic phenomenon.  First, a careful review of the biblical verses relating to the Day of Pentecost reveals that the languages spoken were known languages understandable to those gathered: \\""And how hear we every man in our own tongue, wherein we were born?\\""  Acts 2:8.  On the linguistic side, glossalia has been examined and it has been determined to be an artifact of a mind already developed by language.  Examination of the choice of syllables and formation sounds and words of \\""speaking in tongues\\"" used by the Pentecostals will reveal the native tongue of the speaker and even which part of the country he or she is from.  See \\""Word Play\\"" by Peter Farb.  These facts vitiate Stephenson's principal argument.and formation sounds and words of \\""speaking in tongues\\"" used by the Pentecostals will reveal the native tongue of the speaker and even which part of the country he or she is from.  See \\""Word Play\\"" by Peter Farb.  These facts vitiate Stephenson's principal argument. <br />",2004-12-20
US,29112599,RM5IKH94NHRLW,0553380958,445913,"Snow Crash",Books,4,0,4,N,N,"Snow Crash","An interesting and possible future.  The characters were interesting and I would like to meet many of them.  It has been a long time since I read this book so my memories are not that clear.  I remembered the author and try, when there are available, used paperbacks available, to read everything by Stephenson.  Loved Cryptomonicon and look forward to reading the Baroque Trilogy.",2004-12-18
US,15162468,R141O40XD323LQ,0553380958,445913,"Snow Crash",Books,4,3,5,N,N,"Freelance Pizza Delivering Samurai For Hire","From one of the most bizarre concepts devised by humanity the pulse pounding opening to Snow Crash emerges. Meet Hiro Protagonist, the hero/protagonist. He has been trusted with a package of infinite importance. If it is not delivered within an ever shrinking frame of time Hiro's job, if not his life, will be at an end. <br /> <br />Is it a bomb? A peace treaty with a warring nation? What about some sort of magical ring? All good choices, but by an amazing turn of events, our mystery object is... <br /> <br />A pizza! <br /> <br />But not just a pizza, it's a cooling pizza (A dangerous thing indeed in the future). 30 minutes, that's their promise. You don't reach your destination in 30 minutes it's over for you. Why can they do that? It's because they're the mob of course! <br /> <br />From what you've gathered so far I'm sure you're scratching your head in confusion. Let me assure you that after the opener, pizza plays a very small part in this book (the mob however will play a bigger role). The story of Hiro is more of one of a slightly depressing life. He lives in a storage crate, and he's only paying for half of it. Having a job that puts his life at risk at a near constant rate doesn't help much either. <br /> <br />To escape his suicidal living conditions, Hiro spends a lot of his time in the Metaverse. This is a sort of virtual reality / internet game (this is the future after all). On said alternate universe Hiro is a rather skilled new age samurai. Sword fights and programming jargon are his tools, and he's never lost at the former (he shouldn't, he wrote the software). <br /> <br />Anyways the actual plot of the book depends on a certain aspect of the Metaverse, called a snow crash. Think of it as like a blue screen on a Windows OS, it's usually game over. Anyways a special kind of crash is going around, one that alarmingly hits the users in the real world as well. Coma and useless babbling are the only symptoms, and when it hits a close personal friend ofHiro it's vengeance time for the Samurai. <br /> <br />The rest of the book goes deeper into programming style plot, and takes a surprising turn into ancient culture and religion. I won't ruin it for you but lets just say the ending leaves you wanting more (not necessarily in a good way). <br /> <br />You will enjoy \\""Snow Crash\\"" if: <br />- You enjoy a Science Fiction now and then <br />- You don't mind the occasion long winded explanation <br /> <br />You may want to pass on \\""Snow Crash\\"" if: <br />- Computers never interested you <br />- You don't have the maturity to take a bit of swearing and adult situations.",2004-12-16
US,50825604,R3069V8ARD06P9,0553380958,445913,"Snow Crash",Books,5,3,4,N,N,"What so many people seem to think The Da Vinci Code is","So I went from reading _The Da Vinci Code_ on the (regrettable) advice of a friend to reading _Snow Crash_ based on a throwaway line in a newspaper editorial. Despite all the obvious differences in the books, I was struck by one huge underlying similarity: the use of ancient legend to try to make sense of the modern world generally, and religion specifically. The difference is that where TDVC comes off as a screed against religion duct-taped on top of a bunch of chase scenes, _Snow Crash_ actually works as a novel all by itself, with a semi-coherent philosophy giving it enough impact to be memorable. <br /> <br />Of course, it's not a perfect book. I almost gave it 4 stars rather than 5, since there are a few plot holes here and there and a bit too much exposition, but when looking at the book as a whole, those are actually minor issues. Despite its futuristic feel, Stephenson understands the great rule of old-school performers--throw enough good stuff at the audience quickly enough, and it won't matter if some of it doesn't work perfectly. <br /> <br />And, finally, a hint for reading the book, since there's so much detail in it: Don't get hung up on all the Sumerian stuff--you can always page back to it if you need details.",2004-12-14
US,30827718,R1YFH85K55QIF6,0553380958,445913,"Snow Crash",Books,5,0,5,N,N,"Not just another chase scene","I read this book a number of years ago, and I've been a Stephenson fan ever since. It's got the best opening chapter in the history of the English language novel, and the rest of the book isn't bad either.",2004-12-02
US,28004833,RIJEXI2QGM95J,0553380958,445913,"Snow Crash",Books,5,0,2,N,N,"My first Neal Stephenson read.","At the outset we meet our protagonist, Hiro Protagonist (yes, it is a stupid name). It is difficult to tell exactly what is taking place. The narrator speaks in third person who is quite annoying at first but you get used to it; does not last through the whole book. Soon it becomes clear that Hiro is a pizza delivery boy who also thinks he is a samurai. <br /> <br />Please don't stop reading after the first fifty or sixty pages as I almost did. I promise that it starts to make sense. The whole book is not about the process of future pizza delivery. If you stop you will miss out on some of the best speculative fiction ever. Hiro must figure out who is unleashing a virus that can destroy minds through the Metaverse (the future internet). Rarely had a book raised my adrenalin levels as much as this did. <br /> <br />I must admire an author who can take such a silly seeming idea and infuse it with so mush life and thankfully Stephenson is writing faster than most people can read. From the reviews it seems that this is something to be thankful for.  <br /> <br />Highly recommended to any Sci-fi fan not only hackers and programmers (I can barely check my email). <br />",2004-11-20
US,50856279,RAH8GLTDAQCHV,0553380958,445913,"Snow Crash",Books,5,2,4,N,N,"Great introduction to Neal Stephenson","This was the first book I read by Neal Stephenson.  Fantastic ideas!  You'll say to yourself, \\""Why didn't I think of that?\\""  Beginning to show its age, as it was written in the age of fledgling networks, but before the age of the Internet.  If you don't keep that in mind, you'll wonder why no one is using a web browser in this book.  :-)  If you do like this book, I'd recommend all the other books by him, up through the first volume of the Baroque cycle.  Then his style becomes quite heavy and ponderous, like reading the dictionary.",2004-10-24
