marketplace,customer_id,review_id,product_id,product_parent,product_title,product_category,star_rating,helpful_votes,total_votes,vine,verified_purchase,review_headline,review_body,review_date
US,51586896,R3PSAHDDWW82F,0553380958,445913,"Snow Crash",Books,4,2,3,N,Y,"Great Book!","Awesome book! It came recommended by a friend. I don't usually like sci-fi, but this was stellar. The pace was good, I was invested in the characters, and the ending was conclusive and well done (a difficult feat). I am looking to read more by Neal Stephenson.",2015-08-23
US,20525674,R3F6YCYKKMB4GS,0553380958,445913,"Snow Crash",Books,3,1,2,N,Y,"Great technological futurism for when it was written.","At the time this book was written and published the technology it prefaced was avantgarde. To read this book over twenty years after it was published is fascinating. His ability to create and describe what would be the internet, viruses and hacker issues, virtual reality, and an a sundry of other technologies is quite amazing. The take on the future of religion, nations, politics, and the public franchising of common and governmental functions is quite interesting and remains to be seen as put into practice. Impressively presented. Than being said, the characters and the story wasn't as fulfilling as the science part of the fiction. Although I am being adamantly encouraged to read a few more of his books I think I will put my reading time to other pursuits. Not to say I won't read anymore from this author, just not a Stephensonian fanatic as some other people I know.",2015-08-22
US,10765724,RS2IK9NOGESQ9,0553380958,445913,"Snow Crash",Books,4,1,3,N,Y,"Four Stars","Unusual, one of a kind, cyber punk science fiction, very imaginative.",2015-08-20
US,14505506,RGLW4NJXINKJO,0553562614,445913,"Snow Crash",Books,5,2,3,N,Y,"Mainstream, easy to read Sci-Fi","I don't want to put in any spoilers, but this is a great book.<br /><br />Pros:<br />1) It isn't just science fiction. Stephenson weaves in myth, politics, and many themes that are becoming relevant to today's society.<br />2) Stylistically, the book is really easy to read. While some of the content may not be appropriate, a fifth or sixth grader could understand the prose.<br />3) It is really fun to see many of Stephenson's ideas about the internet and technology come true in today's world.<br /><br />Cons:<br />1) The female characters are a bit underdeveloped and one dimensional<br />2) Parts can become long and droning or overly pedantic<br /><br />Overall, it is a great book that I recommend to friends. Like Neuromancer, it is a sci-fi book that non sci-fi fans can appreciate.",2015-08-14
US,12058331,R3AFJTURJ9YIHI,0553562614,445913,"Snow Crash",Books,5,1,2,N,Y,"Five Stars","fantastic. you like good sci fi? then you buy this book.",2015-08-11
US,50793391,R1AWDMAF2GZ3LS,0553380958,445913,"Snow Crash",Books,5,1,2,N,Y,"Five Stars","One of the best novels by Neal. Nuff' said.",2015-08-11
US,11757881,R8GR1UK5GMLCD,0553380958,445913,"Snow Crash",Books,4,1,2,N,N,"Somehow I had missed reading this novel when it first ...","Somehow I had missed reading this novel when it first came out in 1992.  It is always interesting to read an old Cyberpunk novel and see what the author got right and what he got wrong.  In Stephenson’s concept of the near future, privatization has run amuck and governments are weak.  Stephenson’s version of the Internet/World Wide Web is called the Metaverse, which has an uncanny resemblance to a web site called “Second Life”.<br /> Some critics believe Snow Crash to be a satire of William Gibson’s Neuromancer, and I think it is a legitimate interpretation.  In the opening chapter, one of the main characters, actually called Hiro Protagonist, is delivering pizzas and calling himself the Deliverator.  There is also a Jerry Falwell-type character who finances his church by controlling all the fiber optic cable in the world.<br /> On the other hand, Stephenson interrupts the narrative to deliver information critical to understanding the story.  He did not have the writing skill to seamlessly insert important information in the text.  Furthermore, many of the characters are stereotypes, such as Uncle Enzo, a mafia boss, and other characters, such as Raven, an Aleutian, are motivated by ideologies, not feelings.",2015-07-27
US,7554520,R2JD89ZRA4EBG3,0553380958,445913,"Snow Crash",Books,5,1,2,N,Y,"Five Stars","Great mix of futuristic, historical, and mythological with a fun sense of humor. Classic Stephenson ;)",2015-07-25
US,39057511,R28CX1947FEMQX,0553380958,445913,"Snow Crash",Books,4,1,3,N,Y,"Four Stars","Pretty good",2015-07-23
US,51992077,R3KY6ZR3WCFL99,0553380958,445913,"Snow Crash",Books,3,2,3,N,N,"Not as great as all the hype, but not bad either","Unemployed programmer Hiro Protagonist works as a pizza delivery guy in a not too distant future, but it is far enough that the world is a very different place. Big businesses have gotten really big, owning neighborhoods where people are quasi-citizens of the company. They run legitimate businesses like Uncle Enzo's CosaNostra Pizza, Inc., where Hiro works. They also have political connections and, often, organized crime connections as well. The other future development is how the internet has taken off and become a quasi-reality where people have alternate versions of themselves (called avatars) and interact with others who are physically far away. Hiro spends a lot of time in this &#34;metaverse&#34; and has customized several things about his avatar and his &#34;property&#34; in cyberspace. He is a hacker after all. The story hops back and forth between the real world and the computer world.<br /><br />Things start to change when two things happen. First, on a failed pizza delivery he meets up with Y. T., a fifteen year-old Kourier who delivers messages by skateboarding from sender to receiver. She uses a magnetic harpoon to attach herself to vehicles so she can deliver items swiftly. She becomes an ongoing ally. Second, Hiro's friend Da5id dies when he sees a certain image that makes his mind melt. There's a virus called Snow Crash that's a virtual version of the recreational drug Snow Crash which has become popular but also deadly. Hiro's investigation into the virus catapults him and Y.T. into a fantastic, far-fetched adventure.<br /><br />The set-up of the book is very interesting. The world is a fascinating imagining of the future, though bits of it are less convincing. Money in the future is highly inflated and some bills are referred to as &#34;Gippers&#34; and &#34;Meeses.&#34; That was surely hip and relevant in the early 1990s when the book was written but I doubt Millenials who read this book will have any idea to whom Stephenson is referring. The samegoes for the L. Ron Hubbard character. The story also bogs down in unnecessarily long exposition about ancient Sumerian mythology which is tied into the plot. About half-way through the book I ran out of excitement and energy as a reader. Neither came back as I continued through the rest of the book. The action picks up at the end but my emotional investment in the story was gone so it wasn't as compelling and exciting as it should have been. The book isn't bad, it just isn't as great as the hype around it.",2015-07-21
US,23575214,RRVCSCLUJ5M7G,0553380958,445913,"Snow Crash",Books,5,1,2,N,Y,"Five Stars","Hilariously poignant and one of my all-time favorites!",2015-07-02
US,11472208,RIMYO2XHY7203,0553380958,445913,"Snow Crash",Books,5,1,2,N,Y,"good book","great book, highly recommend it, predates the matrix and twice as good.",2015-07-01
US,43056369,R2ZH0QXK1KY325,0553380958,445913,"Snow Crash",Books,4,0,1,N,N,"Fast-paced and Fun","As with all Stephenson books, this novel proves imaginative and compelling. A well-established futuristic society nestled within the United States is a great setting for an Internet-era showdown among rivaling factions. There is plenty of action and intrigue that builds among the major characters, creating enjoyable narrative tension. Originally published in the 1990s, this novel still projects a possible future that may not be all that far away for us.",2015-06-27
US,27250986,R13P83R9LMRDA,0553380958,445913,"Snow Crash",Books,5,0,1,N,Y,"Maybe my favorite book ever -- and I'm NOT a big reader!","Some of the most dense writing, ever.  Incredible.  But not for dumb/shallow/clueless people.",2015-06-27
US,49066061,R3UJJB46AE7AGG,0553380958,445913,"Snow Crash",Books,3,2,3,N,N,"Writing itself good; intellectual violence behind the plot line bad","I am giving this a VERY “split” review. On writing style and the surface level flow of the plot, it’s worthy of five stars.<br /><br />As for how he develops his plot, specifically, fair chunks of the backbone and background of the plot? It’s three stars at best, maybe only two. I could have considered 3.5 stars overall, but went for three. And now, I'll explain why.<br /><br />Stephenson does a lot of deliberate violence to some elements of philosophy and religion. And, having read his bio, he’s smart enough to have known better, that’s why I call it deliberate.<br /><br />The first big thing I noticed in this way? Stephenson gets wrong monistic philosophers. Leibniz and Berkeley immediately jumped to mind as anti-materialist monists, contra his claim that all monistic philosophers are materialists.<br /><br />Even more wrong is his Procrustrean take on the documentary hypothesis, that is the historical-critical idea that the Torah was created by material from four authors, the Yahwist (J), the Elohist (E), the Deuteronomist (D) and the Priestly author (P), with final editing most commonly presumed to be by someone in the P tradition. His idea that E was that heavily edited by D is iffy at best, and he entirely ignores the P section, which goes back to sacrificial and other Temple cultus prescriptions.<br /><br />And, I know why he ignores the P section. It entirely undercuts his idea that D was influenced by Sumerian writing and building on the linguistic virus from Sumerian writing that’s the whole cornerstone of the novel. Oops!<br /><br />But, that’s not all.<br /><br />Yeah, he was born in Fort Meade; beyond being a college computer luster, maybe his dad worked for the NSA. That’s no excuse for his forced seeing of binaries, as in coding 0 and 1, where they don’t exist.<br /><br />He also is wrong on tie-ins or riffs on memes and NLP. I’ll cut him slack on memes based on the date of his writing, as they were more scientifically respectable then than now? But NLP? It was known to be pseudoscience 15 years ago.<br /><br />As for philosophy? If he didn’t knowingly botch monism, then he’s an example of a scientismy type who ought to actually talk to some philosophers.<br /><br />If other novels of his have as good of writing, or nearly so, and better thought processes and intellectual honesty, I’d be glad to read them. If not, this taste was enough.e then than now? But NLP? It was known to be pseudoscience 15 years ago.<br /><br />As for philosophy? If he didn’t knowingly botch monism, then he’s an example of a scientismy type who ought to actually talk to some philosophers.<br /><br />If other novels of his have as good of writing, or nearly so, and better thought processes and intellectual honesty, I’d be glad to read them. If not, this taste was enough.",2015-06-23
US,11489799,R27XTMG5UFV0C1,0553380958,445913,"Snow Crash",Books,4,0,1,N,Y,"Heady","I found it fast paced and amusing. Intelligent. Book is like 20 years oLd. Seems nit picky to say character depth is lacking.",2015-06-21
US,23273954,RWB7KYRBRU58C,0553380958,445913,"Snow Crash",Books,5,0,1,N,Y,"Best cyberpunk book I've ever read","Best cyberpunk book I've ever read. I actually bought a hardcopy after having borrowed this book from my local library. I read it faster than any other book I've read in the last decade, I was so transfixed. It's a delightful piece of sci-fi and compulsively readable.",2015-06-21
US,52993580,R31VATN9X5D2OQ,0553380958,445913,"Snow Crash",Books,5,0,1,N,Y,"All time GREAT","This is one of the great cyber punk novels of all time - quite possibly the greatest.  If you haven't yet read it, you are in for an unforgettable treat.  Sublime.  Unforgettable.  This is why we read science fiction.",2015-06-11
US,18729066,R1WV0SWUWA15BK,0553380958,445913,"Snow Crash",Books,5,0,1,N,N,"convergent realities","This is an extremely interesting science fiction simulation of a world in which virtual reality and reality are much more convergent than is actually the case.  Conflict, struggle and gamesmanship of one person against another not only enlightens us concerning this convergence but makes the book interesting as shear fantasy as well.  There is also a fair amount of intellectual discussion among characters that brings out the nature of the simulation.  What can we learn from this?  Just like a simulation in physics or engineering, this is a social physics simulation.  It challenges us to think somewhat more clearly and deeply about computation and the nature of the computer revolution.  I can recommend this book, if one wants to be intellectually alive to some of the technology that is shifting the nature of the social fabric in the modern world.",2015-06-07
US,2483087,R330XK4AB130FE,0553380958,445913,"Snow Crash",Books,5,0,1,N,Y,"Five Stars","this book is amazing",2015-05-27
US,35089004,R3DJVIYQO759V1,0553380958,445913,"Snow Crash",Books,3,2,3,N,N,"Snow Crash is still one of the go-to recommendations for modern cyberpunk. But does it fully deserve the hype?","Review Originally Posted At: www.FictionForesight.com<br /><br />Let’s start off easy…Snow Crash is full of awesome concepts: Badass mixed-race sword fighter and hacker Hiro Protagonist? Check. Plucky sidekick girl who skateboards for a living? Check. An ominous antagonist who carries a nuke in the sidecar of his motorcycle? Uh – CHECK. The future US is ran not by the government but by franchises and corporate mafias? Obviously. Fast-paced action inside a shared computer universe called the Metaverse? Yes please. A mysterious computer virus incapacitating the top hackers around the world? You know it.<br /><br />Stephenson’s third full-length novel brought him to the forefront of science fiction, and it’s easy to see why. In Snow Crash, he showed an uncanny ability to extrapolate actual technologies into very robust, believable, real-world applications. The Metaverse is an interconnected virtual social space, which we see an echo of in today’s social media and MMO gaming. Stephenson also popularized the use of the word “avatar” to describe a virtual body or character. In addition, we see several technologies in the novel that are still coming into popular usage – the skateboarders use something eerily similar to the “Hovding Cyclist Airbag”. Our main character acquires a digital library and a program that is basically Google Earth. And the Snow Crash virus – our main plot point – is, in its most basic form, an internet meme.<br /><br />The ugly side of all these fantastic things is that there hardly seems room in the book for anything else. Snow Crash is so jam-packed full of amazing ideas that the universe feels somehow incomplete, the characters are two-dimensional at best, and the ending – whew, don’t even get me started. We’ll come back to that in a bit.<br /><br />The story takes place in a future United States, where the government has become irrelevant and the country marches to the beat of a type of “anarcho-capitalism.” People live in suburban enclaves, run by franchises such as “Mr. Lee’s Greater Hong Kong,” and the American Mafia, who now makes a large profit from delivering pizza. The Los Angeles highways are still lined with lights, but they are patrolled by a private security with easily greased palms, and unless you are sponsored by one of the big businesses you have to fend for yourself.<br /><br />Life outside the sovereignty of these megacorps is the niche that our protagonists occupy – living in storage containers, hosting underground rock shows, collecting information to sell to any interested parties. Hiro’s life in L.A. is gritty, bright, and feels a little dangerous. However, when he follows the Snow Crash trail to a massive floating raft-city off the coast of Oregon, we suddenly lose all sense of place. It’s understandable that Stephenson doesn't want to bog down the narrative, especially just before the height of the action; but there’s so much he fails to mention that would give our story a setting inside a larger, complete universe. The West Coast doesn't just exist in a cell. I grew up there, and they’d like to think that the rest of the country doesn't exist, but that’s just not true. So where is it? For that matter, how does the rest of the world react to the way Mr. Lee and the Mafiosos are running the U.S.? Couldn't tell you. As it stands, the novel provides just enough explanation to get away with it, but we still feel like our characters are just moving through a space without their feet hitting the ground.<br /><br />Ah, yes, the characters. Like much of the rest of this work, they sound awesome in concept. But when it comes to creating a fully formed, three-dimensional human being, Stephenson falls short. Hiro Protagonist has little to no back-story, and his motivations for pursuing information regarding the Snow Crash virus are about as imaginative as his name. He wants to sell information about it. Oh, I guess his friend and ex-girlfriend get swept up in the plot and I think maybe Hiro goes to save them, but I don’t remember him seeming to care too much about them. The girl, Y.T., has a mother that the government captured to provide “motivation” for her, but midway through the book she gets swept up in a pointless “romance” with our nuke-toting bad guy, and becomes another damsel for Hiro to rescue. Said bad guy seems to have no real reason to be working for the evil masterminds behind the virus, other than the fact that America wronged his ancestors and his family’s lands, so…obviously America has to go. In theory, these characters have complete back-stories and complex reasons for doing the things they do, but Stephenson fails to deliver – I believe again out of the fear of getting in the way of the story (and the science behind it) itself. So instead of characters we have cardboard cutouts that move through this world simply to get us to the end of the book.<br /><br />And so, we arrive at the ending. Once we've revealed who is behind Snow Crash and why it is proving so dangerous to hackers around the world, we get to have a happy ending, right? Not particularly. Everyone who can be saved is saved, there’s a sort-of shootout where early benefactors come into play again – and then everyone just goes home. Hiro and Y.T. both remain exactly the same as they have been throughout the story, no learning, or character growth, or any sense of forward progression in their lives. Snow Crash happened to them, and now they presumably just go back to things as they were before. It’s like if the Lord of the Rings had ended with Frodo throwing the ring into the mountain and then just going home. Problem solved, right? Who cares what happened at Minas Tirith?<br /><br />For all its many shortcomings, Snow Crash is still a novel with a clear vision and where it does excel, it shines. The science behind the Snow Crash virus is interesting and well-researched, and the tech in the world is sowell thought out that even 23 years later, it is still relevant and hardly shows its age. However, the novel as whole reads like it was written by a twenty-something grad student who had a bunch of “wouldn't it be cool if…” ideas and then threw them together into something resembling a story. I think Stephenson had yet to come into his style with this book, so I look forward to reading some of his later works, like Cryptonomicon and Anathem. In my opinion, Snow Crash might be slightly overrated, but has reached a wide audience and has clearly influence today’s technology – I’d say it’s worth your time.<br /><br />Fun fact: Joe Cornish, director of 2011 feature film Attack the Block, has been signed on by Paramount Studios to write and direct a film adaptation of Snow Crash. Stephenson has warned fans that there’s no guarantee the film will ever be made.<br /><br />(www.FictionForesight.com)",2015-05-08
US,18049112,R361E1AHGGMM0W,0553380958,445913,"Snow Crash",Books,5,0,1,N,Y,"Five Stars","Love it",2015-04-22
