marketplace,customer_id,review_id,product_id,product_parent,product_title,product_category,star_rating,helpful_votes,total_votes,vine,verified_purchase,review_headline,review_body,review_date
US,47316689,R243FAHMU1HNWZ,0553380958,445913,"Snow Crash",Books,5,0,1,N,Y,"Wonderful journey into what is.","Neal Stephenson is visionary in this prophetic novel. Extremely alluring and entertaining read. Perfect gift for the inner geek in all of us.",2011-02-05
US,12764269,R26RTZU09EQDM6,0553380958,445913,"Snow Crash",Books,5,0,2,N,N,"Brilliant","It's a great book.  If you want to poke holes at Stephenson's Sumerian knowledge than this book is not for you in the first place.  Enjoy the witty, frank, and imaginative world of this book - it's a roller coaster.  It is pure fun.",2011-02-01
US,52678873,RG7WWNE72JLSF,0553380958,445913,"Snow Crash",Books,1,6,47,N,N,"good for atheists, offensive to Christians","I read this book initially during my younger, agnostic years, and I liked it a lot.  Inventive, crazy, disturbing, and definitely entertaining.  Tried to re-read it recently and found it deeply offensive, now that I am a Christian.  In this book the Holy Spirit is likened to a virus.  I threw it in the trash, could not finish it.  So, if you are an atheist and like books that trash Christianity and reinforce your world view, then this one is for you.  I don't require the promotion of my world view in the books I read, but I'd rather not have it attacked.  I don't understand why so many sci-fi authors do that these days, given that the super majority of Americans self identify as Christians.",2011-01-29
US,44294312,R1S8W5B3LFKZLX,0553380958,445913,"Snow Crash",Books,3,1,6,N,Y,"Way too violent for me","Too bad there is no MPAA rating for books (at least not that I know of, if someone knows a rating system for books then please let me know) like there is for movies. This book would otherwise be rated NC-17 based on the gory violence. Obviously it doesn't bother most people, but it bothers me. The language would also give the book at least an R rating. I could overlook the foul language but gave up a third into the book because of the gore. So if violence and sliced up corpses doesn't bother you then this might be a good book, otherwise be warned.",2011-01-10
US,43458434,RVU4VF01NAH0F,0553380958,445913,"Snow Crash",Books,5,0,2,N,N,"ahead of its time","A friend recommended this book years ago, but I finally got around to reading it. After a few chapters I was totally immersed in Stephenson's bizarre, yet oddly plausible, future reality. I don't read much sci-fi, but this is now one of my favorite books. I can't wait to read more of his work. This book was published in 1992 - it's way ahead of its time. In some ways, this book predicted the future popularity of Facebook and other social media websites.",2011-01-09
US,16380084,R25UK906NR2JC8,0553380958,445913,"Snow Crash",Books,4,0,0,N,N,"Dystopian Cyberpunk Language Hacking","With main characters named Hiro Protagonist and YT (Yours Truly), this book already had a unique style by chapter three. A dystopian near-tomorrow 1980's based setting conceptualizes a world past the collapse of society into franchises (like Uncle Enzo's Mafia, the Crips, Greater Hong Kong, and the Government of the United States) and enclaves/burblands, where commerce is conducted by might-makes-right and daredevil Kouriers who ride the skateboards of tomorrow. Weird concepts include electromagnetically (har)pooning traffic for greater board speed, cyborg pit-bulls called 'Rat-Things', and the portable suitcase railgun 'Reason'.  Hiro is black/asian, and he is a sword wielding hacker who has a pizza delivery side job and lives inside a small converted storage locker in Reality. In the Metaverse, the 3-d version of the internet, he's serious business, having helped write the avatar disposal routines. YT is fifteen, has a short attention span, and is sexually active (complete with her own love scene late book). This may offend. YT and Hiro become business partners around page 90ish after they save each other from various circumstances.  The plot is neurolinguistic hacking... based on a bunch exposition involving the Tower of Babel and Sumerian history, someone has figured out how to basically hack into the subconscious of the everyman and reprogram his psyche. These ancient programs called 'me' would concentrate an obscene amount of power into someone's hands, and Hiro and YT are trying to stop it.  The prose is funny, gritty, in-your-face, cyberpunk-styled action, but the exposition is inserted in story flow disruptive chunks, and the ending leaves much to be desired in terms of characterization closure. Overall I liked the work, but it had rough edges. Three and a half stars rounded up.",2010-12-12
US,49575901,R23E1O3YPM5227,0553380958,445913,"Snow Crash",Books,5,0,1,N,N,"Snow Crash - One of my Top Ten favorite books","Many other people will have already written full-on book reports about Snow Crash, so don't expect that here.<br /><br />I picked up this book at a friends house decades ago.  He told me I couldn't borrow it if I liked it as he hadn't finished it yet.  I read the first 100 or so pages and on the way home bought my own copy.  In some ways even more-so then William Gibson, Neal Stephenson nailed the Near Possible Future squarely on the head.  I found the pace and detail of the book perfectly to my liking with characters I wouldn't mind seeing again.  The one thing I will say, Neal has trouble ending books.  I don't mind they way they end in general but Snow Crash and also Cryptonomicon both ended shall I say  Jaggedly?  The story was wrapped up, but the ending wasn't clean.  This however did not hurt my love of these books the first time I read, nor when I have had to re-read.  And yes, being in my Top Ten means sometimes I *have* to reread this book.",2010-11-13
US,20195449,R3OHCLZRPK8Q1W,0553380958,445913,"Snow Crash",Books,3,0,5,N,N,"Mediocre at Best","The Title says it all. Lots of others have summarized the plot so I wont bother, but I have to say I'm pretty disappointed with this book.    Stephenson starts the whole thing off with an awkward bang, and the first couple chapters hum along at a great pace. But the cliches are just a bit too abundant to really get into this story. Hiro is written as a character a 14 year old computer nerd would think is cool, Y.T. is an overly witty skateboarder kid, and the villain is so forgettable I cant honestly remember his name while writing this review. The only character that I found interesting is Uncle Enzo, and he shows up for about 10 pages all together.    It's kind of a shame how this story doesn't live up, because the concept is pretty interesting. While I didn't hate the Sumerian research stuff like a lot of other reviewers it was fairly unnecessary padding. The MetaVerse is a pretty cool idea, but again it's painted amateurly at best. The ending was way too rushed to be enjoyable, and readers will likely have more questions than answers when it's all said and done.    Snow Crash isn't terrible, it just isn't very good. If you're desperate for a new story to read, go ahead and pick it up. Otherwise I would recommend skipping this one.",2010-10-24
US,15221206,R29VKXJI8FJCW,0553380958,445913,"Snow Crash",Books,5,0,1,N,N,"An excellent read.","It's not often that I read a book more than once, but this is one that merited the reexamination. It really is a fantastic book.",2010-10-16
US,30853455,R8H3MMYV1GMI6,0553380958,445913,"Snow Crash",Books,5,0,1,N,N,"What a Ride!","I read this as part of my ongoing (yes very slow) reading of the Science Fiction Book Club's 50th anniversary collection, a truly outstanding although far from comprehensive survey of that period. This book (number 33 of 40) was an outstanding ride with lots of insights. Its 1992 initial publication date will have you nodding in reflection about how on-target Stephenson was. The mix of young and older characters, virtual and real world, financial titans, religious demagogues, Mafia types, and people living in storage rental spaces make this a great ride. It was my first exposure to his work. I'm looking forward to reading more and I'm not worried about getting a pizza delivered in 30 minutes anymore.",2010-10-05
US,47741631,R2VIOC0QI49SV4,0553380958,445913,"Snow Crash",Books,4,0,1,N,Y,"good book","No, great book. Enough said. Remember, this was written before the internet was in every home and school. It's a bit ahead of it's time.",2010-09-30
US,14716532,R3Q9S9ST173BLH,0553380958,445913,"Snow Crash",Books,4,2,4,N,N,"Way better than Gibson","I like the style and story...this is way better than anything William Gibson ever did.  My only beef if the sex scene with a 15 year old...I like sex scenes just fine, but why did the girl have to be 15 years old?  Seemed kind of inappropriate so I had a hard time enjoying it like I would have if she was 18.  As far as I could tell, there was no plot line necessitating that she be that particular age.",2010-09-24
US,44081087,R2HVBFYFU8903F,0553380958,445913,"Snow Crash",Books,3,1,3,N,N,"Interesting book with a black/Asian protagonist, but falls short...","Too much exposition halts the plot and give unbalance...    I finally was able to read Neal Stephenson's Snow Crash after seeing a fellow student read it on a bus ride to school, and hearing positive things about it from various other sources (online, sci-fi community, etc).    Was it everything I expected?    It could have been better.    I thought the idea of a 'Blasian' (half-black/half-Asian) hero, Hiro Protagonist was pretty cool.    The idea that the Sumerian legends had something to do with the virus of the title that is soon to be unleashed to those outside the Metaverse (which is the virtual world where characters spend time).    The major aspect that turns me off of the book are the very long Sumerian explanations that halt the book at various points.     Hiro seems to already know these legends and consults a library at one point to go over the legends and their relation to Snow Crash...then at another, while he is speeding on a motorcycle.    I do like the 15-year-old blonde Caucasian character of Y.T., as she seems to be an individual who can pretty much handle herself; her mother, a single-parent, works for a the government in a pretty strong 'by the book' environment.    The world seems to be a bit dystopian (which is somewhat of a cliche of virtual reality stories) as Hiro lives in a storage area; and, Y.T. at some point of the story even has a quick fling with a man much older than she...who turns out to be the villain of the story.    All in all, I found myself wanting to find out what happens, and when I did...I didn't find it as mind-blowing as many, but I do understand there is an audience for this book. Furthermore, I now have an interest of reading some of William Gibson's cyberpunk books.    As aforementioned, I think the areas with the Sumerian exposition could have been worked into the story, rather than devoting several pages to it; because, it seems to grind the story to a halt..especially when the reader (i.e. me) is into a certain action sequence. (It makes the story a bit unbalanced).    I may revisit this book in the future, and I do recommend it for others...who may have their own likes and dislikes, as well as their own interpretations on the material.    *** out of *****",2010-09-16
US,50367108,R5T1E6MX8Y6WL,0553380958,445913,"Snow Crash",Books,4,0,1,N,N,"cons","the places where the author goes into religious history are quite painful. those sections really could have done with some editing. most of the details are irrelevant to the story and uninteresting in their own right.<br /><br />the author clearly loves to go into the details about the technical gadgets he invents in the book, and the story both excels and suffers from that. in some respects the author predicts the future of things correctly, but in other ways he is way off, and that dates to the book to some degree. any high-tech sci-fi suffers from this problem though.<br /><br />i thought the story ended a little abruptly. i won't go into details as that would be a spoiler. i was quite attached to the characters and some info about where they went from there would have been nice.",2010-09-09
US,29992171,R1M3V1TC4IBIG7,0553380958,445913,"Snow Crash",Books,3,1,3,N,N,"High-tech Science Fiction Epic or Comic Book Style Fantasy?","Neal Stephenson has produced a futuristic society engulfed in anarchy where corporations take the place of nations and virtual realty has moved to the forefront of leisure.  Hiro Protagonist, a gritty and likable computer hacker/swordsman extraordinaire, stumbles upon a secret whereby society is slowly being manipulated both via software virus and something much more sinister.<br /><br />Aside from its intriguing ideas that meld libertarianism with near complete lawlessness, the story struggles between being a high-tech science fiction epic and a comic book style fantasy.  On the one hand, the story revolves around virtual realty and technologically advanced weaponry, on the other hand the book contains family pets turned to fighting robots and pizza delivery services risen to near sacred importance.<br /><br />There is no doubt Stephenson is incredibly inventive and he surely let his imagination run wild; however, the contrasting elements of style make this book hard to label.  The story takes different directions and produces many captivating environments, but only slowly develops to an eventual anticlimactic ending without any real excitement or intrigue.",2010-08-17
US,50419113,R2ZY6WOJQVPS98,0553380958,445913,"Snow Crash",Books,3,3,5,N,N,"Cyberpunk? I guess so","There are 30 reviews that summarize the plot of Snow Crash. So I'm going to skip that.<br /><br />The book was okay. Just okay. I found the pacing a little uneven, and it certainly feels like an author's first full novel. The ideas encapsulated in the fiction are interesting, sometimes even compelling. But Snow Crash is a bit of an idea novel. There is only one really interesting character and Y.T. isn't really the main protagonist.<br /><br />The important ideas are the anarcho-capitalism and languages as virus themes. In many ways, these serve as characters as much as anything else.<br /><br />Finally, the novel, in my mind, closes with several poorly closed threads that are not carried on in future novels. These detract from my pleasure in the novel. If you like Stephenson's other books, you probably like Snow Crash. If you come to Snow Crash as an introduction to Stephenson, it will tell you if you will like his other books.",2010-07-30
US,49050321,R3M0C4XNPGUYIF,0553380958,445913,"Snow Crash",Books,3,2,4,N,Y,"Visionary cyberthriller, but plot doesn't stand up","A visionary work which popularized the term \\""Avatar\\"" and foresaw Google Earth. Also quite humorous (Mafia pizza franchises, the main character's name, etc). However, the Sumerian background mythos is so contrived that it requires endless expository dialogue. Huge swaths of the book therefore read like an essay. Worth finishing, but not starting: the characters and action were interesting enough to push me on to the end, but overall I recommend spending the time on another book entirely (try Daniel Suarez's The Daemon for a more modern and coherent work in the same genre).",2010-07-11
US,17096364,R3VUVS9YBCM1XH,0553351923,445913,"Snow Crash",Books,5,0,2,N,N,"Brilliantly written but not for everyone","I'm giving this 5 stars b/c it's everything I like in a well-written book but I doubt that Stephenson's style of writing is everyone's cup of tea. I found Snow Crash to be clever and thoroughly engaging. It doesn't hurt that I'm a tech geek either. Well done.",2010-07-07
US,13136498,R202F2DAGQLEEE,0553380958,445913,"Snow Crash",Books,4,1,3,N,Y,"A must read for Sci Fi / Cyberpunk Fans - It's just.....COOL!","This is the only Stephenson book I have read. He was recommended to me by a friend even though I said I wasn't into SciFi. He pushed me to give it a chance because Stephenson is such a great writer so I picked up Snow Crash. I was not disappointed. This book is an amazing read start to finish. His vision of a future America run by commercial entities (one of which is the Mafia) is so detailed that you will lose yourself in the setting and have moments where you think, \\""wow that's what it's gonna be like.\\"" It's obviuos to me that Stephenson was keeping himself out of the \\""cyberpunk\\"" trend as the SciFi market was being flooded with books of this genre, but then decided he would show everyone up and come out and show that not only was he capable of writing in that genre but he could raise the bar for everyone else. Stephenson never takes anything too seriously, I mean his protagonist is named \\""Hiro Protagonist,\\"" which keeps the tone fun. His characters, especially Hiro and YT are bursting with personality. On eof my favorite passages is how he describes, through Hiro, how everyman at one point or another thinks he could be a totally bada$$ mofo.<br /><br />I have heard criticisms of Stephenson's other novels that his endings are weak, well that is not the casehere. I'm keeping this spoiler free but suffice it to say the showdown atthe end is very rewarding for the reader and will not leave you hanging.<br /><br />The book combines Asian influences with traditional SciFi and wraps it in this \\""cyberpunk\\"" package that gives it an edgy feel. It just feels cool, and you will feel cooler for having read it. Pick it up now!",2010-06-22
US,10181599,R4TF2AGSZQ00,0553380958,445913,"Snow Crash",Books,3,6,7,N,N,"Wildly imaginative, funny, edgy and highly entertaining at first - but then it gets bogged down and loses its way","Snow Crash captures your imagination right from the opening lines.  The first part of the novel is wildly imaginative, funny, edgy, and highly entertaining.  In the opening pages Stephenson introduces us to our hero protagonist (aptly named Hiro Protagonist) a sword wielding, computer hacking, pizza-delivery driver.  We soon learn that the Mafia is in the business of selling pizza, that Kouriers get around by `pooning cars from their planks', that people can `jack into the Metaverse', and that California is home to numerous City-states called Burbclaves.  There are no laws and corporations run everything.<br /><br />Unfortunately, after a great opening, the novel quickly loses its edge.  The irreverent tone of the early chapters gives way to an unnecessarily detailed exploration of linguistic theory and Sumerian legends.  Stories from the Old Testament are linked to Sumerian myths and then connected to computer viruses.  These links involve some serious stretches in thinking and some pretty thin theorizing as selective information is used to tie the evolution of human language and religion to a deadly metavirus.  It all becomes an overly complicated, unconvincing mess and momentum killer.<br /><br />While the early chapters brim with wildly preposterous ideas that have just enough truth to them to constitute great satire, the `Sumerian myth/linguistic theory/metavirus idea' is tedious and bogs the narrative down.  The novel picks up speed again near the end and there is a bright spot late in the novel when a character who works for the Federal government is required to read (in 15.62 minutes) a multipage memo on `intra-office toilet-paper policies', but by then I'd pretty much lost interest.  I did enjoy this hilarious skewering of Government Bureaucracy but it wasn't enough to re-engage me in the story.<br /><br />For me, a promising start gave way to uneven pacing and an unconvincing and largely uninteresting premise.  Despite my enthusiastic reaction to the first part of the novel and that bright bit of satire near the end, I can only give this novel three stars.nd that bright bit of satire near the end, I can only give this novel three stars.",2010-06-21
US,12750398,R15IP5UX8C7PRU,0553380958,445913,"Snow Crash",Books,5,2,3,N,Y,"WARNING! Paperback is poorly printed.","I love Snow Crash. I've read it 3 times now.  I bought the \\""Snow Crash (Bantam Spectra Book) (Paperback)\\"" for my 3rd read.<br /><br />Firstly, I can see through the pages are so thing that I can easily read the print on the opposite side of the page--WITH the pages all pressed together (not with them held up singly).  This makes reading that much less pleasant. It is very distracting and does, at times, slow me down a little. Not enough to make reading a word difficult, but enough to affect the speed at which it registers.<br /><br />Secondly, the typeface is very bad. The print is large and sloppy. There is a large gradient from one page to the next and it feels like a half the pages were printed with too much ink--so that letters with with curves at times look a little smudged.<br /><br />For me, both of these affect the pleasure of the read. Some perspective on my opinions; I normally don't pay particular attention to type face or paper quality because normally it is not an issue, but this IS one of the very few times I've found a printing to be unpleasant and of a deficient quality.<br /><br />If you are buying not just because you want to read the book, but that you want to keep the book as part of your personal library/collection/whatever do not get this paperback. Buy a hardback, or find different printing in a brick and mortar store.",2010-06-03
US,15908648,R1EB7FNAFW2VZ8,0553380958,445913,"Snow Crash",Books,5,3,4,N,N,"A great read that is never boring.","Snow Crash was my first cyberpunk read and probably will not be my last - it certainly won't be my last Neal Stephenson book!    The main character in Snow Crash, Hiro Protagonist, is an ex-pizza delivery driver for the mafia. He collects information, uploads it and makes money off of it if customers find the information he uploads useful. While Hiro is in the metaverse, a virtual reality 'Second Life' of sorts, he discovers a virus called Snow Crash. Snow Crash is no ordinary virus however; it affects people in real life - outside of the metaverse. It's Hiros mission to figure out more about the virus.    Snow Crash moves at a break-neck pace. Stephenson has a very creative prose which makes this book almost impossible to put down at times. I found myself late to work more than once because I would attempt to read just a few passages before rolling out of bed only to find that I just couldn't peel myself away! This is one of those books that will put you in a time machine - you think you've only been reading for 20 minutes when in fact it has been an hour!     One of the more common complaints I see in other reviews is how he tends to digress, especially when he talks about topics like ancient Sumerian culture. I didn't find this annoying at all, I actually found it really interesting how he tied everything together.    This is an addicting read that I highly recommend! I can't wait to read more of Stephenson's work!",2010-03-04
US,23429016,R18PX2N18NWQG,0553380958,445913,"Snow Crash",Books,4,0,6,N,N,"Wacked out","It was like the book version of a video game. I couldn't put it down, was late for work. More do you want... no, I don't give \\""5\\""s.",2010-02-21
US,48763129,R17FO4U6KA4GRJ,0553380958,445913,"Snow Crash",Books,2,2,10,N,N,"Not for the mature reader","Superficial development and banal, stereotypical portrayal of all major characters. If the book didn't have a somewhat interesting plotline, it would have nothing to recommend it to the mature reader (i.e. any reader who is not a teenage boy or a man with a teenager's mentality).",2010-02-16
US,39540160,R1Z741LVLIE3DF,0553380958,445913,"Snow Crash",Books,4,0,3,N,Y,"Great geeky story","Loved the story and all the geek that is involved. Didn't care so much for all of the language though. Would recommend to other geeks looking for a fun read.",2010-02-07
US,15368696,R3EH579CH7H6DC,0553380958,445913,"Snow Crash",Books,5,0,3,N,N,"Great Read","Not his best book but definitely worth it.  I would recommend this to anyone who is into cyber punk books, the internet, or pizza.  Great read and well worth the time as long as you are into technology and interested in what the future may hold.",2010-01-31
US,53093738,R2GJC9METVBG81,0553380958,445913,"Snow Crash",Books,1,10,25,N,N,"Unreadable - couldn't finish it","There are a lot of well written reviews for this book, and I'm not going to attempt a thorough review. That would be unfair as I didn't finish the book. But I just wanted to say that I didn't really like it. For some reason I found the style of writing extremely irritating. I think the author tries too hard to write in a cool style, but it ends up as a flashy, verbose, cacophony of words totally obscuring anything in the way of character development or plot. After a while I got so annoyed with the book I couldn't be bothered finishing it and took it back to the library.    Some people might like it, but I found it unreadable.",2010-01-16
US,53002697,R3N8U6DZ1XM6J3,0553380958,445913,"Snow Crash",Books,5,0,6,N,N,"ONLY THE BEST SF CYBER PUNK","This is the best cyber punk novel ever written. I think this is NS very best. I recommend it and all NS but I suggest you read this one first. It contains the best virtual sword fight EVER. Hero Protagonist, The Deliverator, what a great name. Pooning sounds like a gas. Think I am going to get out my rebar katana and read it again.<br /><br />EVERYONE wants T R Caspell<br />mr. Toads wild ride. Todd Royall Caspell<br />RIDE LOTS Tord,Thor,Torka,Todo<br /><br />and sundry<br />(expressed opinions not necessarily of<br />my brain)<br /><br />Todd R Caspell",2009-12-22
