marketplace,customer_id,review_id,product_id,product_parent,product_title,product_category,star_rating,helpful_votes,total_votes,vine,verified_purchase,review_headline,review_body,review_date
US,48720238,R38EH077LJSXHX,0553380958,445913,"Snow Crash",Books,5,27,34,N,N,"A Rare Accomplishment In the Genre","NOTE: I wrote a review of this novel a couple of months ago, but it was never posted. I won't speculate on the reason or reasons why (although I have my suspicions), but I promise to be a good little Phrodoe this time out. Onward:<br />  Snow Crash is an astonishing, clever, funny, suspenseful work of the imagination. I've read a couple of Neal Stephenson's books (Cryptonomicon and The Diamoind Age, both of which I highly reccommend), and I still think this is his best novel. In Snow Crash, a part-time hacker, information-scrounge, and delivery boy for Uncle Enzo's Cosa Nostra Pizzerias, and full-time Metaverse (virtual reality) samurai named Hiro Protagonist (one of the best names since Billy Pilgrim!), is slowly drawn into a mystery involving a virus program called Snow Crash, which is claiming not only the computers but the minds on hackers the world over, including Hiro's best friend. Who is behind all this, and what it has to do with Sumerian mythology and the hard-wiring of the human language centers is what Hiro must find out, while at the same time he attempts to prevent the further spread of the Snow Crash virus. Along the way he falls in with a skateboard punk named Y.T., who is more instrumental to the story than might first be suggested, and who is the novel's most intriguing character, if only because her investigations are almost more revealing than Hiro's are -- in fact, Hiro comes off as a bit of a cypher compared to her. But I digress. All of these events take place in Stephenson's richly- imagined near-future, where the American government has become a tight-sphinctered, half-failed corporation, while corporations have become governments, and a multimedia mogul has cobbled together a vast fleet of refugee boats from various countries, in the most questionable act of philanthropy since Ted Turner tried to buy the UN. There are also gated communities that are not just gated but practically self-contained universes. And then there is the Metaverse...Stephenson's delightful extrapolation of the Internet, where you can be anyone you want to be, whether that person is yourself or someone else, within reasonable limits of course. The Metaverse is also as overloaded with advertising as the 'net is, and it was Stephenson's clever description of M.V. ads that really hooked me on this book for good (not that I needed much more persuasion at that point). The Metaverse, and the weird, wired world which surrounds it, are both so enthrallingly, memorably...I was going to say realistically, but perhaps a better term would be surrealistically, rendered, that reading about it is one of the novel's high points. Every moment of Snow Crash, practically, is full of mystery, intrigue, brightly-drawn (for the most part) characters, and humor. Oh, didn't I mention that Stephenson is a bloody riot to read? The man is a futurist-humorist-satirist of the first caliber...I would say worthy of Vonnegut, but that's pretty lofty company, and probably not entirely accurate. yet Stephenson comes darned close, and he, along with Kurt Vonnegut, Mark Twain, and Douglas Adams, is one of the few authors who can make me laugh right out loud, so mordantly witty is his stuff. But Stephenson is also more than a wit, as the clever premise behind Snow Crash suggests. His concept, that human consciousness and language concepts are as programmable as any computer, is as intelligently-reasoned as any science-fiction concept I've ever come across, and one which would later be revisited, reexplored, and expanded upon by Greg Bear in Darwin's Radio (see my review, he said in a shameless plug), although Bear added some wrinkles even Stephenson didn't think of. And in linking his concept back to both the Biblical story of the Tower of Babel, and to the Babylonian creation myth Enuma Elish, Stephenson creates a tapestry of invention that few writers in my experience have been able to equal, all told elegantly in Stephenson's supple, muscular prose. And if none of what I've written here convinces you to pick up Snow Crash, maybe this will: There is a tendency in science-fiction for writers to create improbable post-apocalypse dystopias (i.e., The Matrix, Mad Max, or any one of a hundred bad stories written by good writers -- even the great Harlan Ellison has written his share), and in my opinion such stories are not only ill-conceived but also a cheat. It's easy to imagine a post-apocalyptic world (where there seems to be all the gasoline, computer time, and electric energy available, no matter how wretched the rest of the world has become) -- in fact, it's too easy, which is part of the problem. Show me instead a far more difficult feat...instead of a blue-sky approximation of the post-apocalypse, show me how the world is GOING to end. That is what Vonnegut has done time and again (cf. &quot;Harrison Bergeron&quot; and the novel Slaughterhouse Five), and that is pretty much what Stephenson is doing with Snow Crash. He isn't worried about the post-apocalypse...but rather, about the aptly-named Infocalypse which may be happening all around us even now, right under our noses. And that, above all else, is why I love Snow Crash so much. It is rare, unique, and a thrill to read, and I would reccommend it without reservation to anybody.",2001-01-27
US,45578555,R3OWNJN1WR5Y71,0553380958,445913,"Snow Crash",Books,3,3,4,N,N,"Fun at first, but plot fizzles","This is my first experience with Stephenson, and the first 50 pages had me grinning like a mental patient. The images come to life, the scenes are deftly described, and the Metaverse unfolds spectacularly before your eyes.<br />But for all the flash and promise at the start, the plot is oddly and disappointingly weak. Utterly predictable and hopelessly cliched, the characters never develop, never show any motivation as to why they are doing what they do. Relationships are not explored past the superficial. The relationship between Hiro and Juanita and the reason he risks his life to go get her is explained off with a Sumerian myth. Ridiculous.<br />This novel is a fun diversion, and entertaining for the first 100 pages. After that, you are on your own.",2001-01-24
US,51177659,RBR3267ONJPHE,0553380958,445913,"Snow Crash",Books,5,5,9,N,Y,"Completely Engrossing, This is Best of the Best Sci-Fi","I started reading Snow Crash towards the tail end of a long flight, although I was sitting towards the front of the plane I was the last one off, as I simply couldn't put it down. This book has everything, great characters, ancient legends, sword fights, fantastic and realistic weapons, incredibly cutting edge technologies, romance, a super-internet where one can walk and talk, inter-family blood feuds, bullet bikes, skate-boarding couriers, the Mafia, hackers, first rate super villains, a floating city and nano-technology.  One could fill this review with cursory mention of all of the incredible things that the author has managed to work into this book.  The treatment of these topics is not light either, but there is real thought behind it.  The author did his homework, talking with many authoritites before introducing cutting edge topics, and it pays off. It really is one of the best pieces of science fiction I have ever read.<br />This book is not just a great piece of Sci-Fi, but it is good literature too.  The story is written around solid characters and a very interesting plot, it just so happens that it takes place in the future.  There are many interesting characters, although the book does focus around the actions of Hiro Protagnoist and Y.T.  Those other characters are all incredibly interesting , with their own motivation and purpose in the story.  They interact with each other in many ways, but always consistently, keeping the pace lively.  Mr. Stephenson's characters are deep- even when he writes in the first person as a super-bioengineered dog his characters are consistent and interesting.<br />The plot is top-notch, with the focus being Hiro, a hacker and swordfighter (yes, this is believably explained), and his sidekick, YT, a futuristic skate-boarding courier, are forced to unravel a mind-controlling virus that threatens the planet.  This requires him to move through the Metaverse (the super internet of previous mention), and California of the near future, including adventures on a floating raft, gun boats, romance, sword fights and more.  The action is non-stop, and it is done in a rich and colorful universe that is believable and engrossing.<br />I can't recommend this book enough.  It is fantastically entertaining and thoroughly thought provoking.r future, including adventures on a floating raft, gun boats, romance, sword fights and more.  The action is non-stop, and it is done in a rich and colorful universe that is believable and engrossing.<br />I can't recommend this book enough.  It is fantastically entertaining and thoroughly thought provoking.",2001-01-23
US,50104487,R1J064688FTKHE,0553562614,445913,"Snow Crash",Books,5,1,3,N,N,"See below","This is a great book. Buy it, it is good.",2001-01-22
US,52897083,RDDVNXLGSXSZQ,0553380958,445913,"Snow Crash",Books,4,0,0,N,N,"Great sci-fi book for anyone!","This is an awesome, sci-fi, thriller which is more about today than the future. The hero (his name is Hiro) is a lively character as is everyone else in this book. I don't usually enjoy science fiction but this book was a big exception and came highly recommended to me by many friends. I am sure this will be made into a major movie.",2001-01-15
US,51925879,R1AJXAI2I46AZA,0553380958,445913,"Snow Crash",Books,5,0,1,N,N,"Amazing...","This book is an incredible journey into the future of the Internet and corporate America.  Join Hiro Protaganist on his quest to make the 'Net safe for hackers everywhere!  You won't be disappointed!",2001-01-05
US,48515670,R1MNHI0SWGBP0Q,0553380958,445913,"Snow Crash",Books,4,0,1,N,N,"A great read","Stephenson is at once realistic, sarcastic, and strangely humorous.  Snow Crash is my favorite of his books and allows much of his wit to shine through.  Set in a nearer future than Diamond Age, Snow Crash is primarily about the use of virtual reality.  It is a fascinating, intricate book, and is slightly more focused than Diamond Age.  This book might be the easiest introduction to Stephenson's work as it is less complicated than either Cryptonomicon or Diamond Age and a quicker read than Zodiac.  The ending, as is often true of Stephenson, is a little abrupt and not altogether coherent, but as is also usually true with his work, this does not detract too much from the overall experience.  A must read.",2001-01-03
US,53003891,R3H7CGIXPM02T,0553380958,445913,"Snow Crash",Books,5,0,1,N,N,"Attention to Detail","Stephenson loves details, and this book is full of 'em. Every single thing in this book, from the pizza deliveries to the metaverse to the orign of a deadly virus, everything in this book is detailed to perfection. Stephenson's description of his post-modern world is truly quite amazing.<br />The characters are also quite great, but perhaps not as detailed as the environments themselves. The relationship between Hiro Protagonist (the coolest character name ever, btw) and Y.T. is never really explained, and you sometimes wonder why they even help each other out. Their whole relationship seems to be not based on of loyalty or much less friendship, but one of being there at the same time. They're never aware what the other one is up to until they run into each other. But it actually makes for a few laughs and unpredictability.<br />You can't go wrong with Snow Crash. It's an easy read, entertaining and even informative. You'll be wanting to read it again right after you finish it.",2000-12-16
US,52701643,RF4JJW6SA75VH,0553380958,445913,"Snow Crash",Books,5,3,3,N,N,"Where's the Metaverse Movie?!?","I'm an ex PC 3D Graphics Product Manager weasel and I used to muse about a 3D internet as THE application that would someday consume the 3D rendering power on the product roadmaps of graphics companies. I'd argue that the most intuitive human interface is three dimensional, so it will just be a matter of time before it is so on the net. I had 3D web dreams, but those paled in comparison to the Metaverse in \\""Snow Crash.\\""  It is astonishing that this book was written back in '88-'91. What a vision! There are equally compelling futures for the Library of Congress (&quot;...people are not entirely clear what the word &quot;congress&quot; means...&quot;), skateboard wheels, pizza delivery and the interstate highway system. Wow.<br />Where is the \\""Snow Crash\\"" movie? It would be a mosh of \\""Black Rain\\"", \\""Blade Runner\\"", \\""The Matrix\\"", \\""Star Gate\\"", \\""Total Recall\\"", \\""Brazil\\"",  and \\""The Sopranos\\"". Yes, the book gets a little deep in Sumerian languages and pre-monotheistic religions, but if you find those topics interesting too (I do), this book has the potential to sweep you off your feet. Overlook the little errors or annoyances and see the big picture. One of the three best books I've read this year.",2000-12-15
US,46526623,RRSKZDNJ4O341,0553380958,445913,"Snow Crash",Books,3,1,3,N,N,"Interesting, but wordy","Well, like most of the 350-something reviews say, the book starts off great but loses more and more momentum as time goes on, until it's just kind of dragging you along. Several interesting ideas are presented in it, with the corporate suburb-states the United States has splintered into, the Metaverse in general, and the hyperinflation of the dollar bill, so that Y.T. actually pays 745 billion once as a bribe to cops. However, instead of expanding on any of these ideas, Stephenson goes off on wierd trips through mythology.<br />Thus, we never get a real feel for the relationship between Y.T. and Hiro, we never learn how the U.S. came to be as it is in the story, and we never learn why the nuke doesn't go off when Raven dies. That, and I admittedly thought it a bit much to try and show the degeneration of morals by having ever male character in the book except Hiro salivate over a 15 year old girl. Even the (supposedly) good guy Mafia men tend towards this, and the little scene with Raven and Y.T. was just disturbing.",2000-12-13
US,51031013,R3RENUFOH7H02S,0553380958,445913,"Snow Crash",Books,4,6,7,N,N,"Cyberpunk Becomes Funny","In a future America where everything is for rent -- the Army, the Police, the Highway system -- and the only thing that works efficiently is pizza delivery (because it's monopolized by the Mafia) Hiro Protagonist is a freelance hacker who also happens to be the only one standing between the computer-based Metaverse and a horrible new drug called Snow Crash. As if this isn't enough, he owes the Mafia the cost of replacing the pizza delivery car he wrecked, and he has to pull Y.T.'s fat out of the fire after the Skateboard Kourier delivers his last pizza for him, saving him from the punishment of the Mob. <br />If you go down to Silicon Valley and ask anyone wearing this year's model of pocket protector, I'll bet you even money they're there because they read Snow Crash. This book saved the dying cyberpunk genre by giving it a sense of humour. Besides, though the term &quot;cyberspace&quot; comes from the writings of William Gibson, the current concept of cyberspace comes from Stephenson's vision of the Metaverse. Every geek in the Valley read this, and many of them are computer-hacking now because they want to grow up to be Hiro Protagonist.",2000-12-10
US,53086925,R2W4SDIX3ER4VC,0553562614,445913,"Snow Crash",Books,5,1,2,N,Y,"What can I add?","What can I add to the other 363 reviews? Which, btw, I haven't read... most likely, nothing. Still, this is one of the most important books in the post-cyberpunk genre, so I'll add my bit, for whatever it is worth.<br />Cyberpunk, as seen in Neuromancer, is reputed to be dead. There is certainly a difference in perspective between this book and the cyberpunk genre, but also a lot in common. Cyberpunk universe is decadent, without hope, and it's successor is not.<br />You'd have a hard time telling that from this book, though. Certainly, institutions and values we are taught to cherish have all gone awry or simply away in here. And the insane speed with which life happens, the cacophony resulting of a million cultural groups clashing, is all the more depressing in the way it feels familiar.<br />But there is a subtle undercurrent that paints all this not as decadent, depressing, but as vibrant and alive. And there is hope.<br />The story is typical of the cyberpunk genre. Male uber-geek and female street samurai companion save the world from itself, without the world ever noticing it. It is well crafted, and a definite page-turner. And is definitely an essential read for any cyberpunk fan.",2000-11-30
US,49276864,R21PAJ1UWVBREJ,0553380958,445913,"Snow Crash",Books,4,0,1,N,N,"Heck of a read","_Snow_Crash_ is definitely deserving of a purchase.<br />While the book is hardly the best work of its author, and while there have certainly been better cyberpunk novels, this one stands out for its sheer humor.<br />While most cyberpunk novels are darker than dark and are devoid of spirited characters, Stephenson proves that one can be comical and still stay true to the genre.  Things as diverse as linguistics, Sumerian mythology, and pizza delivery are linked together (much to some readers' distress) to form a tapestry that stands alone in cyberpunk.<br />Albeit, this novel is not a light read, it is certainly easier fare than Stephenson's best novel to date _Cryptonomicon_.  If you want to give Stephenson's work a try or are just looking for something entertaining, this is your book.",2000-11-12
US,50104487,R3U5L1O6PKIEHX,0553380958,445913,"Snow Crash",Books,4,2,13,N,N,"Really Good","This is not your normal sci-fi book. It is really good and diffrent, because it has sveral cool aspects, like a cyber universe,ect. i think that you should buy this book. But dont take my word for it, read the other reviews. :-) (But say mine was good) hehe",2000-10-14
US,51309823,RFHUK4367QPA8,0553380958,445913,"Snow Crash",Books,4,3,4,N,N,"Sci-fi punk piece greater than the sum of its parts","&quot;Snow Crash&quot; is often cited as science fiction's answer to &quot;Pulp Fiction.&quot; Like that movie, its creator is far more interested in providing speedy impressions than having a consistent through-line. In this case, however, Stephenson has actually created interesting characters, from Samurai-cum-hacker/mafia pizza delivery boy Hiro Protagonist and his sometimes-faithful sidekick Y.T. to super-badass Raven, battling it out in a bizarre pseudo-post-apocalyptic Earth.<br />If Stephenson's ramblings take a turn for the bizarre (What WAS the point of all the Sumerian mythological stuff, other than to show his obscure interests?), or his science gets occasionally inconsistent or laughable (A black-and-white computer image bitmap which scrambles hacker's minds because their neurological backgrounds establish binary pathways in their brains? Puh-LEEZE! And exactly how do people interact with their computers to utilize the Metaverse? do they enter commands at a keyboard, or what?), at least the ride is exhilarating, and the plot pacing highly enjoyable. Hang on, and have fun.",2000-10-05
US,49622423,R1M4JVPLYVYCYD,0553380958,445913,"Snow Crash",Books,5,1,2,N,N,"More great cyberpunk","After reading some of William Gibson's books, I found Snow Crash.  I was glad I did.  Much was very similar (which is also good), but Snow Crash keeps its own identity.  The story revolves around one of the founders of cyberspace as it exists in the book, who also happens to be quite good with a katana.  The mixture between cyberspace and martial arts is very interesting as the main character exhibits some of the trademark characteristics of a samurai, but perhaps more of a fallen one.  <br />The plot is pretty good.  It too mixes cyberpunk with mythology, reaching back to ancient themes, not common to western culture, and mix them seamlessly with the current technological world.  <br />The world Stephenson creates is quite intriguing.  Nations no longer really exist, just large corporate territories, to which people can obtain citizenship.  This is a great world and a great story.  If you enjoy anything by Gibson, you'll like this as well.",2000-09-30
US,53072565,R1ENZ6F7Q63S65,0553380958,445913,"Snow Crash",Books,4,0,1,N,N,"Brilliant book but could have been better","On one level this book deserved 5 stars. The whole concept and vivid description of the Metaverse was great. The interlinked plot about the Sumerian language, the tower of Babel, and the Post Modern virus &quot;Snow Crash&quot; was powerful, mind-stimulating stuff. Its just a pity the author didn't focus on the virus more, and got caught up instead in the continual diversions of &quot;special effects&quot; such as the endless skateboarding antics of a 15 year old.",2000-09-29
US,52351823,R84TW0PQPMU46,0553380958,445913,"Snow Crash",Books,5,32,41,N,Y,"Buy this book","Have your friends buy this book, then steal it and make them buy it again!<br />Seriously.  Stephenson is great at illuminating the world of the hacker.  This book does so, but not the overly self-aware coolness associated with Cryptonomicon or Heavy Weather (by Bruce Sterling).<br />It's fun, it's never serious - even when someone is trying to destroy the world - and it makes you turn the pages.<br />I read a lot of science fiction, and am a rabid Gibson fan, and when I read this book, all I could say was 'cool'.  The world, and the cyberworld.  The arcane references to the Sumerians.  Da5id. My personal favorite, Sushi K. <br />And of course, Hiro Protagonist - freelance coder, swordmaster, information seller and pizza deliverydude.<br />Remember, Americans do 4 things better than anyone else: music, movies, microcode and pizza delivery.<br />And the position of baddest mother is taken.<br />Piques your interest?  You'll like Snow Crash.  Think the attitude is childish?  Pass this book up.  Read Zodiac instead. Or Diamond Age.",2000-09-26
US,52630283,R3UHON1X82AA25,0553380958,445913,"Snow Crash",Books,5,1,3,N,Y,"One of the greatest Cyberpunk books ever!","This book (Snowcrash) is one of the best Cyberpunk books Ive ever read.  The story is action packed and funny!  The pages turn themself and I  couldn't stand to put the book down.  If you like futuristic,  virtual-realty based stories, then this book is for you!!  Neal  Stephenson's greatest book to date!! (ive only read one of his other books;  Cryptonomicron)",2000-09-10
US,48700940,R1C4I5I35S2GX1,0553380958,445913,"Snow Crash",Books,5,13,16,N,N,"superbly imagined and entertaining","It's difficult to say anything about this brilliant book that hasn't  already been mentioned in the other reviews.  Suffice to say, this is a  brilliant cyberpunk novel.  Descended from William Gibson's genre-making  &quot;Neuromancer&quot;, &quot;Snow Crash&quot; is an entertaining,  wild-eyed look at the near future, but is not as bleak, either in writing  style or imagination.  The three strongest points to make about the book  are its plot, characters, and pure imagination.  The first half of the book  is an introduction of the characters and the discovery of a technological  and biological virus named Snow Crash, which a person can get through  blood, exposure, or by looking at diseased data in the Metaverse, a kind of  populated, mall-like cyberspace.  The last half is a mad, action-filled  rush to the conclusion.  It has enough action to keep a thriller fan happy  but requires plenty of brains to follow the origination of Snow Crash,  which moves from Sumerian myth to populist religion in modern times.  The  idea is completely hair-brained, but somehow Stephenson makes you want to  believe in the possibility of what he writes, which belies his talent.   Secondly, his bizarre assortment of characters like the attitudinal skater  Y.T., the cool but psychotic Raven, and the familial mobster Uncle Enzo  populate a world strange enough to belong to the Twilight Zone, but  frighteningly familiar.  There's not much substance behind the characters,  including the aptly-named Hiro Protagonist, but they make up for it with  style.  Stephenson's imagination links his plot into the environment of an  imploded USA, most of which is pure fiction that couldn't happen in the  next twenty years, if not longer.  Still, what they lack in reality is made  up for in hilarity.  His look at the possibility of Mafia-run pizza  delivery and what's left of the government are hilarious!  Add that to an  image of cyberspace VR intertwined with the mall-going culture, and you  have a wild ride through a nearly-insane world.  All in all, this is a  fabulous book, and even if the characters and plot aren't so deep, the  sheer power of Stephenson's imagination and humor shoots it into the  atmosphere.",2000-08-25
