US	51659951	R2UO7E2A74H185	080213422X	640122618	The Painted Bird	Books	1	17	45	N	N	For Shame	It's extremely unethical and irresponsible for Amazon to be passing this book off even as &quot;semi-autobiographical&quot; in order to sell it. <br />  <br /> I myself was taken in by this story when I read it, believing, as Kosinski wanted everyone to do, that it was based on his own experiences. <br /> As it turns out, the only authentic elements in this book are names of people who in fact cooperated in protecting his entire family. The plot and incidents described are possibly borrowed, but most likely invented out of whole cloth. See &quot;Steps&quot; for a taste of Kosinski's interests and imagination, or see Sloan's biography -- which also corrects the record regarding Kosinski's war-time experience. <br />  <br />	2004-08-01
US	23046695	RLV6FIWMLTOHQ	080213422X	640122618	The Painted Bird	Books	1	18	45	N	N	Fraud - fantasy passed off as history	This book is mostly lies, and I don't mean the subtle kind common in such works - I mean flat out fabrications and inventions.  It isn't worth a real review.  For G-d's sake, if you must read it, check it out from a library or buy it used.<br />If you don't believe me, check around, that's what Google is for.<br />This fraud, Kosinsky, defames all those who suffered in WWII with his shameless gold-digging.	2004-06-20
US	32987921	RKU7YLP985NEG	080213422X	640122618	The Painted Bird	Books	5	10	19	N	N	Morally irresponsible to candycoat	There seem to be a lot of people out there who feel that life is all bunnies and flowers, and anything that isn't should be hidden away or candycoated.  This book takes place during an era which is morally irresponsible to candycoat.  How else do you get across the horrors that truly took place in most of Europe throughout WWII without seriously insulting and compromising not only truth, history, and reality, but also the memories of those who perished as well as the aging members of that generation who can never forget what they saw and experienced?  The awful things in this book, such as when the young plowboy literally loses his eyes, the scene the unnamed boy witnesses between Quail, Ewka, Makar, and the goat, Rainbow raping the beautiful young Jewish woman, or the pillage and rape-spree the Kalmuks go on, aren't in here to be titilating, but rather because things like that really did happen!  And what kind of disturbed person would feel aroused by any of the brutal sex and violence that take place through the book?<br />Some people dismiss books about WWII and the Holocaust because there are so many of them and they feel that after awhile, it's just repeating the same story over and over again, only with different names and locations.  But this book is rather unique in the genre, in that there isn't one single scene in a death train, death march, ghetto, camp, not even the front lines.  It's told by an unnamed young boy, only six years old when the Nazis invade his native Poland, who is shuttled from caretaker to caretaker.  We don't even know if he's Jewish, a Gypsy, or neither.  From hostile village to hostile village he goes, usually because he's been chased out by either the villagers themselves or the often cruel people he's been staying with.  He learns early on to survive by his wits, in a superstitious world gone even madder with war.  As an innocent, he cannot understand what is truly going on all around him, so there is none of the inner emotional and psychological turmoil we often see in other books about this time period.  He finally comes to discover that being nice, staying out of the way, even constantly praying, didn't help him one iota.  When he witnesses the scene between Ewka, Makar, Quail, and the goat in the barn, he realises what it means to be in league with the Devil and what evil is.  The boy now knows that being nice didn't get him anywhere, and the only people he's been around who got things accomplished were evil, so he decides he must become evil too, become like one of his oppressors in order to succeed.  It's understandable, given that he can barely remember anything but evil and suffering.  And already he's become so traumatised by all he's gone through that he has just shut down and become a mute, though of course he's far too young to realise the reasons why that happened to him.  And when the war finally ends, he has become so used to being evil and on the run that he doesn't know how to adjust to a normal life again, one of the great tragedies of any war.<br />I don't know enough about the man to know whether or not Jerzy Kosinski was indeed guilty of plagiarism or lying about his life history, and if so, how much or how little, but that doesn't change the fact that this is a work of fiction, perhaps loosely based on his experiences as a young boy during the war.  I'd see where critics get off had this been billed as a memoir, or a work of fiction said to be strongly based on his own life, but it remains a novel.  If this is a fraud, then every fictional account of a historical event that really happened is a fraud too, as well as novels loosely based on something that may have happened in the author's own life.  It's a powerful, moving, unforgettable book, whether it be fiction or partial autobiography.psychological turmoil we often see in other books about this time period.  He finally comes to discover that being nice, staying out of the way, even constantly praying, didn't help him one iota.  When he witnesses the scene between Ewka, Makar, Quail, and the goat in the barn, he realises what it means to be in league with the Devil and what evil is.  The boy now knows that being nice didn't get him anywhere, and the only people he's been around who got things accomplished were evil, so he decides he must become evil too, become like one of his oppressors in order to succeed.  It's understandable, given that he can barely remember anything but evil and suffering.  And already he's become so traumatised by all he's gone through that he has just shut down and become a mute, though of course he's far too young to realise the reasons why that happened to him.  And when the war finally ends, he has become so used to being evil and on the run that he doesn't know how to adjust to a normal life again, one of the great tragedies of any war.<br />I don't know enough about the man to know whether or not Jerzy Kosinski was indeed guilty of plagiarism or lying about his life history, and if so, how much or how little, but that doesn't change the fact that this is a work of fiction, perhaps loosely based on his experiences as a young boy during the war.  I'd see where critics get off had this been billed as a memoir, or a work of fiction said to be strongly based on his own life, but it remains a novel.  If this is a fraud, then every fictional account of a historical event that really happened is a fraud too, as well as novels loosely based on something that may have happened in the author's own life.  It's a powerful, moving, unforgettable book, whether it be fiction or partial autobiography.	2004-05-18
US	26915713	R8AGP6JQXXRGI	080213422X	640122618	The Painted Bird	Books	5	3	9	N	N	Bizarre, Kafkaesque	After I read Painted Bird, digested it and read it again I was awfully excited about Jerzy Kozinski.  Painted Bird is about the human condition, set in a time and place where the human condition had the whole spectrum of opportunities to manifest itself.  Kozinski's perceptions of humanity are poignant, surgical, honest and brutal.  I love this book.<br />After reading it I attempted other Kozinskis as they emerged and found that all fell completely flat for me.  This one's in a class all its own, in my view.	2004-05-12
US	35982054	R27NEAVTSLNH6G	080213422X	640122618	The Painted Bird	Books	5	0	4	N	N	Lone Pole on the Run From the Gun	This book might not be for you.  Jerzy paints some wondrous pictures.  Some people will say they're gross, offensive. Probably; but in my opinion The Painted Bird is probably the greatest single journey made by an unlikely hero (next to Cozzen's Castaway, and Greene's Power and the Glory).  Sometimes artwork isn't the easiest thing to swallow, but mouthfuls like this are definetly nutritious.	2004-05-04
US	20239306	R22KSKW5B4XFAW	080213422X	640122618	The Painted Bird	Books	5	13	19	N	N	Unsentimental	It's always irritated me when people talk about the Nazis and the period of the Second World War in general as though they were some kind of abberation, an inhuman evil which is rarely witnessed. As Kosinski shows us, cruelty is intrinsic, and any moral or lesson drawn by historians pales when compared with the incomprehensible reality of an event. The Polish villagers misreat the protagonist viciously while a Nazi soldier actually takes pity on him; rather than finding relief on his return to society, he is disgusted and coddled by it. The only largely good characters in the novel, the Russians, constantly harp on the goodness of Stalin (and we know the truth). World War Two may be more complex than anyone can ever show, but Kosinski admits that complexity as not many people have attempted to. I was surprised, also, by the sympathy that Kosinski develops for the protagonist. The kid is _tough_, simply, and there's something very endearing about it; also, the way he constantly tries to figure out the world, throwing in his lot with God, and then with the Devil, and then with the communists, is extremely relatable; it's the sort of conflict any child goes through. Viewed from a certain angle, it's just an incredibly twisted coming-of-age story.	2004-03-17
US	39947025	R1TFRFNSRZMKVF	080213422X	640122618	The Painted Bird	Books	3	4	14	N	N	lots of holes	I have to confess, first off, that I didn't read this entire novel. In fact, I stopped at about chapter 6 or 7. I'm an avid reader, and usually don't mind long I.E. five hundred plus paged books. Perhaps I have no imagination, but the main reason I forebore to read the rest of this, is that there were too many unanswered questions for me, most importantly, how does this boy (we never learn his name) escape from each of his cruel caretakers? The author never shows him actually running away from the villages, except for the first one, and it's never made clear how he spends his days, or why certain people take him in, and others couldn't be bothered. I don't despise this book, but I'm definitely not a fan of spare writing, and this thing's certainly full of that. The violence and hints of deviant sexual behaviors weren't extremely off-putting either, although that long description of the gouging out and disposing of a youth's eye was more than a little nauseating.	2004-02-18
US	52869048	R3JBU9AQWCVTVQ	080213422X	640122618	The Painted Bird	Books	5	0	14	N	N	A response to Robert J. Crawford	He, Jerzy, did not die because of lies, but because of aging. He hated getting old.<br />The book, Painted Bird, is exceptional.	2003-11-09
US	51185140	R17SA7GGK7KI0E	080213422X	640122618	The Painted Bird	Books	1	14	38	N	N	I don't believe in book burning, but ...	... if I did, this book might top my list.  I made it past the story of the man spooning out another man's eyes and stepping on them, but when I got to the woman having a bottle of poop shoved up her and being kicked until it broke and then kicked some more -- that's when I gave up.  This is the most disgustingly graphic book I've ever seen, and it's not as if it had a plot to make up for it.  The whole point of the book (to where I read) seemed to be to shock the reader with wretched depictions.  No thanks...	2003-11-08
US	34449426	RRJJJI2MKW3WX	080213422X	640122618	The Painted Bird	Books	5	2	10	N	N	The title tells all!	It's been several years since reading this novel,but what I can say is that for the most part it was the title that helped define the book for me.Yes,it's a story about a young parentless  Jewish  boy that roams Eastern Europe during the second World War and does contain graphic depictions of somewhat gory scenes,but all to a purpose.The young boy is speechless and all throughout the story is encountering a variety of situations that is incomprehensible for someone his age,but still he struggles to define what surrounds him.The title in itself is very important for it is represented in the story.The youth encounters a bird catcher that uses the ploy of painting a bird of one species to capture that of a different species,which after discovering it's a painted bird pecks it to death.To me it was a metaphor for how the jewish population attempted to adapt to the harsh surroundings of the time period,but inevitably were sacrificed.Kosinski presents a complex portrayal of cruelty which unfortunately must be admitted as being a portion of the modern world where a holocaust has numbed us to the nuances of man's inhumanity.Kosinski's novel works on a variety of levels,but to me it is mainly addressing the question of identity and how one becomes defined by experiences.The novel is as complex as is the personality of Kosinski,who has written under several pseudonyms.The &quot;Painted Bird&quot; is a novel with very vivid descriptions that has a psychological hue to it that is unforgettable after reading!It can only help to broaden one's mental horizon and get a glimpse into another man's soul,be it ever so dark and brooding!	2003-10-17
US	31674918	RD6ZZ7C1QD1GN	080213422X	640122618	The Painted Bird	Books	5	2	11	N	N	An incredible story	The first time I read this book was as a summer assignment for a High School honors class.  It was either this or Agony and the Ecstasy that I wanted, and this was shorter, so I picked this one.  No one else did out of the hundreds of other titles they could choose.  I read The Painted Bird from start to finish, apalled yet enthralled by all this young boy went through.  You are pulled into this morbid odyssey and share his travels with him.  You experience the depravity and debauchery of humanity's darker side that cannot be ignored nor disproved.  We all know it's there.  This book does not allow us to hide from this theme, nor spares us from it by the tale's end.  The aftermath is at an orphanage, a microcosm of children no longer innocent after witnessing the atrocities of adults, suddenly placed into an ordered society and expected to assume a happy-go-lucky niche again.  It doesn't happen, it won't happen, and though by the tale's end, our protagonist seems to have a hopeful future, his past has been forever sullied with the smarmy truth that will always cast a dark shadow on all of his future, no matter how bright it may shine at times.<br />Anybody who likes to read should pick up this book and experience this.  It is seven years later, and I have since bought the book.  It has inspired me in my own writing style.  This is a true literary gem, a classic beauty despite the brutality it depicts.	2003-06-29
US	51063938	R1ELT9MW76HEBH	080213422X	640122618	The Painted Bird	Books	5	0	10	N	N	When people say 'peasant mentality'....	I read this powerful book as a young man and vividly recall <BR>its stark imagery of the cruel and mindless (sometimes<BR>gleeful) violence of rural Eastern Europe.  It helped me <BR>gain a sense of what people mean when they talk about <BR>backwards areas.	2003-06-25
US	52101719	R1004FGU993N8L	080213422X	640122618	The Painted Bird	Books	3	2	7	N	N	Not a weekend read	What makes this book so brilliant is the protagonist, an adolescent viewing his world through the pure, neutral eyes of childhood. Through him, the reader is forced to confront the nature of innocence, whether or not it even exists. The child becomes a microcosm for a world without order or structure, a place where laws are arbitrary and, often, brutally barbaric. <br />That being said, this is not a casual read. By buying, and subsequently, reading this book, you will be forced to confront issues and ideas that you might not want to deal with. <br />While this book may or may not be for you, do not deny its brilliance. No book has ever moved or shaken me the way this novel has.	2003-05-03
US	50369248	R1C7Y03KCT366H	080213422X	640122618	The Painted Bird	Books	4	2	9	N	N	Bleak, harrowing	Excellently written, evocative and compelling, this book is also fairly unique in its ability to capture and convey the absolute 7th ring of hell very convincingly, without allowing you to look away. A masterpiece, possibly the seminal work of holocaust literature. In later life Kosinsky was accused of being a fraud (the book obviously is not literally autobiographical) and he was described as ungrateful by the Polish villagers who are portrayed in the book so negatively. The 1st accusation was obviously ridiculously naive and rooted in jealous. The 2nd accusation is hilariously ironic. Read the book, you won't forget it.	2003-04-25
US	51643876	R3OQGSDHLKVYDO	080213422X	640122618	The Painted Bird	Books	5	3	11	N	N	"I knew that the ghost might never leave me..."	This book is necessary reading for anyone who is literate.  An exploration into the very depths of human depravity and an apt dissection of how war sheds all masks.  Haunting, revolting, and most definitely life changing this tale of a prepubescent boy abandoned by war will strip the scales from any reader's eyes.<br />Kosinski takes a bleak situation and denies hope at every turn dragging his young protagonist again and again through the razor studded halls of hell.  The sorrow and horror are tangible as bullets, leaving the reader intellectually shellshocked.  Atrocities abound, all too recognizably human.<br />After reading The Painted Bird it immediately went on my list of top 20 books.  For any who read this the outcome will always be the same:  YOU WILL HATE WAR!  Even more than you should now.<br />\\"I knew that the ghost might never leave me, that it might follow me, haunt me at night, seep sickness into my veins and madness into my brain.\\"	2003-03-19
US	48079090	R2QTM959D3IS6J	080213422X	640122618	The Painted Bird	Books	1	20	35	N	N	A putrid attempt at macabre storytelling	I read this book many, many years ago.  I have never stopped thinking that it is one of the most gratuitous pieces of fiction I have ever read.  It is disturbing.  What is also disturbing is that an individual would actually sit down and write it.  It is incoherent in its effort to paint a reasonable story.  It is a collection of perverted thinking.<br />It was not to long after reading &#8220;The Painted Bird&#8221; that I read &#8220;Last Exit to Brooklyn&#8221; by Hubert Selby.  There were many similar horrific and inhumane actions in this book but I could at least attempt to understand the basis for the behavior.  In Kosinki&#8217;s book there was no connection between behavior and reasoning, it is just a putrid attempt at macabre storytelling.	2003-01-24
US	52010263	R3J3NQTE06CP7J	080213422X	640122618	The Painted Bird	Books	1	15	37	N	N	not literature	There is no excuse for this book, which is basically a litany of every imaginary atrocity that man could possibly inflict on another man.	2003-01-22
US	36335396	R37NWLO8V69SMG	080213422X	640122618	The Painted Bird	Books	3	11	18	N	N	I was surprised	I have read much about the book before i've read it myself. Finally i got it and read in one day. And i was surprised - maybe the Polish version was different somehow from English one? First of all, in book i've read, the child is not Gypsy or Jewish. The peasants consider it Gypsy or Jewish, but we don't know anything about it, in fact, we can be quite sure (from the poems it knows) that it is child from Polish intelligentsia. <br />I've read this is anti-Polish book. It is not. <br />Peasants are not Poles (Just see the names: Makar, Anton, Olga - these are not Polish names). They are peasants from, i think, somewhere from Polesie considering description of landscape. They are not Catholic, they are both Catholic and Orthodox. <br />It is too cruel, i was tired by the end of the book by endless horrors, but it does show how evil can be as virus, as young kid became as cruel as those who were bullying it before. <br />Anyway, i just couldn't stop reading it - even when shrugging sometimes with description of Germans or Russians (only positive characters in the book). Just can't understand other people reviews. I guess they read different book.	2003-01-02
US	42087299	R18QU4C8SKTXYY	080213422X	640122618	The Painted Bird	Books	5	9	19	N	N	Not About Brutality. It's About Survival, And That's Moral.	Jerzy Kozinski's Painted Bird is a stunning & frank portrayal of the odyssey of a young boy, mistaken for gypsy or Jew, learning to survive on his own wits in Eastern Europe in WWII.<BR>It is often shocking & frequently raw, but above all of that, there is a shining glory because it aims to get the reader to examine their moral compass. You can't do that with a candied over book when you're talking about holocaust. This book will change you for the better if you let it & ignore criticisms from people who think that morality is only about painting a rosy picture. Kozinski wants to get a rise out of you with this tale, but for righteous anger, not titillation.<br />   This book and its author are frequently maligned for the most idiotic reasons. Whether it's the alleged \\"historical inaccuracy\\" charges, or the brainless snipes about it being sensationalistic exhibitionism and violence, none of the charges seem to get to the heart of Painted Bird, Kozinski's masterpiece.<br />   First off, the atrocities in the book that happen to the little boy are voyeuristicly described because Kosinski wants to place you up front as if a real war is going on, and you have to make moral choices. It's naked and it's brutal. Most people are expecting The Diary Of Anne Frank when they read this, and they want to be coddled & sheltered in an attic like that book, awaiting the atrocities in the company of family not knowing what's going on outside*. Kozinski doesn't do that. He puts you in a frame of reference of being in the war with immediate threat to life & dignity, all shown through the psyche of a little boy who represents the future of the world & what will happen to it from the conflict.<br />    Secondly, charges have been levelled against this book for it portraying the WWII peasants too cruelly. This misses the point of the book, of course. The author was trying to encapsulate the essence of ALL purges, ALL \\"ethnic cleansing\\", therefore it is about ALL holocausts from world history from the mongol hordes to Stalin to Bosnia & Hussein. People who nitpick over the book's \\"historical correctness\\" miss its MORAL correctness.<br />    The joy in reading this book has nothing to do with any of the lurid situations, but in seeing the boy learn to fight for his innocence & survive. Of course he doesn't come out unscathed and I think many people are angry with the author for not having a tidy finish. They shouldn't be; this isn't a whitewash job done as a lullaby Hollywood script, but an opinion about inhumanity. The holocaust wasn't a damn amusement park history recreation that we should observe from the safety of our cars. It was and IS possible. In this book, Kozinski is trying to make you highly aware of the ease with which it could happen to you, and he wants to shred your denial & complacency away. Some people don't like that because they've held on to their security blanket of ego too hard.<br />   For those of you unfamiliar with this book, read it. Yes, it may shock your conscience, but that is a GOOD thing. It may inspire you to bring some more humanity & compassion into the world for your fellow human beings. This book is NOT about despair & corruption & the wickedness of mankind, but about the fact that we can cope with almost ANYTHING if we try.<br />  And that's beautiful.	2002-12-06
US	37010568	R2K4JYHIV0MO44	080213422X	640122618	The Painted Bird	Books	1	20	36	N	N	Only descriptions.	An account of the bestial experiences of a child during World War II.<br />This novel is exhibitionist and cold. It only rarely transcends the descriptions of brutalities, sexual depravations and filth. Art is not the reproduction but the arousing of feelings.<BR>This is an anti-war and an anti-mankind novel, but the author was more interested in the depiction of obscenities. The books of the Marquis de Sade are masterpieces compared with this work.	2002-12-03
