US	50230169	R3A8PMF37Y4JLL	080213422X	640122618	The Painted Bird	Books	1	63	84	N	N	Beats You Senseless	Another village, another beating. The nameless child narrator of \\"The Painted Bird\\" is one unlucky person, and so are you while reading this inane exercise in page-turning masochism.<br /><br />The thin, episodic storyline follows a young homeless boy, of possible Jewish or Gypsy extraction, who wanders across the swampy, war-blasted ruins of Eastern Europe during the early 1940s. One step ahead of the Nazis, who he knows will send him to an extermination camp, the boy must contend with the inhumanity of local villagers who seem to have become morally distended by the carnage around them.<br /><br />That Jerzy Kosinski didn't really live the life of his character in this story shouldn't be held against him. Charles Dickens wasn't Oliver Twist, either, and no one calls him a fraud for that. Kosinski negatively portrays the people around the boy, by implication Poles though he doesn't say so directly in my edition, but no one in this book comes off well except the Soviets, oddly enough considering Kosinski was not a fan of theirs, either. Such a profusion of terrible things happen to the child that it beggars belief, but Kosinski may have written this, like his later novel I enjoyed, \\"Being There\\", as a pseudo-fable, so he gets a pass on that from me, too.<br /><br />What annoyed and angered me about \\"The Painted Bird\\" was that it managed to be both cruel and dull. Cruel, in the way it continually assaulted you from chapter to chapter with assorted horrors inflicted on animals and people alike, all reasonless and unmotivated. Dull, in how it never manages to be about anything more than this awfulness, not offering a shred of sympathy, to the point where you just don't care.<br /><br />The kid, to start with, is a cipher. Very early on, we see him play with a friendly squirrel. Then some mean children capture the squirrel and burn it. Later, the woman who has adopted the boy is also burned, though she was apparently dead already. That's all the back story we get before the boy goes on his journey, to be relentlessly abused and attacked everywhere he goes because his dark hair and features make him stick out. (Is this Poland or Sweden?) People die suddenly, violently, and rather spectacularly, so it's good Kosinski doesn't bother making you care about them.<br /><br />Every chapter introduces a new group of awful people, with Kosinski apparently striving to outdo himself every time in terms of brutality. Eventually he introduces sex to the equation, featuring farm animals and an incestuous family. For me the most outlandish part had to be the man who ties the boy in a room with a killer dog nearly every day for a period of months, in hopes the boy will relax and be torn apart.<br /><br />Here, and at other times, \\"The Painted Bird\\" crosses the line from tragic to comic until it becomes like Robert Stack in \\"Airplane!\\": \\"Have you ever been face down in the mud, kicked in the head with an iron boot? Of course you haven't! No one has! It's a dumb question! Skip it!\\"<br /><br />People in Eastern Europe did suffer, and die, in ways like those experienced in \\"The Painted Bird\\". But it's unlikely any endured their horrors in the assembly-line fashion presented here. Tragedy can seem much less to an outsider who sees just the darkness and no light, to the point it's not clear what if anything is being lost.<br /><br />Kosinski may have lived through the war in comfort, but \\"The Painted Bird\\" seems a product of authentic if misplaced feelings that could have been survivor's guilt. This might explain the novel's insane popularity after its 1965 publication - a lot of readers felt the same guilt. Also, Kosinski's book was a bracing challenge of societal norms and a celebration of the persecuted outsider - \\"the painted bird\\" of the title sent out by a cruel master (society? God? parents?) to be pecked to death by its own kind. Any other decade but the 1960s, and you would never have heard of it. Instead it was taught at my boarding school.<br/><br />Great literature has the license to make you feel pain. But making you feel pain does not make a book great. \\"The Painted Bird\\" is an exercise in cruelty no one should have to endure.ing you feel pain does not make a book great. \\"The Painted Bird\\" is an exercise in cruelty no one should have to endure.	2009-12-14
US	12503184	RBR9WYRAZLWHL	080213422X	640122618	The Painted Bird	Books	5	2	5	N	N	Painted Bird, disturbing look at the real side of war	No book can come close showing the horrors of war and the evil actions and impulses of people that exist everywhere as does 'The Painted Bird.' I read it as a teenager for a required English project for a very progressive English teacher's class.   I was very impressed with the truth of the book, the horror that people endure at the hands of their fellow man in every civilization.  It spoke to me, as a child of a very dysfunctional family who had witnessed violence in my own home.  My father was a WWII veteran and I believe that this experience ruined his psyche and did not allow him to maintain a decent, loving relationship throughout his life. It is not for the weak of mind, those easily impressed, or for someone seeking thrills.  For them, stick to the horror movies and the monsters under the bed.  This book is for those who want to face the truth of the horror that exists under the thin veneer of civilization in our society.	2009-07-09
US	29881753	R1OMDXPM2PLGYL	080213422X	640122618	The Painted Bird	Books	5	1	3	N	N	Poignant	This book is definitely not for the faint of heart in its portrayal of the brutality of a world at war.  The disturbing images paint a dark portrait of humanity as an unnamed boy drifts from village to village in Eastern Europe.  From backwater superstitions to the persecution of anyone different, this boy witnesses some of the most horrible atrocities, which transform him body and soul.  It is an incredible portrayal of life in the remote villages of Eastern Europe while the war wages in the distance.  While I wouldn't recommend it to many people due to its graphicness, I would insist that it be treated as a classic piece of literature and a poignant study of (in)humanity.	2009-06-24
US	52965119	RRCXOXWM741AW	080213422X	640122618	The Painted Bird	Books	5	4	6	N	Y	Questions and themes for directed reading	I REGULARLY TEACH THIS CLASSIC IN A COURSE ON HOLOCAUST IN TEXT AND IMAGE.  I note that, like most of my students, very few reviewers here understand the allegorical nature of the work, nor are they interested in the structure, language, and literary merits.  So let me share with you the handout I give to the students (university level)    Some Questions for Directed Reading and Class Discussion:    This book has become a classic in the literature of the Holocaust, which does  not mean, of course, that is beyond critique.  It has a certain contested pedigree (as you will read in the epilogue to the book by the author, now deceased)    1.  It is representative to some extent of many survivor memoirs in which individuals (and even families) hide out on the other side, in both urban and rural settings, including those who were children at the time, alone and on their own.      2.  Yet the book is also the most \\"allegorical,\\" the most \\"symbolic\\" of the works we read  in that it is meant to focus questions of the Holocaust on what it means to be \\"other\\" in society and it plumbs the imaginative depths of evil in new and memorable ways.  Note that the boy is never named.      3.  It also takes up the theme of childhood and the child as victim to explore more radically and with greater shock the effect of the Holocaust on our notions of the foundations of society and the nature and range of human behavior.  You might compare some aspects of the book with Burned Child Seeks the Fire.      Some questions to consider while you are reading.    1.  What is the nature of the child? What is the role of education, learning, moral values, and making sense of the world?  The nature of perception?  The desire for survival?      2.  How and in what ways does the work treat the relationship between nature and culture?  What do you make of the role of plants, animals, natural elements, seasonal changes, etc?  What are the uses of landscape as an essential conveyor of meaning(s)?  Are these relationships stable or do they shift back and forth throughout?  Note especially  the uses of the four primal elements: earth, air, fire, and water,       3.  How does the book work as a whole?  As a narrative of \\"coming of age,\\" what can you say about the organization of episodes?  Do they make any kind of progression?  Can you look back after reading (or as you go) to see whether you can make sense out of the structure of the book and its sequence of events?  How, for example is the \\"dialogue\\" between Christian and Jew conducted in the book?  More pervasive still is the issue of gender, of male and female relationships, and of parental figures (both maternal and paternal).  Do his role models evolve?  What in your opinion are the decisive turning points in the child's evolution and where might these lead in your understanding of the work?      4.  How does the author approach the problem of representing atrocity?  What are some of the techniques he uses to bring us into that \\"other\\" zone of unspeakable experience?  For example, What are some of the repetitive themes?  What role does metaphor(s) play in the work and what are some of the leading images? How do you read the questions of of silence and speech?  And what are the relationships between sex and violence?      5.  What episode (or at most, two episodes) seem to you to be the most powerful in the narrative and why.    6.  What do you make of the ending?	2009-06-02
US	32528702	ROQRXDWSRTCLM	080213422X	640122618	The Painted Bird	Books	5	0	2	N	N	Not for the sensitive or faint of heart	Savage, terrible, beautiful, challenging & exquisitely written, this is the finest novel I have read.      Warning:  if you are so inclined there is much here find offensive or off-putting including rampant sexual violence.	2009-03-10
US	52559022	R31GVFFV74ANYD	080213422X	640122618	The Painted Bird	Books	5	4	4	N	N	Couldn't finish it...	I read the edited version back in the 70's.<br />This is the first and only book I could not finish.The brutality and evil the child in the novel(it's not clear if the child is Kosinski,or a compilation of experiences he  or others witnessed) witnessed during the war was too much for me to take.I have attempted over the years to finish it,but have not been successful to date.<br />Mr.Kosinski wrote with deep,scarring emotion. And I couldn't  finish his testimony to what depths the human soul can sink.<br />The off-handed,even nonchalant way in which these horrible acts,whether towards humans or animals,were carried out was too much for me to take. I am a coward.I admit it.There is only so much brutality the reader can take.Having said that,this book still stands as one of the most unforgettable books about the Holocaust,and one that should be read by someone who can stand it.I'm not that person,but I will tell you what:Even though I only read less than half the book,the behavior of the monsters was enough for me to make sure that I would not stand for cruelty,to humans or animals,and I stuck to it.<br />I can write no more of this book.I will only ask that you give it a chance.I'm still trying.	2008-11-12
US	51789784	R22MNI15DRSJMT	080213422X	640122618	The Painted Bird	Books	4	1	4	N	N	Spectacular...and more...	I had this book on my old list of college fiction, which i'm re-reading again before i turn 50.  It's an incredible book, one of the best i've ever read (in my personal 'Top 10').  I'm shocked at so many bad reviews, and bad reviews of the author - per se.  As far as a well-written book, it's incredible.  You feel as if you ARE the boy, traveling thru the villages.  All of your senses come to life, and you live as he lives.  That - to me - makes for a spectacular book, AND writer.  Not whether there are some graphic parts in it or not.  And YES - there are - so i 'only' gave it 4 stars because of parts that may bother sensitive people, including myself.  But as a piece of art, it's totally amazing.  A part of literary history that i'm very glad i read again, and experienced.  A masterpiece.	2008-10-12
US	39169752	R3CMOQPGQM40NT	080213422X	640122618	The Painted Bird	Books	3	4	8	N	N	A Good Story, No Doubt, and a Series of Polonophobic Tall Tales	Although oversaturated with sex and violence, this Holocaust fiction is full of adventures, sensory expressiveness, victimhood, dealing with trustworthy and untrustworthy adults, the drama of hiding and escaping, etc.<br /><br />The reader is led to believe such things as (review based on the 1965 edition): Jerzy Kosinski (Lewinkopf) living in an orphanage (p. 195), wandering from town to town, repeatedly beaten by adults with loss of teeth (13, 103, 200), pushed by boys into a mud puddle (p. 80), thrust into an ice hole while ice skating to be drowned (pp. 142-143), thrown by shepherds into a fire (p. 85), tied to a horse and dragged (p. 121), and losing his voice while being thrown into a manure pit (pp. 123-124). None of these things ever happened! Want to know what actually did? See the detailed English-language Peczkis review of [[ASIN:8385458042 Czarny ptasior]] (THE BLACK BIRD-MONSTROSITY).<br /><br />Jews would rightfully be displeased if a popular fiction-masquerading-as-fact defamed them, especially if it was read in schools by impressionable children and teens. So why shouldn't Poles feel the same way? Note that anti-Polish fiction is still anti-Polish, just as anti-Semitic fiction (e. g., THE PROTOCOLS OF THE ELDERS OF ZION) is still anti-Semitism. The popularity of the book makes it especially harmful. So is the fact that 99% of English-speaking readers know virtually nothing about the actual situation in German-occupied Poland.<br /><br />Faithful Catholics are portrayed as ogres who would eagerly drown a child in excrement for accidentally dropping a missal. Misconceptions about indulgences are furthered, portrayed as they are as some sort of \\"Brownie points\\" with God, designed to bring fortune and avert misfortune. Negative Christian teachings about Jews are mentioned, but not the equally negative Judaic teachings about Christ and Christianity.<br /><br />This work also aggravates blame-the-poor attitudes towards the peasantry. While peasants indeed were backward, this backwardness was primarily technological in nature. Most peasants were people of upright character, sophisticated in their own way. They owned no monopoly on prejudice, cruelty, or superstition. Unlike their detractors, they had to work very hard for a living.<br /><br />However, this book also has indirect long-term value. It reminds us of the ingratitude of many Polish Jews (not only Kosinski!) to the Poles who saved them. It advertises how the press is willing to publicize anything dramatic about the Holocaust, without first checking out its authenticity (and thereby causing more eventual damage to Holocaust memory than the tiny band of Holocaust deniers ever could). Finally, it serves as a sobering wake-up call not to believe uncritically Jewish accounts of Polish atrocities (most recently compiled in Gross' FEAR). Bearing in mind that the vast majority of these accounts lack corroboration, one can only wonder how many of them are Kosinski-style fabrications that tell us more about Jewish prejudices against Poles than about real events.<br /><br />THE PAINTED BIRD is best understood in the light of more recent works of the same genre. See the Peczkis review of [[ASIN:0788153250 Jerzy Kosinski: A Biography]].s was primarily technological in nature. Most peasants were people of upright character, sophisticated in their own way. They owned no monopoly on prejudice, cruelty, or superstition. Unlike their detractors, they had to work very hard for a living.    However, this book also has indirect long-term value. It reminds us of the ingratitude of many Polish Jews (not only Kosinski!) to the Poles who saved them. It advertises how the press is willing to publicize anything dramatic about the Holocaust, without first checking out its authenticity (and thereby causing more eventual damage to Holocaust memory than the tiny band of Holocaust deniers ever could). Finally, it serves as a sobering wake-up call not to believe uncritically Jewish accounts of Polish atrocities (most recently compiled in Gross' FEAR). Bearing in mind that the vast majority of these accounts lack corroboration, one can only wonder how many of them are Kosinski-style fabrications that tell us more about Jewish prejudices against Poles than about real events.    THE PAINTED BIRD is best understood in the light of more recent works of the same genre. See the Peczkis review of [[ASIN:0788153250 Jerzy Kosinski: A Biography]].	2008-09-28
US	19358453	RHXHQIOW77J3T	080213422X	640122618	The Painted Bird	Books	5	6	9	N	N	This is no bluebird on your shoulder...	A powerful, brutally dark novel, *The Painted Bird* is a masterpiece of 20th century literature whatever the prevailing critical/personal opinions regarding Kosinski and the many controversies that surround him may be. I'm not exactly sure how it gets the reputation as a Holocaust novel because the adolescent main character is neither Jewish nor sent to a concentration camp. He is, however, suspected of being a Jew, or, just as \\"bad,\\" a Gypsy, and under constant threat of being turned over to the Nazis as he roams, homeless, across a war-ravaged countryside populated by folks straight out of the Inferno.<br /><br />One can't read *The Painted Bird* as a realistic chronicle--that so many bad things could possibly happen to one person, even the unluckiest, is absurd. But as a \\"mythic\\" morality tale, as a kind of picaresque \\"everyvictim's\\" experience of man's inhumanity to man as specifically manifested during the Nazi Occupation of Europe, it is a profound and uncompromising and perhaps unparalleled tale of the suffering of the outcast and persecuted individual wherever, whenever, and whoever he happens to be in history.<br /><br />Kosinski spares us nothing as his young narrator passes from one horrendous scene of degradation to another. Perversion, superstition, ignorance, poverty, violence, disease, and death are everywhere among the peasantry through which Kosinski describes--and their counterbalance, ironically and appallingly, is in the godlike supremacy of the figure of the ultra \\"civilized\\" SS officer. This is a world in which Evil--both high and low--has the upper hand and the only safe place tobe is on the side that's strongest. It's a grim picture of life but one hard to argue against given the events of the 20th century and what we've seen modern man capable of doing. Those who like to point to the eventual triumph of good over evil at the end of WW2 are conveniently forgetting the horrors of Hiroshima and Stalin's Soviet dictatorship.<br /><br />*The Painted Bird* has the timeless, parable-like simplicity of the great Nobel prize-winning novels of yesteryear--when the prize generally was awarded for literary merit rather than to recognize ethnic and sexual diversity or to reward political agendas. A spare, slender novel but as serious as a stiletto in the fist of an assassin and packing a wallop that will follow you for the remainder of your reading days, *The Painted Bird* truly is one of those books you'll never forget.ess, parable-like simplicity of the great Nobel prize-winning novels of yesteryear--when the prize generally was awarded for literary merit rather than to recognize ethnic and sexual diversity or to reward political agendas. A spare, slender novel but as serious as a stiletto in the fist of an assassin and packing a wallop that will follow you for the remainder of your reading days, *The Painted Bird* truly is one of those books you'll never forget.	2008-02-22
US	51757266	R27GDK1CQNA271	080213422X	640122618	The Painted Bird	Books	5	2	2	N	N	A Sufferor's Tale of Suffering in Fable Fashion [T]	Brothers Grimm meet Soviet novelist. This tale of a childhood adventure has dainty fable-like highlights intermingled with horrific accounts of the savagery of war.<br /><br />Like Grimm, this tale is not light on death. People are killed the old fashioned way: axes, knives and bludgeoning. Throughout this book, you occasionally have to wince as Kosinski describes such events with incredible detail.<br /><br />And, the senselessness of many of the deaths grow wider as the book proceeds.  Single murders in the early chapter evolve to mass murders in the last chapters. Some of the later murderous events include: bandit raids of villages before the Soviet Reds take over, train wrecks for revenge of a beating and the war's blowing away of villages.<br /><br />This story revolves around the orphaned protagonist (from ages 6 to 12) who wanders during the horrors of World War II. He witnesses a grotesque overdose of human indecency arising within the Russian citizenry.  Just after entering one town, the boy is forced to move to another. Each foster home is a worse nightmare than the prior. One foster parent has children commit incest upon one another. Another has the child hang on hooks all day. Another conceives different ways to beat the child.<br /><br />By the end, the 12-year old child is a young man with little concern of others' emotions or feelings.  Like  Cormac McCarthy's protagonist in \\"Blood Meridian\\" - he is child transformed into the devil incarnate.  Adults tarnish a child's innocence in life. No one but the adults can be held accountable for the child's demise.<br /><br />But, unlike McCarthy, Kosinski is optimistic. Maybe his personal survival and revival from Holocaust events lead the author to allow the young man to survive his purgatory called childhood. That is good news.<br /><br />Written in a choppy fashion, similar to a journal kept by a scientist, the reading is stilted and constrained.  But, after acclimating to this unique style of writing, it moves well and such writing style accomplishes giving the book a fictional feel to events which probably are oh-too-nonfictional.  I believe the horrors are derived more from  memories  than from literary license.<br /><br />To those with a weak stomach, stay away from this book. For those who like Grimm, or would like Grimm on steroids, this is your book. And, for those interested in Russian literature or history, this is a must read.giving the book a fictional feel to events which probably are oh-too-nonfictional.  I believe the horrors are derived more from  memories  than from literary license.    To those with a weak stomach, stay away from this book. For those who like Grimm, or would like Grimm on steroids, this is your book. And, for those interested in Russian literature or history, this is a must read.	2007-12-08
US	51238938	R941WSE5F4S1X	0553074431	640122618	The Painted Bird	Books	4	5	8	N	N	Very disturbing but obsessive read	The painted bird is probably one my favourite books ever, as it plunges the reader in the worst of human behaviour but manages to captivate at the same time.  The novel follows a young boy in his roamings through the Balkans during the second world war after he has been separated from his parents during a razzia. His dark skin complexion immediately stigmatizes him as a gypsy and this biases his journey that takes him to the lowest of human behaviour, which Kosinsky describes with great detail, but also with an intruiging air as if all of this is all very normal. The reader is continuously fighting against the urge to throw the book aside in disgust and the desire to know how the unfateful journey of the main character unfolds.  After reading this book, even the most liberated of spirits must acknowledge that 'anything goes' should be accompanied by rules of human decency and social conduct, as the justifications of human evil that Kosinsky describes resonates in debates today	2007-11-09
