US	52825207	R1O9SG7KMFUAC6	B000F9Q3H0	640122618	The Painted Bird	Books	5	0	0	N	N	Meaning and Belonging Against the Odds	There are few books that have changed my worldview and indelibly inscribed my mind with images that will last as long as I do.  Jerzy Kosinki's The Painted Bird is one of the few.  Until I read The Painted Bird I was convinced that Cormac McCarthy, especially in his novel Blood Meridian, was far better than any other writer of fiction at showing us that human experience could always become more painful, terrifying, and brutally ugly than anything that had gone before.  McCarthy did this, moreover, with a prose style that was a product of a mastery of English so complete and innovative that it read like a distinctively superior form of language.  The Painted Bird, however, surpasses Blood Meridian with regard to both its intensely horrific metaphors and the simple but richly detailed elegance of its prose style.<br /><br />I can't be sure that Jerzy Kosinski wanted to show us that life on earth, as he had known it, was inexpressibly hellish and could always become more painful and terrifying, but that is what he did.  Much of his account of everyday events is embedded in deeply disturbing images, gross corruptions of commonplace practices that are almost too alarming to read.  Once read, moreover, they are never forgotten.  In Kosinski's rendering, the good, kind, peaceful, and warmly communal are routinely and sickeningly crowded out by mundane cruelty and indifference, suspicion and brutality, xenophobia and superstition, insularity and vengeance ,,, the list of sources of suffering might as well be endless.<br /><br />With crushing irony, moreover, it's evident throughout The Painted Bird that the world is not inherently brutal and brutalizing or inherently anything else.  Even when the physical conditions of existence are impoverished and harsh, human beings, unselfconsciously and guided by cultural norms and values, filtered and refined from their fore-bearers, create the circumstances of life as we live it.<br /><br />Cruelty and socially engendered suffering have many proximate causes.  They include misguided religious rules and practices, born and developed over centuries in a miserably failed effort to make sense of a senseless world.  Elaborate patterns of superstition aimed at warding off the innumerable forces of evil and rooted in the same forlorn search for meaning and security as their established religious analogues.  Rules governing economic relationships that serve the interests of the few in the guise of practices meant to meet the needs of the community and all its members.  Political, ethnic, racial, linguistic, national, and other inherently inconsequential traits, as contrived and pointless as the color of one's hair and eyes, are invoked to tell us what it all means.  As such, these institutions and innocuous markers are the social tools used to distinguish members from aliens in fundamentally arbitrary terms that circumscribe the boundaries of innumerable, endlessly lethal conflicts.<br /><br />At the most fundamental level, Kosinski's novel bespeaks an effort across millennia to find a solid basis for answering the most basic questions:  Who are we?  Where do we belong?  How can we find timeless meaning in life?  Differences among us are troubling because they are social sources of doubt, rendering uncertain our best answers to these questions.  So we seek, by whatever means, to eliminate any and all things that intimate alternatives to what we have settled on.<br /><br />The character Stupid Ludmilla wasn't always stupid and psychotic.  Nor was she always slatternly, indifferent to others' interpretations of her failure to suitably cover her still voluptuous body.  She became Stupid Ludmilla with her socially proscribed lack of awareness only after she was gang-raped by men from her village.<br /><br />The women of her village, chronically uncertain of their husband's fidelity, later conveniently blamed ill-clad Stupid Ludmilla for their anxiety and killed her by forcing a homemade grenade into her vagina and exploding it.  At last, everyone could relax knowing that husbands were faithful, provocative sexual manifestations had been eliminated, families were whole, villages were orderly and secure, and the harvest would not be tainted by God's collective punishment for carnal sin.<br /><br />The Painted Bird itself was just a bird of a specific species that had been captured, painted garish colors, and set free to join a passing flock.  None of The Painted Bird's other species-specific traits could persuade the members of the flock that it was one of them.  The paint was functionally inconsequential, but The Painted Bird was rejected and attacked by the other birds, and it fell to its death.  This cruel trick was something that rural folk played regularly.  In the presence of an intimation of difference, the birds behaved like men, and the converse was also true, as we have seen.<br /><br />It bears testimony to Kozinski's mastery of language and the novel form the he was able to tell his brilliant but pain-filled story using a pre-adolescent boy, a social casualty of World War II, as its protagonist and sole narrator.  The displaced boy's survival from ages seven to twelve in the most isolated, insular, and brutishly difficult confines of Eastern Europe does, indeed, seem unlikely, though Kosinski's masterfully detailed account makes it seem almost plausible.  The boy's youthful naivete' and outsider's openness enabled him to experience conventional sources of meaning and belonging, one after the other, until it became clear that each was fiction.<br /><br />The boy's reverence for Stalin, however, was not remedied by experience.  Perhaps because those who taught him about the Soviet Union and its heroes treated the boy well, as one of them, with his own uniform, and they trusted him with secrets worth keeping.  It wasn't Stalin he revered, but the members of the Red Army who made him one of them and gave him purpose.<br /><br />Oddly, the novel ends very abruptly, with a two-page last chapter.  Whether or not the outcome is satisfying depends on the readers' interpretation and worldview.  For me, the ending is sadly under-developed, an ambiguous afterthought, and inconsistent with the rest of the novel as I understand it.  In spite of this disappointment, however, I'm convinced The Painted Bird is a masterpiece of prose fiction, a brilliant book that will leave those who read it with a better-informed, more sober and insightful outlook.<br /><br />As an addendum, in the early 1980's Jerzy Kosinski became caught up in a heated controversy involving charges of plagiarism, holocaust profiteering, and misrepresentation of life in Poland during World War II.  In failing health and wounded by his critics, Kosinski committed suicide at age fifty-eight.  I do not know if the charges against Kosinski have merit; if they do, he was despicable.  But whatever the judgment on Kosinski, The Painted Bird is a great book.gina and exploding it.  At last, everyone could relax knowing that husbands were faithful, provocative sexual manifestations had been eliminated, families were whole, villages were orderly and secure, and the harvest would not be tainted by God's collective punishment for carnal sin.<br /><br />The Painted Bird itself was just a bird of a specific species that had been captured, painted garish colors, and set free to join a passing flock.  None of The Painted Bird's other species-specific traits could persuade the members of the flock that it was one of them.  The paint was functionally inconsequential, but The Painted Bird was rejected and attacked by the other birds, and it fell to its death.  This cruel trick was something that rural folk played regularly.  In the presence of an intimation of difference, the birds behaved like men, and the converse was also true, as we have seen.<br /><br />It bears testimony to Kozinski's mastery of language and the novel form the he was able to tell his brilliant but pain-filled story using a pre-adolescent boy, a social casualty of World War II, as its protagonist and sole narrator.  The displaced boy's survival from ages seven to twelve in the most isolated, insular, and brutishly difficult confines of Eastern Europe does, indeed, seem unlikely, though Kosinski's masterfully detailed account makes it seem almost plausible.  The boy's youthful naivete' and outsider's openness enabled him to experience conventional sources of meaning and belonging, one after the other, until it became clear that each was fiction.<br /><br />The boy's reverence for Stalin, however, was not remedied by experience.  Perhaps because those who taught him about the Soviet Union and its heroes treated the boy well, as one of them, with his own uniform, and they trusted him with secrets worth keeping.  It wasn't Stalin he revered, but the members of the Red Army who made him one of them and gave him purpose.<br /><br />Oddly, the novel ends very abruptly, with a two-page last chapter.  Whether or not the outcome is satisfying depends on the readers' interpretation and worldview.  For me, the ending is sadly under-developed, an ambiguous afterthought, and inconsistent with the rest of the novel as I understand it.  In spite of this disappointment, however, I'm convinced The Painted Bird is a masterpiece of prose fiction, a brilliant book that will leave those who read it with a better-informed, more sober and insightful outlook.<br /><br />As an addendum, in the early 1980's Jerzy Kosinski became caught up in a heated controversy involving charges of plagiarism, holocaust profiteering, and misrepresentation of life in Poland during World War II.  In failing health and wounded by his critics, Kosinski committed suicide at age fifty-eight.  I do not know if the charges against Kosinski have merit; if they do, he was despicable.  But whatever the judgment on Kosinski, The Painted Bird is a great book.	2013-09-27
US	51124060	R3P4R3Y5FX1HVE	080213422X	640122618	The Painted Bird	Books	1	5	22	N	N	You People Know This Book Is A Fraud, Correct?	Kosinsky concocted this entire tale from his imagination. During WWII, Kosinsky's family was harbored by Polish peasants even though they knew the Kosinskys were Jewish. Kosinsky witnessed none of the horrors described in this book.<br /><br />Read Norman Finkelstein's [[ASIN:185984488X The Holocaust Industry: Reflections on the Exploitation of Jewish Suffering, New Edition 2nd Edition]] for an account of this piece of sadomasochistic trash.	2013-07-19
US	29547017	R1I25FYXOW148Z	080213422X	640122618	The Painted Bird	Books	3	2	3	N	N	You won't forget this book!	If a good writer gives you a book which you will not easily forget, then Jerzy Kosinski if a great writer. There were passages he wrote that were almost lyrical, descriptive and thought provoking. The use of a child as the protagonist makes the story even more compelling.<br /><br />I agree with other reviewers the violence and brutality are often over the top but perhaps that is why you will never forget this book. This child makes deals with God, the devil, the Soviets or any other plausible person, idea or theory to help him get through this \\"hell\\" he is living each day.<br /><br />When I finished this book I wasn't sure if I liked it or not, I'm glad I read it as it gave me insight into the brutality of war and how man can treat another human when he thinks he is superior.<br /><br />As each chapter unfolds you see the transformation in this child, as he endures another torture, humiliation, and beating he grows psychologically and realizes what he needs to do to survive.<br /><br />I think there is an universal message in this book....\\"Lest We Forget\\".<br /><br />Five stars for the message, three stars for the story.	2013-07-04
US	24410111	R1YR6SSWTQZYX6	080213422X	640122618	The Painted Bird	Books	1	4	15	N	N	What a sicko !	Kosinski was probably one of the biggest sickos and frauds in history of American literature.  You have to read into his biography to really understand this book. He, most evidently, on the road to commercial and literary success, preyed on ignorance of the American reader about Eastern European IIWW history.<br /><br />The book alone can not and should not be read without understanding his life story which, by the way, is readily available on wikipedia.  It has to be understood that at the moment of publication Kosinski announced the book was autobiographical.  That, given the unusually harrowing circumstances of the main character's life, greatly contributed to the book's success in the US market, as it quickly became a bestseller.  The news about this success trickled into his homeland, Poland.  It was in Poland where it became evident the book wasn't autobiographical at all !  It was all a creation of his imagination.  In reality he did not spend the war as a boy wondering around the countryside.  What truly happened was that he and his family was SAVED and HARBORED by a Polish peasant family, which risked their lives every day in order to protect them from the Nazis.  Upon his visit back to Poland circa 1990, and confronted by his saviors about the book, he withdrew, avoided them, and failed to provide a good explanation for his book, which, indirectly, slandered these and other couragous people in Poland.<br /><br />The book's plot was evidently fueled by his vivid sexual and sadomachistic imagination as Kosinski was known to have been an avid participant of sadomachictic activities and SM New York scene.  It seems that in the book he used liberally IIWW Poland as an outlet for his sexual and sadomachistic fantasies rather than described life under occupation accurately.  He was also a known contributor to pornographic magazines; Playboy and Penthouse.<br /><br />During his late life, Kosinski was accused by many of plagiarism. Among others, his hit book \\"Being There\\" seems to have been based on a Polish pre-war bestseller by Dolega-Mostowicz \\"The Nicodemus Dyzma's Career\\".  The accusations made that he was no longer welcome in American literary salons but rather started being shunned.<br /><br />This fall from grace, from a best selling author to an accused plagiarist, seems to have contributed to his depression which later led him to suicide.<br /><br />In my humble opinion the American reader who is not knowledgeable about Eastern Europe during IIWW (very few Americans are)is an easy prey for skilled literary manipulators such as Kosinski.  The book has its value as an abstract, dark, harrowing and sexual tale. However, one must be aware that the book is not fact, it's fiction, and it can take place pretty much anywhere.  To me Kosinski is a master manipulator, a literary Bernard Madoff of sorts.	2013-05-12
US	49719772	RNWTWXWRQQVIP	080213422X	640122618	The Painted Bird	Books	5	10	13	N	N	Unforgettable tale of terror	The cover of the Mass Market Paperback edition from the 1970s of The Painted Bird features a small section of Heironomous Bosch hell-landscape -- dressed in sickly green and wearing a white hood, a creature with a man's body and head of a long-beaked bird walks on crutches carrying a large wicker basket on its back, and in the basket a small black devil with spiky fingers touches the shoulder of a wary young boy as he whispers into the boy's ear.  This is an apt cover for Jerzy Kosinski's fictionalized autobiographical novel set in Poland during the reign of Nazi terror in World War 11.<br /><br />I first read this harrowing tale 35 years ago.  I have read many dark, disturbing novels filled with brutality of every stripe, including such works as Malamud's The Fixer, Dostoyevsky's House of the Dead, and Solzhenitsyn's Gulag Archipelago, but, in my view, perhaps because the narrator is a 10 year old boy, no novel has its main character live through a more painful hell than in The Painted Bird.  Several months after reading this novel, the author himself made a visit to a large bookstore in Philadelphia for a book-signing, so I had an opportunity to actually meet him -- a small man with a thin, high pitched voice and sharp, chiseled fine features, a man who struck me as being both sensitive and friendly.  He appreciated my words of thanks and told me, when asked, that he was heading to New Orleans and expected to have some exciting times.<br /><br />Anyway, that was then.  Several days ago I saw my local library had a copy of The Painted Bird audiobook and immediately checked it out.  I started also rereading the printed book as I listened to the CDs.  The reader, Fred Berman, did his homework -- his accent and inflection and manner of speaking is spot-on Jerzy Kosinski.  If you are unfamiliar, this story is of an orphan boy with black eyes and sharp nose, labeled gypsy-Jew, forced to wander from village to village, subjected physically to beatings, rape, tortures, as well as murder attempts, while subjected psychologically to being treated as a messenger of the devil and an evil spirit who casts spells with a glance from his black eyes.  The boy is so traumatized from unrelenting abuse, he completely losses his capacity to speak for many months.  The abuse reaches such a pitch, at one point he reflects on the nature of evil:  \\"I tried to visualize the manner in which the evil spirits operated.  The minds and souls of people were as open to these forces as a plowed field, and it was on this field that the Evil Ones incessantly scattered their malignant seed.  If their seed sprouted to life, if they felt welcomed, they offered all the help which might be needed, on the condition that it would be used for selfish purposes and only to the detriment of others.  From the moment of signing a pact with the Devil, the more harm, misery, injury, and bitterness a man could inflict on those around him, the more help he could expect.\\"  Quite the musings from a 10 year old!  Just goes to show how extreme was his direct experience of the forces of evil.<br /><br />If you are up for an unforgettable experience of terror expressed in the clear, vivid literary language of a fine writer, then you are ready for Jerzy Kosinski's The Painted Bird.well as murder attempts, while subjected psychologically to being treated as a messenger of the devil and an evil spirit who casts spells with a glance from his black eyes.  The boy is so traumatized from unrelenting abuse, he completely losses his capacity to speak for many months.  The abuse reaches such a pitch, at one point he reflects on the nature of evil:  \\"I tried to visualize the manner in which the evil spirits operated.  The minds and souls of people were as open to these forces as a plowed field, and it was on this field that the Evil Ones incessantly scattered their malignant seed.  If their seed sprouted to life, if they felt welcomed, they offered all the help which might be needed, on the condition that it would be used for selfish purposes and only to the detriment of others.  From the moment of signing a pact with the Devil, the more harm, misery, injury, and bitterness a man could inflict on those around him, the more help he could expect.\\"  Quite the musings from a 10 year old!  Just goes to show how extreme was his direct experience of the forces of evil.<br /><br />If you are up for an unforgettable experience of terror expressed in the clear, vivid literary language of a fine writer, then you are ready for Jerzy Kosinski's The Painted Bird.	2013-05-05
US	52326036	R2HL0OL3HN28CA	080213422X	640122618	The Painted Bird	Books	3	0	3	N	N	Brutally graphic, brutally long	I wanted to like this book.  I am not someone who gets queasy easily about graphic violence, which is good because the Painted Bird has violence in spades.  However, I did get tired of the brutality that each chapter brought.  The questioning of God's nature and/or existence is a theme that is over-shadowed by each brutal act that happens upon the main character chapter after chapter.  I got to the point where I was tired of the beatings this kid received.	2013-04-09
US	18189818	RRMO0CPPC3EYI	080213422X	640122618	The Painted Bird	Books	1	8	14	N	N	Sorry I read this.	I read this about 30 years ago. Wish I hadn't. I've read some horrific, graphic books on the Holocaust that made me cry. But when I finished this book, I burned it in the fireplace.  I have NEVER burnt any other book in my life.  I was angry, unlike any anger I have felt from a book.  I read and read and read and nothing has ever affected me like this book.  I think its because he used a young child to show mans inhumanity to man. This review will probably make some curious to read it.  Proceed at your own risk.	2013-03-27
US	18252856	R3SX4PNKGRMPDQ	080213422X	640122618	The Painted Bird	Books	5	2	3	N	Y	One of the best books I've ever read.	It is disturbing.  Go into this novel expecting to be disturbed on every level.  However, it is worth the read.  Kosinski shares a brutally honest side of what people are capable of doing to each other when we believe someone else is dangerously different from us.	2013-02-25
US	47625619	RP9ZKQ3YXH7WM	080213422X	640122618	The Painted Bird	Books	5	1	2	N	N	The cover blurbs were right....	Everything the blurbs on the cover said. It is heartbreaking, amazing, powerful. At times you want to turn away, but you don't; then, you realize that life is not always nice.<br /><br />The protagonist changes many times throughout the book. He changes in order to survive, he changes because he sees something that he believes is better, or he changes because his eyes are opened and he sees how life really is.<br /><br />Kosinski was accused of betraying his country, he was also accused of not going far enough in showing the horrors of war as the boy experienced them. Maybe it's autobiographical, maybe it's not. What is important is that it is a true picture of what happened to many during the years of the Second World War.<br /><br />The author pulls no punches, so be prepared to read about depravity, hatred, racism, violence and even death when you pick up this book.<br /><br />And prepare to be changed. I was.	2013-01-04
US	13524255	R23LKSG8074MAR	080213422X	640122618	The Painted Bird	Books	5	1	3	N	N	From The Depths, I Have Cried Out To You	The violence starts from the first pages and only gets worse as the narrative progresses. At first, it gives the impression that it is violence for violence's sake; however, it does culminate into a very deep insight into human nature. Society, under normal circumstances, limits the acceptable level of interpersonal violence. When the normal order is altered, anything becomes possible and the inner demons come out. The brutal acts described in the book seem fantastical, but really are not much different than anything seen on the evening news.<br /><br />As someone who has never \\"fit in\\" and has always been an outsider, I related to the unnamed narrator on a personal level.<br /><br />As to the question of whether the book is autobiographical, I do not think there is much of a question about it. I think it is obvious that some of it is inspired by the author's real life experiences, and some from other survivors' stories that he had heard, but the story is clearly fiction.	2012-10-15
